id,institutionCode,collectionCode,ownerInstitutionCode,collectionID,basisOfRecord,occurrenceID,catalogNumber,otherCatalogNumbers,kingdom,phylum,class,order,family,scientificName,taxonID,scientificNameAuthorship,genus,specificEpithet,taxonRank,infraspecificEpithet,identifiedBy,dateIdentified,identificationReferences,identificationRemarks,taxonRemarks,identificationQualifier,typeStatus,recordedBy,recordNumber,eventDate,year,month,day,startDayOfYear,endDayOfYear,verbatimEventDate,occurrenceRemarks,habitat,fieldNumber,informationWithheld,dataGeneralizations,dynamicProperties,associatedTaxa,associatedOccurrences,reproductiveCondition,establishmentMeans,lifeStage,sex,individualCount,samplingProtocol,samplingEffort,preparations,country,stateProvince,county,municipality,locality,locationRemarks,decimalLatitude,decimalLongitude,geodeticDatum,coordinateUncertaintyInMeters,verbatimCoordinates,georeferencedBy,georeferenceProtocol,georeferenceSources,georeferenceVerificationStatus,georeferenceRemarks,minimumElevationInMeters,maximumElevationInMeters,minimumDepthInMeters,maximumDepthInMeters,verbatimDepth,verbatimElevation,disposition,language,recordEnteredBy,modified,rights,rightsHolder,accessRights,recordId,references
56661501,AUGIE,ENT,,120bf21c-d066-48ee-b4c0-880596ea22e4,PreservedSpecimen,7ba99307-301d-4038-8a61-fd809f9ddb41,AUGUENTA0000001,,Animalia,Arthropoda,Insecta,Coleoptera,Coccinellidae,Coccinellidae,,,,,,,,,,,,,,"Freed, J.M.",A0000001,10/21/1992,1992,10,21,295,,X 21 1992,,,,,,,,,,,,,,,,,United States,IL,Rock Island,Rock Island,,,,,,,,,,,,,,,,,,,,,tierneybrosius,5/19/2021 8:57,http://creativecommons.org/licenses/by-nc/4.0/,Augustana College,,urn:uuid:7ba99307-301d-4038-8a61-fd809f9ddb41,https://scan-bugs.org:443/portal/collections/individual/index.php?occid=56661501
56661512,AUGIE,ENT,,120bf21c-d066-48ee-b4c0-880596ea22e4,PreservedSpecimen,cbb231a6-3ec1-41b3-828a-b8f22b7b08e1,AUGIEENTA0000002,,Animalia,Arthropoda,Insecta,Coleoptera,Coccinellidae,Coccinellidae,,,,,,,,,,,,,,Wilson K.,A0000002,8/15/2008,2008,8,15,228,,15-VIII-2008,,,,,,,,,,,,,,,,,United States,IL,Rock Island,Rock Island,,,,,,,,,,,,,,,,,,,,,tierneybrosius,5/19/2021 8:57,http://creativecommons.org/licenses/by-nc/4.0/,Augustana College,,urn:uuid:cbb231a6-3ec1-41b3-828a-b8f22b7b08e1,https://scan-bugs.org:443/portal/collections/individual/index.php?occid=56661512
56664507,AUGIE,ENT,,120bf21c-d066-48ee-b4c0-880596ea22e4,PreservedSpecimen,eb2a03d8-3835-4e6c-abb2-fea42921daf3,AUGIEENTA0000004,,Animalia,Arthropoda,Insecta,Coleoptera,Coccinellidae,Coccinellidae,,,,,,,,,,,,,,Burke D.,A0000004,9/20/1988,1988,9,20,264,,IX 20 1988,,,,,,,,,,,,,,,,,United States,IL,Rock Island,Rock Island,,,,,,,,,,,,,,,,,,,,,tierneybrosius,5/21/2021 12:36,http://creativecommons.org/licenses/by-nc/4.0/,Augustana College,,urn:uuid:eb2a03d8-3835-4e6c-abb2-fea42921daf3,https://scan-bugs.org:443/portal/collections/individual/index.php?occid=56664507
56664508,AUGIE,ENT,,120bf21c-d066-48ee-b4c0-880596ea22e4,PreservedSpecimen,423a097a-02e8-494e-9e5c-d582d41f5c23,AUGIEENTA0000005,,Animalia,Arthropoda,Insecta,Coleoptera,Coccinellidae,Coccinellidae,,,,,,,,,,,,,,Keator S.,A0000005,10/29/1974,1974,10,29,302,,X 29 1974,,,,,,,,,,,,,,,,,United States,IL,Rock Island,Rock Island,,,,,,,,,,,,,,,,,,,,,tierneybrosius,5/24/2021 8:03,http://creativecommons.org/licenses/by-nc/4.0/,Augustana College,,urn:uuid:423a097a-02e8-494e-9e5c-d582d41f5c23,https://scan-bugs.org:443/portal/collections/individual/index.php?occid=56664508
56664509,AUGIE,ENT,,120bf21c-d066-48ee-b4c0-880596ea22e4,PreservedSpecimen,017f33ca-7dfc-40a0-ad99-a42acff1ff6f,AUGIEENTA0000006,,Animalia,Arthropoda,Insecta,Coleoptera,Coccinellidae,Coccinellidae,,,,,,,,,,,,,,Mekus Kathy,A0000006,10/21/1972,1972,10,21,295,,X 21 1972,,,,,,,,,,,,,,,,,United States,IL,Rock Island,Rock Island,,,,,,,,,,,,,,,,,,,,,tierneybrosius,5/21/2021 12:36,http://creativecommons.org/licenses/by-nc/4.0/,Augustana College,,urn:uuid:017f33ca-7dfc-40a0-ad99-a42acff1ff6f,https://scan-bugs.org:443/portal/collections/individual/index.php?occid=56664509
56664511,AUGIE,ENT,,120bf21c-d066-48ee-b4c0-880596ea22e4,PreservedSpecimen,4fd15c0a-fada-47b7-a455-f7f5bbe1eb41,AUGIEENTA0000007,,Animalia,Arthropoda,Insecta,Coleoptera,Coccinellidae,Coccinellidae,,,,,,,,,,,,,,DeVoss Marley; Tierney Brosius,7,8/30/2018,2018,8,30,242,,30-Aug-18,,,,,,,,,,,,,,,,,United States,IA,Scott,Davenport,Nahant Marsh,,,,,,,,,,,,,,,,,,,,tierneybrosius,5/24/2021 8:03,http://creativecommons.org/licenses/by-nc/4.0/,Augustana College,,urn:uuid:4fd15c0a-fada-47b7-a455-f7f5bbe1eb41,https://scan-bugs.org:443/portal/collections/individual/index.php?occid=56664511
56664515,AUGIE,ENT,,120bf21c-d066-48ee-b4c0-880596ea22e4,PreservedSpecimen,ea512790-a584-40ba-a4b6-53b6944df3dc,AUGIEENTA0000008,,Animalia,Arthropoda,Insecta,Coleoptera,Coccinellidae,Coccinellidae,,,,,,,,,,,,,,Frese H.,8,9/20/1997,1997,9,20,263,,9-XX-1997,,,,,,,,,,,,,,,,,United States,IL,Adams,,,,,,,,,,,,,,,,,,,,,,tierneybrosius,5/24/2021 8:03,http://creativecommons.org/licenses/by-nc/4.0/,Augustana College,,urn:uuid:ea512790-a584-40ba-a4b6-53b6944df3dc,https://scan-bugs.org:443/portal/collections/individual/index.php?occid=56664515
56664527,AUGIE,ENT,,120bf21c-d066-48ee-b4c0-880596ea22e4,PreservedSpecimen,7fc581f1-2316-4cb6-b627-134b0bc2d686,AUGIEENTA0000009,,Animalia,Arthropoda,Insecta,Coleoptera,Coccinellidae,Coccinellidae,,,,,,,,,,,,,,Gurrieri B,9,9/16/1986,1986,9,16,259,,IX 16 1986,,,,,,,,,,,,,,,,,United States,IL,Rock Island,Rock Island,,,,,,,,,,,,,,,,,,,,,tierneybrosius,5/21/2021 12:36,http://creativecommons.org/licenses/by-nc/4.0/,Augustana College,,urn:uuid:7fc581f1-2316-4cb6-b627-134b0bc2d686,https://scan-bugs.org:443/portal/collections/individual/index.php?occid=56664527
56664533,AUGIE,ENT,,120bf21c-d066-48ee-b4c0-880596ea22e4,PreservedSpecimen,0dbd78da-c771-4ea2-a692-ebec3b5a2dfa,AUGIEENTA0000010,,Animalia,Arthropoda,Insecta,Coleoptera,Coccinellidae,Coccinellidae,,,,,,,,,,,,,,Gonzalez M,10,9/18/1997,1997,9,18,261,,18-IX-1997,,,,,,,,,,,,,,,,,United States,IL,Rock Island,Rock Island,,,,,,,,,,,,,,,,,,,,,tierneybrosius,5/24/2021 8:03,http://creativecommons.org/licenses/by-nc/4.0/,Augustana College,,urn:uuid:0dbd78da-c771-4ea2-a692-ebec3b5a2dfa,https://scan-bugs.org:443/portal/collections/individual/index.php?occid=56664533
56664539,AUGIE,ENT,,120bf21c-d066-48ee-b4c0-880596ea22e4,PreservedSpecimen,2251aa89-d193-428f-97d6-454013367c7f,AUGIEENTA0000011,,Animalia,Arthropoda,Insecta,Coleoptera,Coccinellidae,Chilocorus stigma,25164,"Guérin-Méneville, 1842",Chilocorus,stigma,,,Larson I.W.,1975,,,,,,Larson I.W.,11,8/27/1993,1993,8,27,239,,VIII.23.1993,,,,,,,,,,,,,,,,,United States,Montana,Jasper,Carthage,,,,,,,,,,,,,,,,,,,,,tierneybrosius,5/24/2021 7:30,http://creativecommons.org/licenses/by-nc/4.0/,Augustana College,,urn:uuid:2251aa89-d193-428f-97d6-454013367c7f,https://scan-bugs.org:443/portal/collections/individual/index.php?occid=56664539
56664541,AUGIE,ENT,,120bf21c-d066-48ee-b4c0-880596ea22e4,PreservedSpecimen,7f4778e1-876c-4ab1-971a-7440d82f21c3,AUGIEENTA0000012,,Animalia,Arthropoda,Insecta,Coleoptera,Coccinellidae,Chilocorus stigma,25164,"Guérin-Méneville, 1842",Chilocorus,stigma,,,Larson I.W.,1975,,,,,,Dishno T.,12,10/10/1994,1994,10,10,283,,X 10 1994,,,,,,,,,,,,,,,,,United States,IL,Rock Island,Rock Island,,,,,,,,,,,,,,,,,,,,,tierneybrosius,5/24/2021 7:31,http://creativecommons.org/licenses/by-nc/4.0/,Augustana College,,urn:uuid:7f4778e1-876c-4ab1-971a-7440d82f21c3,https://scan-bugs.org:443/portal/collections/individual/index.php?occid=56664541
56665711,AUGIE,ENT,,120bf21c-d066-48ee-b4c0-880596ea22e4,PreservedSpecimen,9dcc90e4-5a86-4c01-bbb2-b0c9b37b27d5,AUGIEENTA0000013,,Animalia,Arthropoda,Insecta,Coleoptera,Coccinellidae,Chilocorus stigma,25164,"Guérin-Méneville, 1842",Chilocorus,stigma,,,,1975,,,,,,Bawden C.,13,6/14/1971,1971,6,14,165,,VI 14 1971,,,,,,,,,,,,,,,,,United States,IL,Mercer,,,,,,,,,,,,,,,,,,,,,,tierneybrosius,5/24/2021 8:04,http://creativecommons.org/licenses/by-nc/4.0/,Augustana College,,urn:uuid:9dcc90e4-5a86-4c01-bbb2-b0c9b37b27d5,https://scan-bugs.org:443/portal/collections/individual/index.php?occid=56665711
56665712,AUGIE,ENT,,120bf21c-d066-48ee-b4c0-880596ea22e4,PreservedSpecimen,28aae1cc-0af8-47fa-a634-965dd6dd91f8,AUGIEENTA0000014,,Animalia,Arthropoda,Insecta,Coleoptera,Coccinellidae,Chilocorus stigma,25164,"Guérin-Méneville, 1842",Chilocorus,stigma,,,Larson I.W.,1975,,,,,,Lingwall M. J.,14,10/2/1970,1970,10,2,275,,10/2 1970,,,,,,,,,,,,,,,,,United States,IL,Rock Island,,,,,,,,,,,,,,,,,,,,,,tierneybrosius,5/24/2021 8:04,http://creativecommons.org/licenses/by-nc/4.0/,Augustana College,,urn:uuid:28aae1cc-0af8-47fa-a634-965dd6dd91f8,https://scan-bugs.org:443/portal/collections/individual/index.php?occid=56665712
56665713,AUGIE,ENT,,120bf21c-d066-48ee-b4c0-880596ea22e4,PreservedSpecimen,b19a1eeb-6bf7-489b-8dc3-7258c04364aa,AUGIEENTA0000015,,Animalia,Arthropoda,Insecta,Coleoptera,Coccinellidae,Hippodamia convergens,27393,"Guérin-Méneville, 1842",Hippodamia,convergens,,,Larson I.W.,1975,,,,,,Larson I.W.,15,7/2/1970,1970,7,2,183,,VII.2.1981,,,,,,,,,,,,,,,,,United States,Colorado,Adams,Thornton,,,,,,,,,,,,,,,,,,,,,tierneybrosius,5/24/2021 8:04,http://creativecommons.org/licenses/by-nc/4.0/,Augustana College,,urn:uuid:b19a1eeb-6bf7-489b-8dc3-7258c04364aa,https://scan-bugs.org:443/portal/collections/individual/index.php?occid=56665713
56665747,AUGIE,ENT,,120bf21c-d066-48ee-b4c0-880596ea22e4,PreservedSpecimen,39b1a889-7ffb-4689-950e-f2468cf37787,AUGIEENTA0000016,,Animalia,Arthropoda,Insecta,Coleoptera,Coccinellidae,Hippodamia convergens,27393,"Guérin-Méneville, 1842",Hippodamia,convergens,,,Larson I.W.,1975,,,,,,Larson I.W.,16,7/2/1981,1981,7,2,183,,VII.2.1981,,,,,,,,,,,,,,,,,United States,Colorado,Adams,Thornton,,,,,,,,,,,,,,,,,,,,,tierneybrosius,5/24/2021 8:04,http://creativecommons.org/licenses/by-nc/4.0/,Augustana College,,urn:uuid:39b1a889-7ffb-4689-950e-f2468cf37787,https://scan-bugs.org:443/portal/collections/individual/index.php?occid=56665747
56665752,AUGIE,ENT,,120bf21c-d066-48ee-b4c0-880596ea22e4,PreservedSpecimen,b2b904ee-97d6-4b55-9a2a-145bbbabb927,AUGIEENTA0000017,,Animalia,Arthropoda,Insecta,Coleoptera,Coccinellidae,Hippodamia convergens,27393,"Guérin-Méneville, 1842",Hippodamia,convergens,,,Larson I.W.,1975,,,,,,Barnet M.,17,10/5/1974,1974,10,5,278,,X-5-1974,,,,,,,,,,,,,,,,,United States,IL,Rock Island,,,,,,,,,,,,,,,,,,,,,,tierneybrosius,5/24/2021 8:04,http://creativecommons.org/licenses/by-nc/4.0/,Augustana College,,urn:uuid:b2b904ee-97d6-4b55-9a2a-145bbbabb927,https://scan-bugs.org:443/portal/collections/individual/index.php?occid=56665752
56665762,AUGIE,ENT,,120bf21c-d066-48ee-b4c0-880596ea22e4,PreservedSpecimen,24bf3d0a-7577-4c22-95fe-c919eb341aff,AUGIEENTA0000018,,Animalia,Arthropoda,Insecta,Coleoptera,Coccinellidae,Hippodamia caseyi,27392,"Johnson, 1910",Hippodamia,caseyi,,,Larson I.W.,1975,,,,,,Larson I.W.,18,5/14/1956,1956,5,14,135,,V.14.1956,,,,,,,,,,,,,,,,,United States,Kansas,Riley,,,,,,,,,,,,,,,,,,,,,,tierneybrosius,5/24/2021 8:04,http://creativecommons.org/licenses/by-nc/4.0/,Augustana College,,urn:uuid:24bf3d0a-7577-4c22-95fe-c919eb341aff,https://scan-bugs.org:443/portal/collections/individual/index.php?occid=56665762
56665771,AUGIE,ENT,,120bf21c-d066-48ee-b4c0-880596ea22e4,PreservedSpecimen,727d4587-dd39-4d8b-ada1-9e486240aa6e,AUGIEENTA0000019,,Animalia,Arthropoda,Insecta,Coleoptera,Coccinellidae,Hippodamia convergens,27393,"Guérin-Méneville, 1842",Hippodamia,convergens,,,Larson I.W.,1975,,,,,,Canty T. C.,19,10/2/1970,1970,10,2,275,,X 2 1970,,,,,,,,,,,,,,,,,United States,IL,Rock Island,Rock Island,,,,,,,,,,,,,,,,,,,,,tierneybrosius,8/19/2021 12:11,http://creativecommons.org/licenses/by-nc/4.0/,Augustana College,,urn:uuid:727d4587-dd39-4d8b-ada1-9e486240aa6e,https://scan-bugs.org:443/portal/collections/individual/index.php?occid=56665771
56665774,AUGIE,ENT,,120bf21c-d066-48ee-b4c0-880596ea22e4,PreservedSpecimen,f406803f-88ac-4664-91bc-d0982e33e78f,AUGIEENTA0000020,,Animalia,Arthropoda,Insecta,Coleoptera,Coccinellidae,Hippodamia parenthesis,27400,"Guérin-Méneville, 1842",Hippodamia,parenthesis,,,Larson I.W.,1975,,,,,,Carlson C. A.,20,8/28/1965,1965,8,28,240,,Aug 28 1965,,,,,,,,,,,,,,,,,United States,IL,Rock Island,,,,,,,,,,,,,,,,,,,,,,tierneybrosius,5/24/2021 8:05,http://creativecommons.org/licenses/by-nc/4.0/,Augustana College,,urn:uuid:f406803f-88ac-4664-91bc-d0982e33e78f,https://scan-bugs.org:443/portal/collections/individual/index.php?occid=56665774
56665777,AUGIE,ENT,,120bf21c-d066-48ee-b4c0-880596ea22e4,PreservedSpecimen,c36b394e-b1f8-4e9c-b050-f1b0befc06db,AUGIEENTA0000021,,Animalia,Arthropoda,Insecta,Coleoptera,Coccinellidae,Hippodamia parenthesis,27400,"Guérin-Méneville, 1842",Hippodamia,parenthesis,,,Larson I.W.,1975,,,,,,Simonis R.,21,9/16/1978,1978,9,16,259,,9-16 1978,,,,,,,,,,,,,,,,,United States,IL,Rock Island,Rock Island,,,,,,,,,,,,,,,,,,,,,tierneybrosius,5/24/2021 8:01,http://creativecommons.org/licenses/by-nc/4.0/,Augustana College,,urn:uuid:c36b394e-b1f8-4e9c-b050-f1b0befc06db,https://scan-bugs.org:443/portal/collections/individual/index.php?occid=56665777
56665787,AUGIE,ENT,,120bf21c-d066-48ee-b4c0-880596ea22e4,PreservedSpecimen,60d0f068-9c8f-4d0b-ab8c-5cac56c953ba,AUGIEENTA0000022,,Animalia,Arthropoda,Insecta,Coleoptera,Coccinellidae,Hippodamia tredecimpunctata,27404,"Guérin-Méneville, 1842",Hippodamia,tredecimpunctata,,,Larson I.W.,1975,,,,,,Carlson C. A.,22,5/4/1965,1965,5,4,124,,May 4 1965,,,,,,,,,,,,,,,,,United States,IL,Mercer,Sherrard,,,,,,,,,,,,,,,,,,,,,tierneybrosius,5/24/2021 8:10,http://creativecommons.org/licenses/by-nc/4.0/,Augustana College,,urn:uuid:60d0f068-9c8f-4d0b-ab8c-5cac56c953ba,https://scan-bugs.org:443/portal/collections/individual/index.php?occid=56665787
56665789,AUGIE,ENT,,120bf21c-d066-48ee-b4c0-880596ea22e4,PreservedSpecimen,4700dd30-883d-421e-8094-788e639e3564,AUGIEENTA0000023,,Animalia,Arthropoda,Insecta,Coleoptera,Coccinellidae,Hippodamia tredecimpunctata,27404,"Guérin-Méneville, 1842",Hippodamia,tredecimpunctata,,,Larson I.W.,1975,,,,,,Carlson C. A.,23,5/4/1965,1965,5,4,124,,May 4 1965,,,,,,,,,,,,,,,,,United States,IL,Mercer,Sherrard,,,,,,,,,,,,,,,,,,,,,tierneybrosius,5/25/2021 8:28,http://creativecommons.org/licenses/by-nc/4.0/,Augustana College,,urn:uuid:4700dd30-883d-421e-8094-788e639e3564,https://scan-bugs.org:443/portal/collections/individual/index.php?occid=56665789
56665795,AUGIE,ENT,,120bf21c-d066-48ee-b4c0-880596ea22e4,PreservedSpecimen,db196a14-1ec8-436e-b7b4-0caba82bacc4,AUGIEENTA0000024,,Animalia,Arthropoda,Insecta,Coleoptera,Coccinellidae,Hippodamia tredecimpunctata,27404,"Guérin-Méneville, 1842",Hippodamia,tredecimpunctata,,,Larson I.W.,1975,,,,,,Lindquist A.,24,11/5/1972,1972,11,5,310,,Nov. 5 1972,,,,,,,,,,,,,,,,,United States,IL,Rock Island,,,,,,,,,,,,,,,,,,,,,,tierneybrosius,5/24/2021 8:16,http://creativecommons.org/licenses/by-nc/4.0/,Augustana College,,urn:uuid:db196a14-1ec8-436e-b7b4-0caba82bacc4,https://scan-bugs.org:443/portal/collections/individual/index.php?occid=56665795
56667624,AUGIE,ENT,,120bf21c-d066-48ee-b4c0-880596ea22e4,PreservedSpecimen,30a201ba-09d1-4080-b62f-46193e8db0d5,AUGIEENTA0000025,,Animalia,Arthropoda,Insecta,Coleoptera,Coccinellidae,Brachiacantha ursina,24421,"Guérin-Méneville, 1842",Brachiacantha,ursina,,,Larson I.W.,1975,,,,,,Schroder S. W.,25,6/18/1975,1975,6,18,169,,1975.VI. 18,,,,,,,,,,,,,,,,,United States,IL,Rcok Island,Rock Island,,,,,,,,,,,,,,,,,,,,,tierneybrosius,5/25/2021 8:06,http://creativecommons.org/licenses/by-nc/4.0/,Augustana College,,urn:uuid:30a201ba-09d1-4080-b62f-46193e8db0d5,https://scan-bugs.org:443/portal/collections/individual/index.php?occid=56667624
56667633,AUGIE,ENT,,120bf21c-d066-48ee-b4c0-880596ea22e4,PreservedSpecimen,625d1023-295b-4cde-9983-3593e3fe01bc,AUGIEENTA0000026,,Animalia,Arthropoda,Insecta,Coleoptera,Coccinellidae,Brachiacantha ursina,24421,"Guérin-Méneville, 1842",Brachiacantha,ursina,,,Larson I.W.,1975,,,,,,Carlson C. A.,26,6/24/1966,1966,6,24,175,,29-Jun-66,,,,,,,,,,,,,,,,,United States,IL,Rock Island,,,,,,,,,,,,,,,,,,,,,,tierneybrosius,5/25/2021 8:10,http://creativecommons.org/licenses/by-nc/4.0/,Augustana College,,urn:uuid:625d1023-295b-4cde-9983-3593e3fe01bc,https://scan-bugs.org:443/portal/collections/individual/index.php?occid=56667633
56667640,AUGIE,ENT,,120bf21c-d066-48ee-b4c0-880596ea22e4,PreservedSpecimen,ece7c3de-5757-4cce-bfab-87339668cc87,AUGIEENTA0000027,,Animalia,Arthropoda,Insecta,Coleoptera,Coccinellidae,Brachiacantha ursina,24421,"Guérin-Méneville, 1842",Brachiacantha,ursina,,,Larson I.W.,1975,,,,,,Tindall Joe,27,5/24/1965,1965,5,24,144,,May 24 1965,,,,,,,,,,,,,,,,,United States,IL,Rock Island,Moline,,,,,,,,,,,,,,,,,,,,,tierneybrosius,5/25/2021 8:13,http://creativecommons.org/licenses/by-nc/4.0/,Augustana College,,urn:uuid:ece7c3de-5757-4cce-bfab-87339668cc87,https://scan-bugs.org:443/portal/collections/individual/index.php?occid=56667640
56667646,AUGIE,ENT,,120bf21c-d066-48ee-b4c0-880596ea22e4,PreservedSpecimen,e204237b-687d-402a-b149-67b27b44f9f5,AUEIEENTA0000028,,Animalia,Arthropoda,Insecta,Coleoptera,Coccinellidae,Brachiacantha ursina,24421,"Guérin-Méneville, 1842",Brachiacantha,ursina,,,Larson I.W.,1975,,,,,,Tindall Joe,28,5/4/1965,1965,5,4,124,,May 4 1965,,,,,,,,,,,,,,,,,United States,IL,Rock Island,Moline,,,,,,,,,,,,,,,,,,,,,tierneybrosius,5/25/2021 8:15,http://creativecommons.org/licenses/by-nc/4.0/,Augustana College,,urn:uuid:e204237b-687d-402a-b149-67b27b44f9f5,https://scan-bugs.org:443/portal/collections/individual/index.php?occid=56667646
56667650,AUGIE,ENT,,120bf21c-d066-48ee-b4c0-880596ea22e4,PreservedSpecimen,b1a71900-c911-4e3b-802f-4ba1e95b1c3a,AUGIEENTA0000029,,Animalia,Arthropoda,Insecta,Coleoptera,Coccinellidae,Brachiacantha ursina,24421,"Guérin-Méneville, 1842",Brachiacantha,ursina,,,Larson I.W.,1975,,,,,,Carlson C. A.,29,6/29/1966,1966,6,29,180,,29-Jun-66,,,,,,,,,,,,,,,,,United States,IL,Rock Island,,,,,,,,,,,,,,,,,,,,,,tierneybrosius,5/25/2021 8:18,http://creativecommons.org/licenses/by-nc/4.0/,Augustana College,,urn:uuid:b1a71900-c911-4e3b-802f-4ba1e95b1c3a,https://scan-bugs.org:443/portal/collections/individual/index.php?occid=56667650
56667653,AUGIE,ENT,,120bf21c-d066-48ee-b4c0-880596ea22e4,PreservedSpecimen,cd2ac0b9-1168-48c3-98fe-e42f93a6ed92,AUGIEENTA0000030,,Animalia,Arthropoda,Insecta,Coleoptera,Coccinellidae,Brachiacantha ursina,24421,"Guérin-Méneville, 1842",Brachiacantha,ursina,,,Larson I.W.,1975,,,,,,Yazsec J.,30,9/17/1976,1976,9,17,261,,IX-17-1976,,,,,,,,,,,,,,,,,United States,IL,Rock Island,,,,,,,,,,,,,,,,,,,,,,tierneybrosius,5/25/2021 8:20,http://creativecommons.org/licenses/by-nc/4.0/,Augustana College,,urn:uuid:cd2ac0b9-1168-48c3-98fe-e42f93a6ed92,https://scan-bugs.org:443/portal/collections/individual/index.php?occid=56667653
56667658,AUGIE,ENT,,120bf21c-d066-48ee-b4c0-880596ea22e4,PreservedSpecimen,eea8e306-7636-497e-816f-d3c3a1eeb3d0,AUGIEENTA0000031,,Animalia,Arthropoda,Insecta,Coleoptera,Coccinellidae,Brachiacantha ursina,24421,"Guérin-Méneville, 1842",Brachiacantha,ursina,,,Larson I.W.,1975,,,,,,Bennett S.,31,7/16/1975,1975,7,16,197,,1975-VII-16,,,,,,,,,,,,,,,,,United States,IL,Rock Island,,,,,,,,,,,,,,,,,,,,,,tierneybrosius,5/25/2021 8:23,http://creativecommons.org/licenses/by-nc/4.0/,Augustana College,,urn:uuid:eea8e306-7636-497e-816f-d3c3a1eeb3d0,https://scan-bugs.org:443/portal/collections/individual/index.php?occid=56667658
56667660,AUGIE,ENT,,120bf21c-d066-48ee-b4c0-880596ea22e4,PreservedSpecimen,17cbaab3-9fab-4386-a8ce-413dfe1be42d,AUGIEENTA0000032,,Animalia,Arthropoda,Insecta,Coleoptera,Coccinellidae,Brachiacantha ursina,24421,"Guérin-Méneville, 1842",Brachiacantha,ursina,,,Larson I.W.,1975,,,,,,Swiff J.,32,9/23/1986,1986,9,23,266,,IX-23-76,,,,,,,,,,,,,,,,,United States,Iowa,Scott,,,,,,,,,,,,,,,,,,,,,,tierneybrosius,5/25/2021 8:26,http://creativecommons.org/licenses/by-nc/4.0/,Augustana College,,urn:uuid:17cbaab3-9fab-4386-a8ce-413dfe1be42d,https://scan-bugs.org:443/portal/collections/individual/index.php?occid=56667660
56682390,AUGIE,ENT,,120bf21c-d066-48ee-b4c0-880596ea22e4,PreservedSpecimen,2744e1d0-585b-4176-a48b-f6a872b91bc5,AUGIEENTA0000033,,Animalia,Arthropoda,Insecta,Coleoptera,Coccinellidae,Psyllobora vigintimaculata,31188,"Guérin-Méneville, 1842",Psyllobora,vigintimaculata,,,Larson I.W.,1975,,,,,,Yazsec J.,,5/7/1976,1976,5,7,128,,x-7 1976,,,,,,,,,,,,,,,,,United States,IL,Rock Island,,,,,,,,,,,,,,,,,,,,,,tierneybrosius,5/28/2021 7:00,http://creativecommons.org/licenses/by-nc/4.0/,Augustana College,,urn:uuid:2744e1d0-585b-4176-a48b-f6a872b91bc5,https://scan-bugs.org:443/portal/collections/individual/index.php?occid=56682390
56682393,AUGIE,ENT,,120bf21c-d066-48ee-b4c0-880596ea22e4,PreservedSpecimen,cbfea2fc-642a-4be6-8d65-f6dfb39c3010,AUGIEENTA0000034,,Animalia,Arthropoda,Insecta,Coleoptera,Coccinellidae,Psyllobora vigintimaculata,31188,"Guérin-Méneville, 1842",Psyllobora,vigintimaculata,,,Larson I.W.,1975,,,,,,Domlgaen D.J.,,5/29/1970,1970,5,29,149,,X.29.1970,,,,,,,,,,,,,,,,,United States,IL,Rock Island,,,,,,,,,,,,,,,,,,,,,,tierneybrosius,5/28/2021 7:02,http://creativecommons.org/licenses/by-nc/4.0/,Augustana College,,urn:uuid:cbfea2fc-642a-4be6-8d65-f6dfb39c3010,https://scan-bugs.org:443/portal/collections/individual/index.php?occid=56682393
56682397,AUGIE,ENT,,120bf21c-d066-48ee-b4c0-880596ea22e4,PreservedSpecimen,cb8b340a-11fb-4994-94b4-118b749cdeca,AUGIEENTA0000035,,Animalia,Arthropoda,Insecta,Coleoptera,Coccinellidae,Psyllobora vigintimaculata,31188,"Guérin-Méneville, 1842",Psyllobora,vigintimaculata,,,Larson I.W.,1975,,,,,,Dahlgren D.J.,,5/9/1970,1970,5,9,129,,X 9 1970,,,,,,,,,,,,,,,,,United States,IL,Rock Island,Rock Island,,,,,,,,,,,,,,,,,,,,,tierneybrosius,5/28/2021 7:05,http://creativecommons.org/licenses/by-nc/4.0/,Augustana College,,urn:uuid:cb8b340a-11fb-4994-94b4-118b749cdeca,https://scan-bugs.org:443/portal/collections/individual/index.php?occid=56682397
57239600,AUGIE,ENT,,120bf21c-d066-48ee-b4c0-880596ea22e4,PreservedSpecimen,3ff27382-d1dd-4c4f-8ccb-ae3008a4c6a3,AUGIEENTA0000036,,Animalia,Arthropoda,Insecta,Coleoptera,coccinellidae,coccinellidae,,,,,,,,,,,,,,Mekus G.I.,,9/18/1970,1970,9,18,261,,IX 18 1970,,,,,,,,,,,,,,,,,United States,Il,Rock Island,Rock Island,Augustana Campus,,,,,,,,,,,,,,,,,,,,tierneybrosius,6/17/2021 10:52,http://creativecommons.org/licenses/by-nc/4.0/,Augustana College,,urn:uuid:3ff27382-d1dd-4c4f-8ccb-ae3008a4c6a3,https://scan-bugs.org:443/portal/collections/individual/index.php?occid=57239600
57306011,AUGIE,ENT,,120bf21c-d066-48ee-b4c0-880596ea22e4,PreservedSpecimen,5fe0d221-2834-4ccb-857c-0baffb50fd9e,AUGIEENTA0000037,,Animalia,Arthropoda,Insecta,Coleoptera,Coccinellidae,Coleomegilla maculata fuscilabris,43425,Mulsant,Coleomegilla,maculata,,fuscilabris,Larson I. W.,,,,,,,Larson I. W.,,4/20/1953,1953,4,20,110,,IV 201953,,,,,,,,,,,,,,,,,United States,Minnesota,Pine,,,,,,,,,,,,,,,,,,,,,,tierneybrosius,6/29/2021 7:42,http://creativecommons.org/licenses/by-nc/4.0/,Augustana College,,urn:uuid:5fe0d221-2834-4ccb-857c-0baffb50fd9e,https://scan-bugs.org:443/portal/collections/individual/index.php?occid=57306011
57306030,AUGIE,ENT,,120bf21c-d066-48ee-b4c0-880596ea22e4,PreservedSpecimen,86d6455d-1d00-4d71-9f9f-886dd4714a70,AUGIEENTA0000047,,Animalia,Arthropoda,Insecta,Coleoptera,Coccinellidae,Cycloneda sanguinea limbifer,43837,,Cycloneda,sanguinea,,limbifer,I.W. Larson,1975,,,,,,Carlson C.,,5/19/1965,1965,5,19,139,,5/19/1965,,,,,,,,,,,,,,,,,United States,Illinois,Rock Island,Moline,,,,,,,,,,,,,,,,,,,,,jackhughes20,6/29/2021 7:53,http://creativecommons.org/licenses/by-nc/4.0/,Augustana College,,urn:uuid:86d6455d-1d00-4d71-9f9f-886dd4714a70,https://scan-bugs.org:443/portal/collections/individual/index.php?occid=57306030
57306031,AUGIE,ENT,,120bf21c-d066-48ee-b4c0-880596ea22e4,PreservedSpecimen,ceb19d78-ec16-4c58-ae39-29cf7bcb4ec6,AUGIEENTA0000038,,Animalia,Arthropoda,Insecta,Coleoptera,Coccinellidae,Coleomegilla maculata fuscilabris,43425,Mulsant,Coleomegilla,maculata,,fuscilabris,LARSON I. W.,,,,,,,KOURAKOS J. N.,,10/3/1970,1970,10,3,276,,X 31970,,,,,,,,,,,,,,,,,United States,IL,Rock Island,Rock Island,,,,,,,,,,,,,,,,,,,,,marissagorsegner,6/29/2021 7:54,http://creativecommons.org/licenses/by-nc/4.0/,Augustana College,,urn:uuid:ceb19d78-ec16-4c58-ae39-29cf7bcb4ec6,https://scan-bugs.org:443/portal/collections/individual/index.php?occid=57306031
57306032,AUGIE,ENT,,120bf21c-d066-48ee-b4c0-880596ea22e4,PreservedSpecimen,c0388a15-5530-49a4-8bc6-4ba24bfcb0c4,AUGIEENTA0000048,,Animalia,Arthropoda,Insecta,Coleoptera,Coccinellidae,Cycloneda sanguinea limbifer,43837,,Cycloneda,sanguinea,,limbifer,I.W. Larson,1975,,,,,,Nelson A.,,6/19/1970,1970,6,19,170,,6/19/1970,,,,,,,,,,,,,,,,,United States,Illinois,Rock Island,Rock Island,,,,,,,,,,,,,,,,,,,,,jackhughes20,6/29/2021 7:55,http://creativecommons.org/licenses/by-nc/4.0/,Augustana College,,urn:uuid:c0388a15-5530-49a4-8bc6-4ba24bfcb0c4,https://scan-bugs.org:443/portal/collections/individual/index.php?occid=57306032
57306033,AUGIE,ENT,,120bf21c-d066-48ee-b4c0-880596ea22e4,PreservedSpecimen,5d6beb67-7981-41aa-8e2c-6bcfe6adf8c2,AUGIEENTA0000039,,Animalia,Arthropoda,Insecta,Coleoptera,Coccinellidae,Coleomegilla maculata fuscilabris,43425,Mulsant,Coleomegilla,maculata,,fuscilabris,LARSON I. W.,,,,,,,LEHMANN W. G.,,10/2/1970,1970,10,2,275,,X 2 1970,,,,,,,,,,,,,,,,,United States,IL,Rock Island,Rock Island,,,,,,,,,,,,,,,,,,,,,marissagorsegner,6/29/2021 7:56,http://creativecommons.org/licenses/by-nc/4.0/,Augustana College,,urn:uuid:5d6beb67-7981-41aa-8e2c-6bcfe6adf8c2,https://scan-bugs.org:443/portal/collections/individual/index.php?occid=57306033
57306034,AUGIE,ENT,,120bf21c-d066-48ee-b4c0-880596ea22e4,PreservedSpecimen,ab389e7c-6cd7-4650-898c-54e4e59473ed,AUGIEENTA0000049,,Animalia,Arthropoda,Insecta,Coleoptera,Coccinellidae,Cycloneda sanguinea limbifer,43837,,Cycloneda,sanguinea,,limbifer,I.W. Larson,1975,,,,,,Carlson C.A.,,5/11/1965,1965,5,11,131,,5/11/1965,,,,,,,,,,,,,,,,,United States,Illinois,,Sherrard,,,,,,,,,,,,,,,,,,,,,jackhughes20,6/29/2021 7:58,http://creativecommons.org/licenses/by-nc/4.0/,Augustana College,,urn:uuid:ab389e7c-6cd7-4650-898c-54e4e59473ed,https://scan-bugs.org:443/portal/collections/individual/index.php?occid=57306034
57306035,AUGIE,ENT,,120bf21c-d066-48ee-b4c0-880596ea22e4,PreservedSpecimen,9a27da70-05f2-4540-8786-576bcdf3d79a,AUGIEENTA0000040,,Animalia,Arthropoda,Insecta,Coleoptera,Coccinellidae,Anatis mali,23666,Say,Anatis,mali,,,LARSON I. W.,,,,,,,LARSON I. W.,,5/26/1955,1955,5,26,146,,V 26 1955,,,,,,,,,,,,,,,,,United States,Minnesota,Houston,,,,,,,,,,,,,,,,,,,,,,marissagorsegner,6/29/2021 8:03,http://creativecommons.org/licenses/by-nc/4.0/,Augustana College,,urn:uuid:9a27da70-05f2-4540-8786-576bcdf3d79a,https://scan-bugs.org:443/portal/collections/individual/index.php?occid=57306035
57306037,AUGIE,ENT,,120bf21c-d066-48ee-b4c0-880596ea22e4,PreservedSpecimen,83e1269b-1076-4415-8b0a-4b3d29816c78,AUGIEENTA0000050,,Animalia,Arthropoda,Insecta,Coleoptera,Coccinellidae,Olla v-nigrum,29667,"(Mulsant, 1866)",Olla,v-nigrum,,,I.W. Larson,1975,,,,9,,Brugge D.,,8/11/1974,1974,8,11,223,,1974-8-XI,,,,,,,,,,,,,,,,,United States,Illinois,Rock Island,Rock Island,,,,,,,,,,,,,,,,,,,,,jackhughes20,6/29/2021 8:09,http://creativecommons.org/licenses/by-nc/4.0/,Augustana College,,urn:uuid:83e1269b-1076-4415-8b0a-4b3d29816c78,https://scan-bugs.org:443/portal/collections/individual/index.php?occid=57306037
57306038,AUGIE,ENT,,120bf21c-d066-48ee-b4c0-880596ea22e4,PreservedSpecimen,64184268-99c6-441e-82d0-b92162af3df0,AUGIEENTA0000041,,Animalia,Arthropoda,Insecta,Coleoptera,Coccinellidae,Anatis labiculata,23664,Oliv.,Anatis,labiculata,,,,,,,,,,Carlson C. A.,,5/18/1964,1964,5,18,139,,18-May-64,,,,,,,,,,,,,,,,,United States,IL,Rock Island,,,,,,,,,,,,,,,,,,,,,,marissagorsegner,8/19/2021 12:12,http://creativecommons.org/licenses/by-nc/4.0/,Augustana College,,urn:uuid:64184268-99c6-441e-82d0-b92162af3df0,https://scan-bugs.org:443/portal/collections/individual/index.php?occid=57306038
57306039,AUGIE,ENT,,120bf21c-d066-48ee-b4c0-880596ea22e4,PreservedSpecimen,23dce9ee-de1c-4184-a804-68f62f1c7449,AUGIEENTA0000051,,Animalia,Arthropoda,Insecta,Coleoptera,Coccinellidae,Olla v-nigrum,29667,"(Mulsant, 1866)",Olla,v-nigrum,,,I.W. Larson,1975,,,,9,,Brugge D.,,8/11/1974,1974,8,11,223,,1974-8-XI,,,,,,,,,,,,,,,,,United States,Illinois,Rock Island,Rock Island,,,,,,,,,,,,,,,,,,,,,jackhughes20,6/29/2021 8:09,http://creativecommons.org/licenses/by-nc/4.0/,Augustana College,,urn:uuid:23dce9ee-de1c-4184-a804-68f62f1c7449,https://scan-bugs.org:443/portal/collections/individual/index.php?occid=57306039
57306040,AUGIE,ENT,,120bf21c-d066-48ee-b4c0-880596ea22e4,PreservedSpecimen,2037fade-5489-49be-9aaa-9f13385aa045,AUGIEENTA0000042,,Animalia,Arthropoda,Insecta,Coleoptera,Coccinellidae,Anatis labiculata,23664,Oliv.,Anatis,labiculata,,,LARSON I. W.,,,,,,,LARSON I. W.,,4/16/1955,1955,4,16,106,,IV 16 1955,,,,,,,,,,,,,,,,,United States,Minnesota,Anoka,,,,,,,,,,,,,,,,,,,,,,marissagorsegner,6/29/2021 8:16,http://creativecommons.org/licenses/by-nc/4.0/,Augustana College,,urn:uuid:2037fade-5489-49be-9aaa-9f13385aa045,https://scan-bugs.org:443/portal/collections/individual/index.php?occid=57306040
57306041,AUGIE,ENT,,120bf21c-d066-48ee-b4c0-880596ea22e4,PreservedSpecimen,fa5c0c65-b45c-42f2-9004-177b019073b9,AUGIEENTA0000052,,Animalia,Arthropoda,Insecta,Coleoptera,Coccinellidae,Olla v-nigrum,29667,"(Mulsant, 1866)",Olla,v-nigrum,,,I.W. Larson,1975,,,,9,,Carter J.,,9/17/1974,1974,9,17,260,,9/17/1974,,,,,,,,,,,,,,,,,United States,Illinois,Rock Island,Rock Island,,,,,,,,,,,,,,,,,,,,,jackhughes20,7/1/2021 8:05,http://creativecommons.org/licenses/by-nc/4.0/,Augustana College,,urn:uuid:fa5c0c65-b45c-42f2-9004-177b019073b9,https://scan-bugs.org:443/portal/collections/individual/index.php?occid=57306041
57306043,AUGIE,ENT,,120bf21c-d066-48ee-b4c0-880596ea22e4,PreservedSpecimen,191b97b8-99ce-45c6-9c84-768966a5c581,AUGIEENTA0000043,,Animalia,Arthropoda,Insecta,Coleoptera,Coccinellidae,Anatis labiculata,23664,Oliv.,Anatis,labiculata,,,LARSON I. W.,,,,,,,LARSON I. W.,,4/20/1955,1955,4,20,110,,IV 20 1955,,,,,,,,,,,,,,,,,United States,Michigan,Pine,,,,,,,,,,,,,,,,,,,,,,marissagorsegner,6/29/2021 8:16,http://creativecommons.org/licenses/by-nc/4.0/,Augustana College,,urn:uuid:191b97b8-99ce-45c6-9c84-768966a5c581,https://scan-bugs.org:443/portal/collections/individual/index.php?occid=57306043
57306044,AUGIE,ENT,,120bf21c-d066-48ee-b4c0-880596ea22e4,PreservedSpecimen,5e6eb937-1926-4533-9b79-dbaf86a3616c,AUGIEENTA0000044,,Animalia,Arthropoda,Insecta,Coleoptera,Coccinellidae,Adalia bipunctata,23310,L.,Adalia,bipunctata,,,LARSON I. W.,,,,,,,Makus G. I.,,10/3/1970,1970,10,3,276,,X 3 1970,,,,,,,,,,,,,,,,,United States,IL,Rock Island,,,,,,,,,,,,,,,,,,,,,,marissagorsegner,6/29/2021 8:16,http://creativecommons.org/licenses/by-nc/4.0/,Augustana College,,urn:uuid:5e6eb937-1926-4533-9b79-dbaf86a3616c,https://scan-bugs.org:443/portal/collections/individual/index.php?occid=57306044
57306045,AUGIE,ENT,,120bf21c-d066-48ee-b4c0-880596ea22e4,PreservedSpecimen,e51a50c9-42ff-402d-b54b-fe9b3da97ba5,AUGIEENTA0000045,,Animalia,Arthropoda,Insecta,Coleoptera,Coccinellidae,Adalia bipunctata,23310,L.,Adalia,bipunctata,,,LARSON I. W.,,,,,,,KOURAKOS J. N.,,10/17/1970,1970,10,17,290,,X 17 1970,,,,,,,,,,,,,,,,,United States,IL,Rock Island,,,,,,,,,,,,,,,,,,,,,,marissagorsegner,6/29/2021 8:17,http://creativecommons.org/licenses/by-nc/4.0/,Augustana College,,urn:uuid:e51a50c9-42ff-402d-b54b-fe9b3da97ba5,https://scan-bugs.org:443/portal/collections/individual/index.php?occid=57306045
57306046,AUGIE,ENT,,120bf21c-d066-48ee-b4c0-880596ea22e4,PreservedSpecimen,0483d940-58e5-431a-8475-4b5beb0f7a4d,AUGIEENTA0000046,,Animalia,Arthropoda,Insecta,Coleoptera,Coccinellidae,Adalia bipunctata,23310,L.,Adalia,bipunctata,,,LARSON I. W.,,,,,,,Barnett M.,,10/5/1974,1974,10,5,278,,X 5 1974,,,,,,,,,,,,,,,,,United States,IL,Rock Island,,,,,,,,,,,,,,,,,,,,,,marissagorsegner,6/29/2021 8:13,http://creativecommons.org/licenses/by-nc/4.0/,Augustana College,,urn:uuid:0483d940-58e5-431a-8475-4b5beb0f7a4d,https://scan-bugs.org:443/portal/collections/individual/index.php?occid=57306046
57306047,AUGIE,ENT,,120bf21c-d066-48ee-b4c0-880596ea22e4,PreservedSpecimen,3754441b-b2a6-4d5e-83bb-1e5444fc4a5f,AUGIEENTA0000053,,Animalia,Arthropoda,Insecta,Coleoptera,Coccinellidae,Coccinella transversoguttata,25521,"Faldermann, 1835",Coccinella,transversoguttata,,,I.W. Larson,1981,,,,,,Larson I.W.,,8/8/1980,1980,8,8,221,,1980-8-VIII,,,,,,,,,,,,,,,,,United States,Minnesota,Todd,,,,,,,,,,,,,,,,,,,,,,jackhughes20,8/12/2021 8:07,http://creativecommons.org/licenses/by-nc/4.0/,Augustana College,,urn:uuid:3754441b-b2a6-4d5e-83bb-1e5444fc4a5f,https://scan-bugs.org:443/portal/collections/individual/index.php?occid=57306047
57306050,AUGIE,ENT,,120bf21c-d066-48ee-b4c0-880596ea22e4,PreservedSpecimen,fcc418b4-90b1-471b-968b-329ca7c488f1,AUGIEENTA0000054,,Animalia,Arthropoda,Insecta,Coleoptera,Coccinellidae,Coccinella transversoguttata,25521,"Faldermann, 1835",Coccinella,transversoguttata,,,I.W. Larson,1981,,,,,,Larson I.W.,,8/8/1980,1980,8,8,221,,1980-8-VIII,,,,,,,,,,,,,,,,,United States,Minnesota,Todd,,,,,,,,,,,,,,,,,,,,,,jackhughes20,6/29/2021 8:18,http://creativecommons.org/licenses/by-nc/4.0/,Augustana College,,urn:uuid:fcc418b4-90b1-471b-968b-329ca7c488f1,https://scan-bugs.org:443/portal/collections/individual/index.php?occid=57306050
57306054,AUGIE,ENT,,120bf21c-d066-48ee-b4c0-880596ea22e4,PreservedSpecimen,898a9d0d-37b5-45c5-9685-af1ceded36cc,AUGIEENTA0000055,,Animalia,Arthropoda,Insecta,Coleoptera,Coccinellidae,Epilachna varivestis,26495,,Epilachna,varivestis,,,I.W. Larson,1975,,,,,,Herzfeldt R. R.,,10/2/1970,1970,10,2,275,,X-2-1970,,,,,,,,,,,,,,,,,United States,Illinois,Rock Island,Rock Island,,,,,,,,,,,,,,,,,,,,,jackhughes20,6/29/2021 8:34,http://creativecommons.org/licenses/by-nc/4.0/,Augustana College,,urn:uuid:898a9d0d-37b5-45c5-9685-af1ceded36cc,https://scan-bugs.org:443/portal/collections/individual/index.php?occid=57306054
57306057,AUGIE,ENT,,120bf21c-d066-48ee-b4c0-880596ea22e4,PreservedSpecimen,00a0752b-8799-401c-974e-278358e8fe7a,AUGIEENTA0000056,,Animalia,Arthropoda,Insecta,Coleoptera,Coccinellidae,Epilachna varivestis,26495,,Epilachna,varivestis,,,Larson I.W.,1975,,,,,,Mekus K.,,10/7/1972,1972,10,7,281,,X-7-1972,,,,,,,,,,,,,,,,,United States,Illinois,Rock Island,Rock Island,,,,,,,,,,,,,,,,,,,,,jackhughes20,6/29/2021 8:33,http://creativecommons.org/licenses/by-nc/4.0/,Augustana College,,urn:uuid:00a0752b-8799-401c-974e-278358e8fe7a,https://scan-bugs.org:443/portal/collections/individual/index.php?occid=57306057
57306059,AUGIE,ENT,,120bf21c-d066-48ee-b4c0-880596ea22e4,PreservedSpecimen,d0cfd3dc-a98f-4220-a9f4-5132221640e2,AUGIEENTA0000057,,Animalia,Arthropoda,Insecta,Coleoptera,Coccinellidae,Epilachna varivestis,26495,,Epilachna,varivestis,,,Larson I.W.,1975,,,,,,Fusco B.,,9/16/1972,1972,9,16,260,,IX-16-1972,,,,,,,,,,,,,,,,,United States,Illinois,Rock Island,Rock Island,,,,,,,,,,,,,,,,,,,,,jackhughes20,6/29/2021 8:37,http://creativecommons.org/licenses/by-nc/4.0/,Augustana College,,urn:uuid:d0cfd3dc-a98f-4220-a9f4-5132221640e2,https://scan-bugs.org:443/portal/collections/individual/index.php?occid=57306059
57306061,AUGIE,ENT,,120bf21c-d066-48ee-b4c0-880596ea22e4,PreservedSpecimen,b4567730-8e1f-464d-a22f-40b38abe648c,AUGIEENTA0000058,,Animalia,Arthropoda,Insecta,Coleoptera,Coccinellidae,Hyperaspis signata,27835,,Hyperaspis,signata,,,Larson I.W.,1981,,,,,,Larson I.W.,,7/8/1983,1983,7,8,189,,VII-8-1983,,,,,,,,,,,,,,,,,United States,Kansas,Reno,,,,,,,,,,,,,,,,,,,,,,jackhughes20,6/29/2021 8:44,http://creativecommons.org/licenses/by-nc/4.0/,Augustana College,,urn:uuid:b4567730-8e1f-464d-a22f-40b38abe648c,https://scan-bugs.org:443/portal/collections/individual/index.php?occid=57306061
57306064,AUGIE,ENT,,120bf21c-d066-48ee-b4c0-880596ea22e4,PreservedSpecimen,b858c869-6ff2-4864-bf31-fe0c009245c4,AUGIEENTA0000059,,Animalia,Arthropoda,Insecta,Coleoptera,Coccinellidae,Psyllobora vigintimaculata,31188,,Psyllobora,vigintimaculata,,,Veronica Cervantes,8/19/2021,,,,,,Miller S.,,10/30/1980,1980,10,30,304,,X-30-1980,,,,,,,,,,,,,,,,,United States,Illinois,Rock Island,Rock Island,,,,,,,,,,,,,,,,,,,,,jackhughes20,8/19/2021 12:19,http://creativecommons.org/licenses/by-nc/4.0/,Augustana College,,urn:uuid:b858c869-6ff2-4864-bf31-fe0c009245c4,https://scan-bugs.org:443/portal/collections/individual/index.php?occid=57306064
57306065,AUGIE,ENT,,120bf21c-d066-48ee-b4c0-880596ea22e4,PreservedSpecimen,5db5385a-3899-4095-af8f-2da9a2297c54,AUGIEENTA0000060,,Animalia,Arthropoda,Insecta,Coleoptera,Coccinellidae,Psyllobora vigintimaculata,31188,,Psyllobora,vigintimaculata,,,Veronica Cervantes,8/19/2021,,,,,,Trick C.,,10/25/1980,1980,10,25,299,,X-25-1980,,,,,,,,,,,,,,,,,United States,Illinois,Rock Island,Rock Island,,,,,,,,,,,,,,,,,,,,,jackhughes20,8/19/2021 12:20,http://creativecommons.org/licenses/by-nc/4.0/,Augustana College,,urn:uuid:5db5385a-3899-4095-af8f-2da9a2297c54,https://scan-bugs.org:443/portal/collections/individual/index.php?occid=57306065
57306067,AUGIE,ENT,,120bf21c-d066-48ee-b4c0-880596ea22e4,PreservedSpecimen,c5a4c4a1-964d-4d54-b7cc-2fb4fdccd77a,AUGIEENTA0000063,,Animalia,Arthropoda,Insecta,Coleoptera,Coccinellidae,Coleomegilla maculata,25547,,Coleomegilla,maculata,,,Veronica Cervantes,8/19/2021,,,,,,Tamplin J.,,9/15/1983,1983,9,15,258,,IX 15 1983,,,,,,,,,,,,,,,,,United States,IL,Rock Island,,,,,,,,,,,,,,,,,,,,,,marissagorsegner,8/19/2021 12:22,http://creativecommons.org/licenses/by-nc/4.0/,Augustana College,,urn:uuid:c5a4c4a1-964d-4d54-b7cc-2fb4fdccd77a,https://scan-bugs.org:443/portal/collections/individual/index.php?occid=57306067
57306069,AUGIE,ENT,,120bf21c-d066-48ee-b4c0-880596ea22e4,PreservedSpecimen,bdaf201b-2739-4ce9-abe8-4caf30ce517e,AUGIEENTA0000061,,Animalia,Arthropoda,Insecta,Coleoptera,Coccinellidae,Psyllobora vigintimaculata,31188,,Psyllobora,vigintimaculata,,,Veronica Cervantes,8/19/2021,,,,,,Deip R.,,10/21/1976,1976,10,21,295,,X-21-1976,,,,,,,,,,,,,,,,,United States,Illinois,Rock Island,Rock Island,,,,,,,,,,,,,,,,,,,,,jackhughes20,8/19/2021 12:23,http://creativecommons.org/licenses/by-nc/4.0/,Augustana College,,urn:uuid:bdaf201b-2739-4ce9-abe8-4caf30ce517e,https://scan-bugs.org:443/portal/collections/individual/index.php?occid=57306069
57306070,AUGIE,ENT,,120bf21c-d066-48ee-b4c0-880596ea22e4,PreservedSpecimen,03310b76-d727-43fc-a14e-61b57a2d2578,AUGIEENTA0000062,,Animalia,Arthropoda,Insecta,Coleoptera,Coccinellidae,Coleomegilla maculata,25547,,Coleomegilla,maculata,,,Ruffatto O.,6/29/2021,,,,,,Rigdon S.,,9/14/1982,1982,9,14,257,,IX 14 1982,,,,,,,,,,,,,,,,,United States,IL,Rock Island,,,,,,,,,,,,,,,,,,,,,,marissagorsegner,6/29/2021 9:08,http://creativecommons.org/licenses/by-nc/4.0/,Augustana College,,urn:uuid:03310b76-d727-43fc-a14e-61b57a2d2578,https://scan-bugs.org:443/portal/collections/individual/index.php?occid=57306070
57306072,AUGIE,ENT,,120bf21c-d066-48ee-b4c0-880596ea22e4,PreservedSpecimen,ccb1fd37-a4d0-46fb-97ed-99b983144177,AUGIEENTA0000064,,Animalia,Arthropoda,Insecta,Coleoptera,Coccinellidae,Coleomegilla maculata,25547,,Coleomegilla,maculata,,,Ruffatto O.,6/29/2021,,,,,,Lavelle S.,,7/20/2016,2016,7,20,202,,20-Jul-16,,,,,,,,,,,,,,,,,United States,Iowa,Scott,,Credit Island,,,,,,,,,,,,,,,,,,,,marissagorsegner,6/29/2021 9:11,http://creativecommons.org/licenses/by-nc/4.0/,Augustana College,,urn:uuid:ccb1fd37-a4d0-46fb-97ed-99b983144177,https://scan-bugs.org:443/portal/collections/individual/index.php?occid=57306072
57306074,AUGIE,ENT,,120bf21c-d066-48ee-b4c0-880596ea22e4,PreservedSpecimen,1dd91c4c-a2ea-4983-80b5-6981be557f71,AUGIEENTA0000070,,Animalia,Arthropoda,Insecta,Coleoptera,Coccinellidae,Coleomegilla maculata,25547,,Coleomegilla,maculata,,,Ruffatto O.,6/29/2021,,,,,,Dulaney S.,,9/3/1980,1980,9,3,247,,"9, III, 1980",,,,,,,,,,,,,,,,,United States,IL,Rock Island,,,,,,,,,,,,,,,,,,,,,,marissagorsegner,6/29/2021 9:14,http://creativecommons.org/licenses/by-nc/4.0/,Augustana College,,urn:uuid:1dd91c4c-a2ea-4983-80b5-6981be557f71,https://scan-bugs.org:443/portal/collections/individual/index.php?occid=57306074
57306075,AUGIE,ENT,,120bf21c-d066-48ee-b4c0-880596ea22e4,PreservedSpecimen,0fe0371a-1144-488a-860b-2181a04c2441,AUGIEENTA0000069,,Animalia,Arthropoda,Insecta,Coleoptera,Coccinellidae,Coleomegilla maculata,25547,,Coleomegilla,maculata,,,Ruffatto O.,6/29/2021,,,,,,Solberg L.,,9/30/1982,1982,9,30,273,,IX 30 1982,,,,,,,,,,,,,,,,,United States,IL,Rock Island,,,,,,,,,,,,,,,,,,,,,,marissagorsegner,6/29/2021 9:15,http://creativecommons.org/licenses/by-nc/4.0/,Augustana College,,urn:uuid:0fe0371a-1144-488a-860b-2181a04c2441,https://scan-bugs.org:443/portal/collections/individual/index.php?occid=57306075
57306076,AUGIE,ENT,,120bf21c-d066-48ee-b4c0-880596ea22e4,PreservedSpecimen,0bce9613-bd4f-468d-922d-874d86bc0b39,AUGIEENTA0000068,,Animalia,Arthropoda,Insecta,Coleoptera,Coccinellidae,Coleomegilla maculata,25547,,Coleomegilla,maculata,,,Ruffatto O.,6/29/2021,,,,,,Dulaney S.,,11/7/1980,1980,11,7,312,,11 7 1980,,,,,,,,,,,,,,,,,United States,IL,Rock Island,,,,,,,,,,,,,,,,,,,,,,marissagorsegner,6/29/2021 9:17,http://creativecommons.org/licenses/by-nc/4.0/,Augustana College,,urn:uuid:0bce9613-bd4f-468d-922d-874d86bc0b39,https://scan-bugs.org:443/portal/collections/individual/index.php?occid=57306076
57306077,AUGIE,ENT,,120bf21c-d066-48ee-b4c0-880596ea22e4,PreservedSpecimen,90c5b87c-1f2f-4498-86ce-46c1a9d3d376,AUGIEENTA0000067,,Animalia,Arthropoda,Insecta,Coleoptera,Coccinellidae,Coleomegilla maculata,25547,,Coleomegilla,maculata,,,Ruffatto O.,6/29/2021,,,,,,Claeys C.,,4/7/1995,1995,4,7,97,,IV 7 1995,,,,,,,,,,,,,,,,,United States,Iowa,Scott,,,,,,,,,,,,,,,,,,,,,,marissagorsegner,6/29/2021 9:19,http://creativecommons.org/licenses/by-nc/4.0/,Augustana College,,urn:uuid:90c5b87c-1f2f-4498-86ce-46c1a9d3d376,https://scan-bugs.org:443/portal/collections/individual/index.php?occid=57306077
57306078,AUGIE,ENT,,120bf21c-d066-48ee-b4c0-880596ea22e4,PreservedSpecimen,acdd3e51-42a0-4421-852a-6cf533ee2965,AUGIEENTA0000066,,Animalia,Arthropoda,Insecta,Coleoptera,Coccinellidae,Coleomegilla maculata,25547,,Coleomegilla,maculata,,,Ruffatto O.,6/29/2021,,,,,,Clark,,9/6/1999,1999,9,6,249,,9 VI 1999,,,,,,,,,,,,,,,,,United States,IL,,,,,,,,,,,,,,,,,,,,,,,marissagorsegner,6/29/2021 9:28,http://creativecommons.org/licenses/by-nc/4.0/,Augustana College,,urn:uuid:acdd3e51-42a0-4421-852a-6cf533ee2965,https://scan-bugs.org:443/portal/collections/individual/index.php?occid=57306078
57306079,AUGIE,ENT,,120bf21c-d066-48ee-b4c0-880596ea22e4,PreservedSpecimen,067e2cba-ff81-4cc8-93d6-7d5efb7ec29c,AUGIEENTA0000065,,Animalia,Arthropoda,Insecta,Coleoptera,Coccinellidae,Coleomegilla maculata,25547,,Coleomegilla,maculata,,,Ruffatto O.,6/29/2021,,,,,,Rigdon S.,,9/14/1982,1982,9,14,257,,"IX-14, 1982",,,,,,,,,,,,,,,,,United States,IL,Rock Island,,,,,,,,,,,,,,,,,,,,,,marissagorsegner,6/29/2021 9:29,http://creativecommons.org/licenses/by-nc/4.0/,Augustana College,,urn:uuid:067e2cba-ff81-4cc8-93d6-7d5efb7ec29c,https://scan-bugs.org:443/portal/collections/individual/index.php?occid=57306079
57306080,AUGIE,ENT,,120bf21c-d066-48ee-b4c0-880596ea22e4,PreservedSpecimen,22ab92bc-29c6-447e-a8d1-4531556c9596,AUGIEENTA0000071,,Animalia,Arthropoda,Insecta,Coleoptera,Coccinellidae,Coleomegilla maculata,25547,,Coleomegilla,maculata,,,Ruffatto O.,6/29/2021,,,,,,Grinnan,,7/6/1999,1999,7,6,187,,7 VI 1999,,,,,,,,,,,,,,,,,United States,IL,Rock Island,,,,,,,,,,,,,,,,,,,,,,marissagorsegner,6/29/2021 9:32,http://creativecommons.org/licenses/by-nc/4.0/,Augustana College,,urn:uuid:22ab92bc-29c6-447e-a8d1-4531556c9596,https://scan-bugs.org:443/portal/collections/individual/index.php?occid=57306080
57306081,AUGIE,ENT,,120bf21c-d066-48ee-b4c0-880596ea22e4,PreservedSpecimen,2938659b-9445-463a-8f02-877561808457,AUGIEENTA0000072,,Animalia,Arthropoda,Insecta,Coleoptera,Coccinellidae,Coleomegilla maculata,25547,,Coleomegilla,maculata,,,Ruffatto O.,6/29/2021,,,,,,Young B. A.,,6/12/1980,1980,6,12,164,,VI 12 1980,,,,,,,,,,,,,,,,,United States,IL,Rock Island,,,,,,,,,,,,,,,,,,,,,,marissagorsegner,6/29/2021 9:33,http://creativecommons.org/licenses/by-nc/4.0/,Augustana College,,urn:uuid:2938659b-9445-463a-8f02-877561808457,https://scan-bugs.org:443/portal/collections/individual/index.php?occid=57306081
57306082,AUGIE,ENT,,120bf21c-d066-48ee-b4c0-880596ea22e4,PreservedSpecimen,79abbc93-daff-4749-9e2b-9fa8f6adc032,AUGIEENTA0000073,,Animalia,Arthropoda,Insecta,Coleoptera,Coccinellidae,Coleomegilla maculata,25547,,Coleomegilla,maculata,,,Ruffatto O.,6/29/2021,,,,,,Cohen E.,,5/4/1965,1965,5,4,124,,4-May-65,,,,,,,,,,,,,,,,,United States,IL,Rock Island,,,,,,,,,,,,,,,,,,,,,,marissagorsegner,8/19/2021 12:24,http://creativecommons.org/licenses/by-nc/4.0/,Augustana College,,urn:uuid:79abbc93-daff-4749-9e2b-9fa8f6adc032,https://scan-bugs.org:443/portal/collections/individual/index.php?occid=57306082
57306083,AUGIE,ENT,,120bf21c-d066-48ee-b4c0-880596ea22e4,PreservedSpecimen,38ba03c8-7eb6-4f9d-9e5a-5ff8959782f2,AUGIEENTA0000074,,Animalia,Arthropoda,Insecta,Coleoptera,Coccinellidae,Coleomegilla maculata,25547,,Coleomegilla,maculata,,,Ruffatto O.,6/29/2021,,,,,,Carlson C. A.,,5/4/1965,1965,5,4,124,,4-May-65,,,,,,,,,,,,,,,,,United States,IL,Rock Island,Sherrard,,,,,,,,,,,,,,,,,,,,,marissagorsegner,6/29/2021 9:38,http://creativecommons.org/licenses/by-nc/4.0/,Augustana College,,urn:uuid:38ba03c8-7eb6-4f9d-9e5a-5ff8959782f2,https://scan-bugs.org:443/portal/collections/individual/index.php?occid=57306083
57306085,AUGIE,ENT,,120bf21c-d066-48ee-b4c0-880596ea22e4,PreservedSpecimen,96870ef0-554e-4604-be4a-110012e70f90,AUGIEENTA0000075,,Animalia,Arthropoda,Insecta,Coleoptera,Coccinellidae,Coleomegilla maculata,25547,,Coleomegilla,maculata,,,Ruffatto O.,6/29/2021,,,,,,Bork A.,,8/14/1997,1997,8,14,226,,8/14/1997,,,,,,,,,,,,,,,,,United States,IL,Rock Island,,,,,,,,,,,,,,,,,,,,,,marissagorsegner,6/29/2021 9:39,http://creativecommons.org/licenses/by-nc/4.0/,Augustana College,,urn:uuid:96870ef0-554e-4604-be4a-110012e70f90,https://scan-bugs.org:443/portal/collections/individual/index.php?occid=57306085
57306086,AUGIE,ENT,,120bf21c-d066-48ee-b4c0-880596ea22e4,PreservedSpecimen,e2ffd169-b612-480f-968b-b1acb8b06e67,AUGIEENTA0000076,,Animalia,Arthropoda,Insecta,Coleoptera,Coccinellidae,Coleomegilla maculata,25547,,Coleomegilla,maculata,,,Ruffatto O.,6/29/2021,,,,,,Koelling K.,,10/10/1999,1999,10,10,283,,10 X 1999,,,,,,,,,,,,,,,,,United States,IL,McHenry,,,,,,,,,,,,,,,,,,,,,,marissagorsegner,6/29/2021 9:41,http://creativecommons.org/licenses/by-nc/4.0/,Augustana College,,urn:uuid:e2ffd169-b612-480f-968b-b1acb8b06e67,https://scan-bugs.org:443/portal/collections/individual/index.php?occid=57306086
57306089,AUGIE,ENT,,120bf21c-d066-48ee-b4c0-880596ea22e4,PreservedSpecimen,1d146fdd-f019-412f-936e-6779aa0fcaa5,AUGIEENTA0000077,,Animalia,Arthropoda,Insecta,Coleoptera,Coccinellidae,Coleomegilla maculata,25547,,Coleomegilla,maculata,,,Ruffatto O.,6/29/2021,,,,,,Bassler M.,,9/27/1981,1981,9,27,270,,IX 27 1981,,,,,,,,,,,,,,,,,United States,IL,Rock Island,,,,,,,,,,,,,,,,,,,,,,marissagorsegner,6/29/2021 9:43,http://creativecommons.org/licenses/by-nc/4.0/,Augustana College,,urn:uuid:1d146fdd-f019-412f-936e-6779aa0fcaa5,https://scan-bugs.org:443/portal/collections/individual/index.php?occid=57306089
57306093,AUGIE,ENT,,120bf21c-d066-48ee-b4c0-880596ea22e4,PreservedSpecimen,4e5d0ada-6ee3-48ef-a552-55da4337e63b,AUGIEENTA0000078,,Animalia,Arthropoda,Insecta,Coleoptera,Coccinellidae,Coleomegilla maculata,25547,,Coleomegilla,maculata,,,Ruffatto O.,6/29/2021,,,,,,Good B.,,6/9/2008,2008,6,9,161,,6/9/2008,,,,,,,,,,,,,,,,,United States,IL,Lee,,Green Wing,,,,,,,,,,,,,,,,,,,,marissagorsegner,6/29/2021 9:46,http://creativecommons.org/licenses/by-nc/4.0/,Augustana College,,urn:uuid:4e5d0ada-6ee3-48ef-a552-55da4337e63b,https://scan-bugs.org:443/portal/collections/individual/index.php?occid=57306093
57306096,AUGIE,ENT,,120bf21c-d066-48ee-b4c0-880596ea22e4,PreservedSpecimen,2e82489e-f35e-460f-8997-e58d9ae8a891,AUGIEENTA0000079,,Animalia,Arthropoda,Insecta,Coleoptera,Coccinellidae,Coleomegilla maculata,25547,,Coleomegilla,maculata,,,Ruffatto O.,6/29/2021,,,,,,Blakle J.,,9/2/1976,1976,9,2,246,,IX-2-76,,,,,,,,,,,,,,,,,United States,IL,Rock Island,,,,,,,,,,,,,,,,,,,,,,marissagorsegner,6/29/2021 9:48,http://creativecommons.org/licenses/by-nc/4.0/,Augustana College,,urn:uuid:2e82489e-f35e-460f-8997-e58d9ae8a891,https://scan-bugs.org:443/portal/collections/individual/index.php?occid=57306096
57306097,AUGIE,ENT,,120bf21c-d066-48ee-b4c0-880596ea22e4,PreservedSpecimen,bcebc5cf-d51e-44c8-894b-0986960b1004,AUGIEENTA0000080,,Animalia,Arthropoda,Insecta,Coleoptera,Coccinellidae,Coleomegilla maculata,25547,,Coleomegilla,maculata,,,Ruffatto O.,6/29/2021,,,,,,Munson R. C.,,10/12/1970,1970,10,12,285,,12-Oct-70,,,,,,,,,,,,,,,,,United States,IL,Rock Island,,,,,,,,,,,,,,,,,,,,,,marissagorsegner,6/29/2021 9:49,http://creativecommons.org/licenses/by-nc/4.0/,Augustana College,,urn:uuid:bcebc5cf-d51e-44c8-894b-0986960b1004,https://scan-bugs.org:443/portal/collections/individual/index.php?occid=57306097
57306100,AUGIE,ENT,,120bf21c-d066-48ee-b4c0-880596ea22e4,PreservedSpecimen,ac32d965-8d39-4dab-973e-b3ac3130381e,AUGIEENTA0000081,,Animalia,Arthropoda,Insecta,Coleoptera,Coccinellidae,Coleomegilla maculata,25547,,Coleomegilla,maculata,,,Ruffatto O.,6/29/2021,,,,,,Carlson C. A.,,5/4/1965,1965,5,4,124,,4-May-65,,,,,,,,,,,,,,,,,United States,IL,Rock Island,Sherrard,,,,,,,,,,,,,,,,,,,,,marissagorsegner,6/29/2021 9:50,http://creativecommons.org/licenses/by-nc/4.0/,Augustana College,,urn:uuid:ac32d965-8d39-4dab-973e-b3ac3130381e,https://scan-bugs.org:443/portal/collections/individual/index.php?occid=57306100
57306105,AUGIE,ENT,,120bf21c-d066-48ee-b4c0-880596ea22e4,PreservedSpecimen,47a5f339-198e-4167-b8b1-21bfaf939fe2,AUGIEENTA0000082,,Animalia,Arthropoda,Insecta,Coleoptera,Coccinellidae,Coleomegilla maculata,25547,,Coleomegilla,maculata,,,Ruffatto O.,6/29/2021,,,,,,Galers H.,,9/18/1984,1984,9,18,262,,IX-18-1984,,,,,,,,,,,,,,,,,United States,IL,Rock Island,,,,,,,,,,,,,,,,,,,,,,marissagorsegner,6/29/2021 9:53,http://creativecommons.org/licenses/by-nc/4.0/,Augustana College,,urn:uuid:47a5f339-198e-4167-b8b1-21bfaf939fe2,https://scan-bugs.org:443/portal/collections/individual/index.php?occid=57306105
57306106,AUGIE,ENT,,120bf21c-d066-48ee-b4c0-880596ea22e4,PreservedSpecimen,47f84512-cfb6-4e0a-8c53-14b687f6d1f9,AUGIEENTA0000083,,Animalia,Arthropoda,Insecta,Coleoptera,Coccinellidae,Coleomegilla maculata,25547,,Coleomegilla,maculata,,,Ruffatto O.,6/29/2021,,,,,,Hutchins K.,,9/6/1977,1977,9,6,249,,IX-6-1977,,,,,,,,,,,,,,,,,United States,IL,Rock Island,,,,,,,,,,,,,,,,,,,,,,marissagorsegner,6/29/2021 9:55,http://creativecommons.org/licenses/by-nc/4.0/,Augustana College,,urn:uuid:47f84512-cfb6-4e0a-8c53-14b687f6d1f9,https://scan-bugs.org:443/portal/collections/individual/index.php?occid=57306106
57306111,AUGIE,ENT,,120bf21c-d066-48ee-b4c0-880596ea22e4,PreservedSpecimen,188affba-91b0-4277-bff7-f1d557b2c86c,AUGIEENTA0000084,,Animalia,Arthropoda,Insecta,Coleoptera,Coccinellidae,Coleomegilla maculata,25547,,Coleomegilla,maculata,,,Ruffatto O.,6/29/2021,,,,,,Gerasch Andrew,,10/9/2018,2018,10,9,282,,9 Oct. 2018,,,,,,,,,,,,,,,,,United States,IL,Rock Island,,,,,,,,,,,,,,,,,,,,,,marissagorsegner,6/29/2021 9:57,http://creativecommons.org/licenses/by-nc/4.0/,Augustana College,,urn:uuid:188affba-91b0-4277-bff7-f1d557b2c86c,https://scan-bugs.org:443/portal/collections/individual/index.php?occid=57306111
57306114,AUGIE,ENT,,120bf21c-d066-48ee-b4c0-880596ea22e4,PreservedSpecimen,339aecaa-be56-4fb2-a010-b1153f12c0e0,AUGIEENTA0000085,,Animalia,Arthropoda,Insecta,Coleoptera,Coccinellidae,Coleomegilla maculata,25547,,Coleomegilla,maculata,,,Ruffatto O.,6/29/2021,,,,,,Natzite R. A.,,10/28/1986,1986,10,28,301,,X 28 1986,,,,,,,,,,,,,,,,,United States,IL,Rock Island,,,,,,,,,,,,,,,,,,,,,,marissagorsegner,6/29/2021 9:58,http://creativecommons.org/licenses/by-nc/4.0/,Augustana College,,urn:uuid:339aecaa-be56-4fb2-a010-b1153f12c0e0,https://scan-bugs.org:443/portal/collections/individual/index.php?occid=57306114
57306118,AUGIE,ENT,,120bf21c-d066-48ee-b4c0-880596ea22e4,PreservedSpecimen,0d479c90-000d-4737-bb69-463631c0e049,AUGIEENTA0000086,,Animalia,Arthropoda,Insecta,Coleoptera,Coccinellidae,Coleomegilla maculata,25547,,Coleomegilla,maculata,,,Ruffatto O.,6/29/2021,,,,,,Campacona J.,,10/26/1976,1976,10,26,300,,10/26/1976,,,,,,,,,,,,,,,,,United States,IL,Rock Island,,,,,,,,,,,,,,,,,,,,,,marissagorsegner,6/29/2021 9:59,http://creativecommons.org/licenses/by-nc/4.0/,Augustana College,,urn:uuid:0d479c90-000d-4737-bb69-463631c0e049,https://scan-bugs.org:443/portal/collections/individual/index.php?occid=57306118
57306123,AUGIE,ENT,,120bf21c-d066-48ee-b4c0-880596ea22e4,PreservedSpecimen,014ba05e-b23c-48e9-834f-d4617f200800,AUGIEENTA0000087,,Animalia,Arthropoda,Insecta,Coleoptera,Coccinellidae,Coleomegilla maculata,25547,,Coleomegilla,maculata,,,Ruffatto O.,6/29/2021,,,,,,Martinez B.,,9/26/1986,1986,9,26,269,,IX 26 1986,,,,,,,,,,,,,,,,,United States,IL,Rock Island,,,,,,,,,,,,,,,,,,,,,,marissagorsegner,6/29/2021 10:00,http://creativecommons.org/licenses/by-nc/4.0/,Augustana College,,urn:uuid:014ba05e-b23c-48e9-834f-d4617f200800,https://scan-bugs.org:443/portal/collections/individual/index.php?occid=57306123
57306133,AUGIE,ENT,,120bf21c-d066-48ee-b4c0-880596ea22e4,PreservedSpecimen,43d43f65-ba1a-4455-99c3-0be020dc3932,AUGIEENTA0000088,,Animalia,Arthropoda,Insecta,Coleoptera,Coccinellidae,Coleomegilla maculata,25547,,Coleomegilla,maculata,,,Ruffatto O.,6/29/2021,,,,,,Johnson A.,,9/14/1982,1982,9,14,257,,IX 14 1982,,,,,,,,,,,,,,,,,United States,IL,Rock Island,,,,,,,,,,,,,,,,,,,,,,marissagorsegner,6/29/2021 10:05,http://creativecommons.org/licenses/by-nc/4.0/,Augustana College,,urn:uuid:43d43f65-ba1a-4455-99c3-0be020dc3932,https://scan-bugs.org:443/portal/collections/individual/index.php?occid=57306133
57306134,AUGIE,ENT,,120bf21c-d066-48ee-b4c0-880596ea22e4,PreservedSpecimen,98030920-26b4-4397-8d4b-38a405aa2a2a,AUGIEENTA0000089,,Animalia,Arthropoda,Insecta,Coleoptera,Coccinellidae,Coleomegilla maculata,25547,,Coleomegilla,maculata,,,Ruffatto O.,6/29/2021,,,,,,Gevac S.,,7/12/1976,1976,7,12,194,,12 VII 1976,,,,,,,,,,,,,,,,,United States,IL,Lee,,Green Wing,,,,,,,,,,,,,,,,,,,,marissagorsegner,6/29/2021 10:06,http://creativecommons.org/licenses/by-nc/4.0/,Augustana College,,urn:uuid:98030920-26b4-4397-8d4b-38a405aa2a2a,https://scan-bugs.org:443/portal/collections/individual/index.php?occid=57306134
57306135,AUGIE,ENT,,120bf21c-d066-48ee-b4c0-880596ea22e4,PreservedSpecimen,c53ff6dd-efcf-4bb7-aec9-635fedf1937f,AUGIEENTA0000090,,Animalia,Arthropoda,Insecta,Coleoptera,Coccinellidae,Coleomegilla maculata,25547,,Coleomegilla,maculata,,,Ruffatto O.,6/29/2021,,,,,,Burke K.,,10/30/1986,1986,10,30,303,,X 30 1986,,,,,,,,,,,,,,,,,United States,IL,Rock Island,,,,,,,,,,,,,,,,,,,,,,marissagorsegner,6/29/2021 10:08,http://creativecommons.org/licenses/by-nc/4.0/,Augustana College,,urn:uuid:c53ff6dd-efcf-4bb7-aec9-635fedf1937f,https://scan-bugs.org:443/portal/collections/individual/index.php?occid=57306135
57306136,AUGIE,ENT,,120bf21c-d066-48ee-b4c0-880596ea22e4,PreservedSpecimen,0b925a6f-30ca-4f51-8fbc-c79b000e380a,AUGIEENTA0000091,,Animalia,Arthropoda,Insecta,Coleoptera,Coccinellidae,Coleomegilla maculata,25547,,Coleomegilla,maculata,,,Ruffatto O.,6/29/2021,,,,,,Triebs E.,,9/26/1980,1980,9,26,270,,IX 26 1980,,,,,,,,,,,,,,,,,United States,IL,Rock Island,,,,,,,,,,,,,,,,,,,,,,marissagorsegner,6/29/2021 10:09,http://creativecommons.org/licenses/by-nc/4.0/,Augustana College,,urn:uuid:0b925a6f-30ca-4f51-8fbc-c79b000e380a,https://scan-bugs.org:443/portal/collections/individual/index.php?occid=57306136
57306137,AUGIE,ENT,,120bf21c-d066-48ee-b4c0-880596ea22e4,PreservedSpecimen,8aeda417-8861-4f9b-9765-6281e0a3aa21,AUGIEENTA0000092,,Animalia,Arthropoda,Insecta,Coleoptera,Coccinellidae,Coleomegilla maculata,25547,,Coleomegilla,maculata,,,Ruffatto O.,6/29/2021,,,,,,Carlson C. A.,,5/11/1965,1965,5,11,131,,May 11 1965,,,,,,,,,,,,,,,,,United States,IL,Rock Island,,,,,,,,,,,,,,,,,,,,,,marissagorsegner,6/29/2021 10:10,http://creativecommons.org/licenses/by-nc/4.0/,Augustana College,,urn:uuid:8aeda417-8861-4f9b-9765-6281e0a3aa21,https://scan-bugs.org:443/portal/collections/individual/index.php?occid=57306137
57306138,AUGIE,ENT,,120bf21c-d066-48ee-b4c0-880596ea22e4,PreservedSpecimen,fb7e6c16-9e6d-4969-afac-6caabe5d481a,AUGIEENTA0000093,,Animalia,Arthropoda,Insecta,Coleoptera,Coccinellidae,Coleomegilla maculata,25547,,Coleomegilla,maculata,,,Ruffatto O.,6/29/2021,,,,,,Ebert J.,,6/11/1999,1999,6,11,162,,11 VI 1999,,,,,,,,,,,,,,,,,United States,IL,Lee,,,,,,,,,,,,,,,,,,,,,,marissagorsegner,6/29/2021 10:11,http://creativecommons.org/licenses/by-nc/4.0/,Augustana College,,urn:uuid:fb7e6c16-9e6d-4969-afac-6caabe5d481a,https://scan-bugs.org:443/portal/collections/individual/index.php?occid=57306138
57306158,AUGIE,ENT,,120bf21c-d066-48ee-b4c0-880596ea22e4,PreservedSpecimen,f474aa6d-9e6b-4a9e-9957-5518866e9aea,AUGIEENTA0000094,,Animalia,Arthropoda,Insecta,Coleoptera,Coccinellidae,Coleomegilla maculata,25547,,Coleomegilla,maculata,,,Ruffatto O.,6/29/2021,,,,,,Lindquist A.,,11/5/1972,1972,11,5,310,,5-Nov-72,,,,,,,,,,,,,,,,,United States,IL,Rock Island,,,,,,,,,,,,,,,,,,,,,,marissagorsegner,6/29/2021 11:07,http://creativecommons.org/licenses/by-nc/4.0/,Augustana College,,urn:uuid:f474aa6d-9e6b-4a9e-9957-5518866e9aea,https://scan-bugs.org:443/portal/collections/individual/index.php?occid=57306158
57306159,AUGIE,ENT,,120bf21c-d066-48ee-b4c0-880596ea22e4,PreservedSpecimen,c2d61f35-dfc8-4078-90cf-0c44e877b240,AUGIEENTA0000095,,Animalia,Arthropoda,Insecta,Coleoptera,Coccinellidae,Coleomegilla maculata,25547,,Coleomegilla,maculata,,,Ruffatto O.,6/29/2021,,,,,,Benson B.,,10/2/1985,1985,10,2,275,,X 2 1985,,,,,,,,,,,,,,,,,United States,IL,Rock Island,,,,,,,,,,,,,,,,,,,,,,marissagorsegner,6/29/2021 11:09,http://creativecommons.org/licenses/by-nc/4.0/,Augustana College,,urn:uuid:c2d61f35-dfc8-4078-90cf-0c44e877b240,https://scan-bugs.org:443/portal/collections/individual/index.php?occid=57306159
57306160,AUGIE,ENT,,120bf21c-d066-48ee-b4c0-880596ea22e4,PreservedSpecimen,e52d0031-8630-49c9-a874-a2bc51c19b4d,AUGIEENTA0000096,,Animalia,Arthropoda,Insecta,Coleoptera,Coccinellidae,Coleomegilla maculata,25547,,Coleomegilla,maculata,,,Ruffatto O.,6/29/2021,,,,,,O'Shea K.,,9/28/1982,1982,9,28,271,,IX 28 1982,,,,,,,,,,,,,,,,,United States,IL,Rock Island,,,,,,,,,,,,,,,,,,,,,,marissagorsegner,6/29/2021 11:10,http://creativecommons.org/licenses/by-nc/4.0/,Augustana College,,urn:uuid:e52d0031-8630-49c9-a874-a2bc51c19b4d,https://scan-bugs.org:443/portal/collections/individual/index.php?occid=57306160
57306161,AUGIE,ENT,,120bf21c-d066-48ee-b4c0-880596ea22e4,PreservedSpecimen,494ed6ae-0adc-4642-803f-6656f2bb5e09,AUGIEENTA0000097,,Animalia,Arthropoda,Insecta,Coleoptera,Coccinellidae,Coleomegilla maculata,25547,,Coleomegilla,maculata,,,Ruffatto O.,6/29/2021,,,,,,Faivre,,10/21/1997,1997,10,21,294,,IX 21 1997,,,,,,,,,,,,,,,,,United States,IL,Lee,,Green Wing,,,,,,,,,,,,,,,,,,,,marissagorsegner,6/29/2021 11:11,http://creativecommons.org/licenses/by-nc/4.0/,Augustana College,,urn:uuid:494ed6ae-0adc-4642-803f-6656f2bb5e09,https://scan-bugs.org:443/portal/collections/individual/index.php?occid=57306161
57306163,AUGIE,ENT,,120bf21c-d066-48ee-b4c0-880596ea22e4,PreservedSpecimen,f000e165-aa65-4d93-90c3-dda3998af694,AUGIEENTA0000098,,Animalia,Arthropoda,Insecta,Coleoptera,Coccinellidae,Coleomegilla maculata,25547,,Coleomegilla,maculata,,,Ruffatto O.,6/29/2021,,,,,,Decker R.,,9/17/1999,1999,9,17,260,,17 IX 1999,,,,,,,,,,,,,,,,,United States,IL,Whiteside,,,,,,,,,,,,,,,,,,,,,,marissagorsegner,6/29/2021 11:12,http://creativecommons.org/licenses/by-nc/4.0/,Augustana College,,urn:uuid:f000e165-aa65-4d93-90c3-dda3998af694,https://scan-bugs.org:443/portal/collections/individual/index.php?occid=57306163
57306165,AUGIE,ENT,,120bf21c-d066-48ee-b4c0-880596ea22e4,PreservedSpecimen,fefb15fe-cc42-40d8-8415-5d43013b4415,AUGIEENTA0000099,,Animalia,Arthropoda,Insecta,Coleoptera,Coccinellidae,Coleomegilla maculata,25547,,Coleomegilla,maculata,,,Ruffatto O.,6/29/2021,,,,,,Guerrian B.,,9/26/1986,1986,9,26,269,,IX 26 1986,,,,,,,,,,,,,,,,,United States,IL,Rock Island,,,,,,,,,,,,,,,,,,,,,,marissagorsegner,6/29/2021 11:13,http://creativecommons.org/licenses/by-nc/4.0/,Augustana College,,urn:uuid:fefb15fe-cc42-40d8-8415-5d43013b4415,https://scan-bugs.org:443/portal/collections/individual/index.php?occid=57306165
57306177,AUGIE,ENT,,120bf21c-d066-48ee-b4c0-880596ea22e4,PreservedSpecimen,8831590a-a8d9-414e-a05a-371f98c03c6c,AUGIEENTA0000100,,Animalia,Arthropoda,Insecta,Coleoptera,Coccinellidae,Chilocorus stigma,25164,,Chilocorus,stigma,,,Ruffatto O.,6/29/2021,,,,,,Bassler M.,,9/13/1981,1981,9,13,256,,IX 13 1981,,,,,,,,,,,,,,,,,United States,IL,Rock Island,,,,,,,,,,,,,,,,,,,,,,marissagorsegner,8/19/2021 12:25,http://creativecommons.org/licenses/by-nc/4.0/,Augustana College,,urn:uuid:8831590a-a8d9-414e-a05a-371f98c03c6c,https://scan-bugs.org:443/portal/collections/individual/index.php?occid=57306177
57306178,AUGIE,ENT,,120bf21c-d066-48ee-b4c0-880596ea22e4,PreservedSpecimen,cb6391fe-65e0-411a-bf4a-00074c67427c,AUGIEENTA0000101,,Animalia,Arthropoda,Insecta,Coleoptera,Coccinellidae,Adalia bipunctata,23310,,Adalia,bipunctata,,,Ruffatto O.,6/29/2021,,,,,,Sweet J. A.,,10/6/1970,1970,10,6,279,,X 6 1970,,,,,,,,,,,,,,,,,United States,IL,Rock Island,,,,,,,,,,,,,,,,,,,,,,marissagorsegner,6/29/2021 11:20,http://creativecommons.org/licenses/by-nc/4.0/,Augustana College,,urn:uuid:cb6391fe-65e0-411a-bf4a-00074c67427c,https://scan-bugs.org:443/portal/collections/individual/index.php?occid=57306178
57306181,AUGIE,ENT,,120bf21c-d066-48ee-b4c0-880596ea22e4,PreservedSpecimen,7b408126-8ad4-42e2-9d3f-d72432e81b86,AUGIEENTA0000102,,Animalia,Arthropoda,Insecta,Coleoptera,Coccinellidae,Adalia bipunctata,23310,,Adalia,bipunctata,,,Ruffatto O.,6/29/2021,,,,,,Carlson C. A.,,4/30/1965,1965,4,30,120,,30-Apr-65,,,,,,,,,,,,,,,,,United States,Iowa,Scott,Davenport,,,,,,,,,,,,,,,,,,,,,marissagorsegner,6/29/2021 11:21,http://creativecommons.org/licenses/by-nc/4.0/,Augustana College,,urn:uuid:7b408126-8ad4-42e2-9d3f-d72432e81b86,https://scan-bugs.org:443/portal/collections/individual/index.php?occid=57306181
57306183,AUGIE,ENT,,120bf21c-d066-48ee-b4c0-880596ea22e4,PreservedSpecimen,689e0c2f-a5c7-4a79-b669-1f1b860d7f9e,AUGIEENTA0000103,,Animalia,Arthropoda,Insecta,Coleoptera,Coccinellidae,Adalia bipunctata,23310,,Adalia,bipunctata,,,Ruffatto O.,6/29/2021,,,,,,Dulaney S.,,11/7/1980,1980,11,7,312,,11 7 1980,,,,,,,,,,,,,,,,,United States,IL,Rock Island,,,,,,,,,,,,,,,,,,,,,,marissagorsegner,6/29/2021 11:22,http://creativecommons.org/licenses/by-nc/4.0/,Augustana College,,urn:uuid:689e0c2f-a5c7-4a79-b669-1f1b860d7f9e,https://scan-bugs.org:443/portal/collections/individual/index.php?occid=57306183
57306184,AUGIE,ENT,,120bf21c-d066-48ee-b4c0-880596ea22e4,PreservedSpecimen,e44d572f-fc1b-4f14-87b6-730ce853a299,AUGIEENTA0000104,,Animalia,Arthropoda,Insecta,Coleoptera,Coccinellidae,Adalia bipunctata,23310,,Adalia,bipunctata,,,Ruffatto O.,6/29/2021,,,,,,Makus G. I.,,10/30/1970,1970,10,30,303,,X 30 1970,,,,,,,,,,,,,,,,,United States,IL,Rock Island,,Augustana College,,,,,,,,,,,,,,,,,,,,marissagorsegner,6/29/2021 11:23,http://creativecommons.org/licenses/by-nc/4.0/,Augustana College,,urn:uuid:e44d572f-fc1b-4f14-87b6-730ce853a299,https://scan-bugs.org:443/portal/collections/individual/index.php?occid=57306184
57306186,AUGIE,ENT,,120bf21c-d066-48ee-b4c0-880596ea22e4,PreservedSpecimen,a3663915-3e19-47da-8cff-9657fea51c5b,AUGIEENTA0000105,,Animalia,Arthropoda,Insecta,Coleoptera,Coccinellidae,Adalia bipunctata,23310,,Adalia,bipunctata,,,Ruffatto O.,6/29/2021,,,,,,Carlson C. A.,,4/30/1965,1965,4,30,120,,30-Apr-65,,,,,,,,,,,,,,,,,United States,Iowa,Scott,Davenport,,,,,,,,,,,,,,,,,,,,,marissagorsegner,6/29/2021 11:24,http://creativecommons.org/licenses/by-nc/4.0/,Augustana College,,urn:uuid:a3663915-3e19-47da-8cff-9657fea51c5b,https://scan-bugs.org:443/portal/collections/individual/index.php?occid=57306186
57306189,AUGIE,ENT,,120bf21c-d066-48ee-b4c0-880596ea22e4,PreservedSpecimen,2b94e81f-12e5-46e3-8749-5e7a13d348ac,AUGIEENTA0000106,,Animalia,Arthropoda,Insecta,Coleoptera,Coccinellidae,Adalia bipunctata,23310,,Adalia,bipunctata,,,Ruffatto O.,6/29/2021,,,,,,Loueh S.,,6/18/1975,1975,6,18,169,,18-Jun-75,,,,,,,,,,,,,,,,,United States,IL,Rock Island,,Augustana College,,,,,,,,,,,,,,,,,,,,marissagorsegner,6/29/2021 11:26,http://creativecommons.org/licenses/by-nc/4.0/,Augustana College,,urn:uuid:2b94e81f-12e5-46e3-8749-5e7a13d348ac,https://scan-bugs.org:443/portal/collections/individual/index.php?occid=57306189
57306190,AUGIE,ENT,,120bf21c-d066-48ee-b4c0-880596ea22e4,PreservedSpecimen,738f6377-7547-4cbf-a321-9d7f8968c2ed,AUGIEENTA0000107,,Animalia,Arthropoda,Insecta,Coleoptera,Coccinellidae,Adalia bipunctata,23310,,Adalia,bipunctata,,,Ruffatto O.,6/29/2021,,,,,,,,10/2/1970,1970,10,2,275,,X 2 1970,,,,,,,,,,,,,,,,,United States,IL,Rock Island,,,,,,,,,,,,,,,,,,,,,,marissagorsegner,6/29/2021 11:27,http://creativecommons.org/licenses/by-nc/4.0/,Augustana College,,urn:uuid:738f6377-7547-4cbf-a321-9d7f8968c2ed,https://scan-bugs.org:443/portal/collections/individual/index.php?occid=57306190
57306193,AUGIE,ENT,,120bf21c-d066-48ee-b4c0-880596ea22e4,PreservedSpecimen,641c960f-08a4-4d04-b8f9-515d130c6d75,AUGIEENTA0000108,,Animalia,Arthropoda,Insecta,Coleoptera,Coccinellidae,Adalia bipunctata,23310,,Adalia,bipunctata,,,Ruffatto O.,6/29/2021,,,,,,Lamdahl,,10/9/1970,1970,10,9,282,,9-Oct-70,,,,,,,,,,,,,,,,,United States,IL,Rock Island,,,,,,,,,,,,,,,,,,,,,,marissagorsegner,6/29/2021 11:28,http://creativecommons.org/licenses/by-nc/4.0/,Augustana College,,urn:uuid:641c960f-08a4-4d04-b8f9-515d130c6d75,https://scan-bugs.org:443/portal/collections/individual/index.php?occid=57306193
57306195,AUGIE,ENT,,120bf21c-d066-48ee-b4c0-880596ea22e4,PreservedSpecimen,fbc6beec-6f7c-4e5c-b889-4f5a674630c7,AUGIEENTA0000109,,Animalia,Arthropoda,Insecta,Coleoptera,Coccinellidae,Adalia bipunctata,23310,,Adalia,bipunctata,,,Ruffatto O.,6/29/2021,,,,,,Carlson C. A.,,3/26/1959,1959,3,26,85,,3/26/1959,,,,,,,,,,,,,,,,,United States,Iowa,Story,Ames,,,,,,,,,,,,,,,,,,,,,marissagorsegner,6/29/2021 11:29,http://creativecommons.org/licenses/by-nc/4.0/,Augustana College,,urn:uuid:fbc6beec-6f7c-4e5c-b889-4f5a674630c7,https://scan-bugs.org:443/portal/collections/individual/index.php?occid=57306195
57306198,AUGIE,ENT,,120bf21c-d066-48ee-b4c0-880596ea22e4,PreservedSpecimen,53a5fd78-ea13-4a82-b4fc-80dc0244af5b,AUGIEENTA0000110,,Animalia,Arthropoda,Insecta,Coleoptera,Coccinellidae,Adalia bipunctata,23310,,Adalia,bipunctata,,,Ruffatto O.,6/29/2021,,,,,,Carlson C. A.,,4/30/1965,1965,4,30,120,,30-Apr-65,,,,,,,,,,,,,,,,,United States,Iowa,Scott,Davenport,,,,,,,,,,,,,,,,,,,,,marissagorsegner,6/29/2021 11:30,http://creativecommons.org/licenses/by-nc/4.0/,Augustana College,,urn:uuid:53a5fd78-ea13-4a82-b4fc-80dc0244af5b,https://scan-bugs.org:443/portal/collections/individual/index.php?occid=57306198
57306199,AUGIE,ENT,,120bf21c-d066-48ee-b4c0-880596ea22e4,PreservedSpecimen,ba00d833-1a1d-4f2d-b52c-edd8bd5de078,AUGIEENTA0000111,,Animalia,Arthropoda,Insecta,Coleoptera,Coccinellidae,Adalia bipunctata,23310,,Adalia,bipunctata,,,Ruffatto O.,6/29/2021,,,,,,Carlson C. A.,,4/30/1965,1965,4,30,120,,30-Apr-65,,,,,,,,,,,,,,,,,United States,Iowa,Scott,Davenport,,,,,,,,,,,,,,,,,,,,,marissagorsegner,6/29/2021 11:31,http://creativecommons.org/licenses/by-nc/4.0/,Augustana College,,urn:uuid:ba00d833-1a1d-4f2d-b52c-edd8bd5de078,https://scan-bugs.org:443/portal/collections/individual/index.php?occid=57306199
57306204,AUGIE,ENT,,120bf21c-d066-48ee-b4c0-880596ea22e4,PreservedSpecimen,578016d2-32b0-40d5-aae3-c346f274359e,AUGIEENTA0000112,,Animalia,Arthropoda,Insecta,Coleoptera,Coccinellidae,Hippodamia convergens,27393,"Guérin-Méneville, 1842",Hippodamia,convergens,,,LARSON I. W.,,,,,,,Carlson C. A.,,5/13/1965,1965,5,13,133,,May 13 1965,,,,,,,,,,,,,,,,,United States,IL,Rock Island,,Quad Cities Airport,,,,,,,,,,,,,,,,,,,,marissagorsegner,6/29/2021 11:33,http://creativecommons.org/licenses/by-nc/4.0/,Augustana College,,urn:uuid:578016d2-32b0-40d5-aae3-c346f274359e,https://scan-bugs.org:443/portal/collections/individual/index.php?occid=57306204
57306208,AUGIE,ENT,,120bf21c-d066-48ee-b4c0-880596ea22e4,PreservedSpecimen,29d44ecc-d390-4024-89c4-0ef8dec9c78e,AUGIEENTA0000113,,Animalia,Arthropoda,Insecta,Coleoptera,Coccinellidae,Hippodamia convergens,27393,"Guérin-Méneville, 1842",Hippodamia,convergens,,,Ruffatto O.,6/29/2021,,,,,,Ehles H.,,9/6/1984,1984,9,6,250,,IX 6 1984,,,,,,,,,,,,,,,,,United States,IL,Rock Island,,,,,,,,,,,,,,,,,,,,,,marissagorsegner,6/29/2021 11:36,http://creativecommons.org/licenses/by-nc/4.0/,Augustana College,,urn:uuid:29d44ecc-d390-4024-89c4-0ef8dec9c78e,https://scan-bugs.org:443/portal/collections/individual/index.php?occid=57306208
57306212,AUGIE,ENT,,120bf21c-d066-48ee-b4c0-880596ea22e4,PreservedSpecimen,524f1d65-b0e4-4012-a270-f7fe749a3983,AUGIEENTA0000114,,Animalia,Arthropoda,Insecta,Coleoptera,Coccinellidae,Hippodamia convergens,27393,"Guérin-Méneville, 1842",Hippodamia,convergens,,,LARSON I. W.,,,,,,,Carlson C. A.,,5/4/1965,1965,5,4,124,,4-May-65,,,,,,,,,,,,,,,,,United States,IL,Rock Island,Sherrard,,,,,,,,,,,,,,,,,,,,,marissagorsegner,6/29/2021 11:40,http://creativecommons.org/licenses/by-nc/4.0/,Augustana College,,urn:uuid:524f1d65-b0e4-4012-a270-f7fe749a3983,https://scan-bugs.org:443/portal/collections/individual/index.php?occid=57306212
57306218,AUGIE,ENT,,120bf21c-d066-48ee-b4c0-880596ea22e4,PreservedSpecimen,4d1e8f1e-972b-42f6-8bab-d4c8a6ce3aa3,AUGIEENTA0000115,,Animalia,Arthropoda,Insecta,Coleoptera,Coccinellidae,Hippodamia convergens,27393,"Guérin-Méneville, 1842",Hippodamia,convergens,,,Ruffatto O.,6/29/2021,,,,,,Wym Bob,,10/10/1974,1974,10,10,283,,X 10 1974,,,,,,,,,,,,,,,,,United States,IL,Rock Island,,,,,,,,,,,,,,,,,,,,,,marissagorsegner,6/29/2021 11:42,http://creativecommons.org/licenses/by-nc/4.0/,Augustana College,,urn:uuid:4d1e8f1e-972b-42f6-8bab-d4c8a6ce3aa3,https://scan-bugs.org:443/portal/collections/individual/index.php?occid=57306218
57306219,AUGIE,ENT,,120bf21c-d066-48ee-b4c0-880596ea22e4,PreservedSpecimen,95a9125a-ba96-45a0-9104-a0a2bcbb3438,AUGIEENTA0000116,,Animalia,Arthropoda,Insecta,Coleoptera,Coccinellidae,Hippodamia convergens,27393,"Guérin-Méneville, 1842",Hippodamia,convergens,,,Ruffatto O.,6/29/2021,,,,,,Hunnicutt D.,,9/18/1984,1984,9,18,262,,IX 18 1984,,,,,,,,,,,,,,,,,United States,IL,Rock Island,,,,,,,,,,,,,,,,,,,,,,marissagorsegner,6/29/2021 11:43,http://creativecommons.org/licenses/by-nc/4.0/,Augustana College,,urn:uuid:95a9125a-ba96-45a0-9104-a0a2bcbb3438,https://scan-bugs.org:443/portal/collections/individual/index.php?occid=57306219
57306220,AUGIE,ENT,,120bf21c-d066-48ee-b4c0-880596ea22e4,PreservedSpecimen,0e4cb203-45df-4f14-aa63-c56bb5c4de28,AUGIEENTA0000117,,Animalia,Arthropoda,Insecta,Coleoptera,Coccinellidae,Hippodamia convergens,27393,"Guérin-Méneville, 1842",Hippodamia,convergens,,,Ruffatto O.,6/29/2021,,,,,,Carlson C. A.,,10/19/1964,1964,10,19,293,,19-Sep-64,,,,,,,,,,,,,,,,,United States,IL,Rock Island,,,,,,,,,,,,,,,,,,,,,,marissagorsegner,6/29/2021 11:44,http://creativecommons.org/licenses/by-nc/4.0/,Augustana College,,urn:uuid:0e4cb203-45df-4f14-aa63-c56bb5c4de28,https://scan-bugs.org:443/portal/collections/individual/index.php?occid=57306220
57306221,AUGIE,ENT,,120bf21c-d066-48ee-b4c0-880596ea22e4,PreservedSpecimen,c5b97505-5c0d-4a01-8557-32660973ecda,AUGIEENTA0000118,,Animalia,Arthropoda,Insecta,Coleoptera,Coccinellidae,Hippodamia convergens,27393,"Guérin-Méneville, 1842",Hippodamia,convergens,,,Ruffatto O.,6/29/2021,,,,,,Carlson C. A.,,5/4/1965,1965,5,4,124,,4-May-65,,,,,,,,,,,,,,,,,United States,IL,Rock Island,,,,,,,,,,,,,,,,,,,,,,marissagorsegner,6/29/2021 11:45,http://creativecommons.org/licenses/by-nc/4.0/,Augustana College,,urn:uuid:c5b97505-5c0d-4a01-8557-32660973ecda,https://scan-bugs.org:443/portal/collections/individual/index.php?occid=57306221
57306222,AUGIE,ENT,,120bf21c-d066-48ee-b4c0-880596ea22e4,PreservedSpecimen,e37c677b-d62b-4aab-ba9f-3061d365c870,AUGIEENTA0000119,,Animalia,Arthropoda,Insecta,Coleoptera,Coccinellidae,Cycloneda sanguinea,25913,"(Linnaeus, 1763)",Cycloneda,sanguinea,,,Ruffatto O.,6/29/2021,,,,,,Camdaomla J.,,10/26/1970,1970,10,26,299,,10/26/1970,,,,,,,,,,,,,,,,,United States,IL,Rock Island,,,,,,,,,,,,,,,,,,,,,,marissagorsegner,6/29/2021 11:47,http://creativecommons.org/licenses/by-nc/4.0/,Augustana College,,urn:uuid:e37c677b-d62b-4aab-ba9f-3061d365c870,https://scan-bugs.org:443/portal/collections/individual/index.php?occid=57306222
57306224,AUGIE,ENT,,120bf21c-d066-48ee-b4c0-880596ea22e4,PreservedSpecimen,c80f0ead-18fa-40ae-a9d8-5709c6c1abd9,AUGIEENTA0000120,,Animalia,Arthropoda,Insecta,Coleoptera,Coccinellidae,Cycloneda sanguinea,25913,"(Linnaeus, 1763)",Cycloneda,sanguinea,,,Ruffatto O.,6/29/2021,,,,,,Wright,,11/6/1996,1996,11,6,311,,11 VI 1996,,,,,,,,,,,,,,,,,United States,IL,Lee,,Green Wing,,,,,,,,,,,,,,,,,,,,marissagorsegner,6/29/2021 11:48,http://creativecommons.org/licenses/by-nc/4.0/,Augustana College,,urn:uuid:c80f0ead-18fa-40ae-a9d8-5709c6c1abd9,https://scan-bugs.org:443/portal/collections/individual/index.php?occid=57306224
57306225,AUGIE,ENT,,120bf21c-d066-48ee-b4c0-880596ea22e4,PreservedSpecimen,c8ad5973-ebf5-4864-9ae9-93fecc649fb1,AUGIEENTA0000121,,Animalia,Arthropoda,Insecta,Coleoptera,Coccinellidae,Cycloneda sanguinea,25913,"(Linnaeus, 1763)",Cycloneda,sanguinea,,,Ruffatto O.,6/29/2021,,,,,,Hartz D.,,10/17/1974,1974,10,17,290,,X 17 1974,,,,,,,,,,,,,,,,,United States,IL,Rock Island,,,,,,,,,,,,,,,,,,,,,,marissagorsegner,6/29/2021 11:49,http://creativecommons.org/licenses/by-nc/4.0/,Augustana College,,urn:uuid:c8ad5973-ebf5-4864-9ae9-93fecc649fb1,https://scan-bugs.org:443/portal/collections/individual/index.php?occid=57306225
57306226,AUGIE,ENT,,120bf21c-d066-48ee-b4c0-880596ea22e4,PreservedSpecimen,3a1df3cd-b784-4919-a04e-ac8cd3e5b74c,AUGIEENTA0000122,,Animalia,Arthropoda,Insecta,Coleoptera,Coccinellidae,Cycloneda sanguinea,25913,"(Linnaeus, 1763)",Cycloneda,sanguinea,,,Ruffatto O.,6/29/2021,,,,,,Carlson C. A.,,5/19/1965,1965,5,19,139,,19-May-65,,,,,,,,,,,,,,,,,United States,IL,Rock Island,Moline,,,,,,,,,,,,,,,,,,,,,marissagorsegner,6/29/2021 11:50,http://creativecommons.org/licenses/by-nc/4.0/,Augustana College,,urn:uuid:3a1df3cd-b784-4919-a04e-ac8cd3e5b74c,https://scan-bugs.org:443/portal/collections/individual/index.php?occid=57306226
57306227,AUGIE,ENT,,120bf21c-d066-48ee-b4c0-880596ea22e4,PreservedSpecimen,39be5169-1504-4b20-8dcc-e19912e2c01b,AUGIEENTA0000123,,Animalia,Arthropoda,Insecta,Coleoptera,Coccinellidae,Cycloneda sanguinea,25913,"(Linnaeus, 1763)",Cycloneda,sanguinea,,,Ruffatto O.,6/29/2021,,,,,,Stambolis,,10/25/1970,1970,10,25,298,,X 25 1970,,,,,,,,,,,,,,,,,United States,IL,Rock Island,,,,,,,,,,,,,,,,,,,,,,marissagorsegner,6/29/2021 11:51,http://creativecommons.org/licenses/by-nc/4.0/,Augustana College,,urn:uuid:39be5169-1504-4b20-8dcc-e19912e2c01b,https://scan-bugs.org:443/portal/collections/individual/index.php?occid=57306227
57306228,AUGIE,ENT,,120bf21c-d066-48ee-b4c0-880596ea22e4,PreservedSpecimen,d097731b-5887-4d8b-af8a-d3c8ac98dcb6,AUGIEENTA0000124,,Animalia,Arthropoda,Insecta,Coleoptera,Coccinellidae,Cycloneda sanguinea,25913,"(Linnaeus, 1763)",Cycloneda,sanguinea,,,Ruffatto O.,6/29/2021,,,,,,LEHMANN W. G.,,10/2/1970,1970,10,2,275,,X 2 1970,,,,,,,,,,,,,,,,,United States,IL,Rock Island,,,,,,,,,,,,,,,,,,,,,,marissagorsegner,6/29/2021 11:52,http://creativecommons.org/licenses/by-nc/4.0/,Augustana College,,urn:uuid:d097731b-5887-4d8b-af8a-d3c8ac98dcb6,https://scan-bugs.org:443/portal/collections/individual/index.php?occid=57306228
57306229,AUGIE,ENT,,120bf21c-d066-48ee-b4c0-880596ea22e4,PreservedSpecimen,23453683-7fb3-4bc5-b2e8-2e285cc455c5,AUGIEENTA0000125,,Animalia,Arthropoda,Insecta,Coleoptera,Coccinellidae,Cycloneda sanguinea,25913,"(Linnaeus, 1763)",Cycloneda,sanguinea,,,Ruffatto O.,6/29/2021,,,,,,Tindall Joe,,5/4/1965,1965,5,4,124,,4-May-65,,,,,,,,,,,,,,,,,United States,IL,Mercer,Sherrard,,,,,,,,,,,,,,,,,,,,,marissagorsegner,6/29/2021 11:54,http://creativecommons.org/licenses/by-nc/4.0/,Augustana College,,urn:uuid:23453683-7fb3-4bc5-b2e8-2e285cc455c5,https://scan-bugs.org:443/portal/collections/individual/index.php?occid=57306229
57306230,AUGIE,ENT,,120bf21c-d066-48ee-b4c0-880596ea22e4,PreservedSpecimen,1f13a87b-fd25-4a71-abd6-8aced8dd549c,AUGIEENTA0000126,,Animalia,Arthropoda,Insecta,Coleoptera,Coccinellidae,Cycloneda sanguinea,25913,"(Linnaeus, 1763)",Cycloneda,sanguinea,,,Ruffatto O.,6/29/2021,,,,,,LARSON I. W.,,6/18/1980,1980,6,18,170,,VI 18 1980,,,,,,,,,,,,,,,,,United States,Minnesota,Todd,,,,,,,,,,,,,,,,,,,,,,marissagorsegner,6/29/2021 11:55,http://creativecommons.org/licenses/by-nc/4.0/,Augustana College,,urn:uuid:1f13a87b-fd25-4a71-abd6-8aced8dd549c,https://scan-bugs.org:443/portal/collections/individual/index.php?occid=57306230
57306231,AUGIE,ENT,,120bf21c-d066-48ee-b4c0-880596ea22e4,PreservedSpecimen,254a4f7b-0086-4396-9370-d245c8479027,AUGIEENTA0000127,,Animalia,Arthropoda,Insecta,Coleoptera,Coccinellidae,Cycloneda sanguinea,25913,"(Linnaeus, 1763)",Cycloneda,sanguinea,,,Ruffatto O.,6/29/2021,,,,,,Dahlgren D. J.,,10/24/1970,1970,10,24,297,,X 24 1970,,,,,,,,,,,,,,,,,United States,IL,Rock Island,,,,,,,,,,,,,,,,,,,,,,marissagorsegner,6/30/2021 10:00,http://creativecommons.org/licenses/by-nc/4.0/,Augustana College,,urn:uuid:254a4f7b-0086-4396-9370-d245c8479027,https://scan-bugs.org:443/portal/collections/individual/index.php?occid=57306231
57306232,AUGIE,ENT,,120bf21c-d066-48ee-b4c0-880596ea22e4,PreservedSpecimen,299e175d-0134-4989-b64f-1915ae6f98c4,AUGIEENTA0000128,,Animalia,Arthropoda,Insecta,Coleoptera,Coccinellidae,Cycloneda sanguinea,25913,"(Linnaeus, 1763)",Cycloneda,sanguinea,,,LARSON I. W.,,,,,,,Canty T. C.,,10/2/1970,1970,10,2,275,,X 2 1970,,,,,,,,,,,,,,,,,United States,IL,Rock Island,,,,,,,,,,,,,,,,,,,,,,marissagorsegner,6/29/2021 11:57,http://creativecommons.org/licenses/by-nc/4.0/,Augustana College,,urn:uuid:299e175d-0134-4989-b64f-1915ae6f98c4,https://scan-bugs.org:443/portal/collections/individual/index.php?occid=57306232
57306233,AUGIE,ENT,,120bf21c-d066-48ee-b4c0-880596ea22e4,PreservedSpecimen,c22e5199-1e95-4587-9204-21ea09b320e5,AUGIEENTA0000129,,Animalia,Arthropoda,Insecta,Coleoptera,Coccinellidae,Cycloneda sanguinea,25913,"(Linnaeus, 1763)",Cycloneda,sanguinea,,,Ruffatto O.,6/29/2021,,,,,,Carlson C. A.,,10/20/1964,1964,10,20,294,,20-Oct-64,,,,,,,,,,,,,,,,,United States,IL,Rock Island,,,,,,,,,,,,,,,,,,,,,,marissagorsegner,6/29/2021 11:58,http://creativecommons.org/licenses/by-nc/4.0/,Augustana College,,urn:uuid:c22e5199-1e95-4587-9204-21ea09b320e5,https://scan-bugs.org:443/portal/collections/individual/index.php?occid=57306233
57306234,AUGIE,ENT,,120bf21c-d066-48ee-b4c0-880596ea22e4,PreservedSpecimen,4d1e349b-b88f-459e-b8eb-ff3bd1b3e955,AUGIEENTA0000130,,Animalia,Arthropoda,Insecta,Coleoptera,Coccinellidae,Cycloneda sanguinea,25913,"(Linnaeus, 1763)",Cycloneda,sanguinea,,,Ruffatto O.,6/29/2021,,,,,,Zhorne A.,,8/8/2003,2003,8,8,220,,VIII 9 2003,,,,,,,,,,,,,,,,,United States,IL,Lee,,Green Wing,,,,,,,,,,,,,,,,,,,,marissagorsegner,6/29/2021 11:59,http://creativecommons.org/licenses/by-nc/4.0/,Augustana College,,urn:uuid:4d1e349b-b88f-459e-b8eb-ff3bd1b3e955,https://scan-bugs.org:443/portal/collections/individual/index.php?occid=57306234
57306235,AUGIE,ENT,,120bf21c-d066-48ee-b4c0-880596ea22e4,PreservedSpecimen,c792ac75-746d-481a-9950-5ce7d81e5b96,AUGIEENTA0000131,,Animalia,Arthropoda,Insecta,Coleoptera,Coccinellidae,Cycloneda sanguinea,25913,"(Linnaeus, 1763)",Cycloneda,sanguinea,,,Ruffatto O.,6/29/2021,,,,,,Sottos S.,,7/12/1996,1996,7,12,194,,12 VII 1996,,,,,,,,,,,,,,,,,United States,IL,Lee,,Green Wing,,,,,,,,,,,,,,,,,,,,marissagorsegner,6/29/2021 12:00,http://creativecommons.org/licenses/by-nc/4.0/,Augustana College,,urn:uuid:c792ac75-746d-481a-9950-5ce7d81e5b96,https://scan-bugs.org:443/portal/collections/individual/index.php?occid=57306235
57306236,AUGIE,ENT,,120bf21c-d066-48ee-b4c0-880596ea22e4,PreservedSpecimen,6ca672b4-cdd6-4548-8cb5-047858b75143,AUGIEENTA0000132,,Animalia,Arthropoda,Insecta,Coleoptera,Coccinellidae,Cycloneda sanguinea,25913,"(Linnaeus, 1763)",Cycloneda,sanguinea,,,Ruffatto O.,6/29/2021,,,,,,Yemm W.,,9/17/1974,1974,9,17,260,,IX 17 1974,,,,,,,,,,,,,,,,,United States,IL,Rock Island,,,,,,,,,,,,,,,,,,,,,,marissagorsegner,6/29/2021 12:01,http://creativecommons.org/licenses/by-nc/4.0/,Augustana College,,urn:uuid:6ca672b4-cdd6-4548-8cb5-047858b75143,https://scan-bugs.org:443/portal/collections/individual/index.php?occid=57306236
57306237,AUGIE,ENT,,120bf21c-d066-48ee-b4c0-880596ea22e4,PreservedSpecimen,39dc6f41-6d79-4061-bdb3-599bbd71592f,AUGIEENTA0000133,,Animalia,Arthropoda,Insecta,Coleoptera,Coccinellidae,Hippodamia tredecimpunctata,27404,,Hippodamia,tredecimpunctata,,,LARSON I. W.,,,,,,,Carlson C. A.,,5/4/1965,1965,5,4,124,,4-May-65,,,,,,,,,,,,,,,,,United States,IL,Mercer,Sherrard,,,,,,,,,,,,,,,,,,,,,marissagorsegner,6/29/2021 12:12,http://creativecommons.org/licenses/by-nc/4.0/,Augustana College,,urn:uuid:39dc6f41-6d79-4061-bdb3-599bbd71592f,https://scan-bugs.org:443/portal/collections/individual/index.php?occid=57306237
57306238,AUGIE,ENT,,120bf21c-d066-48ee-b4c0-880596ea22e4,PreservedSpecimen,f175212b-064d-4608-9954-6a5d43469a04,AUGIEENTA0000134,,Animalia,Arthropoda,Insecta,Coleoptera,Coccinellidae,Hippodamia tredecimpunctata,27404,,Hippodamia,tredecimpunctata,,,Ruffatto O.,6/29/2021,,,,,,Bowden,,6/16/1980,1980,6,16,168,,6/16/1980,,,,,,,,,,,,,,,,,United States,IL,Rock Island,,,,,,,,,,,,,,,,,,,,,,marissagorsegner,6/29/2021 12:13,http://creativecommons.org/licenses/by-nc/4.0/,Augustana College,,urn:uuid:f175212b-064d-4608-9954-6a5d43469a04,https://scan-bugs.org:443/portal/collections/individual/index.php?occid=57306238
57306240,AUGIE,ENT,,120bf21c-d066-48ee-b4c0-880596ea22e4,PreservedSpecimen,a6cac589-3e48-4667-85e9-4be2111da9c3,AUGIEENTA0000135,,Animalia,Arthropoda,Insecta,Coleoptera,Coccinellidae,Hippodamia tredecimpunctata,27404,,Hippodamia,tredecimpunctata,,,Ruffatto O.,6/29/2021,,,,,,Carlson C. A.,,5/4/1965,1965,5,4,124,,4-May-65,,,,,,,,,,,,,,,,,United States,IL,Mercer,Sherrard,,,,,,,,,,,,,,,,,,,,,marissagorsegner,6/29/2021 12:11,http://creativecommons.org/licenses/by-nc/4.0/,Augustana College,,urn:uuid:a6cac589-3e48-4667-85e9-4be2111da9c3,https://scan-bugs.org:443/portal/collections/individual/index.php?occid=57306240
57306241,AUGIE,ENT,,120bf21c-d066-48ee-b4c0-880596ea22e4,PreservedSpecimen,1922e758-dcca-49f8-bab5-e6d50893f518,AUGIEENTA0000136,,Animalia,Arthropoda,Insecta,Coleoptera,Coccinellidae,Hippodamia tredecimpunctata,27404,,Hippodamia,tredecimpunctata,,,Ruffatto O.,6/29/2021,,,,,,Carlson C. A.,,5/4/1965,1965,5,4,124,,4-May-65,,,,,,,,,,,,,,,,,United States,IL,Mercer,Sherrard,,,,,,,,,,,,,,,,,,,,,marissagorsegner,6/29/2021 12:13,http://creativecommons.org/licenses/by-nc/4.0/,Augustana College,,urn:uuid:1922e758-dcca-49f8-bab5-e6d50893f518,https://scan-bugs.org:443/portal/collections/individual/index.php?occid=57306241
57306243,AUGIE,ENT,,120bf21c-d066-48ee-b4c0-880596ea22e4,PreservedSpecimen,83f07345-1c31-4bdf-a2ad-d74f388d37b9,AUGIEENTA0000137,,Animalia,Arthropoda,Insecta,Coleoptera,Coccinellidae,Hippodamia convergens,27393,"Guérin-Méneville, 1842",Hippodamia,convergens,,,Ruffatto O.,6/29/2021,,,,,,Canty T. C.,,10/20/1970,1970,10,20,293,,X 20 1970,,,,,,,,,,,,,,,,,United States,IL,Rock Island,,,,,,,,,,,,,,,,,,,,,,marissagorsegner,6/30/2021 12:12,http://creativecommons.org/licenses/by-nc/4.0/,Augustana College,,urn:uuid:83f07345-1c31-4bdf-a2ad-d74f388d37b9,https://scan-bugs.org:443/portal/collections/individual/index.php?occid=57306243
57306244,AUGIE,ENT,,120bf21c-d066-48ee-b4c0-880596ea22e4,PreservedSpecimen,deed1e03-394f-4575-9a4e-dc0dbba1cb5d,AUGIEENTA0000138,,Animalia,Arthropoda,Insecta,Coleoptera,Coccinellidae,Hippodamia tredecimpunctata,27404,,Hippodamia,tredecimpunctata,,,Ruffatto O.,6/29/2021,,,,,,Carlson C. A.,,5/4/1965,1965,5,4,124,,4-May-65,,,,,,,,,,,,,,,,,United States,IL,Mercer,Sherrard,,,,,,,,,,,,,,,,,,,,,marissagorsegner,6/29/2021 12:15,http://creativecommons.org/licenses/by-nc/4.0/,Augustana College,,urn:uuid:deed1e03-394f-4575-9a4e-dc0dbba1cb5d,https://scan-bugs.org:443/portal/collections/individual/index.php?occid=57306244
57306612,AUGIE,ENT,,120bf21c-d066-48ee-b4c0-880596ea22e4,PreservedSpecimen,ba00aa41-86cb-4dc6-9ab5-3d7496fac1d2,AUGIEENTA0000139,,Animalia,Arthropoda,Insecta,Coleoptera,Coccinellidae,Hippodamia convergens,27393,"Guérin-Méneville, 1842",Hippodamia,convergens,,,Oliva Ruffatto,,,,,,,Bawden C.,,5/29/1971,1971,5,29,149,,5/29/1971,,,,,,,,,,,,,,,,,United States,Illinois,Mercer,Seaton,,,,,,,,,,,,,,,,,,,,,VeroCerv18,6/30/2021 12:51,http://creativecommons.org/licenses/by-nc/4.0/,Augustana College,,urn:uuid:ba00aa41-86cb-4dc6-9ab5-3d7496fac1d2,https://scan-bugs.org:443/portal/collections/individual/index.php?occid=57306612
57306613,AUGIE,ENT,,120bf21c-d066-48ee-b4c0-880596ea22e4,PreservedSpecimen,7afcc64c-c6a4-4acf-8069-b8792183b515,AUGIEENTA0000140,,Animalia,Arthropoda,Insecta,Coleoptera,Coccinellidae,Hippodamia convergens,27393,"Guérin-Méneville, 1842",Hippodamia,convergens,,,Olivia Ruffatto,,,,,,,Newburg L.,,10/3/1974,1974,10,3,276,,X-3-1974,,,,,,,,,,,,,,,,,United States,Illinois,Rock Island,,,,,,,,,,,,,,,,,,,,,,VeroCerv18,6/30/2021 12:50,http://creativecommons.org/licenses/by-nc/4.0/,Augustana College,,urn:uuid:7afcc64c-c6a4-4acf-8069-b8792183b515,https://scan-bugs.org:443/portal/collections/individual/index.php?occid=57306613
57306614,AUGIE,ENT,,120bf21c-d066-48ee-b4c0-880596ea22e4,PreservedSpecimen,6d0ffdd0-072e-42d6-a0b3-a649436563c4,AUGIEENTA0000141,,Animalia,Arthropoda,Insecta,Coleoptera,Coccinellidae,Hippodamia convergens,27393,"Guérin-Méneville, 1842",Hippodamia,convergens,,,Olivia Ruffatto,,,,,,,Maxson J.,,10/17/1974,1974,10,17,290,,X-17-1974,,,,,,,,,,,,,,,,,United States,Illinois,Rock Island,,,,,,,,,,,,,,,,,,,,,,VeroCerv18,6/30/2021 12:50,http://creativecommons.org/licenses/by-nc/4.0/,Augustana College,,urn:uuid:6d0ffdd0-072e-42d6-a0b3-a649436563c4,https://scan-bugs.org:443/portal/collections/individual/index.php?occid=57306614
57306617,AUGIE,ENT,,120bf21c-d066-48ee-b4c0-880596ea22e4,PreservedSpecimen,1956a79b-e4d9-42df-a34f-e37e3f6c1348,AUGIEENTA0000142,,Animalia,Arthropoda,Insecta,Coleoptera,Coccinellidae,Hippodamia convergens,27393,"Guérin-Méneville, 1842",Hippodamia,convergens,,,Olivia Ruffatto,,,,,,,Anthony B.,,10/30/1980,1980,10,30,304,,X-10-1980,,,,,,,,,,,,,,,,,United States,Illinois,Rock Island,,,,,,,,,,,,,,,,,,,,,,VeroCerv18,6/30/2021 12:50,http://creativecommons.org/licenses/by-nc/4.0/,Augustana College,,urn:uuid:1956a79b-e4d9-42df-a34f-e37e3f6c1348,https://scan-bugs.org:443/portal/collections/individual/index.php?occid=57306617
57306621,AUGIE,ENT,,120bf21c-d066-48ee-b4c0-880596ea22e4,PreservedSpecimen,913050e6-b937-4566-9f50-3abc83eb0be8,AUGIEENTA0000143,,Animalia,Arthropoda,Insecta,Coleoptera,Coccinellidae,Hippodamia convergens,27393,"Guérin-Méneville, 1842",Hippodamia,convergens,,,Olivia Ruffatto,,,,,,,Mekus G.I.,,10/3/1970,1970,10,3,276,,X-3-1970,,,,,,,,,,,,,,,,,United States,Illinois,Rock Island,,,,,,,,,,,,,,,,,,,,,,VeroCerv18,6/30/2021 12:52,http://creativecommons.org/licenses/by-nc/4.0/,Augustana College,,urn:uuid:913050e6-b937-4566-9f50-3abc83eb0be8,https://scan-bugs.org:443/portal/collections/individual/index.php?occid=57306621
57306622,AUGIE,ENT,,120bf21c-d066-48ee-b4c0-880596ea22e4,PreservedSpecimen,77360632-be43-48f5-8bea-faf423764bd8,AUGIEENTA0000144,,Animalia,Arthropoda,Insecta,Coleoptera,Coccinellidae,Hippodamia convergens,27393,"Guérin-Méneville, 1842",Hippodamia,convergens,,,Olivia Ruffatto,,,,,,,Carlson C.A.,,6/17/1965,1965,6,17,168,,June 17 1965,,,,,,,,,,,,,,,,,United States,Illinois,,Barnston,,,,,,,,,,,,,,,,,,,,,VeroCerv18,6/30/2021 12:54,http://creativecommons.org/licenses/by-nc/4.0/,Augustana College,,urn:uuid:77360632-be43-48f5-8bea-faf423764bd8,https://scan-bugs.org:443/portal/collections/individual/index.php?occid=57306622
57306626,AUGIE,ENT,,120bf21c-d066-48ee-b4c0-880596ea22e4,PreservedSpecimen,078e0177-cdda-4bf3-b52f-35897eb9c97f,AUGIEENTA0000145,,Animalia,Arthropoda,Insecta,Coleoptera,Coccinellidae,Hippodamia convergens,27393,"Guérin-Méneville, 1842",Hippodamia,convergens,,,Olivia Ruffatto,,,,,,,Bushong A.,,10/9/1996,1996,10,9,283,,10-IX-1996,,,,,,,,,,,,,,,,,United States,Illinois,Rock Island,,,,,,,,,,,,,,,,,,,,,,VeroCerv18,6/30/2021 12:56,http://creativecommons.org/licenses/by-nc/4.0/,Augustana College,,urn:uuid:078e0177-cdda-4bf3-b52f-35897eb9c97f,https://scan-bugs.org:443/portal/collections/individual/index.php?occid=57306626
57306628,AUGIE,ENT,,120bf21c-d066-48ee-b4c0-880596ea22e4,PreservedSpecimen,abaa8aa0-7156-41bd-b255-e39f6ad47c48,AUGIEENTA0000146,,Animalia,Arthropoda,Insecta,Coleoptera,Coccinellidae,Hippodamia convergens,27393,"Guérin-Méneville, 1842",Hippodamia,convergens,,,Olivia Ruffatto,,,,,,,Hasbargen J. A.,,9/25/1970,1970,9,25,268,,Sept. 25 1970,,,,,,,,,,,,,,,,,United States,Illinois,Rock Island,,,,,,,,,,,,,,,,,,,,,,VeroCerv18,6/30/2021 12:58,http://creativecommons.org/licenses/by-nc/4.0/,Augustana College,,urn:uuid:abaa8aa0-7156-41bd-b255-e39f6ad47c48,https://scan-bugs.org:443/portal/collections/individual/index.php?occid=57306628
57306629,AUGIE,ENT,,120bf21c-d066-48ee-b4c0-880596ea22e4,PreservedSpecimen,bec3e322-32fc-4154-bb38-ec1e829b4e95,AUGIEENTA0000147,,Animalia,Arthropoda,Insecta,Coleoptera,Coccinellidae,Hippodamia convergens,27393,"Guérin-Méneville, 1842",Hippodamia,convergens,,,Olivia Ruffatto,,,,,,,Moore T.,,9/17/1974,1974,9,17,260,,IX-17-1974,,,,,,,,,,,,,,,,,United States,Illinois,Rock Island,,,,,,,,,,,,,,,,,,,,,,VeroCerv18,6/30/2021 12:59,http://creativecommons.org/licenses/by-nc/4.0/,Augustana College,,urn:uuid:bec3e322-32fc-4154-bb38-ec1e829b4e95,https://scan-bugs.org:443/portal/collections/individual/index.php?occid=57306629
57306630,AUGIE,ENT,,120bf21c-d066-48ee-b4c0-880596ea22e4,PreservedSpecimen,80991f41-d64a-4784-947b-058bf09bd53c,AUGIEENTA0000148,,Animalia,Arthropoda,Insecta,Coleoptera,Coccinellidae,Hippodamia convergens,27393,"Guérin-Méneville, 1842",Hippodamia,convergens,,,Olivia Ruffatto,,,,,,,Romano V.,,9/18/1976,1976,9,18,262,,IX-18-1976,,,,,,,,,,,,,,,,,United States,Illinois,Rock Island,,,,,,,,,,,,,,,,,,,,,,VeroCerv18,6/30/2021 13:00,http://creativecommons.org/licenses/by-nc/4.0/,Augustana College,,urn:uuid:80991f41-d64a-4784-947b-058bf09bd53c,https://scan-bugs.org:443/portal/collections/individual/index.php?occid=57306630
57306698,AUGIE,ENT,,120bf21c-d066-48ee-b4c0-880596ea22e4,PreservedSpecimen,92a6cbff-466c-45b3-943a-3ec1195b15f3,AUGIEENTA0000149,,Animalia,Arthropoda,Insecta,Coleoptera,Coccinellidae,Coccinella septempunctata,25520,"(Linnaeus, 1758)",Coccinella,septempunctata,,,Olivia Ruffatto,,,,,,,,,11/3/1988,1988,11,3,308,,XI-3-1988,,,,,,,,,,,,,,,,,United States,Illinois,Rock Island,,,,,,,,,,,,,,,,,,,,,,VeroCerv18,6/30/2021 13:08,http://creativecommons.org/licenses/by-nc/4.0/,Augustana College,,urn:uuid:92a6cbff-466c-45b3-943a-3ec1195b15f3,https://scan-bugs.org:443/portal/collections/individual/index.php?occid=57306698
57306700,AUGIE,ENT,,120bf21c-d066-48ee-b4c0-880596ea22e4,PreservedSpecimen,4d72b92b-5873-4edf-835e-296b64b8fad0,AUGIEENTA0000150,,Animalia,Arthropoda,Insecta,Coleoptera,Coccinellidae,Coccinella septempunctata,25520,"(Linnaeus, 1758)",Coccinella,septempunctata,,,Olivia Ruffatto,,,,,,,Adams J.,,9/25/1997,1997,9,25,268,,25-IX-1997,,,,,,,,,,,,,,,,,United States,Illinois,Rock Island,,,,,,,,,,,,,,,,,,,,,,VeroCerv18,6/30/2021 13:09,http://creativecommons.org/licenses/by-nc/4.0/,Augustana College,,urn:uuid:4d72b92b-5873-4edf-835e-296b64b8fad0,https://scan-bugs.org:443/portal/collections/individual/index.php?occid=57306700
57306703,AUGIE,ENT,,120bf21c-d066-48ee-b4c0-880596ea22e4,PreservedSpecimen,2d80fa08-8da4-4592-b591-c00453d3e141,AUGIEENTA0000151,,Animalia,Arthropoda,Insecta,Coleoptera,Coccinellidae,Coccinella septempunctata,25520,"(Linnaeus, 1758)",Coccinella,septempunctata,,,Olivia Ruffatto,,,,,,,Johnson B.,,10/7/1986,1986,10,7,280,,X-7-1986,,,,,,,,,,,,,,,,,United States,Illinois,Rock Island,,,,,,,,,,,,,,,,,,,,,,VeroCerv18,6/30/2021 13:10,http://creativecommons.org/licenses/by-nc/4.0/,Augustana College,,urn:uuid:2d80fa08-8da4-4592-b591-c00453d3e141,https://scan-bugs.org:443/portal/collections/individual/index.php?occid=57306703
57306704,AUGIE,ENT,,120bf21c-d066-48ee-b4c0-880596ea22e4,PreservedSpecimen,402df329-7813-4de9-80e2-8c9da7bce249,AUGIEENTA0000152,,Animalia,Arthropoda,Insecta,Coleoptera,Coccinellidae,Coccinella septempunctata,25520,"(Linnaeus, 1758)",Coccinella,septempunctata,,,Olivia Ruffatto,,,,,,,Traezek G.,,10/20/1988,1988,10,20,294,,X-20-1988,,,,,,,,,,,,,,,,,United States,Illinois,Rock Island,,,,,,,,,,,,,,,,,,,,,,VeroCerv18,6/30/2021 13:11,http://creativecommons.org/licenses/by-nc/4.0/,Augustana College,,urn:uuid:402df329-7813-4de9-80e2-8c9da7bce249,https://scan-bugs.org:443/portal/collections/individual/index.php?occid=57306704
57306708,AUGIE,ENT,,120bf21c-d066-48ee-b4c0-880596ea22e4,PreservedSpecimen,05adbbcd-d71d-4541-9814-c139b67720e1,AUGIEENTA0000153,,Animalia,Arthropoda,Insecta,Coleoptera,Coccinellidae,Coccinella septempunctata,25520,"(Linnaeus, 1758)",Coccinella,septempunctata,,,Olivia Ruffatto,,,,,,,,,11/3/1988,1988,11,3,308,,XI-3-1988,,,,,,,,,,,,,,,,,United States,Illinois,Rock Island,,,,,,,,,,,,,,,,,,,,,,VeroCerv18,6/30/2021 13:12,http://creativecommons.org/licenses/by-nc/4.0/,Augustana College,,urn:uuid:05adbbcd-d71d-4541-9814-c139b67720e1,https://scan-bugs.org:443/portal/collections/individual/index.php?occid=57306708
57306709,AUGIE,ENT,,120bf21c-d066-48ee-b4c0-880596ea22e4,PreservedSpecimen,288bdca7-fb74-442c-abbc-2a2ad79d91aa,AUGIEENTA0000154,,Animalia,Arthropoda,Insecta,Coleoptera,Coccinellidae,Coccinella septempunctata,25520,"(Linnaeus, 1758)",Coccinella,septempunctata,,,Olivia Ruffatto,,,,,,,Beatty J.,,6/8/2000,2000,6,8,160,,6/8/2000,,,,,,,,,,,,,,,,,United States,Illinois,Rock Island,,,,,,,,,,,,,,,,,,,,,,VeroCerv18,6/30/2021 13:14,http://creativecommons.org/licenses/by-nc/4.0/,Augustana College,,urn:uuid:288bdca7-fb74-442c-abbc-2a2ad79d91aa,https://scan-bugs.org:443/portal/collections/individual/index.php?occid=57306709
57306714,AUGIE,ENT,,120bf21c-d066-48ee-b4c0-880596ea22e4,PreservedSpecimen,5956b1e1-cf51-4b58-996e-c8ef808052ab,AUGIEENTA0000155,,Animalia,Arthropoda,Insecta,Coleoptera,Coccinellidae,Coccinella septempunctata,25520,"(Linnaeus, 1758)",Coccinella,septempunctata,,,Olivia Ruffatto,,,,,,,Bauwens J. A.,,10/15/1986,1986,10,15,288,,X-15-1986,,,,,,,,,,,,,,,,,United States,Iowa,Scott,,,,,,,,,,,,,,,,,,,,,,VeroCerv18,6/30/2021 13:18,http://creativecommons.org/licenses/by-nc/4.0/,Augustana College,,urn:uuid:5956b1e1-cf51-4b58-996e-c8ef808052ab,https://scan-bugs.org:443/portal/collections/individual/index.php?occid=57306714
57306717,AUGIE,ENT,,120bf21c-d066-48ee-b4c0-880596ea22e4,PreservedSpecimen,8c6ab167-0d37-4325-9a42-bb8d73a9e7c5,AUGIEENTA0000156,,Animalia,Arthropoda,Insecta,Coleoptera,Coccinellidae,Coccinella septempunctata,25520,"(Linnaeus, 1758)",Coccinella,septempunctata,,,Olivia Ruffatto,,,,,,,Moon S.,,10/5/1996,1996,10,5,279,,XI-5-1996,,,,,,,,,,,,,,,,,United States,Illinois,Rock Island,,,,,,,,,,,,,,,,,,,,,,VeroCerv18,6/30/2021 13:19,http://creativecommons.org/licenses/by-nc/4.0/,Augustana College,,urn:uuid:8c6ab167-0d37-4325-9a42-bb8d73a9e7c5,https://scan-bugs.org:443/portal/collections/individual/index.php?occid=57306717
57306720,AUGIE,ENT,,120bf21c-d066-48ee-b4c0-880596ea22e4,PreservedSpecimen,a7f20885-140b-472b-b934-a75d08a6cfb9,AUGIEENTA0000157,,Animalia,Arthropoda,Insecta,Coleoptera,Coccinellidae,Coccinella septempunctata,25520,"(Linnaeus, 1758)",Coccinella,septempunctata,,,Olivia Ruffatto,,,,,,,Natzke R. A.,,9/20/1986,1986,9,20,263,,IX-20-1986,,,,,,,,,,,,,,,,,United States,Illinois,Cook,Des Plaines,,,,,,,,,,,,,,,,,,,,,VeroCerv18,7/1/2021 8:06,http://creativecommons.org/licenses/by-nc/4.0/,Augustana College,,urn:uuid:a7f20885-140b-472b-b934-a75d08a6cfb9,https://scan-bugs.org:443/portal/collections/individual/index.php?occid=57306720
57306723,AUGIE,ENT,,120bf21c-d066-48ee-b4c0-880596ea22e4,PreservedSpecimen,2b27731c-0a93-40f7-a34e-b7002ab46e11,AUGIEENTA0000158,,Animalia,Arthropoda,Insecta,Coleoptera,Coccinellidae,Coccinella septempunctata,25520,"(Linnaeus, 1758)",Coccinella,septempunctata,,,Olivia Ruffatto,,,,,,,Braynt J.,,9/24/1990,1990,9,24,267,,IX-24-1990,,,,,,,,,,,,,,,,,United States,Illinois,Rock Island,,,,,,,,,,,,,,,,,,,,,,VeroCerv18,6/30/2021 13:22,http://creativecommons.org/licenses/by-nc/4.0/,Augustana College,,urn:uuid:2b27731c-0a93-40f7-a34e-b7002ab46e11,https://scan-bugs.org:443/portal/collections/individual/index.php?occid=57306723
57306725,AUGIE,ENT,,120bf21c-d066-48ee-b4c0-880596ea22e4,PreservedSpecimen,8de1733c-ed87-4b3d-a6c5-17abd7b4ec65,AUGIEENTA0000159,,Animalia,Arthropoda,Insecta,Coleoptera,Coccinellidae,Coccinella septempunctata,25520,"(Linnaeus, 1758)",Coccinella,septempunctata,,,Olivia Ruffatto,,,,,,,Claeys C.,,10/10/1995,1995,10,10,283,,10/10/1995,,,,,,,,,,,,,,,,,United States,Illinois,Rock Island,,,,,,,,,,,,,,,,,,,,,,VeroCerv18,6/30/2021 13:23,http://creativecommons.org/licenses/by-nc/4.0/,Augustana College,,urn:uuid:8de1733c-ed87-4b3d-a6c5-17abd7b4ec65,https://scan-bugs.org:443/portal/collections/individual/index.php?occid=57306725
57306729,AUGIE,ENT,,120bf21c-d066-48ee-b4c0-880596ea22e4,PreservedSpecimen,6cf788c4-6526-44a9-9542-a42355028dec,AUGIEENTA0000160,,Animalia,Arthropoda,Insecta,Coleoptera,Coccinellidae,Coccinella septempunctata,25520,"(Linnaeus, 1758)",Coccinella,septempunctata,,,Olivia Ruffatto,,,,,,,Wemhold,,9/11/1999,1999,9,11,254,,9/11/1999,,,,,,,,,,,,,,,,,United States,Illinois,Lee,,Greenwing,,,,,,,,,,,,,,,,,,,,VeroCerv18,6/30/2021 13:25,http://creativecommons.org/licenses/by-nc/4.0/,Augustana College,,urn:uuid:6cf788c4-6526-44a9-9542-a42355028dec,https://scan-bugs.org:443/portal/collections/individual/index.php?occid=57306729
57306730,AUGIE,ENT,,120bf21c-d066-48ee-b4c0-880596ea22e4,PreservedSpecimen,d1da63f5-bc14-4161-a22b-4ff2e3b64bbf,AUGIEENTA0000161,,Animalia,Arthropoda,Insecta,Coleoptera,Coccinellidae,Coccinella septempunctata,25520,"(Linnaeus, 1758)",Coccinella,septempunctata,,,Olivia Ruffatto,,,,,,,Burke K.,,10/30/1986,1986,10,30,303,,X-30-1986,,,,,,,,,,,,,,,,,United States,Illinois,Rock Island,,,,,,,,,,,,,,,,,,,,,,VeroCerv18,6/30/2021 13:26,http://creativecommons.org/licenses/by-nc/4.0/,Augustana College,,urn:uuid:d1da63f5-bc14-4161-a22b-4ff2e3b64bbf,https://scan-bugs.org:443/portal/collections/individual/index.php?occid=57306730
57306731,AUGIE,ENT,,120bf21c-d066-48ee-b4c0-880596ea22e4,PreservedSpecimen,330bfa07-4b0a-4e49-9bc1-8a23a48ce77c,AUGIEENTB0000024,,Animalia,Arthropoda,Insecta,Coleoptera,Coccinellidae,Coleomegilla maculata,25547,,Coleomegilla,maculata,,,Jack Hughes,6/30/2021,,,,,,Cervantes V.,,6/24/2021,2021,6,24,175,,6/24/2021,,,,,,,,,,,,,,,,,United States,IA,Scott,,,,41.57847,90.61787,,,,,,,,,,,,,,,,,marissagorsegner,7/1/2021 12:44,http://creativecommons.org/licenses/by-nc/4.0/,Augustana College,,urn:uuid:330bfa07-4b0a-4e49-9bc1-8a23a48ce77c,https://scan-bugs.org:443/portal/collections/individual/index.php?occid=57306731
57306733,AUGIE,ENT,,120bf21c-d066-48ee-b4c0-880596ea22e4,PreservedSpecimen,bcb38bc5-06be-4849-8b04-b509e1afe13e,AUGIEENTB0000013,,Animalia,Arthropoda,Insecta,Coleoptera,Coccinellidae,Coleomegilla maculata,25547,,Coleomegilla,maculata,,,Jack Hughes,6/30/2021,,,,,,Cervantes V.,,6/23/2021,2021,6,23,174,,6/23/2021,,,,,,,,,,,,,,,,,United States,IA,Scott,,,,41.56304,90.46707,,,,,,,,,,,,,,,,,marissagorsegner,7/1/2021 12:44,http://creativecommons.org/licenses/by-nc/4.0/,Augustana College,,urn:uuid:bcb38bc5-06be-4849-8b04-b509e1afe13e,https://scan-bugs.org:443/portal/collections/individual/index.php?occid=57306733
57306750,AUGIE,ENT,,120bf21c-d066-48ee-b4c0-880596ea22e4,PreservedSpecimen,8b01e8fb-8261-4409-832c-a2ff664ede9c,AUGIEENTA0000162,,Animalia,Arthropoda,Insecta,Coleoptera,Coccinellidae,Coccinella septempunctata,25520,"(Linnaeus, 1758)",Coccinella,septempunctata,,,Olivia Ruffatto,,,,,,,Hagopian K.H.,,11/3/1988,1988,11,3,308,,XI-3-1988,,,,,,,,,,,,,,,,,United States,Illinois,Rock Island,,,,,,,,,,,,,,,,,,,,,,VeroCerv18,6/30/2021 13:41,http://creativecommons.org/licenses/by-nc/4.0/,Augustana College,,urn:uuid:8b01e8fb-8261-4409-832c-a2ff664ede9c,https://scan-bugs.org:443/portal/collections/individual/index.php?occid=57306750
57306751,AUGIE,ENT,,120bf21c-d066-48ee-b4c0-880596ea22e4,PreservedSpecimen,be6bc0ea-38eb-40bb-94dc-a04a880cf9bc,AUGIEENTA0000163,,Animalia,Arthropoda,Insecta,Coleoptera,Coccinellidae,Coccinella septempunctata,25520,"(Linnaeus, 1758)",Coccinella,septempunctata,,,OliviaRuffatto,,,,,,,Johnson G.,,10/7/1986,1986,10,7,280,,X-7-1986,,,,,,,,,,,,,,,,,United States,Illinois,Rock Island,,,,,,,,,,,,,,,,,,,,,,VeroCerv18,6/30/2021 13:42,http://creativecommons.org/licenses/by-nc/4.0/,Augustana College,,urn:uuid:be6bc0ea-38eb-40bb-94dc-a04a880cf9bc,https://scan-bugs.org:443/portal/collections/individual/index.php?occid=57306751
57306752,AUGIE,ENT,,120bf21c-d066-48ee-b4c0-880596ea22e4,PreservedSpecimen,84f4da9b-9397-45c1-93b2-2d81da05eb1f,AUGIEENTB0000012,,Animalia,Arthropoda,Insecta,Coleoptera,Coccinellidae,Coleomegilla maculata,25547,,Coleomegilla,maculata,,,Jack Hughes,6/30/2021,,,,,,Cervantes V.,,6/17/2021,2021,6,17,168,,6/17/2021,,,,,,,,,,,,,,,,,United States,IA,Scott,,,,41.56304,90.46707,,,,,,,,,,,,,,,,,marissagorsegner,7/1/2021 12:43,http://creativecommons.org/licenses/by-nc/4.0/,Augustana College,,urn:uuid:84f4da9b-9397-45c1-93b2-2d81da05eb1f,https://scan-bugs.org:443/portal/collections/individual/index.php?occid=57306752
57306753,AUGIE,ENT,,120bf21c-d066-48ee-b4c0-880596ea22e4,PreservedSpecimen,f05882a4-b26c-401d-b124-b6fabe4e8f1d,AUGIEENTA0000164,,Animalia,Arthropoda,Insecta,Coleoptera,Coccinellidae,Coccinella septempunctata,25520,"(Linnaeus, 1758)",Coccinella,septempunctata,,,Olivia Ruffatto,,,,,,,Heckerson W.,,10/2/1986,1986,10,2,275,,X-2-1986,,,,,,,,,,,,,,,,,United States,Illinois,Rock Island,,,,,,,,,,,,,,,,,,,,,,VeroCerv18,6/30/2021 13:43,http://creativecommons.org/licenses/by-nc/4.0/,Augustana College,,urn:uuid:f05882a4-b26c-401d-b124-b6fabe4e8f1d,https://scan-bugs.org:443/portal/collections/individual/index.php?occid=57306753
57306754,AUGIE,ENT,,120bf21c-d066-48ee-b4c0-880596ea22e4,PreservedSpecimen,3bdbf734-d519-402d-b609-d97027fd4ab5,AUGIEENTA0000165,,Animalia,Arthropoda,Insecta,Coleoptera,Coccinellidae,Coccinella septempunctata,25520,"(Linnaeus, 1758)",Coccinella,septempunctata,,,Olivia Ruffatto,,,,,,,Bond J.,,10/13/1996,1996,10,13,287,,13-X-1996,,,,,,,,,,,,,,,,,United States,Illinois,Rock Island,,,,,,,,,,,,,,,,,,,,,,VeroCerv18,7/1/2021 8:05,http://creativecommons.org/licenses/by-nc/4.0/,Augustana College,,urn:uuid:3bdbf734-d519-402d-b609-d97027fd4ab5,https://scan-bugs.org:443/portal/collections/individual/index.php?occid=57306754
57306756,AUGIE,ENT,,120bf21c-d066-48ee-b4c0-880596ea22e4,PreservedSpecimen,8f40a1e3-4c84-4604-b4bf-f8f4f2a6870e,AUGIEENTA0000166,,Animalia,Arthropoda,Insecta,Coleoptera,Coccinellidae,Coccinella septempunctata,25520,"(Linnaeus, 1758)",Coccinella,septempunctata,,,Olivia Ruffatto,,,,,,,Kackert C.C.,,9/23/1986,1986,9,23,266,,IX-23-1986,,,,,,,,,,,,,,,,,United States,Illinois,Rock Island,,,,,,,,,,,,,,,,,,,,,,VeroCerv18,6/30/2021 13:44,http://creativecommons.org/licenses/by-nc/4.0/,Augustana College,,urn:uuid:8f40a1e3-4c84-4604-b4bf-f8f4f2a6870e,https://scan-bugs.org:443/portal/collections/individual/index.php?occid=57306756
57306757,AUGIE,ENT,,120bf21c-d066-48ee-b4c0-880596ea22e4,PreservedSpecimen,2e31021e-d96f-4a3b-989d-a6c960f3ebf5,AUGIEENTB0000011,,Animalia,Arthropoda,Insecta,Coleoptera,Coccinellidae,Coleomegilla maculata,25547,,Coleomegilla,maculata,,,Jack Hughes,6/30/2021,,,,,,M. Gorsegner,,6/24/2021,2021,6,24,175,,6/24/2021,,,,,,,,,,,,,,,,,United States,IA,Scott,,,,41.50368,90.62248,,,,,,,,,,,,,,,,,marissagorsegner,8/12/2021 6:56,http://creativecommons.org/licenses/by-nc/4.0/,Augustana College,,urn:uuid:2e31021e-d96f-4a3b-989d-a6c960f3ebf5,https://scan-bugs.org:443/portal/collections/individual/index.php?occid=57306757
57306758,AUGIE,ENT,,120bf21c-d066-48ee-b4c0-880596ea22e4,PreservedSpecimen,54031182-b25b-446f-9687-bd2c40e27a75,AUGIEENTA0000167,,Animalia,Arthropoda,Insecta,Coleoptera,Coccinellidae,Coccinella septempunctata,25520,"(Linnaeus, 1758)",Coccinella,septempunctata,,,Olivia Ruffatto,,,,,,,Wegner B.,,10/4/1988,1988,10,4,278,,X-4-1988,,,,,,,,,,,,,,,,,United States,Illinois,Rock Island,,,,,,,,,,,,,,,,,,,,,,VeroCerv18,6/30/2021 13:45,http://creativecommons.org/licenses/by-nc/4.0/,Augustana College,,urn:uuid:54031182-b25b-446f-9687-bd2c40e27a75,https://scan-bugs.org:443/portal/collections/individual/index.php?occid=57306758
57306759,AUGIE,ENT,,120bf21c-d066-48ee-b4c0-880596ea22e4,PreservedSpecimen,cab24876-c0e7-42ee-9846-04eb1281f560,AUGIEENTB0000010,,Animalia,Arthropoda,Insecta,Coleoptera,Coccinellidae,Coleomegilla maculata,25547,,Coleomegilla,maculata,,,Jack Hughes,6/30/2021,,,,,,Olivia Ruffatto,,6/24/2021,2021,6,24,175,,6/24/2021,,,,,,,,,,,,,,,,,United States,IA,Scott,,,,41.50368,90.62248,,,,,,,,,,,,,,,,,marissagorsegner,8/12/2021 7:39,http://creativecommons.org/licenses/by-nc/4.0/,Augustana College,,urn:uuid:cab24876-c0e7-42ee-9846-04eb1281f560,https://scan-bugs.org:443/portal/collections/individual/index.php?occid=57306759
57306760,AUGIE,ENT,,120bf21c-d066-48ee-b4c0-880596ea22e4,PreservedSpecimen,a5815e03-3197-4da1-b297-7c7933ca4567,AUGIEENTA0000168,,Animalia,Arthropoda,Insecta,Coleoptera,Coccinellidae,Coccinella septempunctata,25520,"(Linnaeus, 1758)",Coccinella,septempunctata,,,Olivia Ruffatto,,,,,,,Bridge S.,,7/9/1999,1999,7,9,190,,7-IX-1999,,,,,,,,,,,,,,,,,United States,Illinois,Rock Island,,,,,,,,,,,,,,,,,,,,,,VeroCerv18,6/30/2021 13:46,http://creativecommons.org/licenses/by-nc/4.0/,Augustana College,,urn:uuid:a5815e03-3197-4da1-b297-7c7933ca4567,https://scan-bugs.org:443/portal/collections/individual/index.php?occid=57306760
57306761,AUGIE,ENT,,120bf21c-d066-48ee-b4c0-880596ea22e4,PreservedSpecimen,b0df8edb-fe57-43ca-beb1-024cc152d5bc,AUGIEENTA0000169,,Animalia,Arthropoda,Insecta,Coleoptera,Coccinellidae,Coccinella septempunctata,25520,"(Linnaeus, 1758)",Coccinella,septempunctata,,,Olivia Ruffatto,,,,,,,Vimmerman D.,,9/24/1992,1992,9,24,268,,IX-24-1992,,,,,,,,,,,,,,,,,United States,Illinois,Rock Island,,,,,,,,,,,,,,,,,,,,,,VeroCerv18,6/30/2021 13:47,http://creativecommons.org/licenses/by-nc/4.0/,Augustana College,,urn:uuid:b0df8edb-fe57-43ca-beb1-024cc152d5bc,https://scan-bugs.org:443/portal/collections/individual/index.php?occid=57306761
57306762,AUGIE,ENT,,120bf21c-d066-48ee-b4c0-880596ea22e4,PreservedSpecimen,6045df5f-5c84-48c6-9746-4d2e17ed6376,AUGIEENTB0000001,,Animalia,Arthropoda,Insecta,Coleoptera,Coccinellidae,Coleomegilla maculata,25547,,Coleomegilla,maculata,,,Jack Hughes,6/30/2021,,,,,,Hughes J.,,6/23/2021,2021,6,23,174,,,,,,,,,,,,,,,,,,,United States,IA,Scott,,,,41.56812,90.57119,,,,,,,,,,,,,,,,,marissagorsegner,7/1/2021 12:42,http://creativecommons.org/licenses/by-nc/4.0/,Augustana College,,urn:uuid:6045df5f-5c84-48c6-9746-4d2e17ed6376,https://scan-bugs.org:443/portal/collections/individual/index.php?occid=57306762
57306763,AUGIE,ENT,,120bf21c-d066-48ee-b4c0-880596ea22e4,PreservedSpecimen,d87bb26c-cc9f-4d7e-aeb6-c3df25be765a,AUGIEENTA0000170,,Animalia,Arthropoda,Insecta,Coleoptera,Coccinellidae,Coccinella septempunctata,25520,"(Linnaeus, 1758)",Coccinella,septempunctata,,,Olivia Ruffatto,,,,,,,Ynnkley D.,,7/9/1997,1997,7,9,190,,7-IX-1997,,,,,,,,,,,,,,,,,United States,Illinois,Rock Island,,,,,,,,,,,,,,,,,,,,,,VeroCerv18,6/30/2021 13:48,http://creativecommons.org/licenses/by-nc/4.0/,Augustana College,,urn:uuid:d87bb26c-cc9f-4d7e-aeb6-c3df25be765a,https://scan-bugs.org:443/portal/collections/individual/index.php?occid=57306763
57306764,AUGIE,ENT,,120bf21c-d066-48ee-b4c0-880596ea22e4,PreservedSpecimen,b4739827-ceb1-43ad-9b9e-442f2a755c35,AUGIEENTB0000017,,Animalia,Arthropoda,Insecta,Coleoptera,Coccinellidae,Coleomegilla maculata,25547,,Coleomegilla,maculata,,,Jack Hughes,6/30/2021,,,,,,Hughes J.,,6/23/2021,2021,6,23,174,,6/23/2021,,,,,,,,,,,,,,,,,United States,IA,Scott,,,,41.56304,90.46707,,,,,,,,,,,,,,,,,marissagorsegner,7/1/2021 12:42,http://creativecommons.org/licenses/by-nc/4.0/,Augustana College,,urn:uuid:b4739827-ceb1-43ad-9b9e-442f2a755c35,https://scan-bugs.org:443/portal/collections/individual/index.php?occid=57306764
57306765,AUGIE,ENT,,120bf21c-d066-48ee-b4c0-880596ea22e4,PreservedSpecimen,252fb1e5-867e-4acc-b3f2-8dddadf59107,AUGIEENTA0000171,,Animalia,Arthropoda,Insecta,Coleoptera,Coccinellidae,Coccinella septempunctata,25520,"(Linnaeus, 1758)",Coccinella,septempunctata,,,Olivia Ruffatto,,,,,,,Barrantes A.,,9/13/2018,2018,9,13,256,,13-9-2018,,,,,,,,,,,,,,,,,United States,Iowa,Scott,,Nahnat Marsh,,,,,,,,,,,,,,,,,,,,VeroCerv18,6/30/2021 13:49,http://creativecommons.org/licenses/by-nc/4.0/,Augustana College,,urn:uuid:252fb1e5-867e-4acc-b3f2-8dddadf59107,https://scan-bugs.org:443/portal/collections/individual/index.php?occid=57306765
57306766,AUGIE,ENT,,120bf21c-d066-48ee-b4c0-880596ea22e4,PreservedSpecimen,4b17a81b-0f3a-4ddc-94c5-01eeb74bfadb,AUGIEENTB0000016,,Animalia,Arthropoda,Insecta,Coleoptera,Coccinellidae,Coleomegilla maculata,25547,,Coleomegilla,maculata,,,Jack Hughes,6/30/2021,,,,,,Cervantes V.,,6/23/2021,2021,6,23,174,,6/23/2021,,,,,,,,,,,,,,,,,United States,IA,Scott,,,,41.56304,90.46707,,,,,,,,,,,,,,,,,marissagorsegner,7/1/2021 12:42,http://creativecommons.org/licenses/by-nc/4.0/,Augustana College,,urn:uuid:4b17a81b-0f3a-4ddc-94c5-01eeb74bfadb,https://scan-bugs.org:443/portal/collections/individual/index.php?occid=57306766
57306767,AUGIE,ENT,,120bf21c-d066-48ee-b4c0-880596ea22e4,PreservedSpecimen,0b8ea28d-c64b-4be9-a507-5d48ebb6e8dc,AUGIEENTB0000015,,Animalia,Arthropoda,Insecta,Coleoptera,Coccinellidae,Coleomegilla maculata,25547,,Coleomegilla,maculata,,,Jack Hughes,6/30/2021,,,,,,Cervantes V.,,6/23/2021,2021,6,23,174,,6/23/2021,,,,,,,,,,,,,,,,,United States,IA,Scott,,,,41.56304,90.46707,,,,,,,,,,,,,,,,,marissagorsegner,7/1/2021 12:41,http://creativecommons.org/licenses/by-nc/4.0/,Augustana College,,urn:uuid:0b8ea28d-c64b-4be9-a507-5d48ebb6e8dc,https://scan-bugs.org:443/portal/collections/individual/index.php?occid=57306767
57306769,AUGIE,ENT,,120bf21c-d066-48ee-b4c0-880596ea22e4,PreservedSpecimen,08c1370b-2d80-434f-a509-fd230d30f8a3,AGUIEENTB0000002,,Animalia,Arthropoda,Insecta,Coleoptera,Coccinellidae,Coleomegilla maculata,25547,,Coleomegilla,maculata,,,Jack Hughes,6/30/2021,,,,,,Hughes J.,,6/23/2021,2021,6,23,174,,6/23/2021,,,,,,,,,,,,,,,,,United States,IA,Scott,,,,41.5677,90.52301,,,,,,,,,,,,,,,,,marissagorsegner,7/1/2021 12:41,http://creativecommons.org/licenses/by-nc/4.0/,Augustana College,,urn:uuid:08c1370b-2d80-434f-a509-fd230d30f8a3,https://scan-bugs.org:443/portal/collections/individual/index.php?occid=57306769
57306770,AUGIE,ENT,,120bf21c-d066-48ee-b4c0-880596ea22e4,PreservedSpecimen,0ded0a44-af0e-48a9-9966-dc01e420a368,AUGIEENTB0000020,,Animalia,Arthropoda,Insecta,Coleoptera,Coccinellidae,Coleomegilla maculata,25547,,Coleomegilla,maculata,,,Jack Hughes,6/30/2021,,,,,,Gorsegner M.,,6/23/2021,2021,6,23,174,,,,,,,,,,,,,,,,,,,United States,IA,Scott,,,,41.56304,90.46707,,,,,,,,,,,,,,,,,marissagorsegner,7/1/2021 12:39,http://creativecommons.org/licenses/by-nc/4.0/,Augustana College,,urn:uuid:0ded0a44-af0e-48a9-9966-dc01e420a368,https://scan-bugs.org:443/portal/collections/individual/index.php?occid=57306770
57306771,AUGIE,ENT,,120bf21c-d066-48ee-b4c0-880596ea22e4,PreservedSpecimen,4402e1bc-e1fc-4213-a69f-e48a762250ce,AUGIEENTB0000025,,Animalia,Arthropoda,Insecta,Coleoptera,Coccinellidae,Coleomegilla maculata,25547,,Coleomegilla,maculata,,,Jack Hughes,6/30/2021,,,,,,Cervantes V.,,6/24/2021,2021,6,24,175,,6/24/2021,,,,,,,,,,,,,,,,,United States,IA,Scott,,,,41.57847,90.61787,,,,,,,,,,,,,,,,,marissagorsegner,7/1/2021 12:38,http://creativecommons.org/licenses/by-nc/4.0/,Augustana College,,urn:uuid:4402e1bc-e1fc-4213-a69f-e48a762250ce,https://scan-bugs.org:443/portal/collections/individual/index.php?occid=57306771
57306774,AUGIE,ENT,,120bf21c-d066-48ee-b4c0-880596ea22e4,PreservedSpecimen,15c2b148-81b3-4b6e-9177-540011011310,AUGIEENTB0000026,,Animalia,Arthropoda,Insecta,Coleoptera,Coccinellidae,Coleomegilla maculata,25547,,Coleomegilla,maculata,,,Jack Hughes,6/30/2021,,,,,,Hughes J.,,6/24/2021,2021,6,24,175,,6/24/2021,,,,,,,,,,,,,,,,,United States,IA,Scott,,,,41.57847,90.61787,,,,,,,,,,,,,,,,,marissagorsegner,7/1/2021 12:38,http://creativecommons.org/licenses/by-nc/4.0/,Augustana College,,urn:uuid:15c2b148-81b3-4b6e-9177-540011011310,https://scan-bugs.org:443/portal/collections/individual/index.php?occid=57306774
57306777,AUGIE,ENT,,120bf21c-d066-48ee-b4c0-880596ea22e4,PreservedSpecimen,e31bc227-28bd-46d0-8870-bee98fe07925,AUGIEENTB0000008,,Animalia,Arthropoda,Insecta,Coleoptera,Coccinellidae,Propylea quatuordecimpunctata,613667,(Linneus 1758),Propylea,quatuordecimpunctata,,,Marissa Gorsegner,8/12/2021,,,,,,Cervantes V.,,6/23/2021,2021,6,23,174,,6/23/2021,,,,,,,,,,,,,,,,,United States,Iowa,Scott,,,,41.56304,90.46707,,,,,,,,,,,,,,,,,VeroCerv18,8/12/2021 15:47,http://creativecommons.org/licenses/by-nc/4.0/,Augustana College,,urn:uuid:e31bc227-28bd-46d0-8870-bee98fe07925,https://scan-bugs.org:443/portal/collections/individual/index.php?occid=57306777
57306779,AUGIE,ENT,,120bf21c-d066-48ee-b4c0-880596ea22e4,PreservedSpecimen,415c22da-07ba-44f2-a5e5-89ed7f3bc019,AUGIEENTB0000027,,Animalia,Arthropoda,Insecta,Coleoptera,Coccinellidae,Coleomegilla maculata,25547,,Coleomegilla,maculata,,,Jack Hughes,6/30/2021,,,,,,Cervantes V.,,6/24/2021,2021,6,24,175,,6/24/2021,,,,,,,,,,,,,,,,,United States,IA,Scott,,,,41.57847,90.61787,,,,,,,,,,,,,,,,,marissagorsegner,7/1/2021 12:38,http://creativecommons.org/licenses/by-nc/4.0/,Augustana College,,urn:uuid:415c22da-07ba-44f2-a5e5-89ed7f3bc019,https://scan-bugs.org:443/portal/collections/individual/index.php?occid=57306779
57306780,AUGIE,ENT,,120bf21c-d066-48ee-b4c0-880596ea22e4,PreservedSpecimen,013dd4bd-2976-48af-be10-1f5b1967340b,AUGIEENTB0000019,,Animalia,Arthropoda,Insecta,Coleoptera,Coccinellidae,Propylea quatuordecimpunctata,613667,(Linneus 1758),Propylea,quatuordecimpunctata,,,Marissa Gorsegner,8/12/2021,,,,,,Gorsegner M.,,6/23/2021,2021,6,23,174,,6/23/2021,,,,,,,,,,,,,,,,,United States,Iowa,Scott,,,,41.56812,90.57119,,,,,,,,,,,,,,,,,VeroCerv18,8/12/2021 15:47,http://creativecommons.org/licenses/by-nc/4.0/,Augustana College,,urn:uuid:013dd4bd-2976-48af-be10-1f5b1967340b,https://scan-bugs.org:443/portal/collections/individual/index.php?occid=57306780
57306781,AUGIE,ENT,,120bf21c-d066-48ee-b4c0-880596ea22e4,PreservedSpecimen,4184747c-5bbc-4fc2-840f-337bb363804c,AUGIEENTB0000028,,Animalia,Arthropoda,Insecta,Coleoptera,Coccinellidae,Coleomegilla maculata,25547,,Coleomegilla,maculata,,,Jack Hughes,6/30/2021,,,,,,Ruffatto O.,,6/24/2021,2021,6,24,175,,6/24/2021,,,,,,,,,,,,,,,,,United States,IA,Scott,,,,41.57847,90.61787,,,,,,,,,,,,,,,,,marissagorsegner,7/1/2021 12:37,http://creativecommons.org/licenses/by-nc/4.0/,Augustana College,,urn:uuid:4184747c-5bbc-4fc2-840f-337bb363804c,https://scan-bugs.org:443/portal/collections/individual/index.php?occid=57306781
57306784,AUGIE,ENT,,120bf21c-d066-48ee-b4c0-880596ea22e4,PreservedSpecimen,7f3043ba-f2ae-4000-b938-a073878b95f0,AUGIEENTB0000014,,Animalia,Arthropoda,Insecta,Coleoptera,Coccinellidae,Hippodamia parenthesis,27400,,Hippodamia,parenthesis,,,Jack Hughes,6/30/2021,,,,,,Cervantes V.,,6/23/2021,2021,6,23,174,,6/23/2021,,,,,,,,,,,,,,,,,United States,Iowa,Scott,,,,,,,,,,,,,,,,,,,,,,VeroCerv18,6/30/2021 14:06,http://creativecommons.org/licenses/by-nc/4.0/,Augustana College,,urn:uuid:7f3043ba-f2ae-4000-b938-a073878b95f0,https://scan-bugs.org:443/portal/collections/individual/index.php?occid=57306784
57306787,AUGIE,ENT,,120bf21c-d066-48ee-b4c0-880596ea22e4,PreservedSpecimen,fcd3308f-3501-4f68-b5af-61873166e88f,AUGIEENTB0000029,,Animalia,Arthropoda,Insecta,Coleoptera,Coccinellidae,Coleomegilla maculata,25547,,Coleomegilla,maculata,,,Jack Hughes,6/30/2021,,,,,,Gorsegner M.,,6/24/2021,2021,6,24,175,,,,,,,,,,,,,,,,,,,United States,IA,Scott,,,,41.57847,90.61787,,,,,,,,,,,,,,,,,marissagorsegner,7/1/2021 12:37,http://creativecommons.org/licenses/by-nc/4.0/,Augustana College,,urn:uuid:fcd3308f-3501-4f68-b5af-61873166e88f,https://scan-bugs.org:443/portal/collections/individual/index.php?occid=57306787
57306789,AUGIE,ENT,,120bf21c-d066-48ee-b4c0-880596ea22e4,PreservedSpecimen,cd696ce2-4a11-43c3-bfc8-7ccaa84190e9,AUGIEENTB0000004,,Animalia,Arthropoda,Insecta,Coleoptera,Coccinellidae,Harmonia axyridis,27230,"(Pallas, 1773)",Harmonia,axyridis,,,Jack Hughes,6/30/2021,,,,,,Ruffatto O.,,6/24/2021,2021,6,24,175,,6/24/2021,,,,,,,,,,,,,,,,,United States,Iowa,Scott,,,,,,,,,,,,,,,,,,,,,,VeroCerv18,8/12/2021 15:47,http://creativecommons.org/licenses/by-nc/4.0/,Augustana College,,urn:uuid:cd696ce2-4a11-43c3-bfc8-7ccaa84190e9,https://scan-bugs.org:443/portal/collections/individual/index.php?occid=57306789
57306790,AUGIE,ENT,,120bf21c-d066-48ee-b4c0-880596ea22e4,PreservedSpecimen,724d4b80-d50e-4298-b8d0-2b528a863669,AUGIEENTB0000022,,Animalia,Arthropoda,Insecta,Coleoptera,Coccinellidae,Harmonia axyridis,27230,"(Pallas, 1773)",Harmonia,axyridis,,,Veronica Cervantes,8/19/2021,,,,,,Gorsegner M.,,6/23/2021,2021,6,23,174,,6/23/2021,,,,,,,,,,,,,,,,,United States,IA,Scott,,,,41.55032,90.45992,,,,,,,,,,,,,,,,,marissagorsegner,8/19/2021 12:26,http://creativecommons.org/licenses/by-nc/4.0/,Augustana College,,urn:uuid:724d4b80-d50e-4298-b8d0-2b528a863669,https://scan-bugs.org:443/portal/collections/individual/index.php?occid=57306790
57306791,AUGIE,ENT,,120bf21c-d066-48ee-b4c0-880596ea22e4,PreservedSpecimen,0fbeb419-9c27-4d6c-8f3b-6903b4f16d02,AUGIEENTB0000006,,Animalia,Arthropoda,Insecta,Coleoptera,Coccinellidae,Harmonia axyridis,27230,"(Pallas, 1773)",Harmonia,axyridis,,,Jack Hughes,6/30/2021,,,,,,Ruffatto O.,,6/24/2021,2021,6,24,175,,6/24/2021,,,,,,,,,,,,,,,,,United States,Iowa,Scott,,,,41.50206,90.45157,,,,,,,,,,,,,,,,,VeroCerv18,8/12/2021 8:03,http://creativecommons.org/licenses/by-nc/4.0/,Augustana College,,urn:uuid:0fbeb419-9c27-4d6c-8f3b-6903b4f16d02,https://scan-bugs.org:443/portal/collections/individual/index.php?occid=57306791
57306793,AUGIE,ENT,,120bf21c-d066-48ee-b4c0-880596ea22e4,PreservedSpecimen,6933a0d8-ee7a-4b2a-b7b8-c4e1a9f6246b,AUGIEENTB0000009,,Animalia,Arthropoda,Insecta,Coleoptera,Coccinellidae,Harmonia axyridis,27230,"(Pallas, 1773)",Harmonia,axyridis,,,Jack Hughes,6/30/2021,,,,,,Ruffatto O.,,6/24/2021,2021,6,24,175,,6/24/2021,,,,,,,,,,,,,,,,,United States,Iowa,Scott,,,,41.50206,90.45157,,,,,,,,,,,,,,,,,VeroCerv18,8/12/2021 15:47,http://creativecommons.org/licenses/by-nc/4.0/,Augustana College,,urn:uuid:6933a0d8-ee7a-4b2a-b7b8-c4e1a9f6246b,https://scan-bugs.org:443/portal/collections/individual/index.php?occid=57306793
57306795,AUGIE,ENT,,120bf21c-d066-48ee-b4c0-880596ea22e4,PreservedSpecimen,902010fc-95f5-4a30-87d7-1ac87443cef2,AUGIEENTB0000023,,Animalia,Arthropoda,Insecta,Coleoptera,Coccinellidae,Harmonia axyridis,27230,"(Pallas, 1773)",Harmonia,axyridis,,,Jack Hughes,,,,,,,Gorsegner M.,,6/24/2021,2021,6,24,175,,6/24/2021,,,,,,,,,,,,,,,,,United States,Iowa,Scott,,,,,,,,,,,,,,,,,,,,,,VeroCerv18,6/30/2021 14:11,http://creativecommons.org/licenses/by-nc/4.0/,Augustana College,,urn:uuid:902010fc-95f5-4a30-87d7-1ac87443cef2,https://scan-bugs.org:443/portal/collections/individual/index.php?occid=57306795
57306796,AUGIE,ENT,,120bf21c-d066-48ee-b4c0-880596ea22e4,PreservedSpecimen,81d12aeb-75a2-4d0f-84ab-0fa05ff6d387,AUGIEENTB0000005,,Animalia,Arthropoda,Insecta,Coleoptera,Coccinellidae,Harmonia axyridis,27230,"(Pallas, 1773)",Harmonia,axyridis,,,Jack Hughes,,,,,,,Hughes J.,,6/24/2021,2021,6,24,175,,6/24/2021,,,,,,,,,,,,,,,,,United States,Iowa,Scott,,,,,,,,,,,,,,,,,,,,,,VeroCerv18,6/30/2021 14:13,http://creativecommons.org/licenses/by-nc/4.0/,Augustana College,,urn:uuid:81d12aeb-75a2-4d0f-84ab-0fa05ff6d387,https://scan-bugs.org:443/portal/collections/individual/index.php?occid=57306796
57306797,AUGIE,ENT,,120bf21c-d066-48ee-b4c0-880596ea22e4,PreservedSpecimen,a0fcc57b-6a26-46ba-9e87-0b9c0a6dde6a,AUGIEENTB0000003,,Animalia,Arthropoda,Insecta,Coleoptera,Coccinellidae,Harmonia axyridis,27230,"(Pallas, 1773)",Harmonia,axyridis,,,Jack Hughes,6/30/2021,,,,,,Cervantes V.,,6/24/2021,2021,6,24,175,,6/24/2021,,,,,,,,,,,,,,,,,United States,Iowa,Scott,,,,,,,,,,,,,,,,,,,,,,VeroCerv18,6/30/2021 14:14,http://creativecommons.org/licenses/by-nc/4.0/,Augustana College,,urn:uuid:a0fcc57b-6a26-46ba-9e87-0b9c0a6dde6a,https://scan-bugs.org:443/portal/collections/individual/index.php?occid=57306797
57309177,AUGIE,ENT,,120bf21c-d066-48ee-b4c0-880596ea22e4,PreservedSpecimen,c4d2f0a1-0916-478a-9aa0-fef372379527,AUGIEENTB0000030,,Animalia,Arthropoda,Insecta,Coleoptera,Coccinellidae,Coleomegilla maculata,25547,,Coleomegilla,maculata,,,O. Ruffatto,,,,,,,O. Ruffatto,,7/6/2021,2021,7,6,187,,,,,,,,,,,,,,,,,,,United States,Iowa,Scott,,,,41.57974,90.4891,,,,,,,,,,,,,,,,,jackhughes20,7/7/2021 12:28,http://creativecommons.org/licenses/by-nc/4.0/,Augustana College,,urn:uuid:c4d2f0a1-0916-478a-9aa0-fef372379527,https://scan-bugs.org:443/portal/collections/individual/index.php?occid=57309177
57309178,AUGIE,ENT,,120bf21c-d066-48ee-b4c0-880596ea22e4,PreservedSpecimen,67aa07c9-64fa-4a2d-99b9-af42ed6fd0d0,AUGIEENTB0000031,,Animalia,Arthropoda,Insecta,Coleoptera,Coccinellidae,Coleomegilla maculata,25547,,Coleomegilla,maculata,,,O. Ruffatto,,,,,,,M. Gorsegner,,7/6/2021,2021,7,6,187,,,,,,,,,,,,,,,,,,,United States,Iowa,Scott,,,,41.57974,90.4891,,,,,,,,,,,,,,,,,jackhughes20,7/7/2021 12:28,http://creativecommons.org/licenses/by-nc/4.0/,Augustana College,,urn:uuid:67aa07c9-64fa-4a2d-99b9-af42ed6fd0d0,https://scan-bugs.org:443/portal/collections/individual/index.php?occid=57309178
57309180,AUGIE,ENT,,120bf21c-d066-48ee-b4c0-880596ea22e4,PreservedSpecimen,160f97d3-bc1f-449c-9799-1c3eadbf1ea1,AUGIEENTB0000032,,Animalia,Arthropoda,Insecta,Coleoptera,Coccinellidae,Coleomegilla maculata,25547,,Coleomegilla,maculata,,,,,,,,,,V. Cervantes,,7/6/2021,2021,7,6,187,,,,,,,,,,,,,,,,,,,United States,Iowa,Scott,,,,41.57974,90.4891,,,,,,,,,,,,,,,,,jackhughes20,7/7/2021 12:28,http://creativecommons.org/licenses/by-nc/4.0/,Augustana College,,urn:uuid:160f97d3-bc1f-449c-9799-1c3eadbf1ea1,https://scan-bugs.org:443/portal/collections/individual/index.php?occid=57309180
57309182,AUGIE,ENT,,120bf21c-d066-48ee-b4c0-880596ea22e4,PreservedSpecimen,b1f8f323-b344-4e00-9d1b-458bc6f56803,AUGIEENTB0000033,,Animalia,Arthropoda,Insecta,Coleoptera,Coccinellidae,Hippodamia parenthesis,27400,,Hippodamia,parenthesis,,,,,,,,,,V. Cervantes,,7/6/2021,2021,7,6,187,,,,,,,,,,,,,,,,,,,United States,Iowa,Scott,,,,41.57974,90.4891,,,,,,,,,,,,,,,,,jackhughes20,7/7/2021 12:28,http://creativecommons.org/licenses/by-nc/4.0/,Augustana College,,urn:uuid:b1f8f323-b344-4e00-9d1b-458bc6f56803,https://scan-bugs.org:443/portal/collections/individual/index.php?occid=57309182
57309184,AUGIE,ENT,,120bf21c-d066-48ee-b4c0-880596ea22e4,PreservedSpecimen,2c4de316-dfac-4bcd-be31-c737272602a9,AUGIEENTB0000034,,Animalia,Arthropoda,Insecta,Coleoptera,Coccinellidae,Coleomegilla maculata,25547,,Coleomegilla,maculata,,,O. Ruffatto,,,,,,,O. Ruffatto,,7/6/2021,2021,7,6,187,,,,,,,,,,,,,,,,,,,United States,Iowa,Scott,,,,41.611341,90.53765,,,,,,,,,,,,,,,,,jackhughes20,7/7/2021 12:30,http://creativecommons.org/licenses/by-nc/4.0/,Augustana College,,urn:uuid:2c4de316-dfac-4bcd-be31-c737272602a9,https://scan-bugs.org:443/portal/collections/individual/index.php?occid=57309184
57309189,AUGIE,ENT,,120bf21c-d066-48ee-b4c0-880596ea22e4,PreservedSpecimen,f41a9623-e198-4989-9a57-56a8060ed332,AUGIEENTB0000035,,Animalia,Arthropoda,Insecta,Coleoptera,Coccinellidae,Coleomegilla maculata,25547,,Coleomegilla,maculata,,,O. Ruffatto,,,,,,,J. Hughes,,7/6/2021,2021,7,6,187,,,,,,,,,,,,,,,,,,,United States,Iowa,Scott,,,,41.611341,90.53765,,,,,,,,,,,,,,,,,jackhughes20,7/7/2021 12:32,http://creativecommons.org/licenses/by-nc/4.0/,Augustana College,,urn:uuid:f41a9623-e198-4989-9a57-56a8060ed332,https://scan-bugs.org:443/portal/collections/individual/index.php?occid=57309189
57309191,AUGIE,ENT,,120bf21c-d066-48ee-b4c0-880596ea22e4,PreservedSpecimen,e3bc8ca7-d863-4211-87a6-abd8e85b88e2,AUGIEENTB0000036,,Animalia,Arthropoda,Insecta,Coleoptera,Coccinellidae,Hippodamia convergens,27393,"Guérin-Méneville, 1842",Hippodamia,convergens,,,O. Ruffatto,,,,,,,V. Cervantes,,7/6/2021,2021,7,6,187,,,,,,,,,,,,,,,,,,,United States,Iowa,Scott,,,,41.611341,90.53765,,,,,,,,,,,,,,,,,jackhughes20,7/7/2021 12:34,http://creativecommons.org/licenses/by-nc/4.0/,Augustana College,,urn:uuid:e3bc8ca7-d863-4211-87a6-abd8e85b88e2,https://scan-bugs.org:443/portal/collections/individual/index.php?occid=57309191
57309193,AUGIE,ENT,,120bf21c-d066-48ee-b4c0-880596ea22e4,PreservedSpecimen,7c1267d8-3f97-4906-a0db-6abe60f1db43,AUGIEENTB0000037,,,,,,,,,,,,,,,,,,,,,M. Gorsegner,,7/6/2021,2021,7,6,187,,,,,,,,,,,,,,,,,,,United States,Iowa,Scott,Lubbock,,,41.611341,90.53765,,,,,,,,,,,,,,,,,jackhughes20,8/19/2021 8:40,http://creativecommons.org/licenses/by-nc/4.0/,Augustana College,,urn:uuid:7c1267d8-3f97-4906-a0db-6abe60f1db43,https://scan-bugs.org:443/portal/collections/individual/index.php?occid=57309193
57309196,AUGIE,ENT,,120bf21c-d066-48ee-b4c0-880596ea22e4,PreservedSpecimen,25befb75-1fdb-4302-98fc-a8b4913796ff,AUGIEENTB0000038,,Animalia,Arthropoda,Insecta,Coleoptera,Coccinellidae,Hippodamia parenthesis,27400,,Hippodamia,parenthesis,,,O. Ruffatto,,,,,,,O. Ruffatto,,7/6/2021,2021,7,6,187,,,,,,,,,,,,,,,,,,,United States,Iowa,Scott,,,,41.611341,90.53765,,,,,,,,,,,,,,,,,jackhughes20,8/19/2021 12:54,http://creativecommons.org/licenses/by-nc/4.0/,Augustana College,,urn:uuid:25befb75-1fdb-4302-98fc-a8b4913796ff,https://scan-bugs.org:443/portal/collections/individual/index.php?occid=57309196
57309200,AUGIE,ENT,,120bf21c-d066-48ee-b4c0-880596ea22e4,PreservedSpecimen,6b950e7c-1df9-447b-a3e7-3a2024600429,AUGIEENTB0000039,,Animalia,Arthropoda,Insecta,Coleoptera,Coccinellidae,Coleomegilla maculata,25547,,Coleomegilla,maculata,,,O. Ruffatto,,,,,,,V. Cervantes,,7/6/2021,2021,7,6,187,,,,,,,,,,,,,,,,,,,United States,Iowa,Scott,,,,41.611341,90.53765,,,,,,,,,,,,,,,,,jackhughes20,7/7/2021 12:38,http://creativecommons.org/licenses/by-nc/4.0/,Augustana College,,urn:uuid:6b950e7c-1df9-447b-a3e7-3a2024600429,https://scan-bugs.org:443/portal/collections/individual/index.php?occid=57309200
57309202,AUGIE,ENT,,120bf21c-d066-48ee-b4c0-880596ea22e4,PreservedSpecimen,6c0ad889-ab0f-477a-975b-b7ca7ce643de,AUGIEENTB0000040,,Animalia,Arthropoda,Insecta,Coleoptera,Coccinellidae,Coleomegilla maculata,25547,,Coleomegilla,maculata,,,O. Ruffatto,,,,,,,O. Ruffatto,,7/6/2021,2021,7,6,187,,,,,,,,,,,,,,,,,,,United States,Iowa,Scott,,,,41.611341,90.53765,,,,,,,,,,,,,,,,,jackhughes20,8/12/2021 8:05,http://creativecommons.org/licenses/by-nc/4.0/,Augustana College,,urn:uuid:6c0ad889-ab0f-477a-975b-b7ca7ce643de,https://scan-bugs.org:443/portal/collections/individual/index.php?occid=57309202
57309204,AUGIE,ENT,,120bf21c-d066-48ee-b4c0-880596ea22e4,PreservedSpecimen,c3b958a4-c87f-44e1-83ca-21c23b28ee9b,AUGIEENTB0000041,,Animalia,Arthropoda,Insecta,Coleoptera,Coccinellidae,Coleomegilla maculata,25547,,Coleomegilla,maculata,,,O. Ruffatto,,,,,,,V. Cervantes,,7/6/2021,2021,7,6,187,,,,,,,,,,,,,,,,,,,United States,Iowa,Scott,,,,41.611341,90.53765,,,,,,,,,,,,,,,,,jackhughes20,7/7/2021 12:39,http://creativecommons.org/licenses/by-nc/4.0/,Augustana College,,urn:uuid:c3b958a4-c87f-44e1-83ca-21c23b28ee9b,https://scan-bugs.org:443/portal/collections/individual/index.php?occid=57309204
57309206,AUGIE,ENT,,120bf21c-d066-48ee-b4c0-880596ea22e4,PreservedSpecimen,112fb757-ed92-4125-8ca4-1503735bebf4,AUGIEENTB0000041,,Animalia,Arthropoda,Insecta,Coleoptera,Coccinellidae,Coleomegilla maculata,25547,,Coleomegilla,maculata,,,O. Ruffatto,,,,,,,V. Cervantes,,7/6/2021,2021,7,6,187,,,,,,,,,,,,,,,,,,,United States,Iowa,Scott,,,,41.611341,90.53765,,,,,,,,,,,,,,,,,jackhughes20,7/7/2021 12:40,http://creativecommons.org/licenses/by-nc/4.0/,Augustana College,,urn:uuid:112fb757-ed92-4125-8ca4-1503735bebf4,https://scan-bugs.org:443/portal/collections/individual/index.php?occid=57309206
57309209,AUGIE,ENT,,120bf21c-d066-48ee-b4c0-880596ea22e4,PreservedSpecimen,40fa31a3-e096-4db2-aa04-6501caca4dbc,AUGIEENTB0000042,,Animalia,Arthropoda,Insecta,Coleoptera,Coccinellidae,Coleomegilla maculata,25547,,Coleomegilla,maculata,,,O. Ruffatto,,,,,,,J. Hughes,,7/6/2021,2021,7,6,187,,,,,,,,,,,,,,,,,,,United States,Iowa,Scott,,,,41.56304,90.46707,,,,,,,,,,,,,,,,,jackhughes20,7/7/2021 12:42,http://creativecommons.org/licenses/by-nc/4.0/,Augustana College,,urn:uuid:40fa31a3-e096-4db2-aa04-6501caca4dbc,https://scan-bugs.org:443/portal/collections/individual/index.php?occid=57309209
57309212,AUGIE,ENT,,120bf21c-d066-48ee-b4c0-880596ea22e4,PreservedSpecimen,9c11a15a-fef8-49f4-99a9-6b067ae8cf3a,AUGIEENTB0000043,,Animalia,Arthropoda,Insecta,Coleoptera,Coccinellidae,Coleomegilla maculata,25547,,Coleomegilla,maculata,,,O. Ruffatto,,,,,,,J. Hughes,,7/6/2021,2021,7,6,187,,,,,,,,,,,,,,,,,,,United States,Iowa,Scott,,,,41.56304,90.46707,,,,,,,,,,,,,,,,,jackhughes20,7/7/2021 12:43,http://creativecommons.org/licenses/by-nc/4.0/,Augustana College,,urn:uuid:9c11a15a-fef8-49f4-99a9-6b067ae8cf3a,https://scan-bugs.org:443/portal/collections/individual/index.php?occid=57309212
57309215,AUGIE,ENT,,120bf21c-d066-48ee-b4c0-880596ea22e4,PreservedSpecimen,885d96e9-0521-4d7d-bfd4-9c030ba61c69,AUGIEENTB0000044,,Animalia,Arthropoda,Insecta,Coleoptera,Coccinellidae,Coleomegilla maculata,25547,,Coleomegilla,maculata,,,O. Ruffatto,,,,,,,O. Ruffatto,,7/6/2021,2021,7,6,187,,,,,,,,,,,,,,,,,,,United States,Iowa,Scott,,,,41.56304,90.46707,,,,,,,,,,,,,,,,,jackhughes20,7/7/2021 12:44,http://creativecommons.org/licenses/by-nc/4.0/,Augustana College,,urn:uuid:885d96e9-0521-4d7d-bfd4-9c030ba61c69,https://scan-bugs.org:443/portal/collections/individual/index.php?occid=57309215
57309216,AUGIE,ENT,,120bf21c-d066-48ee-b4c0-880596ea22e4,PreservedSpecimen,a7f8734a-64f5-4de0-92ce-f0db74ff2189,AUGIEENTB0000045,,Animalia,Arthropoda,Insecta,Coleoptera,Coccinellidae,Hippodamia convergens,27393,"Guérin-Méneville, 1842",Hippodamia,convergens,,,O. Ruffatto,,,,,,,V. Cervantes,,7/6/2021,2021,7,6,187,,,,,,,,,,,,,,,,,,,United States,Iowa,Scott,,,,41.56304,90.46707,,,,,,,,,,,,,,,,,jackhughes20,7/7/2021 12:46,http://creativecommons.org/licenses/by-nc/4.0/,Augustana College,,urn:uuid:a7f8734a-64f5-4de0-92ce-f0db74ff2189,https://scan-bugs.org:443/portal/collections/individual/index.php?occid=57309216
57309219,AUGIE,ENT,,120bf21c-d066-48ee-b4c0-880596ea22e4,PreservedSpecimen,2f3fd0fa-190c-47c1-8b36-57d014aaa166,AUGIEENTB0000046,,Animalia,Arthropoda,Insecta,Coleoptera,Coccinellidae,Harmonia axyridis,27230,"(Pallas, 1773)",Harmonia,axyridis,,,O. Ruffatto,,,,,,,V. Cervantes,,7/6/2021,2021,7,6,187,,,,,,,,,,,,,,,,,,,United States,Iowa,Scott,,,,41.56304,90.46707,,,,,,,,,,,,,,,,,jackhughes20,7/7/2021 12:47,http://creativecommons.org/licenses/by-nc/4.0/,Augustana College,,urn:uuid:2f3fd0fa-190c-47c1-8b36-57d014aaa166,https://scan-bugs.org:443/portal/collections/individual/index.php?occid=57309219
57309222,AUGIE,ENT,,120bf21c-d066-48ee-b4c0-880596ea22e4,PreservedSpecimen,7a8512aa-977c-4861-b95d-ab99b13b0237,AUGIEENTB0000047,,Animalia,Arthropoda,Insecta,Coleoptera,Coccinellidae,Hippodamia parenthesis,27400,,Hippodamia,parenthesis,,,O. Ruffatto,,,,,,,J. Hughes,,7/6/2021,2021,7,6,187,,,,,,,,,,,,,,,,,,,United States,Iowa,Scott,,,,41.56304,90.46707,,,,,,,,,,,,,,,,,jackhughes20,7/7/2021 12:48,http://creativecommons.org/licenses/by-nc/4.0/,Augustana College,,urn:uuid:7a8512aa-977c-4861-b95d-ab99b13b0237,https://scan-bugs.org:443/portal/collections/individual/index.php?occid=57309222
57309225,AUGIE,ENT,,120bf21c-d066-48ee-b4c0-880596ea22e4,PreservedSpecimen,9efc07b4-715d-45a0-8fe6-131b04bb551f,AUGIEENTB0000048,,Animalia,Arthropoda,Insecta,Coleoptera,Coccinellidae,Hippodamia parenthesis,27400,,Hippodamia,parenthesis,,,O. Ruffatto,,,,,,,M. Gorsegner,,7/6/2021,2021,7,6,187,,,,,,,,,,,,,,,,,,,United States,Iowa,Scott,,,,41.56304,90.46707,,,,,,,,,,,,,,,,,jackhughes20,7/7/2021 12:50,http://creativecommons.org/licenses/by-nc/4.0/,Augustana College,,urn:uuid:9efc07b4-715d-45a0-8fe6-131b04bb551f,https://scan-bugs.org:443/portal/collections/individual/index.php?occid=57309225
57309228,AUGIE,ENT,,120bf21c-d066-48ee-b4c0-880596ea22e4,PreservedSpecimen,97ecad1d-b85f-433b-b4c2-d225f94a7bc7,AUGIEENTB0000049,,Animalia,Arthropoda,Insecta,Coleoptera,Coccinellidae,Hippodamia parenthesis,27400,,Hippodamia,parenthesis,,,O. Ruffatto,,,,,,,J. Hughes,,7/6/2021,2021,7,6,187,,,,,,,,,,,,,,,,,,,United States,Iowa,Scott,,,,41.611341,90.46707,,,,,,,,,,,,,,,,,jackhughes20,7/7/2021 12:52,http://creativecommons.org/licenses/by-nc/4.0/,Augustana College,,urn:uuid:97ecad1d-b85f-433b-b4c2-d225f94a7bc7,https://scan-bugs.org:443/portal/collections/individual/index.php?occid=57309228
57309231,AUGIE,ENT,,120bf21c-d066-48ee-b4c0-880596ea22e4,PreservedSpecimen,57b42e29-9136-4f6c-9a5c-db4f79852ce5,AUGIEENTB0000050,,Animalia,Arthropoda,Insecta,Coleoptera,Coccinellidae,Hippodamia parenthesis,27400,,Hippodamia,parenthesis,,,O. Ruffatto,,,,,,,M. Gorsegner,,7/6/2021,2021,7,6,187,,,,,,,,,,,,,,,,,,,United States,Iowa,Scott,,,,41.56304,90.46707,,,,,,,,,,,,,,,,,jackhughes20,7/7/2021 12:54,http://creativecommons.org/licenses/by-nc/4.0/,Augustana College,,urn:uuid:57b42e29-9136-4f6c-9a5c-db4f79852ce5,https://scan-bugs.org:443/portal/collections/individual/index.php?occid=57309231
57309235,AUGIE,ENT,,120bf21c-d066-48ee-b4c0-880596ea22e4,PreservedSpecimen,78499b14-7299-4a30-8c58-3cdedc7425ed,AUGIEENTB0000051,,Animalia,Arthropoda,Insecta,Coleoptera,Coccinellidae,Hippodamia parenthesis,27400,,Hippodamia,parenthesis,,,O. Ruffatto,,,,,,,M. Gorsegner,,7/6/2021,2021,7,6,187,,,,,,,,,,,,,,,,,,,United States,Iowa,Scott,,,,41.56304,90.46707,,,,,,,,,,,,,,,,,jackhughes20,7/7/2021 12:55,http://creativecommons.org/licenses/by-nc/4.0/,Augustana College,,urn:uuid:78499b14-7299-4a30-8c58-3cdedc7425ed,https://scan-bugs.org:443/portal/collections/individual/index.php?occid=57309235
57309237,AUGIE,ENT,,120bf21c-d066-48ee-b4c0-880596ea22e4,PreservedSpecimen,d2d228e7-a6fa-43af-bcec-c0771d93f7f4,AUGIEENTB0000052,,Animalia,Arthropoda,Insecta,Coleoptera,Coccinellidae,Hippodamia parenthesis,27400,,Hippodamia,parenthesis,,,O. Ruffatto,,,,,,,O. Ruffatto,,7/6/2021,2021,7,6,187,,,,,,,,,,,,,,,,,,,United States,Iowa,Scott,,,,41.56304,90.46707,,,,,,,,,,,,,,,,,jackhughes20,7/7/2021 12:56,http://creativecommons.org/licenses/by-nc/4.0/,Augustana College,,urn:uuid:d2d228e7-a6fa-43af-bcec-c0771d93f7f4,https://scan-bugs.org:443/portal/collections/individual/index.php?occid=57309237
57309239,AUGIE,ENT,,120bf21c-d066-48ee-b4c0-880596ea22e4,PreservedSpecimen,f10f16a5-b155-48c0-b8e0-bfa2420e60fe,AUGIEENTB0000053,,Animalia,Arthropoda,Insecta,Coleoptera,Coccinellidae,Hippodamia parenthesis,27400,,Hippodamia,parenthesis,,,O. Ruffatto,,,,,,,J. Hughes,,7/6/2021,2021,7,6,187,,,,,,,,,,,,,,,,,,,United States,Iowa,Scott,,,,41.56304,90.46707,,,,,,,,,,,,,,,,,jackhughes20,7/7/2021 12:57,http://creativecommons.org/licenses/by-nc/4.0/,Augustana College,,urn:uuid:f10f16a5-b155-48c0-b8e0-bfa2420e60fe,https://scan-bugs.org:443/portal/collections/individual/index.php?occid=57309239
57309241,AUGIE,ENT,,120bf21c-d066-48ee-b4c0-880596ea22e4,PreservedSpecimen,f9ddce56-5fa4-409e-8eb4-12f51fe52485,AUGIEENTB0000054,,Animalia,Arthropoda,Insecta,Coleoptera,Coccinellidae,Coccinella septempunctata,25520,"(Linnaeus, 1758)",Coccinella,septempunctata,,,O. Ruffatto,,,,,,,O. Ruffatto,,7/6/2021,2021,7,6,187,,,,,,,,,,,,,,,,,,,United States,Iowa,Scott,,,,41.56304,90.46707,,,,,,,,,,,,,,,,,jackhughes20,7/7/2021 12:58,http://creativecommons.org/licenses/by-nc/4.0/,Augustana College,,urn:uuid:f9ddce56-5fa4-409e-8eb4-12f51fe52485,https://scan-bugs.org:443/portal/collections/individual/index.php?occid=57309241
57324587,AUGIE,ENT,,120bf21c-d066-48ee-b4c0-880596ea22e4,PreservedSpecimen,97fbeebd-8210-427e-a620-db6681dfe726,AUGIEENTB0000055,,Animalia,Arthropoda,Insecta,Coleoptera,Coccinellidae,Coleomegilla maculata,25547,,Coleomegilla,maculata,,,M. Gorsegner,7/9/2021,,,,,,O. Ruffatto,,7/7/2021,2021,7,7,188,,7/7/2021,,,,,,,,,,,,,,,,,United States,IA,Scott,,,,41.57847,90.61787,,,,,,,,,,,,,,,,,marissagorsegner,7/9/2021 7:42,http://creativecommons.org/licenses/by-nc/4.0/,Augustana College,,urn:uuid:97fbeebd-8210-427e-a620-db6681dfe726,https://scan-bugs.org:443/portal/collections/individual/index.php?occid=57324587
57328683,AUGIE,ENT,,120bf21c-d066-48ee-b4c0-880596ea22e4,PreservedSpecimen,2f6e85b1-3c3a-42e5-a3ce-722dadfa3f63,AUGIEENTB0000056,,Animalia,Arthropoda,Insecta,Coleoptera,Coccinellidae,Coleomegilla maculata,25547,,Coleomegilla,maculata,,,M. Gorsegner,7/9/2021,,,,,,J. Hughes,,7/7/2021,2021,7,7,188,,7/7/2021,,,,,,,,,,,,,,,,,United States,IA,Scott,,,,41.57847,90.61787,,,,,,,,,,,,,,,,,marissagorsegner,7/9/2021 7:45,http://creativecommons.org/licenses/by-nc/4.0/,Augustana College,,urn:uuid:2f6e85b1-3c3a-42e5-a3ce-722dadfa3f63,https://scan-bugs.org:443/portal/collections/individual/index.php?occid=57328683
57328684,AUGIE,ENT,,120bf21c-d066-48ee-b4c0-880596ea22e4,PreservedSpecimen,5fd48ba6-5375-428a-9e5d-f36dc754ee42,AUGIEENTB0000057,,Animalia,Arthropoda,Insecta,Coleoptera,Coccinellidae,Coleomegilla maculata,25547,,Coleomegilla,maculata,,,M. Gorsegner,7/9/2021,,,,,,M. Gorsegner,,7/7/2021,2021,7,7,188,,7/7/2021,,,,,,,,,,,,,,,,,United States,IA,Scott,,,,41.57847,90.61787,,,,,,,,,,,,,,,,,marissagorsegner,7/9/2021 7:47,http://creativecommons.org/licenses/by-nc/4.0/,Augustana College,,urn:uuid:5fd48ba6-5375-428a-9e5d-f36dc754ee42,https://scan-bugs.org:443/portal/collections/individual/index.php?occid=57328684
57328685,AUGIE,ENT,,120bf21c-d066-48ee-b4c0-880596ea22e4,PreservedSpecimen,d634dc46-2864-42b9-baf5-5d4c48dc2d6b,AUGIEENTB0000058,,Animalia,Arthropoda,Insecta,Coleoptera,Coccinellidae,Cycloneda munda,25911,,Cycloneda,munda,,,J. Hughes,7/7/2021,,,,,,J. Hughes,,7/6/2021,2021,7,6,187,,7/6/2021,,,,,,,,,,,,,,,,,United States,IA,Scott,,,,41.56304,90.46707,,,,,,,,,,,,,,,,,marissagorsegner,7/9/2021 7:53,http://creativecommons.org/licenses/by-nc/4.0/,Augustana College,,urn:uuid:d634dc46-2864-42b9-baf5-5d4c48dc2d6b,https://scan-bugs.org:443/portal/collections/individual/index.php?occid=57328685
57328686,AUGIE,ENT,,120bf21c-d066-48ee-b4c0-880596ea22e4,PreservedSpecimen,877cf983-748b-42ff-be6a-591d26332378,AUGIEENTB0000059,,Animalia,Arthropoda,Insecta,Coleoptera,Coccinellidae,Hippodamia parenthesis,27400,,Hippodamia,parenthesis,,,J. Hughes,7/7/2021,,,,,,V. Cervantes,,7/6/2021,2021,7,6,187,,7/6/2021,,,,,,,,,,,,,,,,,United States,IA,Scott,,,,,,,,,,,,,,,,,,,,,,marissagorsegner,7/9/2021 7:55,http://creativecommons.org/licenses/by-nc/4.0/,Augustana College,,urn:uuid:877cf983-748b-42ff-be6a-591d26332378,https://scan-bugs.org:443/portal/collections/individual/index.php?occid=57328686
57328688,AUGIE,ENT,,120bf21c-d066-48ee-b4c0-880596ea22e4,PreservedSpecimen,32f1adda-5071-4ebd-98ff-fb0c93714c0d,AUGIEENTB0000060,,Animalia,Arthropoda,Insecta,Coleoptera,Coccinellidae,Hyperaspis undulata,27847,,Hyperaspis,undulata,,,Veronica Cervantes,8/16/2021,,,,,,M. Gorsegner,,7/6/2021,2021,7,6,187,,,,,,,,,,,,,,,,,,,United States,IA,Scott,,,,41.56304,90.46707,,,,,,,,,,,,,,,,,marissagorsegner,8/16/2021 8:01,http://creativecommons.org/licenses/by-nc/4.0/,Augustana College,,urn:uuid:32f1adda-5071-4ebd-98ff-fb0c93714c0d,https://scan-bugs.org:443/portal/collections/individual/index.php?occid=57328688
57328689,AUGIE,ENT,,120bf21c-d066-48ee-b4c0-880596ea22e4,PreservedSpecimen,a58222c7-6ad3-4a00-b345-022e2516f19e,AUGIEENTB0000061,,Animalia,Arthropoda,Insecta,Coleoptera,Coccinellidae,Hyperaspis undulata,27847,,Hyperaspis,undulata,,,Veronica Cervantes,8/16/2021,,,,,,O. Ruffatto,,7/6/2021,2021,7,6,187,,,,,,,,,,,,,,,,,,,United States,IA,Scott,,,,41.56304,90.46707,,,,,,,,,,,,,,,,,marissagorsegner,8/16/2021 8:03,http://creativecommons.org/licenses/by-nc/4.0/,Augustana College,,urn:uuid:a58222c7-6ad3-4a00-b345-022e2516f19e,https://scan-bugs.org:443/portal/collections/individual/index.php?occid=57328689
57328692,AUGIE,ENT,,120bf21c-d066-48ee-b4c0-880596ea22e4,PreservedSpecimen,ec986d59-cda5-4e15-bcff-1abf99558a6d,AUGIEENTB0000062,,Animalia,Arthropoda,Insecta,Coleoptera,Coccinellidae,Coleomegilla maculata,25547,,Coleomegilla,maculata,,,M. Gorsegner,7/7/2021,,,,,,V. Cervantes,,7/7/2021,2021,7,7,188,,7/7/2021,,,,,,,,,,,,,,,,,United States,IA,Scott,,,,41.57847,90.61787,,,,,,,,,,,,,,,,,marissagorsegner,7/9/2021 8:07,http://creativecommons.org/licenses/by-nc/4.0/,Augustana College,,urn:uuid:ec986d59-cda5-4e15-bcff-1abf99558a6d,https://scan-bugs.org:443/portal/collections/individual/index.php?occid=57328692
57328694,AUGIE,ENT,,120bf21c-d066-48ee-b4c0-880596ea22e4,PreservedSpecimen,4beb7419-e471-4e37-bfcf-ffc8fe918c29,AUGIEENTB0000063,,Animalia,Arthropoda,Insecta,Coleoptera,Coccinellidae,Coleomegilla maculata,25547,,Coleomegilla,maculata,,,M. Gorsegner,7/7/2021,,,,,,M. Gorsegner,,7/7/2021,2021,7,7,188,,,,,,,,,,,,,,,,,,,United States,IA,Scott,,,,41.57847,90.61787,,,,,,,,,,,,,,,,,marissagorsegner,7/9/2021 8:09,http://creativecommons.org/licenses/by-nc/4.0/,Augustana College,,urn:uuid:4beb7419-e471-4e37-bfcf-ffc8fe918c29,https://scan-bugs.org:443/portal/collections/individual/index.php?occid=57328694
57328696,AUGIE,ENT,,120bf21c-d066-48ee-b4c0-880596ea22e4,PreservedSpecimen,88ace990-cf71-457b-8476-470a8192a9df,AUGIEENTB0000064,,Animalia,Arthropoda,Insecta,Coleoptera,Coccinellidae,Coleomegilla maculata,25547,,Coleomegilla,maculata,,,M. Gorsegner,7/9/2021,,,,,,J. Hughes,,7/7/2021,2021,7,7,188,,7/7/2021,,,,,,,,,,,,,,,,,United States,IA,Scott,,,,41.57847,90.61787,,,,,,,,,,,,,,,,,marissagorsegner,7/9/2021 8:11,http://creativecommons.org/licenses/by-nc/4.0/,Augustana College,,urn:uuid:88ace990-cf71-457b-8476-470a8192a9df,https://scan-bugs.org:443/portal/collections/individual/index.php?occid=57328696
57328697,AUGIE,ENT,,120bf21c-d066-48ee-b4c0-880596ea22e4,PreservedSpecimen,41187e52-25c4-4c23-b099-9a3c4181ddd8,AUGIEENTB0000071,,Animalia,Arthropoda,Insecta,Coleoptera,Coccinellidae,Coleomegilla maculata,25547,,Coleomegilla,maculata,,,Olivia Ruffatto,7/9/2021,,,,,,V. Cervantes,,7/7/2021,,,,,,7/7/2021,,,,,,,,,,,,,,,,,United States,Iowa,Scott,,,,41.537828,90.645823,,,,,,,,,,,,,,,,,VeroCerv18,7/9/2021 8:12,http://creativecommons.org/licenses/by-nc/4.0/,Augustana College,,urn:uuid:41187e52-25c4-4c23-b099-9a3c4181ddd8,https://scan-bugs.org:443/portal/collections/individual/index.php?occid=57328697
57328698,AUGIE,ENT,,120bf21c-d066-48ee-b4c0-880596ea22e4,PreservedSpecimen,c3f88913-5692-4c91-9c41-c1b10a81f2a6,AUGIEENTB0000065,,Animalia,Arthropoda,Insecta,Coleoptera,Coccinellidae,Coleomegilla maculata,25547,,Coleomegilla,maculata,,,J. Hughes,7/9/2021,,,,,,O. Ruffatto,,7/7/2021,2021,7,7,188,,7/7/2021,,,,,,,,,,,,,,,,,United States,IA,Scott,,,,41.57847,90.61787,,,,,,,,,,,,,,,,,marissagorsegner,8/19/2021 12:30,http://creativecommons.org/licenses/by-nc/4.0/,Augustana College,,urn:uuid:c3f88913-5692-4c91-9c41-c1b10a81f2a6,https://scan-bugs.org:443/portal/collections/individual/index.php?occid=57328698
57328700,AUGIE,ENT,,120bf21c-d066-48ee-b4c0-880596ea22e4,PreservedSpecimen,e8468620-a1ba-47e9-ac03-a6b45cee592b,AUGIEENTB0000072,,Animalia,Arthropoda,Insecta,Coleoptera,Coccinellidae,Coleomegilla maculata,25547,,Coleomegilla,maculata,,,Olivia Ruffatto,7/9/2021,,,,,,M. Gorsegner,,7/7/2021,2021,7,7,188,,7/7/2021,,,,,,,,,,,,,,,,,United States,Iowa,Scott,,,,41.537828,90.645823,,,,,,,,,,,,,,,,,VeroCerv18,7/9/2021 8:16,http://creativecommons.org/licenses/by-nc/4.0/,Augustana College,,urn:uuid:e8468620-a1ba-47e9-ac03-a6b45cee592b,https://scan-bugs.org:443/portal/collections/individual/index.php?occid=57328700
57328701,AUGIE,ENT,,120bf21c-d066-48ee-b4c0-880596ea22e4,PreservedSpecimen,df5ce2f9-c635-4950-b0d8-d9a6972631db,AUGIEENTB0000073,,Animalia,Arthropoda,Insecta,Coleoptera,Coccinellidae,Coleomegilla maculata,25547,,Coleomegilla,maculata,,,Olivia Ruffatto,7/9/2021,,,,,,Olivia Ruffatto,,7/7/2021,2021,7,7,188,,7/7/2021,,,,,,,,,,,,,,,,,United States,Iowa,Scott,,,,41.537828,90.645823,,,,,,,,,,,,,,,,,VeroCerv18,7/9/2021 8:18,http://creativecommons.org/licenses/by-nc/4.0/,Augustana College,,urn:uuid:df5ce2f9-c635-4950-b0d8-d9a6972631db,https://scan-bugs.org:443/portal/collections/individual/index.php?occid=57328701
57328702,AUGIE,ENT,,120bf21c-d066-48ee-b4c0-880596ea22e4,PreservedSpecimen,534412d5-0f5b-46dd-a5f3-e048129c0c73,AUGIEENTB0000066,,Animalia,Arthropoda,Insecta,Coleoptera,Coccinellidae,Coleomegilla maculata,25547,,Coleomegilla,maculata,,,M. Gorsegner,7/9/2021,,,,,,O. Ruffatto,,7/7/2021,2021,7,7,188,,,,,,,,,,,,,,,,,,,United States,IA,Scott,,,,41.57847,90.61787,,,,,,,,,,,,,,,,,marissagorsegner,7/9/2021 8:19,http://creativecommons.org/licenses/by-nc/4.0/,Augustana College,,urn:uuid:534412d5-0f5b-46dd-a5f3-e048129c0c73,https://scan-bugs.org:443/portal/collections/individual/index.php?occid=57328702
57328704,AUGIE,ENT,,120bf21c-d066-48ee-b4c0-880596ea22e4,PreservedSpecimen,5adf6f7b-6c57-4c3a-b4f1-a4e68d3f067a,AUGIEENTB0000074,,Animalia,Arthropoda,Insecta,Coleoptera,Coccinellidae,Coleomegilla maculata,25547,,Coleomegilla,maculata,,,Olivia Ruffatto,7/9/2021,,,,,,Olivia Ruffatto,,7/7/2021,2021,7,7,188,,7/7/2021,,,,,,,,,,,,,,,,,United States,Iowa,Scott,,,,41.537828,90.645823,,,,,,,,,,,,,,,,,VeroCerv18,7/9/2021 8:20,http://creativecommons.org/licenses/by-nc/4.0/,Augustana College,,urn:uuid:5adf6f7b-6c57-4c3a-b4f1-a4e68d3f067a,https://scan-bugs.org:443/portal/collections/individual/index.php?occid=57328704
57328705,AUGIE,ENT,,120bf21c-d066-48ee-b4c0-880596ea22e4,PreservedSpecimen,63b4edec-3e8e-4631-aa5e-09c3faaf7ea6,AUGIEENTB0000075,,Animalia,Arthropoda,Insecta,Coleoptera,Coccinellidae,Coleomegilla maculata,25547,,Coleomegilla,maculata,,,Olivia Ruffatto,7/9/2021,,,,,,Jack Hughes,,7/7/2021,2021,7,7,188,,7/7/2021,,,,,,,,,,,,,,,,,United States,Iowa,Scott,,,,41.537828,90.645823,,,,,,,,,,,,,,,,,VeroCerv18,7/9/2021 8:21,http://creativecommons.org/licenses/by-nc/4.0/,Augustana College,,urn:uuid:63b4edec-3e8e-4631-aa5e-09c3faaf7ea6,https://scan-bugs.org:443/portal/collections/individual/index.php?occid=57328705
57328707,AUGIE,ENT,,120bf21c-d066-48ee-b4c0-880596ea22e4,PreservedSpecimen,b9147cf0-2cad-4485-8ca1-1b1fbee00225,AUGIEENTB0000076,,Animalia,Arthropoda,Insecta,Coleoptera,Coccinellidae,Hippodamia parenthesis,27400,,Hippodamia,parenthesis,,,Olivia Ruffatto,7/9/2021,,,,,,Jack Hughes,,7/7/2021,2021,7,7,188,,7/7/2021,,,,,,,,,,,,,,,,,United States,Iowa,Scott,,,,41.537828,90.645823,,,,,,,,,,,,,,,,,VeroCerv18,7/9/2021 8:23,http://creativecommons.org/licenses/by-nc/4.0/,Augustana College,,urn:uuid:b9147cf0-2cad-4485-8ca1-1b1fbee00225,https://scan-bugs.org:443/portal/collections/individual/index.php?occid=57328707
57328708,AUGIE,ENT,,120bf21c-d066-48ee-b4c0-880596ea22e4,PreservedSpecimen,1bb3faba-a414-4b65-90c5-c4a3f2c5f36f,AUGIEENTB0000067,,Animalia,Arthropoda,Insecta,Coleoptera,Coccinellidae,Coccinella septempunctata,25520,"(Linnaeus, 1758)",Coccinella,septempunctata,,,J. Hughes,7/9/2021,,,,,,V. Cervantes,,7/7/2021,2021,7,7,188,,,,,,,,,,,,,,,,,,,United States,IA,Scott,,,,41.57847,90.61787,,,,,,,,,,,,,,,,,marissagorsegner,7/9/2021 8:23,http://creativecommons.org/licenses/by-nc/4.0/,Augustana College,,urn:uuid:1bb3faba-a414-4b65-90c5-c4a3f2c5f36f,https://scan-bugs.org:443/portal/collections/individual/index.php?occid=57328708
57328710,AUGIE,ENT,,120bf21c-d066-48ee-b4c0-880596ea22e4,PreservedSpecimen,28677f74-5b2c-4e62-95be-88d985db58a4,AUGIEENTB0000077,,Animalia,Arthropoda,Insecta,Coleoptera,Coccinellidae,Hippodamia parenthesis,27400,,Hippodamia,parenthesis,,,Olivia Ruffatto,7/9/2021,,,,,,Jack Hughes,,7/7/2021,2021,7,7,188,,7/7/2021,,,,,,,,,,,,,,,,,United States,Iowa,Scott,,,,41.537828,90.645823,,,,,,,,,,,,,,,,,VeroCerv18,7/9/2021 8:24,http://creativecommons.org/licenses/by-nc/4.0/,Augustana College,,urn:uuid:28677f74-5b2c-4e62-95be-88d985db58a4,https://scan-bugs.org:443/portal/collections/individual/index.php?occid=57328710
57328711,AUGIE,ENT,,120bf21c-d066-48ee-b4c0-880596ea22e4,PreservedSpecimen,42330e0b-dea6-4261-8da2-35f2d9e4afed,AUGIEENTB0000078,,Animalia,Arthropoda,Insecta,Coleoptera,Coccinellidae,Hippodamia parenthesis,27400,,Hippodamia,parenthesis,,,Olivia Ruffatto,7/9/2021,,,,,,M. Gorsegner,,7/7/2021,2021,7,7,188,,7/7/2021,,,,,,,,,,,,,,,,,United States,Iowa,Scott,,,,41.537828,90.645823,,,,,,,,,,,,,,,,,VeroCerv18,7/9/2021 8:25,http://creativecommons.org/licenses/by-nc/4.0/,Augustana College,,urn:uuid:42330e0b-dea6-4261-8da2-35f2d9e4afed,https://scan-bugs.org:443/portal/collections/individual/index.php?occid=57328711
57328712,AUGIE,ENT,,120bf21c-d066-48ee-b4c0-880596ea22e4,PreservedSpecimen,1daa4b93-a6f5-4848-abd7-1151acb1b488,AUGIEENTB0000068,,Animalia,Arthropoda,Insecta,Coleoptera,Coccinellidae,Coleomegilla maculata,25547,,Coleomegilla,maculata,,,M. Gorsegner,7/9/2021,,,,,,V. Cervantes,,7/7/2021,2021,7,7,188,,,,,,,,,,,,,,,,,,,United States,IA,Scott,,,,41.57847,90.61787,,,,,,,,,,,,,,,,,marissagorsegner,7/9/2021 8:26,http://creativecommons.org/licenses/by-nc/4.0/,Augustana College,,urn:uuid:1daa4b93-a6f5-4848-abd7-1151acb1b488,https://scan-bugs.org:443/portal/collections/individual/index.php?occid=57328712
57328968,AUGIE,ENT,,120bf21c-d066-48ee-b4c0-880596ea22e4,PreservedSpecimen,dfd02300-449d-436d-9c14-c9403d21deca,AUGIEENTB0000079,,Animalia,Arthropoda,Insecta,Coleoptera,Coccinellidae,Hippodamia parenthesis,27400,,Hippodamia,parenthesis,,,Olivia Ruffatto,7/9/2021,,,,,,M. Gorsegner,,7/7/2021,2021,7,7,188,,7/7/2021,,,,,,,,,,,,,,,,,United States,Iowa,Scott,,,,41.537828,90.645823,,,,,,,,,,,,,,,,,VeroCerv18,7/9/2021 8:27,http://creativecommons.org/licenses/by-nc/4.0/,Augustana College,,urn:uuid:dfd02300-449d-436d-9c14-c9403d21deca,https://scan-bugs.org:443/portal/collections/individual/index.php?occid=57328968
57328969,AUGIE,ENT,,120bf21c-d066-48ee-b4c0-880596ea22e4,PreservedSpecimen,02f52bef-cec4-4f2a-af48-2016b0229ec1,AUGIEENTB0000080,,Animalia,Arthropoda,Insecta,Coleoptera,Coccinellidae,Hippodamia parenthesis,27400,,Hippodamia,parenthesis,,,Olivia Ruffatto,7/9/2021,,,,,,V. Cervantes,,7/7/2021,2021,7,7,188,,7/7/2021,,,,,,,,,,,,,,,,,United States,Iowa,Scott,,,,41.537828,90.645823,,,,,,,,,,,,,,,,,VeroCerv18,7/9/2021 8:31,http://creativecommons.org/licenses/by-nc/4.0/,Augustana College,,urn:uuid:02f52bef-cec4-4f2a-af48-2016b0229ec1,https://scan-bugs.org:443/portal/collections/individual/index.php?occid=57328969
57328970,AUGIE,ENT,,120bf21c-d066-48ee-b4c0-880596ea22e4,PreservedSpecimen,6696f6a0-3d16-40ae-9d98-8f21a4f25b90,AUGIEENTB0000069,,Animalia,Arthropoda,Insecta,Coleoptera,Coccinellidae,Coleomegilla maculata,25547,,Coleomegilla,maculata,,,M. Gorsegner,7/9/2021,,,,,,J. Hughes,,7/7/2021,2021,7,7,188,,,,,,,,,,,,,,,,,,,United States,IA,Scott,,,,41.57847,90.61787,,,,,,,,,,,,,,,,,marissagorsegner,7/9/2021 8:29,http://creativecommons.org/licenses/by-nc/4.0/,Augustana College,,urn:uuid:6696f6a0-3d16-40ae-9d98-8f21a4f25b90,https://scan-bugs.org:443/portal/collections/individual/index.php?occid=57328970
57328971,AUGIE,ENT,,120bf21c-d066-48ee-b4c0-880596ea22e4,PreservedSpecimen,cf7cdcda-4b03-474e-8a36-1157931c7762,AUGIEENTB0000081,,Animalia,Arthropoda,Insecta,Coleoptera,Coccinellidae,Hippodamia convergens,27393,"Guérin-Méneville, 1842",Hippodamia,convergens,,,Olivia Ruffatto,7/9/2021,,,,,,Jack Hughes,,7/7/2021,2021,7,7,188,,7/7/2021,,,,,,,,,,,,,,,,,United States,Iowa,Scott,,,,41.537828,90.645823,,,,,,,,,,,,,,,,,VeroCerv18,7/9/2021 8:30,http://creativecommons.org/licenses/by-nc/4.0/,Augustana College,,urn:uuid:cf7cdcda-4b03-474e-8a36-1157931c7762,https://scan-bugs.org:443/portal/collections/individual/index.php?occid=57328971
57328972,AUGIE,ENT,,120bf21c-d066-48ee-b4c0-880596ea22e4,PreservedSpecimen,cf54d718-834d-4aa3-8094-2c35c9ce4f4a,AUGIEENTB0000082,,Animalia,Arthropoda,Insecta,Coleoptera,Coccinellidae,Coleomegilla maculata,25547,,Coleomegilla,maculata,,,Olivia Ruffatto,7/9/2021,,,,,,M. Gorsegner,,7/7/2021,2021,7,7,188,,7/7/2021,,,,,,,,,,,,,,,,,United States,Iowa,Scott,,,,41.537828,90.645823,,,,,,,,,,,,,,,,,VeroCerv18,7/9/2021 8:32,http://creativecommons.org/licenses/by-nc/4.0/,Augustana College,,urn:uuid:cf54d718-834d-4aa3-8094-2c35c9ce4f4a,https://scan-bugs.org:443/portal/collections/individual/index.php?occid=57328972
57328973,AUGIE,ENT,,120bf21c-d066-48ee-b4c0-880596ea22e4,PreservedSpecimen,525331fb-8164-40de-89b3-5da4f15b7832,AUGIEENTB0000070,,Animalia,Arthropoda,Insecta,Coleoptera,Coccinellidae,Cycloneda munda,25911,,Cycloneda,munda,,,J. Hughes,7/9/2021,,,,,,J. Hughes,,7/7/2021,2021,7,7,188,,,,,,,,,,,,,,,,,,,United States,IA,Scott,,,,41.57847,90.61787,,,,,,,,,,,,,,,,,marissagorsegner,7/9/2021 8:33,http://creativecommons.org/licenses/by-nc/4.0/,Augustana College,,urn:uuid:525331fb-8164-40de-89b3-5da4f15b7832,https://scan-bugs.org:443/portal/collections/individual/index.php?occid=57328973
57328974,AUGIE,ENT,,120bf21c-d066-48ee-b4c0-880596ea22e4,PreservedSpecimen,053c7973-c253-4a75-8044-dff77b54d0a3,AUGIEENTB0000083,,Animalia,Arthropoda,Insecta,Coleoptera,Coccinellidae,Hippodamia parenthesis,27400,,Hippodamia,parenthesis,,,Olivia Ruffatto,7/9/2021,,,,,,V. Cervantes,,7/7/2021,2021,7,7,188,,7/7/2021,,,,,,,,,,,,,,,,,United States,Iowa,Scott,,,,41.537828,90.645823,,,,,,,,,,,,,,,,,VeroCerv18,7/9/2021 8:34,http://creativecommons.org/licenses/by-nc/4.0/,Augustana College,,urn:uuid:053c7973-c253-4a75-8044-dff77b54d0a3,https://scan-bugs.org:443/portal/collections/individual/index.php?occid=57328974
57328975,AUGIE,ENT,,120bf21c-d066-48ee-b4c0-880596ea22e4,PreservedSpecimen,c28907e6-3b81-4fe4-9f9e-3088803830c7,AUGIEENTB0000090,,Animalia,Arthropoda,Insecta,Coleoptera,Coccinellidae,Cycloneda munda,25911,,Cycloneda,munda,,,J. Hughes,7/9/2021,,,,,,M. Gorsegner,,7/7/2021,2021,7,7,188,,,,,,,,,,,,,,,,,,,United States,IA,Scott,,,,41.57847,90.61787,,,,,,,,,,,,,,,,,marissagorsegner,7/9/2021 8:37,http://creativecommons.org/licenses/by-nc/4.0/,Augustana College,,urn:uuid:c28907e6-3b81-4fe4-9f9e-3088803830c7,https://scan-bugs.org:443/portal/collections/individual/index.php?occid=57328975
57328976,AUGIE,ENT,,120bf21c-d066-48ee-b4c0-880596ea22e4,PreservedSpecimen,6deb65db-1b86-40fd-b8f8-4f0557223a60,AUGIEENTB0000084,,Animalia,Arthropoda,Insecta,Coleoptera,Coccinellidae,Cycloneda munda,25911,,Cycloneda,munda,,,Jack Hughes,7/9/2021,,,,,,V. Cervantes,,7/7/2021,2021,7,7,188,,7/7/2021,,,,,,,,,,,,,,,,,United States,Iowa,Scott,,,,41.56812,90.57119,,,,,,,,,,,,,,,,,VeroCerv18,8/19/2021 8:45,http://creativecommons.org/licenses/by-nc/4.0/,Augustana College,,urn:uuid:6deb65db-1b86-40fd-b8f8-4f0557223a60,https://scan-bugs.org:443/portal/collections/individual/index.php?occid=57328976
57328977,AUGIE,ENT,,120bf21c-d066-48ee-b4c0-880596ea22e4,PreservedSpecimen,5b49bea2-fa56-4dc7-8e74-b27f96406618,AUGIEENTB0000085,,Animalia,Arthropoda,Insecta,Coleoptera,Coccinellidae,Coleomegilla maculata,25547,,Coleomegilla,maculata,,,Olivia Ruffatto,7/9/2021,,,,,,M. Gorsegner,,7/7/2021,2021,7,7,188,,7/7/2021,,,,,,,,,,,,,,,,,United States,Iowa,Scott,,,,41.56812,90.57119,,,,,,,,,,,,,,,,,VeroCerv18,7/9/2021 8:39,http://creativecommons.org/licenses/by-nc/4.0/,Augustana College,,urn:uuid:5b49bea2-fa56-4dc7-8e74-b27f96406618,https://scan-bugs.org:443/portal/collections/individual/index.php?occid=57328977
57328978,AUGIE,ENT,,120bf21c-d066-48ee-b4c0-880596ea22e4,PreservedSpecimen,9df8812a-6c6a-40a5-a228-061c4930a019,AUGIEENTB0000091,,Animalia,Arthropoda,Insecta,Coleoptera,Coccinellidae,Cycloneda munda,25911,,Cycloneda,munda,,,J. Hughes,7/9/2021,,,,,,J. Hughes,,7/7/2021,2021,7,7,188,,,,,,,,,,,,,,,,,,,United States,IA,Scott,,,,41.57847,90.61787,,,,,,,,,,,,,,,,,marissagorsegner,7/9/2021 8:40,http://creativecommons.org/licenses/by-nc/4.0/,Augustana College,,urn:uuid:9df8812a-6c6a-40a5-a228-061c4930a019,https://scan-bugs.org:443/portal/collections/individual/index.php?occid=57328978
57328979,AUGIE,ENT,,120bf21c-d066-48ee-b4c0-880596ea22e4,PreservedSpecimen,98407b7c-1016-41ad-897d-23cc0c8a8f1a,AUGIEENTB0000086,,Animalia,Arthropoda,Insecta,Coleoptera,Coccinellidae,Propylea quatuordecimpunctata,613667,(Linneus 1758),Propylea,quatuordecimpunctata,,,Veronica Cervantes,8/11/2021,,,,,,Olivia Ruffatto,,7/7/2021,2021,7,7,188,,7/7/2021,,,,,,,,,,,,,,,,,United States,Iowa,Scott,,,,41.56812,90.57119,,,,,,,,,,,,,,,,,VeroCerv18,8/11/2021 11:45,http://creativecommons.org/licenses/by-nc/4.0/,Augustana College,,urn:uuid:98407b7c-1016-41ad-897d-23cc0c8a8f1a,https://scan-bugs.org:443/portal/collections/individual/index.php?occid=57328979
57328980,AUGIE,ENT,,120bf21c-d066-48ee-b4c0-880596ea22e4,PreservedSpecimen,e4b348e4-8f76-4c26-8ca3-5bf9034a6bc1,AUGIEENTB0000092,,Animalia,Arthropoda,Insecta,Coleoptera,Coccinellidae,Cycloneda munda,25911,,Cycloneda,munda,,,J. Hughes,7/9/2021,,,,,,O. Ruffatto,,7/7/2021,2021,7,7,188,,7/7/2021,,,,,,,,,,,,,,,,,United States,IA,Scott,,,,41.57847,90.61787,,,,,,,,,,,,,,,,,marissagorsegner,7/9/2021 8:42,http://creativecommons.org/licenses/by-nc/4.0/,Augustana College,,urn:uuid:e4b348e4-8f76-4c26-8ca3-5bf9034a6bc1,https://scan-bugs.org:443/portal/collections/individual/index.php?occid=57328980
57328981,AUGIE,ENT,,120bf21c-d066-48ee-b4c0-880596ea22e4,PreservedSpecimen,6211ac5f-95f6-4ba6-b6ab-79c88299d98b,AUGIEENTB0000087,,Animalia,Arthropoda,Insecta,Coleoptera,Coccinellidae,Cycloneda munda,25911,,Cycloneda,munda,,,Olivia Ruffatto,7/9/2021,,,,,,V. Cervantes,,7/7/2021,2021,7,7,188,,7/7/2021,,,,,,,,,,,,,,,,,United States,Iowa,Scott,,,,41.56812,90.57119,,,,,,,,,,,,,,,,,VeroCerv18,8/19/2021 8:46,http://creativecommons.org/licenses/by-nc/4.0/,Augustana College,,urn:uuid:6211ac5f-95f6-4ba6-b6ab-79c88299d98b,https://scan-bugs.org:443/portal/collections/individual/index.php?occid=57328981
57328982,AUGIE,ENT,,120bf21c-d066-48ee-b4c0-880596ea22e4,PreservedSpecimen,79a6800c-91bd-497a-947d-1894c5c341f7,AUGIEENTB0000093,,Animalia,Arthropoda,Insecta,Coleoptera,Coccinellidae,Coleomegilla maculata,25547,,Coleomegilla,maculata,,,J. Hughes,7/9/2021,,,,,,V. Cervantes,,7/7/2021,2021,7,7,188,,7/7/2021,,,,,,,,,,,,,,,,,United States,IA,Scott,,,,41.57847,90.61787,,,,,,,,,,,,,,,,,marissagorsegner,7/9/2021 8:44,http://creativecommons.org/licenses/by-nc/4.0/,Augustana College,,urn:uuid:79a6800c-91bd-497a-947d-1894c5c341f7,https://scan-bugs.org:443/portal/collections/individual/index.php?occid=57328982
57328983,AUGIE,ENT,,120bf21c-d066-48ee-b4c0-880596ea22e4,PreservedSpecimen,ffe8f3ed-ad29-453d-97d9-b484da3c0e50,AUGIEENTB0000088,,Animalia,Arthropoda,Insecta,Coleoptera,Coccinellidae,Harmonia axyridis,27230,"(Pallas, 1773)",Harmonia,axyridis,,,Olivia Ruffatto,7/9/2021,,,,,,M. Gorsegner,,7/7/2021,2021,7,7,188,,7/7/2021,,,,,,,,,,,,,,,,,United States,Iowa,Scott,,,,41.56812,90.57119,,,,,,,,,,,,,,,,,VeroCerv18,7/9/2021 8:45,http://creativecommons.org/licenses/by-nc/4.0/,Augustana College,,urn:uuid:ffe8f3ed-ad29-453d-97d9-b484da3c0e50,https://scan-bugs.org:443/portal/collections/individual/index.php?occid=57328983
57328984,AUGIE,ENT,,120bf21c-d066-48ee-b4c0-880596ea22e4,PreservedSpecimen,792b0047-58dc-4012-8194-1406af4476ad,AUGIEENTB0000094,,Animalia,Arthropoda,Insecta,Coleoptera,Coccinellidae,Coleomegilla maculata,25547,,Coleomegilla,maculata,,,J. Hughes,7/9/2021,,,,,,O. Ruffatto,,7/7/2021,2021,7,7,188,,7/7/2021,,,,,,,,,,,,,,,,,United States,IA,Scott,,,,41.57847,90.61787,,,,,,,,,,,,,,,,,marissagorsegner,7/9/2021 8:46,http://creativecommons.org/licenses/by-nc/4.0/,Augustana College,,urn:uuid:792b0047-58dc-4012-8194-1406af4476ad,https://scan-bugs.org:443/portal/collections/individual/index.php?occid=57328984
57328985,AUGIE,ENT,,120bf21c-d066-48ee-b4c0-880596ea22e4,PreservedSpecimen,f633c2eb-8c3d-4b81-a759-29844bd29d80,AUGIEENTB0000089,,Animalia,Arthropoda,Insecta,Coleoptera,Coccinellidae,Coleomegilla maculata,25547,,Coleomegilla,maculata,,,Olivia Ruffatto,7/9/2021,,,,,,Olivia Ruffatto,,7/7/2021,2021,7,7,188,,7/7/2021,,,,,,,,,,,,,,,,,United States,Iowa,Scott,,,,41.5677,90.52301,,,,,,,,,,,,,,,,,VeroCerv18,7/9/2021 8:48,http://creativecommons.org/licenses/by-nc/4.0/,Augustana College,,urn:uuid:f633c2eb-8c3d-4b81-a759-29844bd29d80,https://scan-bugs.org:443/portal/collections/individual/index.php?occid=57328985
57328986,AUGIE,ENT,,120bf21c-d066-48ee-b4c0-880596ea22e4,PreservedSpecimen,f146402b-06f2-4f09-8660-a01d304b3a66,AUGIEENTB0000096,,Animalia,Arthropoda,Insecta,Coleoptera,Coccinellidae,Coleomegilla maculata,25547,,Coleomegilla,maculata,,,Olivia Ruffatto,7/9/2021,,,,,,Jack Hughes,,7/7/2021,2021,7,7,188,,7/7/2021,,,,,,,,,,,,,,,,,United States,Iowa,Scott,,,,41.5677,90.52301,,,,,,,,,,,,,,,,,VeroCerv18,7/9/2021 8:49,http://creativecommons.org/licenses/by-nc/4.0/,Augustana College,,urn:uuid:f146402b-06f2-4f09-8660-a01d304b3a66,https://scan-bugs.org:443/portal/collections/individual/index.php?occid=57328986
57328987,AUGIE,ENT,,120bf21c-d066-48ee-b4c0-880596ea22e4,PreservedSpecimen,d19dc54d-d944-45a2-8e05-2e5336963871,AUGIEENTB0000095,,Animalia,Arthropoda,Insecta,Coleoptera,Coccinellidae,Coleomegilla maculata,25547,,Coleomegilla,maculata,,,M. Gorsegner,7/9/2021,,,,,,M. Gorsegner,,7/7/2021,2021,7,7,188,,7/7/2021,,,,,,,,,,,,,,,,,United States,IA,Scott,,,,41.57847,90.61787,,,,,,,,,,,,,,,,,marissagorsegner,7/9/2021 8:49,http://creativecommons.org/licenses/by-nc/4.0/,Augustana College,,urn:uuid:d19dc54d-d944-45a2-8e05-2e5336963871,https://scan-bugs.org:443/portal/collections/individual/index.php?occid=57328987
57328988,AUGIE,ENT,,120bf21c-d066-48ee-b4c0-880596ea22e4,PreservedSpecimen,2b5c75ac-884d-4fd8-9e6c-7a3f0b1ca2a0,AUGIEENTB0000097,,Animalia,Arthropoda,Insecta,Coleoptera,Coccinellidae,Coleomegilla maculata,25547,,Coleomegilla,maculata,,,Olivia Ruffatto,7/9/2021,,,,,,V. Cervantes,,7/7/2021,2021,7,7,188,,7/7/2021,,,,,,,,,,,,,,,,,United States,Iowa,Scott,,,,41.5677,90.52301,,,,,,,,,,,,,,,,,VeroCerv18,7/9/2021 8:51,http://creativecommons.org/licenses/by-nc/4.0/,Augustana College,,urn:uuid:2b5c75ac-884d-4fd8-9e6c-7a3f0b1ca2a0,https://scan-bugs.org:443/portal/collections/individual/index.php?occid=57328988
57328989,AUGIE,ENT,,120bf21c-d066-48ee-b4c0-880596ea22e4,PreservedSpecimen,833f3cad-501e-410e-b75e-81bffaa5d406,AUGIEENTB0000106,,Animalia,Arthropoda,Insecta,Coleoptera,Coccinellidae,Coleomegilla maculata,25547,,Coleomegilla,maculata,,,J. Hughes,7/9/2021,,,,,,V. Cervantes,,7/7/2021,2021,7,7,188,,7/7/2021,,,,,,,,,,,,,,,,,United States,IA,Scott,,,,41.57847,90.61787,,,,,,,,,,,,,,,,,marissagorsegner,7/9/2021 8:51,http://creativecommons.org/licenses/by-nc/4.0/,Augustana College,,urn:uuid:833f3cad-501e-410e-b75e-81bffaa5d406,https://scan-bugs.org:443/portal/collections/individual/index.php?occid=57328989
57328990,AUGIE,ENT,,120bf21c-d066-48ee-b4c0-880596ea22e4,PreservedSpecimen,d87d666c-a228-4474-a6af-1724951d9ddd,AUGIEENTB0000107,,Animalia,Arthropoda,Insecta,Coleoptera,Coccinellidae,Cycloneda munda,25911,,Cycloneda,munda,,,J. Hughes,7/9/2021,,,,,,V. Cervantes,,7/7/2021,2021,7,7,188,,7/7/2021,,,,,,,,,,,,,,,,,United States,IA,Scott,,,,41.57847,90.61787,,,,,,,,,,,,,,,,,marissagorsegner,7/9/2021 8:55,http://creativecommons.org/licenses/by-nc/4.0/,Augustana College,,urn:uuid:d87d666c-a228-4474-a6af-1724951d9ddd,https://scan-bugs.org:443/portal/collections/individual/index.php?occid=57328990
57328991,AUGIE,ENT,,120bf21c-d066-48ee-b4c0-880596ea22e4,PreservedSpecimen,3cf9afcb-93f7-41d1-aa3b-98782512c888,AUGIEENTB0000098,,Animalia,Arthropoda,Insecta,Coleoptera,Coccinellidae,Coleomegilla maculata,25547,,Coleomegilla,maculata,,,Olivia Ruffatto,7/9/2021,,,,,,Jack Hughes,,7/7/2021,2021,7,7,188,,7/7/2021,,,,,,,,,,,,,,,,,United States,Iowa,Scott,,,,41.544137,90.649164,,,,,,,,,,,,,,,,,VeroCerv18,7/9/2021 8:56,http://creativecommons.org/licenses/by-nc/4.0/,Augustana College,,urn:uuid:3cf9afcb-93f7-41d1-aa3b-98782512c888,https://scan-bugs.org:443/portal/collections/individual/index.php?occid=57328991
57328992,AUGIE,ENT,,120bf21c-d066-48ee-b4c0-880596ea22e4,PreservedSpecimen,07ecdc18-0321-4633-98ca-311bbf60ea7a,AUGIEENTB0000099,,Animalia,Arthropoda,Insecta,Coleoptera,Coccinellidae,Coleomegilla maculata,25547,,Coleomegilla,maculata,,,Olivia Ruffatto,7/9/2021,,,,,,M. Gorsegner,,7/7/2021,2021,7,7,188,,7/7/2021,,,,,,,,,,,,,,,,,United States,Iowa,Scott,,,,41.544137,90.649164,,,,,,,,,,,,,,,,,VeroCerv18,7/9/2021 8:57,http://creativecommons.org/licenses/by-nc/4.0/,Augustana College,,urn:uuid:07ecdc18-0321-4633-98ca-311bbf60ea7a,https://scan-bugs.org:443/portal/collections/individual/index.php?occid=57328992
57328993,AUGIE,ENT,,120bf21c-d066-48ee-b4c0-880596ea22e4,PreservedSpecimen,30533ad5-1109-42d3-8d36-1f9cb81e1fa7,AUGIEENTB0000108,,Animalia,Arthropoda,Insecta,Coleoptera,Coccinellidae,Cycloneda munda,25911,,Cycloneda,munda,,,J. Hughes,7/9/2021,,,,,,M. Gorsegner,,7/7/2021,2021,7,7,188,,,,,,,,,,,,,,,,,,,United States,IA,Scott,,,,41.57847,90.61787,,,,,,,,,,,,,,,,,marissagorsegner,7/9/2021 8:58,http://creativecommons.org/licenses/by-nc/4.0/,Augustana College,,urn:uuid:30533ad5-1109-42d3-8d36-1f9cb81e1fa7,https://scan-bugs.org:443/portal/collections/individual/index.php?occid=57328993
57328994,AUGIE,ENT,,120bf21c-d066-48ee-b4c0-880596ea22e4,PreservedSpecimen,d5014557-55ad-4da4-bbd5-b20281a2b710,AUGIEENTB0000100,,Animalia,Arthropoda,Insecta,Coleoptera,Coccinellidae,Coleomegilla maculata,25547,,Coleomegilla,maculata,,,Olivia Ruffatto,7/9/2021,,,,,,Olivia Ruffatto,,7/7/2021,2021,7,7,188,,7/7/2021,,,,,,,,,,,,,,,,,United States,Iowa,Scott,,,,41.544137,90.649164,,,,,,,,,,,,,,,,,VeroCerv18,7/9/2021 8:58,http://creativecommons.org/licenses/by-nc/4.0/,Augustana College,,urn:uuid:d5014557-55ad-4da4-bbd5-b20281a2b710,https://scan-bugs.org:443/portal/collections/individual/index.php?occid=57328994
57328995,AUGIE,ENT,,120bf21c-d066-48ee-b4c0-880596ea22e4,PreservedSpecimen,02faa553-69d2-493e-b3e9-ee026de19fa5,AUGIEENTB0000101,,Animalia,Arthropoda,Insecta,Coleoptera,Coccinellidae,Coleomegilla maculata,25547,,Coleomegilla,maculata,,,Olivia Ruffatto,7/9/2021,,,,,,V. Cervantes,,7/7/2021,2021,7,7,188,,7/7/2021,,,,,,,,,,,,,,,,,United States,Iowa,Scott,,,,41.544137,90.649164,,,,,,,,,,,,,,,,,VeroCerv18,7/9/2021 8:59,http://creativecommons.org/licenses/by-nc/4.0/,Augustana College,,urn:uuid:02faa553-69d2-493e-b3e9-ee026de19fa5,https://scan-bugs.org:443/portal/collections/individual/index.php?occid=57328995
57328996,AUGIE,ENT,,120bf21c-d066-48ee-b4c0-880596ea22e4,PreservedSpecimen,4d84c5b9-5512-4bf4-8ede-e2c81388d8c1,AUGIEENTB0000109,,Animalia,Arthropoda,Insecta,Coleoptera,Coccinellidae,Coleomegilla maculata,25547,,Coleomegilla,maculata,,,M. Gorsegner,7/9/2021,,,,,,O. Ruffatto,,7/7/2021,2021,7,7,188,,,,,,,,,,,,,,,,,,,United States,IA,Scott,,,,41.57847,90.61787,,,,,,,,,,,,,,,,,marissagorsegner,8/19/2021 12:31,http://creativecommons.org/licenses/by-nc/4.0/,Augustana College,,urn:uuid:4d84c5b9-5512-4bf4-8ede-e2c81388d8c1,https://scan-bugs.org:443/portal/collections/individual/index.php?occid=57328996
57328997,AUGIE,ENT,,120bf21c-d066-48ee-b4c0-880596ea22e4,PreservedSpecimen,679af2b5-4ef1-4bb2-b91a-7cd762e88feb,AUGIEENTB0000102,,Animalia,Arthropoda,Insecta,Coleoptera,Coccinellidae,Cycloneda munda,25911,,Cycloneda,munda,,,Olivia Ruffatto,7/9/2021,,,,,,Jack Hughes,,7/7/2021,2021,7,7,188,,7/7/2021,,,,,,,,,,,,,,,,,United States,Iowa,Scott,,,,41.50609,90.73943,,,,,,,,,,,,,,,,,VeroCerv18,8/11/2021 11:47,http://creativecommons.org/licenses/by-nc/4.0/,Augustana College,,urn:uuid:679af2b5-4ef1-4bb2-b91a-7cd762e88feb,https://scan-bugs.org:443/portal/collections/individual/index.php?occid=57328997
57328999,AUGIE,ENT,,120bf21c-d066-48ee-b4c0-880596ea22e4,PreservedSpecimen,36124d31-b3c1-45a5-8321-80b89ae7fcd1,AUGIEENTB0000110,,Animalia,Arthropoda,Insecta,Coleoptera,Coccinellidae,Coleomegilla maculata,25547,,Coleomegilla,maculata,,,M. Gorsegner,7/9/2021,,,,,,J. Hughes,,7/7/2021,2021,7,7,188,,,,,,,,,,,,,,,,,,,United States,IA,Scott,,,,41.57847,90.61787,,,,,,,,,,,,,,,,,marissagorsegner,8/19/2021 12:31,http://creativecommons.org/licenses/by-nc/4.0/,Augustana College,,urn:uuid:36124d31-b3c1-45a5-8321-80b89ae7fcd1,https://scan-bugs.org:443/portal/collections/individual/index.php?occid=57328999
57329000,AUGIE,ENT,,120bf21c-d066-48ee-b4c0-880596ea22e4,PreservedSpecimen,d439f42f-4df6-4e8b-ac36-c63e7ea2d27d,AUGIEENTB0000104,,Animalia,Arthropoda,Insecta,Coleoptera,Coccinellidae,Coleomegilla maculata,25547,,Coleomegilla,maculata,,,Veronica Cervantes,7/9/2021,,,,,,Olivia Ruffatto,,7/7/2021,2021,7,7,188,,,,,,,,,,,,,,,,,,,United States,Iowa,Scott,,,,41.550606,90.62248,,,,,,,,,,,,,,,,,VeroCerv18,7/9/2021 9:08,http://creativecommons.org/licenses/by-nc/4.0/,Augustana College,,urn:uuid:d439f42f-4df6-4e8b-ac36-c63e7ea2d27d,https://scan-bugs.org:443/portal/collections/individual/index.php?occid=57329000
57329001,AUGIE,ENT,,120bf21c-d066-48ee-b4c0-880596ea22e4,PreservedSpecimen,6aff8bb5-aa4e-4b1f-ad19-7706efc390bb,AUGIEENTB0000111,,Animalia,Arthropoda,Insecta,Coleoptera,Coccinellidae,Coleomegilla maculata,25547,,Coleomegilla,maculata,,,M. Gorsegner,7/9/2021,,,,,,O. Ruffatto,,7/7/2021,2021,7,7,188,,,,,,,,,,,,,,,,,,,United States,IA,Scott,,,,41.57847,90.61787,,,,,,,,,,,,,,,,,marissagorsegner,7/9/2021 9:09,http://creativecommons.org/licenses/by-nc/4.0/,Augustana College,,urn:uuid:6aff8bb5-aa4e-4b1f-ad19-7706efc390bb,https://scan-bugs.org:443/portal/collections/individual/index.php?occid=57329001
57329002,AUGIE,ENT,,120bf21c-d066-48ee-b4c0-880596ea22e4,PreservedSpecimen,2b42c73c-8901-45ae-809c-2ec8cd287a69,AUGIEENTB0000105,,Animalia,Arthropoda,Insecta,Coleoptera,Coccinellidae,Psyllobora vigintimaculata,31188,,Psyllobora,vigintimaculata,,,Veronica Cervantes,8/11/2021,,,,,,M. Gorsegner,,7/7/2021,2021,7,7,188,,,,,,,,,,,,,,,,,,,United States,Iowa,Scott,,,,41.435905,90.501557,,,,,,,,,,,,,,,,,VeroCerv18,8/11/2021 11:55,http://creativecommons.org/licenses/by-nc/4.0/,Augustana College,,urn:uuid:2b42c73c-8901-45ae-809c-2ec8cd287a69,https://scan-bugs.org:443/portal/collections/individual/index.php?occid=57329002
57329003,AUGIE,ENT,,120bf21c-d066-48ee-b4c0-880596ea22e4,PreservedSpecimen,0fe7bac0-b3ce-4a74-98bf-4c44fc4b57a8,AUGIEENTB0000112,,Animalia,Arthropoda,Insecta,Coleoptera,Coccinellidae,Coleomegilla maculata,25547,,Coleomegilla,maculata,,,M. Gorsegner,7/9/2021,,,,,,J. Hughes,,7/7/2021,2021,7,7,188,,7/7/2021,,,,,,,,,,,,,,,,,United States,IA,Scott,,,,41.57847,90.61787,,,,,,,,,,,,,,,,,marissagorsegner,7/9/2021 9:12,http://creativecommons.org/licenses/by-nc/4.0/,Augustana College,,urn:uuid:0fe7bac0-b3ce-4a74-98bf-4c44fc4b57a8,https://scan-bugs.org:443/portal/collections/individual/index.php?occid=57329003
57329004,AUGIE,ENT,,120bf21c-d066-48ee-b4c0-880596ea22e4,PreservedSpecimen,1488f1aa-7e7e-4346-8431-31d2b6ec5f35,AUGIEENTB0000113,,Animalia,Arthropoda,Insecta,Coleoptera,Coccinellidae,Cycloneda munda,25911,,Cycloneda,munda,,,J. Hughes,7/9/2021,,,,,,O. Ruffatto,,7/7/2021,2021,7,7,188,,7/7/2021,,,,,,,,,,,,,,,,,United States,Ia,Scott,,,,41.57847,90.61787,,,,,,,,,,,,,,,,,marissagorsegner,7/9/2021 9:14,http://creativecommons.org/licenses/by-nc/4.0/,Augustana College,,urn:uuid:1488f1aa-7e7e-4346-8431-31d2b6ec5f35,https://scan-bugs.org:443/portal/collections/individual/index.php?occid=57329004
57329005,AUGIE,ENT,,120bf21c-d066-48ee-b4c0-880596ea22e4,PreservedSpecimen,7940d519-9e99-4e10-a5aa-cbf2dcc973d4,AUGIEENTB0000114,,Animalia,Arthropoda,Insecta,Coleoptera,Coccinellidae,Coleomegilla maculata,25547,,Coleomegilla,maculata,,,M. Gorsegner,7/9/2021,,,,,,M. Gorsegner,,7/7/2021,2021,7,7,188,,7/7/2021,,,,,,,,,,,,,,,,,United States,IA,Scott,,,,41.57847,90.61787,,,,,,,,,,,,,,,,,marissagorsegner,7/9/2021 9:16,http://creativecommons.org/licenses/by-nc/4.0/,Augustana College,,urn:uuid:7940d519-9e99-4e10-a5aa-cbf2dcc973d4,https://scan-bugs.org:443/portal/collections/individual/index.php?occid=57329005
57333108,AUGIE,ENT,,120bf21c-d066-48ee-b4c0-880596ea22e4,PreservedSpecimen,52569e53-b1fe-4346-8ada-854943c99e0a,AUGIEENTB0000115,,Animalia,Arthropoda,Insecta,Coleoptera,Coccinellidae,Hippodamia variegata,27405,"(Goeze, 1777)",Hippodamia,variegata,,,Veronica Cervantes,8/16/2021,,,,,,Olivia Ruffatto,,7/7/2021,2021,7,7,188,,,,,,,,,,,,,,,,,,,United States,Iowa,Scott,,,,41.556505,90.57834,,,,,,,,,,,,,,,,,VeroCerv18,8/19/2021 12:52,http://creativecommons.org/licenses/by-nc/4.0/,Augustana College,,urn:uuid:52569e53-b1fe-4346-8ada-854943c99e0a,https://scan-bugs.org:443/portal/collections/individual/index.php?occid=57333108
57333109,AUGIE,ENT,,120bf21c-d066-48ee-b4c0-880596ea22e4,PreservedSpecimen,bb5a44e3-fa59-4375-a2df-c08f032e0de3,AUGIEENTB0000116,,Animalia,Arthropoda,Insecta,Coleoptera,Coccinellidae,Coleomegilla maculata,25547,,Coleomegilla,maculata,,,M. Gorsegner,7/9/2021,,,,,,V. Cervantes,,7/7/2021,2021,7,7,188,,,,,,,,,,,,,,,,,,,United States,Iowa,Scott,,,,41.556505,90.57834,,,,,,,,,,,,,,,,,VeroCerv18,8/19/2021 12:52,http://creativecommons.org/licenses/by-nc/4.0/,Augustana College,,urn:uuid:bb5a44e3-fa59-4375-a2df-c08f032e0de3,https://scan-bugs.org:443/portal/collections/individual/index.php?occid=57333109
57333110,AUGIE,ENT,,120bf21c-d066-48ee-b4c0-880596ea22e4,PreservedSpecimen,1b6c2847-a23e-4672-8a5b-bf449b8ca1c3,AUGIEENTB0000117,,Animalia,Arthropoda,Insecta,Coleoptera,Coccinellidae,Hippodamia variegata,27405,"(Goeze, 1777)",Hippodamia,variegata,,,Veronica Cervantes,8/11/2021,,,,,,M. Gorsegner,,7/7/2021,2021,7,7,188,,,,,,,,,,,,,,,,,,,United States,Iowa,Scott,,,,41.556505,90.57834,,,,,,,,,,,,,,,,,VeroCerv18,8/19/2021 12:53,http://creativecommons.org/licenses/by-nc/4.0/,Augustana College,,urn:uuid:1b6c2847-a23e-4672-8a5b-bf449b8ca1c3,https://scan-bugs.org:443/portal/collections/individual/index.php?occid=57333110
57333514,AUGIE,ENT,,120bf21c-d066-48ee-b4c0-880596ea22e4,PreservedSpecimen,91dbe92d-b7a7-4402-ba94-a492302565e6,AUGIEENTB0000118,,Animalia,Arthropoda,Insecta,Coleoptera,Coccinellidae,Coleomegilla maculata,25547,,Coleomegilla,maculata,,,Marissa Gorsegner,7/12/2021,,,,,,V. Cervantes,,7/8/2021,2021,7,8,189,,7/8/2021,,,,,,,,,,,,,,,,,United States,IL,Rock Island,,,,41.469869,90.506684,,,,,,,,,,,,,,,,,marissagorsegner,7/12/2021 7:24,http://creativecommons.org/licenses/by-nc/4.0/,Augustana College,,urn:uuid:91dbe92d-b7a7-4402-ba94-a492302565e6,https://scan-bugs.org:443/portal/collections/individual/index.php?occid=57333514
57333518,AUGIE,ENT,,120bf21c-d066-48ee-b4c0-880596ea22e4,PreservedSpecimen,044b8adf-0d6a-4f54-b7f3-e2b37eb90c49,AUGIEENTB0000119,,Animalia,Arthropoda,Insecta,Coleoptera,Coccinellidae,Coleomegilla maculata,25547,,Coleomegilla,maculata,,,Marissa Gorsegner,7/12/2021,,,,,,M. Gorsegner,,7/8/2021,2021,7,8,189,,7/8/2021,,,,,,,,,,,,,,,,,United States,IL,Rock Island,,,,41.531584,90.414653,,,,,,,,,,,,,,,,,marissagorsegner,7/12/2021 7:25,http://creativecommons.org/licenses/by-nc/4.0/,Augustana College,,urn:uuid:044b8adf-0d6a-4f54-b7f3-e2b37eb90c49,https://scan-bugs.org:443/portal/collections/individual/index.php?occid=57333518
57333521,AUGIE,ENT,,120bf21c-d066-48ee-b4c0-880596ea22e4,PreservedSpecimen,422a96c3-ed7c-4633-a12e-5ed6f820145e,AUGIEENTB0000120,,Animalia,Arthropoda,Insecta,Coleoptera,Coccinellidae,Coleomegilla maculata,25547,,Coleomegilla,maculata,,,Marissa Gorsegner,7/12/2021,,,,,,Jack Hughes,,7/8/2021,2021,7,8,189,,7/8/2021,,,,,,,,,,,,,,,,,United States,IL,Rock Island,,,,41.531584,90.414653,,,,,,,,,,,,,,,,,marissagorsegner,7/12/2021 7:25,http://creativecommons.org/licenses/by-nc/4.0/,Augustana College,,urn:uuid:422a96c3-ed7c-4633-a12e-5ed6f820145e,https://scan-bugs.org:443/portal/collections/individual/index.php?occid=57333521
57333523,AUGIE,ENT,,120bf21c-d066-48ee-b4c0-880596ea22e4,PreservedSpecimen,2e4fc586-c56f-4644-b706-9c3bb01eedc7,AUGIEENTB0000121,,Animalia,Arthropoda,Insecta,Coleoptera,Coccinellidae,Coleomegilla maculata,25547,,Coleomegilla,maculata,,,Marissa Gorsegner,7/12/2021,,,,,,Olivia Ruffatto,,7/8/2021,2021,7,8,189,,7/8/2021,,,,,,,,,,,,,,,,,United States,IL,Rock Island,,,,41.531584,90.414653,,,,,,,,,,,,,,,,,marissagorsegner,7/12/2021 7:25,http://creativecommons.org/licenses/by-nc/4.0/,Augustana College,,urn:uuid:2e4fc586-c56f-4644-b706-9c3bb01eedc7,https://scan-bugs.org:443/portal/collections/individual/index.php?occid=57333523
57333527,AUGIE,ENT,,120bf21c-d066-48ee-b4c0-880596ea22e4,PreservedSpecimen,1be377c0-aded-4f3e-94be-1cb350c8ee95,AUGIEENTB0000122,,Animalia,Arthropoda,Insecta,Coleoptera,Coccinellidae,Coleomegilla maculata,25547,,Coleomegilla,maculata,,,Marissa Gorsegner,7/12/2021,,,,,,V. Cervantes,,7/8/2021,2021,7,8,189,,7/8/2021,,,,,,,,,,,,,,,,,United States,IL,Rock Island,,,,41.531584,90.414653,,,,,,,,,,,,,,,,,marissagorsegner,7/12/2021 7:27,http://creativecommons.org/licenses/by-nc/4.0/,Augustana College,,urn:uuid:1be377c0-aded-4f3e-94be-1cb350c8ee95,https://scan-bugs.org:443/portal/collections/individual/index.php?occid=57333527
57333531,AUGIE,ENT,,120bf21c-d066-48ee-b4c0-880596ea22e4,PreservedSpecimen,3d96f83b-4eb3-4d19-bbd9-4f56b1347a1b,AUGIEENTB0000123,,Animalia,Arthropoda,Insecta,Coleoptera,Coccinellidae,Coleomegilla maculata,25547,,Coleomegilla,maculata,,,Marissa Gorsegner,7/12/2021,,,,,,V. Cervantes,,7/8/2021,2021,7,8,189,,7/8/2021,,,,,,,,,,,,,,,,,United States,IL,Rock Island,,,,41.428138,90.508097,,,,,,,,,,,,,,,,,marissagorsegner,7/12/2021 7:27,http://creativecommons.org/licenses/by-nc/4.0/,Augustana College,,urn:uuid:3d96f83b-4eb3-4d19-bbd9-4f56b1347a1b,https://scan-bugs.org:443/portal/collections/individual/index.php?occid=57333531
57333532,AUGIE,ENT,,120bf21c-d066-48ee-b4c0-880596ea22e4,PreservedSpecimen,40038f47-db9e-46a3-a49f-58e7684ab88b,AUGIEENTB0000124,,Animalia,Arthropoda,Insecta,Coleoptera,Coccinellidae,Cycloneda munda,25911,,Cycloneda,munda,,,Marissa Gorsegner,7/12/2021,,,,,,M. Gorsegner,,7/8/2021,2021,7,8,189,,7/8/2021,,,,,,,,,,,,,,,,,United States,IL,Rock Island,,,,41.428138,90.508097,,,,,,,,,,,,,,,,,marissagorsegner,7/12/2021 7:27,http://creativecommons.org/licenses/by-nc/4.0/,Augustana College,,urn:uuid:40038f47-db9e-46a3-a49f-58e7684ab88b,https://scan-bugs.org:443/portal/collections/individual/index.php?occid=57333532
57333534,AUGIE,ENT,,120bf21c-d066-48ee-b4c0-880596ea22e4,PreservedSpecimen,92aecaf2-26db-4c43-baed-424c275e870f,AUGIEENTB0000125,,Animalia,Arthropoda,Insecta,Coleoptera,Coccinellidae,Coleomegilla maculata,25547,,Coleomegilla,maculata,,,Marissa Gorsegner,7/12/2021,,,,,,Olivia Ruffatto,,7/8/2021,2021,7,8,189,,7/8/2021,,,,,,,,,,,,,,,,,United States,IL,Rock Island,,,,41.428138,90.508097,,,,,,,,,,,,,,,,,marissagorsegner,7/12/2021 7:28,http://creativecommons.org/licenses/by-nc/4.0/,Augustana College,,urn:uuid:92aecaf2-26db-4c43-baed-424c275e870f,https://scan-bugs.org:443/portal/collections/individual/index.php?occid=57333534
57333535,AUGIE,ENT,,120bf21c-d066-48ee-b4c0-880596ea22e4,PreservedSpecimen,75864ebb-dbf5-4794-9ba4-40d3b7b5af5f,AUGIEENTB0000126,,Animalia,Arthropoda,Insecta,Coleoptera,Coccinellidae,Coleomegilla maculata,25547,,Coleomegilla,maculata,,,Marissa Gorsegner,7/12/2021,,,,,,Jack Hughes,,7/8/2021,2021,7,8,189,,7/8/2021,,,,,,,,,,,,,,,,,United States,IL,Rock Island,,,,41.428138,90.508097,,,,,,,,,,,,,,,,,marissagorsegner,7/12/2021 7:28,http://creativecommons.org/licenses/by-nc/4.0/,Augustana College,,urn:uuid:75864ebb-dbf5-4794-9ba4-40d3b7b5af5f,https://scan-bugs.org:443/portal/collections/individual/index.php?occid=57333535
57333536,AUGIE,ENT,,120bf21c-d066-48ee-b4c0-880596ea22e4,PreservedSpecimen,d71799ff-8df7-4131-ab52-e0550f0fb0dd,AUGIEENTB0000127,,Animalia,Arthropoda,Insecta,Coleoptera,Coccinellidae,Propylea quatuordecimpunctata,613667,(Linneus 1758),Propylea,quatuordecimpunctata,,,Veronica Cervantes,8/11/2021,,,,,,Jack Hughes,,7/8/2021,2021,7,8,189,,7/8/2021,,,,,,,,,,,,,,,,,United States,IL,Rock Island,,,,41.428138,90.508097,,,,,,,,,,,,,,,,,marissagorsegner,8/11/2021 11:57,http://creativecommons.org/licenses/by-nc/4.0/,Augustana College,,urn:uuid:d71799ff-8df7-4131-ab52-e0550f0fb0dd,https://scan-bugs.org:443/portal/collections/individual/index.php?occid=57333536
57333539,AUGIE,ENT,,120bf21c-d066-48ee-b4c0-880596ea22e4,PreservedSpecimen,5709610c-c439-4d10-aaa2-b049a20c51f4,AUGIEENTB0000129,,Animalia,Arthropoda,Insecta,Coleoptera,Coccinellidae,Coleomegilla maculata,25547,,Coleomegilla,maculata,,,Marissa Gorsegner,7/12/2021,,,,,,V. Cervantes,,7/8/2021,2021,7,8,189,,7/8/2021,,,,,,,,,,,,,,,,,United States,IL,Rock Island,,,,41.428138,90.508097,,,,,,,,,,,,,,,,,marissagorsegner,7/12/2021 7:39,http://creativecommons.org/licenses/by-nc/4.0/,Augustana College,,urn:uuid:5709610c-c439-4d10-aaa2-b049a20c51f4,https://scan-bugs.org:443/portal/collections/individual/index.php?occid=57333539
57333540,AUGIE,ENT,,120bf21c-d066-48ee-b4c0-880596ea22e4,PreservedSpecimen,89cac7db-31aa-45b4-906f-5f2b060e7123,AUGIEENTB0000130,,Animalia,Arthropoda,Insecta,Coleoptera,Coccinellidae,Coleomegilla maculata,25547,,Coleomegilla,maculata,,,Marissa Gorsegner,7/12/2021,,,,,,Olivia Ruffatto,,7/8/2021,2021,7,8,189,,7/8/2021,,,,,,,,,,,,,,,,,United States,IL,Rock Island,,,,41.428138,90.508097,,,,,,,,,,,,,,,,,marissagorsegner,7/12/2021 7:40,http://creativecommons.org/licenses/by-nc/4.0/,Augustana College,,urn:uuid:89cac7db-31aa-45b4-906f-5f2b060e7123,https://scan-bugs.org:443/portal/collections/individual/index.php?occid=57333540
57333542,AUGIE,ENT,,120bf21c-d066-48ee-b4c0-880596ea22e4,PreservedSpecimen,0d1ba135-fdf8-43c2-bb2f-b62de6604c4a,AUGIEENTB0000131,,Animalia,Arthropoda,Insecta,Coleoptera,Coccinellidae,Coleomegilla maculata,25547,,Coleomegilla,maculata,,,Marissa Gorsegner,7/12/2021,,,,,,Olivia Ruffatto,,7/8/2021,2021,7,8,189,,7/8/2021,,,,,,,,,,,,,,,,,United States,IL,Rock Island,,,,41.428138,90.508097,,,,,,,,,,,,,,,,,marissagorsegner,7/12/2021 7:44,http://creativecommons.org/licenses/by-nc/4.0/,Augustana College,,urn:uuid:0d1ba135-fdf8-43c2-bb2f-b62de6604c4a,https://scan-bugs.org:443/portal/collections/individual/index.php?occid=57333542
57333543,AUGIE,ENT,,120bf21c-d066-48ee-b4c0-880596ea22e4,PreservedSpecimen,8d92c69f-1d09-4160-bfb6-2161c67363a6,AUGIEENTB0000132,,Animalia,Arthropoda,Insecta,Coleoptera,Coccinellidae,Coleomegilla maculata,25547,,Coleomegilla,maculata,,,Marissa Gorsegner,7/12/2021,,,,,,Jack Hughes,,7/8/2021,2021,7,8,189,,7/8/2021,,,,,,,,,,,,,,,,,United States,IL,Rock Island,,,,41.428138,90.508097,,,,,,,,,,,,,,,,,marissagorsegner,7/12/2021 7:47,http://creativecommons.org/licenses/by-nc/4.0/,Augustana College,,urn:uuid:8d92c69f-1d09-4160-bfb6-2161c67363a6,https://scan-bugs.org:443/portal/collections/individual/index.php?occid=57333543
57333546,AUGIE,ENT,,120bf21c-d066-48ee-b4c0-880596ea22e4,PreservedSpecimen,15e7c6e4-80ff-4233-84b3-58dc4f315e47,AUGIEENTB0000133,,Animalia,Arthropoda,Insecta,Coleoptera,Coccinellidae,Coleomegilla maculata,25547,,Coleomegilla,maculata,,,Marissa Gorsegner,7/12/2021,,,,,,,,7/8/2021,2021,7,8,189,,7/8/2021,,,,,,,,,,,,,,,,,United States,IL,Rock Island,,,,41.463906,90.537662,,,,,,,,,,,,,,,,,marissagorsegner,7/12/2021 8:00,http://creativecommons.org/licenses/by-nc/4.0/,Augustana College,,urn:uuid:15e7c6e4-80ff-4233-84b3-58dc4f315e47,https://scan-bugs.org:443/portal/collections/individual/index.php?occid=57333546
57333551,AUGIE,ENT,,120bf21c-d066-48ee-b4c0-880596ea22e4,PreservedSpecimen,0a433d52-c1d9-4580-87d2-6ccf05623a34,AUGIEENTB0000134,,Animalia,Arthropoda,Insecta,Coleoptera,Coccinellidae,Harmonia axyridis,27230,"(Pallas, 1773)",Harmonia,axyridis,,,Marissa Gorsegner,7/12/2021,,,,,,M. Gorsegner,,7/8/2021,2021,7,8,189,,7/8/2021,,,,,,,,,,,,,,,,,United States,IL,Rock Island,,,,41.463906,90.537662,,,,,,,,,,,,,,,,,marissagorsegner,7/14/2021 6:47,http://creativecommons.org/licenses/by-nc/4.0/,Augustana College,,urn:uuid:0a433d52-c1d9-4580-87d2-6ccf05623a34,https://scan-bugs.org:443/portal/collections/individual/index.php?occid=57333551
57333556,AUGIE,ENT,,120bf21c-d066-48ee-b4c0-880596ea22e4,PreservedSpecimen,4fa580b1-db59-4a45-9acb-4da1af72e92b,AUGIEENTB0000135,,Animalia,Arthropoda,Insecta,Coleoptera,Coccinellidae,Hippodamia parenthesis,27400,,Hippodamia,parenthesis,,,Olivia Ruffatto,7/12/2021,,,,,,Jack Hughes,,7/8/2021,2021,7,8,189,,7/8/2021,,,,,,,,,,,,,,,,,United States,IL,Rock Island,,,,41.520413,90.439069,,,,,,,,,,,,,,,,,marissagorsegner,7/12/2021 8:14,http://creativecommons.org/licenses/by-nc/4.0/,Augustana College,,urn:uuid:4fa580b1-db59-4a45-9acb-4da1af72e92b,https://scan-bugs.org:443/portal/collections/individual/index.php?occid=57333556
57333558,AUGIE,ENT,,120bf21c-d066-48ee-b4c0-880596ea22e4,PreservedSpecimen,7afeb3c5-7900-43a4-aa5b-b6a759e7744a,AUGIEENTB0000136,,Animalia,Arthropoda,Insecta,Coleoptera,Coccinellidae,Cycloneda munda,25911,,Cycloneda,munda,,,Marissa Gorsegner,7/12/2021,,,,,,V. Cervantes,,7/8/2021,2021,7,8,189,,7/8/2021,,,,,,,,,,,,,,,,,United States,IL,Rock Island,,,,41.520413,90.439069,,,,,,,,,,,,,,,,,marissagorsegner,7/12/2021 8:18,http://creativecommons.org/licenses/by-nc/4.0/,Augustana College,,urn:uuid:7afeb3c5-7900-43a4-aa5b-b6a759e7744a,https://scan-bugs.org:443/portal/collections/individual/index.php?occid=57333558
57333561,AUGIE,ENT,,120bf21c-d066-48ee-b4c0-880596ea22e4,PreservedSpecimen,25c5fab2-b7f1-48d0-8fb0-96e2e466c911,AUGIEENTB0000137,,Animalia,Arthropoda,Insecta,Coleoptera,Coccinellidae,Cycloneda munda,25911,,Cycloneda,munda,,,Marissa Gorsegner,7/12/2021,,,,,,M. Gorsegner,,7/8/2021,2021,7,8,189,,7/8/2021,,,,,,,,,,,,,,,,,United States,IL,Rock Island,,,,41.47252,90.473754,,,,,,,,,,,,,,,,,marissagorsegner,7/12/2021 8:21,http://creativecommons.org/licenses/by-nc/4.0/,Augustana College,,urn:uuid:25c5fab2-b7f1-48d0-8fb0-96e2e466c911,https://scan-bugs.org:443/portal/collections/individual/index.php?occid=57333561
57333563,AUGIE,ENT,,120bf21c-d066-48ee-b4c0-880596ea22e4,PreservedSpecimen,ab8ee2e5-133a-4e86-9458-633f76ce68a7,"Cycloneda munda	AUGIEENTB0000141",,Animalia,Arthropoda,Insecta,Coleoptera,Coccinellidae,Chilocorus stigma,25164,,Chilocorus,stigma,,,Marissa Gorsegner,7/12/2021,,,,,,M. Gorsegner,,7/8/2021,2021,7,8,189,,7/8/2021,,,,,,,,,,,,,,,,,United States,IL,Rock Island,,,,41.47252,90.473754,,,,,,,,,,,,,,,,,marissagorsegner,8/19/2021 8:54,http://creativecommons.org/licenses/by-nc/4.0/,Augustana College,,urn:uuid:ab8ee2e5-133a-4e86-9458-633f76ce68a7,https://scan-bugs.org:443/portal/collections/individual/index.php?occid=57333563
57333568,AUGIE,ENT,,120bf21c-d066-48ee-b4c0-880596ea22e4,PreservedSpecimen,ad64ac25-ad4d-45f5-ab4a-b10f2f941bcc,AUGIEENTB0000139,,Animalia,Arthropoda,Insecta,Coleoptera,Coccinellidae,Brachiacantha ursina,24421,,Brachiacantha,ursina,,,Veronica Cervantes,8/11/2021,,,,,,Jack Hughes,,7/8/2021,2021,7,8,189,,7/8/2021,,,,,,,,,,,,,,,,,United States,IL,Rock Island,,,,41.47252,90.473754,,,,,,,,,,,,,,,,,marissagorsegner,8/11/2021 11:57,http://creativecommons.org/licenses/by-nc/4.0/,Augustana College,,urn:uuid:ad64ac25-ad4d-45f5-ab4a-b10f2f941bcc,https://scan-bugs.org:443/portal/collections/individual/index.php?occid=57333568
57333570,AUGIE,ENT,,120bf21c-d066-48ee-b4c0-880596ea22e4,PreservedSpecimen,f8869115-590d-4881-813e-ecfcd6df9c01,AUGIEENTB0000140,,Animalia,Arthropoda,Insecta,Coleoptera,Coccinellidae,Psyllobora vigintimaculata,31188,,Psyllobora,vigintimaculata,,,Veronica Cervantes,8/11/2021,,,,,,Olivia Ruffatto,,7/8/2021,2021,7,8,189,,7/8/2021,,,,,,,,,,,,,,,,,United States,IL,Rock Island,,,,41.47252,90.473754,,,,,,,,,,,,,,,,,marissagorsegner,8/11/2021 11:58,http://creativecommons.org/licenses/by-nc/4.0/,Augustana College,,urn:uuid:f8869115-590d-4881-813e-ecfcd6df9c01,https://scan-bugs.org:443/portal/collections/individual/index.php?occid=57333570
57333571,AUGIE,ENT,,120bf21c-d066-48ee-b4c0-880596ea22e4,PreservedSpecimen,ff1c5311-9e32-4c89-8967-4d815cebc622,AUGIEENTB0000141,,Animalia,Arthropoda,Insecta,Coleoptera,Coccinellidae,Chilocorus stigma,25164,,Chilocorus,stigma,,,Marissa Gorsegner,7/12/2021,,,,,,V. Cervantes,,7/8/2021,2021,7,8,189,,7/8/2021,,,,,,,,,,,,,,,,,United States,IL,Rock Island,,,,41.47252,90.473754,,,,,,,,,,,,,,,,,marissagorsegner,8/19/2021 8:59,http://creativecommons.org/licenses/by-nc/4.0/,Augustana College,,urn:uuid:ff1c5311-9e32-4c89-8967-4d815cebc622,https://scan-bugs.org:443/portal/collections/individual/index.php?occid=57333571
57343223,AUGIE,ENT,,120bf21c-d066-48ee-b4c0-880596ea22e4,PreservedSpecimen,85fa7993-bc42-4405-beb0-d73af9c4d817,AUGIEENTB0000142,,Animalia,Arthropoda,Insecta,Coleoptera,Coccinellidae,Hippodamia parenthesis,27400,,Hippodamia,parenthesis,,,O. Ruffatto,7/21/2021,,,,,,Olivia Ruffatto,,7/19/2021,2021,7,19,200,,7/19/2021,,,,,,,,,,,,,,,,,United States,Iowa,Scott,,,,41.56304,90.46707,,,,,,,,,,,,,,,,,marissagorsegner,7/21/2021 13:24,http://creativecommons.org/licenses/by-nc/4.0/,Augustana College,,urn:uuid:85fa7993-bc42-4405-beb0-d73af9c4d817,https://scan-bugs.org:443/portal/collections/individual/index.php?occid=57343223
57343225,AUGIE,ENT,,120bf21c-d066-48ee-b4c0-880596ea22e4,PreservedSpecimen,ad49fd71-e0dc-4d38-9d42-81b266780e81,AUGIEENTB0000143,,Animalia,Arthropoda,Insecta,Coleoptera,Coccinellidae,Hippodamia parenthesis,27400,,Hippodamia,parenthesis,,,O. Ruffatto,7/21/2021,,,,,,V. Cervantes,,7/19/2021,2021,7,19,200,,7/19/2021,,,,,,,,,,,,,,,,,United States,Iowa,Scott,,,,41.56304,90.46707,,,,,,,,,,,,,,,,,marissagorsegner,7/21/2021 13:25,http://creativecommons.org/licenses/by-nc/4.0/,Augustana College,,urn:uuid:ad49fd71-e0dc-4d38-9d42-81b266780e81,https://scan-bugs.org:443/portal/collections/individual/index.php?occid=57343225
57343227,AUGIE,ENT,,120bf21c-d066-48ee-b4c0-880596ea22e4,PreservedSpecimen,5eb77c13-ae2f-4d7d-8581-1acc6558cf04,AUGIEENTB0000144,,Animalia,Arthropoda,Insecta,Coleoptera,Coccinellidae,Hippodamia parenthesis,27400,,Hippodamia,parenthesis,,,O. Ruffatto,7/21/2021,,,,,,M.,,7/19/2021,2021,7,19,200,,7/19/2021,,,,,,,,,,,,,,,,,United States,Iowa,Scott,,,,41.56304,90.46707,,,,,,,,,,,,,,,,,marissagorsegner,7/21/2021 13:26,http://creativecommons.org/licenses/by-nc/4.0/,Augustana College,,urn:uuid:5eb77c13-ae2f-4d7d-8581-1acc6558cf04,https://scan-bugs.org:443/portal/collections/individual/index.php?occid=57343227
57343228,AUGIE,ENT,,120bf21c-d066-48ee-b4c0-880596ea22e4,PreservedSpecimen,976ee5b7-0404-492d-9c2d-bcf0e779d05a,AUGIEENTB0000145,,Animalia,Arthropoda,Insecta,Coleoptera,Coccinellidae,Coleomegilla maculata,25547,,Coleomegilla,maculata,,,O. Ruffatto,7/21/2021,,,,,,Jack Hughes,,7/19/2021,2021,7,19,200,,7/19/2021,,,,,,,,,,,,,,,,,United States,Iowa,Scott,,,,41.56304,90.46707,,,,,,,,,,,,,,,,,marissagorsegner,7/21/2021 13:28,http://creativecommons.org/licenses/by-nc/4.0/,Augustana College,,urn:uuid:976ee5b7-0404-492d-9c2d-bcf0e779d05a,https://scan-bugs.org:443/portal/collections/individual/index.php?occid=57343228
57343230,AUGIE,ENT,,120bf21c-d066-48ee-b4c0-880596ea22e4,PreservedSpecimen,d41d3bbc-b019-4663-807c-43285694e02b,AUGIEENTB0000146,,Animalia,Arthropoda,Insecta,Coleoptera,Coccinellidae,Hippodamia parenthesis,27400,,Hippodamia,parenthesis,,,O. Ruffatto,7/21/2021,,,,,,V. Cervantes,,7/19/2021,2021,7,19,200,,7/19/2021,,,,,,,,,,,,,,,,,United States,Iowa,Scott,,,,41.56304,90.46707,,,,,,,,,,,,,,,,,marissagorsegner,7/21/2021 13:29,http://creativecommons.org/licenses/by-nc/4.0/,Augustana College,,urn:uuid:d41d3bbc-b019-4663-807c-43285694e02b,https://scan-bugs.org:443/portal/collections/individual/index.php?occid=57343230
57343232,AUGIE,ENT,,120bf21c-d066-48ee-b4c0-880596ea22e4,PreservedSpecimen,59bf169a-5cb0-4068-bdb8-d76e1e4486df,AUGIEENTB0000147,,Animalia,Arthropoda,Insecta,Coleoptera,Coccinellidae,Coccinella septempunctata,25520,"(Linnaeus, 1758)",Coccinella,septempunctata,,,O. Ruffatto,7/21/2021,,,,,,Olivia Ruffatto,,7/19/2021,2021,7,19,200,,7/19/2021,,,,,,,,,,,,,,,,,United States,Iowa,Scott,,,,41.537828,90.645823,,,,,,,,,,,,,,,,,marissagorsegner,7/21/2021 13:34,http://creativecommons.org/licenses/by-nc/4.0/,Augustana College,,urn:uuid:59bf169a-5cb0-4068-bdb8-d76e1e4486df,https://scan-bugs.org:443/portal/collections/individual/index.php?occid=57343232
57343234,AUGIE,ENT,,120bf21c-d066-48ee-b4c0-880596ea22e4,PreservedSpecimen,cf8bf5d7-a057-4685-a82b-b17da4fd9890,AUGIEENTB0000148,,Animalia,Arthropoda,Insecta,Coleoptera,Coccinellidae,Coccinella septempunctata,25520,"(Linnaeus, 1758)",Coccinella,septempunctata,,,O. Ruffatto,7/21/2021,,,,,,Olivia Ruffatto,,7/19/2021,2021,7,19,200,,7/19/2021,,,,,,,,,,,,,,,,,United States,Iowa,Scott,,,,41.537828,90.645823,,,,,,,,,,,,,,,,,marissagorsegner,7/21/2021 13:35,http://creativecommons.org/licenses/by-nc/4.0/,Augustana College,,urn:uuid:cf8bf5d7-a057-4685-a82b-b17da4fd9890,https://scan-bugs.org:443/portal/collections/individual/index.php?occid=57343234
57343237,AUGIE,ENT,,120bf21c-d066-48ee-b4c0-880596ea22e4,PreservedSpecimen,5e519633-3a49-4113-b4d2-0c3ac9607ac7,AUGIEENTB0000149,,Animalia,Arthropoda,Insecta,Coleoptera,Coccinellidae,Coleomegilla maculata,25547,,Coleomegilla,maculata,,,O. Ruffatto,7/21/2021,,,,,,Jack Hughes,,7/19/2021,2021,7,19,200,,7/19/2021,,,,,,,,,,,,,,,,,United States,Iowa,Scott,,,,41.537828,90.645823,,,,,,,,,,,,,,,,,marissagorsegner,7/21/2021 13:38,http://creativecommons.org/licenses/by-nc/4.0/,Augustana College,,urn:uuid:5e519633-3a49-4113-b4d2-0c3ac9607ac7,https://scan-bugs.org:443/portal/collections/individual/index.php?occid=57343237
57343238,AUGIE,ENT,,120bf21c-d066-48ee-b4c0-880596ea22e4,PreservedSpecimen,c817bd8e-34c0-4a6d-bce1-0d528848f650,AUGIEENTB0000150,,Animalia,Arthropoda,Insecta,Coleoptera,Coccinellidae,Coleomegilla maculata,25547,,Coleomegilla,maculata,,,O. Ruffatto,7/21/2021,,,,,,Olivia Ruffatto,,7/19/2021,2021,7,19,200,,7/19/2021,,,,,,,,,,,,,,,,,United States,Iowa,Scott,,,,41.537828,90.645823,,,,,,,,,,,,,,,,,marissagorsegner,7/21/2021 13:40,http://creativecommons.org/licenses/by-nc/4.0/,Augustana College,,urn:uuid:c817bd8e-34c0-4a6d-bce1-0d528848f650,https://scan-bugs.org:443/portal/collections/individual/index.php?occid=57343238
57343239,AUGIE,ENT,,120bf21c-d066-48ee-b4c0-880596ea22e4,PreservedSpecimen,ffdc3ee1-db7a-4330-9ca8-266d8e10a580,AUGIEENTB0000151,,Animalia,Arthropoda,Insecta,Coleoptera,Coccinellidae,Coleomegilla maculata,25547,,Coleomegilla,maculata,,,O. Ruffatto,7/21/2021,,,,,,M. Gorsegner,,7/19/2021,2021,7,19,200,,7/19/2021,,,,,,,,,,,,,,,,,United States,Iowa,Scott,,,,41.537828,90.645823,,,,,,,,,,,,,,,,,marissagorsegner,7/21/2021 13:41,http://creativecommons.org/licenses/by-nc/4.0/,Augustana College,,urn:uuid:ffdc3ee1-db7a-4330-9ca8-266d8e10a580,https://scan-bugs.org:443/portal/collections/individual/index.php?occid=57343239
57343241,AUGIE,ENT,,120bf21c-d066-48ee-b4c0-880596ea22e4,PreservedSpecimen,e63d12c9-55ad-4b27-963b-4cdea0fcccf4,AUGIEENTB0000176,,Animalia,Arthropoda,Insecta,Coleoptera,Coccinellidae,Coleomegilla maculata,25547,,Coleomegilla,maculata,,,Olivia Ruffatto,7/21/2021,,,,,,Jack Hughes,,7/19/2021,2021,7,19,200,,7/19/2021,,,,,,,,,,,,,,,,,United States,IA,Scott,Davenport,,,41.550606,90.62248,,,,,,,,,,,,,,,,,jackhughes20,7/21/2021 13:42,http://creativecommons.org/licenses/by-nc/4.0/,Augustana College,,urn:uuid:e63d12c9-55ad-4b27-963b-4cdea0fcccf4,https://scan-bugs.org:443/portal/collections/individual/index.php?occid=57343241
57343243,AUGIE,ENT,,120bf21c-d066-48ee-b4c0-880596ea22e4,PreservedSpecimen,9d368c62-221d-4f13-a627-6d1a8e92c386,AUGIEENTB0000152,,Animalia,Arthropoda,Insecta,Coleoptera,Coccinellidae,Coleomegilla maculata,25547,,Coleomegilla,maculata,,,O. Ruffatto,7/21/2021,,,,,,V. Cervantes,,7/19/2021,2021,7,19,200,,7/19/2021,,,,,,,,,,,,,,,,,United States,Iowa,Scott,,,,41.537828,90.645823,,,,,,,,,,,,,,,,,marissagorsegner,7/21/2021 13:42,http://creativecommons.org/licenses/by-nc/4.0/,Augustana College,,urn:uuid:9d368c62-221d-4f13-a627-6d1a8e92c386,https://scan-bugs.org:443/portal/collections/individual/index.php?occid=57343243
57343244,AUGIE,ENT,,120bf21c-d066-48ee-b4c0-880596ea22e4,PreservedSpecimen,8bb3451e-3945-4a2c-ab10-a4040be9f169,AUGIEENTB0000153,,Animalia,Arthropoda,Insecta,Coleoptera,Coccinellidae,Coleomegilla maculata,25547,,Coleomegilla,maculata,,,O. Ruffatto,7/21/2021,,,,,,Olivia Ruffatto,,7/19/2021,2021,7,19,200,,7/19/2021,,,,,,,,,,,,,,,,,United States,Iowa,Scott,,,,41.537828,90.645823,,,,,,,,,,,,,,,,,marissagorsegner,7/21/2021 13:43,http://creativecommons.org/licenses/by-nc/4.0/,Augustana College,,urn:uuid:8bb3451e-3945-4a2c-ab10-a4040be9f169,https://scan-bugs.org:443/portal/collections/individual/index.php?occid=57343244
57343245,AUGIE,ENT,,120bf21c-d066-48ee-b4c0-880596ea22e4,PreservedSpecimen,34156117-7a0e-4ef1-aed5-0a22fa7ed3f1,AUGIEENTB0000177,,Animalia,Arthropoda,Insecta,Coleoptera,Coccinellidae,Coleomegilla maculata,25547,,Coleomegilla,maculata,,,Olivia Ruffatto,7/21/2021,,,,,,Olivia Ruffatto,,7/19/2021,2021,7,19,200,,7/19/2021,,,,,,,,,,,,,,,,,United States,IA,Scott,Davenport,,,41.550606,90.62248,,,,,,,,,,,,,,,,,jackhughes20,7/21/2021 13:43,http://creativecommons.org/licenses/by-nc/4.0/,Augustana College,,urn:uuid:34156117-7a0e-4ef1-aed5-0a22fa7ed3f1,https://scan-bugs.org:443/portal/collections/individual/index.php?occid=57343245
57343246,AUGIE,ENT,,120bf21c-d066-48ee-b4c0-880596ea22e4,PreservedSpecimen,76c54826-2b26-4638-b1b8-6b0e6e3e40b6,AUGIEENTB0000154,,Animalia,Arthropoda,Insecta,Coleoptera,Coccinellidae,Coleomegilla maculata,25547,,Coleomegilla,maculata,,,O. Ruffatto,7/21/2021,,,,,,M. Gorsegner,,7/19/2021,2021,7,19,200,,7/19/2021,,,,,,,,,,,,,,,,,United States,Iowa,Scott,,,,41.537828,90.645823,,,,,,,,,,,,,,,,,marissagorsegner,7/21/2021 13:44,http://creativecommons.org/licenses/by-nc/4.0/,Augustana College,,urn:uuid:76c54826-2b26-4638-b1b8-6b0e6e3e40b6,https://scan-bugs.org:443/portal/collections/individual/index.php?occid=57343246
57343248,AUGIE,ENT,,120bf21c-d066-48ee-b4c0-880596ea22e4,PreservedSpecimen,d43e920b-7a8a-46cf-8433-ed23bcaa306d,AUGIEENTB0000178,,Animalia,Arthropoda,Insecta,Coleoptera,Coccinellidae,Coleomegilla maculata,25547,,Coleomegilla,maculata,,,Olivia Ruffatto,7/21/2021,,,,,,Veronica Cervantes,,7/19/2021,2021,7,19,200,,7/19/2021,,,,,,,,,,,,,,,,,United States,IA,Scott,Davenport,,,41.550606,90.62248,,,,,,,,,,,,,,,,,jackhughes20,7/21/2021 13:44,http://creativecommons.org/licenses/by-nc/4.0/,Augustana College,,urn:uuid:d43e920b-7a8a-46cf-8433-ed23bcaa306d,https://scan-bugs.org:443/portal/collections/individual/index.php?occid=57343248
57343249,AUGIE,ENT,,120bf21c-d066-48ee-b4c0-880596ea22e4,PreservedSpecimen,1579ca69-d641-47d7-86b8-6f434cc1d7ed,AUGIEENTB0000155,,Animalia,Arthropoda,Insecta,Coleoptera,Coccinellidae,Hippodamia variegata,27405,"(Goeze, 1777)",Hippodamia,variegata,,,Veronica Cervantes,8/11/2021,,,,,,V. Cervantes,,7/19/2021,2021,7,19,200,,7/19/2021,,,,,,,,,,,,,,,,,United States,Iowa,Scott,,,,41.537828,90.645823,,,,,,,,,,,,,,,,,marissagorsegner,8/11/2021 12:32,http://creativecommons.org/licenses/by-nc/4.0/,Augustana College,,urn:uuid:1579ca69-d641-47d7-86b8-6f434cc1d7ed,https://scan-bugs.org:443/portal/collections/individual/index.php?occid=57343249
57343250,AUGIE,ENT,,120bf21c-d066-48ee-b4c0-880596ea22e4,PreservedSpecimen,1c20d09e-9ca6-4aee-a88e-78c968721015,AUGIEENTB0000156,,Animalia,Arthropoda,Insecta,Coleoptera,Coccinellidae,Hippodamia parenthesis,27400,,Hippodamia,parenthesis,,,O. Ruffatto,7/21/2021,,,,,,Jack Hughes,,7/19/2021,2021,7,19,200,,7/19/2021,,,,,,,,,,,,,,,,,United States,Iowa,Scott,,,,41.537828,90.645823,,,,,,,,,,,,,,,,,marissagorsegner,7/21/2021 13:46,http://creativecommons.org/licenses/by-nc/4.0/,Augustana College,,urn:uuid:1c20d09e-9ca6-4aee-a88e-78c968721015,https://scan-bugs.org:443/portal/collections/individual/index.php?occid=57343250
57343251,AUGIE,ENT,,120bf21c-d066-48ee-b4c0-880596ea22e4,PreservedSpecimen,9f25b61c-6388-42d5-a56a-835719fbd968,AUGIEENTB0000157,,Animalia,Arthropoda,Insecta,Coleoptera,Coccinellidae,Hippodamia parenthesis,27400,,Hippodamia,parenthesis,,,O. Ruffatto,7/21/2021,,,,,,V. Cervantes,,7/19/2021,2021,7,19,200,,7/19/2021,,,,,,,,,,,,,,,,,United States,Iowa,Scott,,,,41.537828,90.645823,,,,,,,,,,,,,,,,,marissagorsegner,7/21/2021 13:47,http://creativecommons.org/licenses/by-nc/4.0/,Augustana College,,urn:uuid:9f25b61c-6388-42d5-a56a-835719fbd968,https://scan-bugs.org:443/portal/collections/individual/index.php?occid=57343251
57343254,AUGIE,ENT,,120bf21c-d066-48ee-b4c0-880596ea22e4,PreservedSpecimen,f7965cb9-4cff-46d0-8a96-21c5ba07e001,AUGIEENTB0000158,,Animalia,Arthropoda,Insecta,Coleoptera,Coccinellidae,Cycloneda munda,25911,,Cycloneda,munda,,,Jack Hughes,7/21/2021,,,,,,V. Cervantes,,7/19/2021,2021,7,19,200,,7/19/2021,,,,,,,,,,,,,,,,,United States,Iowa,Scott,,,,41.56812,90.57119,,,,,,,,,,,,,,,,,marissagorsegner,7/21/2021 13:50,http://creativecommons.org/licenses/by-nc/4.0/,Augustana College,,urn:uuid:f7965cb9-4cff-46d0-8a96-21c5ba07e001,https://scan-bugs.org:443/portal/collections/individual/index.php?occid=57343254
57343255,AUGIE,ENT,,120bf21c-d066-48ee-b4c0-880596ea22e4,PreservedSpecimen,968d4658-94ef-4478-807d-8655c1fcb244,AUGIEENTB0000179,,Animalia,Arthropoda,Insecta,Coleoptera,Coccinellidae,Coleomegilla maculata,25547,,Coleomegilla,maculata,,,Jack Hughes,7/21/2021,,,,,,Olivia Ruffatto,,7/19/2021,2021,7,19,200,,7/19/2021,,,,,,,,,,,,,,,,,United States,IA,Scott,Davenport,,,41.5677,90.52301,,,,,,,,,,,,,,,,,jackhughes20,7/21/2021 13:51,http://creativecommons.org/licenses/by-nc/4.0/,Augustana College,,urn:uuid:968d4658-94ef-4478-807d-8655c1fcb244,https://scan-bugs.org:443/portal/collections/individual/index.php?occid=57343255
57343257,AUGIE,ENT,,120bf21c-d066-48ee-b4c0-880596ea22e4,PreservedSpecimen,d0d9cd82-c57a-4cee-8194-b7c2984a4aef,AUGIEENTB0000159,,Animalia,Arthropoda,Insecta,Coleoptera,Coccinellidae,Harmonia axyridis,27230,"(Pallas, 1773)",Harmonia,axyridis,,,O. Ruffatto,7/21/2021,,,,,,M. Gorsegner,,7/20/2021,2021,7,20,201,,7/20/2021,,,,,,,,,,,,,,,,,United States,Illinois,Rock Island,,,,41.435905,90.501557,,,,,,,,,,,,,,,,,marissagorsegner,7/21/2021 13:53,http://creativecommons.org/licenses/by-nc/4.0/,Augustana College,,urn:uuid:d0d9cd82-c57a-4cee-8194-b7c2984a4aef,https://scan-bugs.org:443/portal/collections/individual/index.php?occid=57343257
57343259,AUGIE,ENT,,120bf21c-d066-48ee-b4c0-880596ea22e4,PreservedSpecimen,db4059c2-884b-42ab-bc15-143198a90917,AUGIEENTB0000180,,Animalia,Arthropoda,Insecta,Coleoptera,Coccinellidae,Cycloneda munda,25911,,Cycloneda,munda,,,Jack Hughes,7/21/2021,,,,,,Olivia Ruffatto,,7/19/2021,2021,7,19,200,,7/19/2021,,,,,,,,,,,,,,,,,United States,IA,Scott,Davenport,,,41.5677,90.52301,,,,,,,,,,,,,,,,,jackhughes20,7/21/2021 13:53,http://creativecommons.org/licenses/by-nc/4.0/,Augustana College,,urn:uuid:db4059c2-884b-42ab-bc15-143198a90917,https://scan-bugs.org:443/portal/collections/individual/index.php?occid=57343259
57343261,AUGIE,ENT,,120bf21c-d066-48ee-b4c0-880596ea22e4,PreservedSpecimen,cb05fee4-4d91-4875-b752-0f47e012143c,AUGIEENTB0000181,,Animalia,Arthropoda,Insecta,Coleoptera,Coccinellidae,Harmonia axyridis,27230,"(Pallas, 1773)",Harmonia,axyridis,,,Olivia Ruffatto,7/21/2021,,,,,,Marissa Gorsegner,,7/19/2021,2021,7,19,200,,7/19/2021,,,,,,,,,,,,,,,,,United States,IA,Scott,Davenport,,,41.5677,90.52301,,,,,,,,,,,,,,,,,jackhughes20,7/21/2021 13:54,http://creativecommons.org/licenses/by-nc/4.0/,Augustana College,,urn:uuid:cb05fee4-4d91-4875-b752-0f47e012143c,https://scan-bugs.org:443/portal/collections/individual/index.php?occid=57343261
57343262,AUGIE,ENT,,120bf21c-d066-48ee-b4c0-880596ea22e4,PreservedSpecimen,f83662b1-47c8-4e72-a91d-391ba71568e9,AUGIEENTB0000160,,Animalia,Arthropoda,Insecta,Coleoptera,Coccinellidae,Harmonia axyridis,27230,"(Pallas, 1773)",Harmonia,axyridis,,,O. Ruffatto,7/21/2021,,,,,,V. Cervantes,,7/20/2021,2021,7,20,201,,7/20/2021,,,,,,,,,,,,,,,,,United States,Illinois,Rock Island,,,,41.47252,90.473754,,,,,,,,,,,,,,,,,marissagorsegner,7/22/2021 9:23,http://creativecommons.org/licenses/by-nc/4.0/,Augustana College,,urn:uuid:f83662b1-47c8-4e72-a91d-391ba71568e9,https://scan-bugs.org:443/portal/collections/individual/index.php?occid=57343262
57343264,AUGIE,ENT,,120bf21c-d066-48ee-b4c0-880596ea22e4,PreservedSpecimen,26c6946c-b64a-4cbf-a514-7a99cf61f728,AUGIEENTB0000161,,Animalia,Arthropoda,Insecta,Coleoptera,Coccinellidae,Harmonia axyridis,27230,"(Pallas, 1773)",Harmonia,axyridis,,,O. Ruffatto,7/21/2021,,,,,,Olivia Ruffatto,,7/20/2021,2021,7,20,201,,7/20/2021,,,,,,,,,,,,,,,,,United States,Illinois,Rock Island,,,,41.47252,90.473754,,,,,,,,,,,,,,,,,marissagorsegner,7/22/2021 9:23,http://creativecommons.org/licenses/by-nc/4.0/,Augustana College,,urn:uuid:26c6946c-b64a-4cbf-a514-7a99cf61f728,https://scan-bugs.org:443/portal/collections/individual/index.php?occid=57343264
57343265,AUGIE,ENT,,120bf21c-d066-48ee-b4c0-880596ea22e4,PreservedSpecimen,3949d26b-0fa5-49bc-b2e9-f2158ca526bb,AUGIEENTB0000182,,Animalia,Arthropoda,Insecta,Coleoptera,Coccinellidae,Harmonia axyridis,27230,"(Pallas, 1773)",Harmonia,axyridis,,,Olivia Ruffatto,7/21/2021,,,,,,Marissa Gorsegner,,7/20/2021,2021,7,20,201,,7/20/2021,,,,,,,,,,,,,,,,,United States,IL,Rock Island,Rock Island,,,41.520413,90.439069,,,,,,,,,,,,,,,,,jackhughes20,7/22/2021 6:37,http://creativecommons.org/licenses/by-nc/4.0/,Augustana College,,urn:uuid:3949d26b-0fa5-49bc-b2e9-f2158ca526bb,https://scan-bugs.org:443/portal/collections/individual/index.php?occid=57343265
57343283,AUGIE,ENT,,120bf21c-d066-48ee-b4c0-880596ea22e4,PreservedSpecimen,299bdac3-a920-4c5b-af38-8917a165ffb7,AUGIEENTB0000162,,Animalia,Arthropoda,Insecta,Coleoptera,Coccinellidae,Harmonia axyridis,27230,"(Pallas, 1773)",Harmonia,axyridis,,,O. Ruffatto,7/20/2021,,,,,,Olivia Ruffatto,,7/20/2021,2021,7,20,201,,,,,,,,,,,,,,,,,,,United States,IL,Rock Island,,,,41.469869,90.506684,,,,,,,,,,,,,,,,,ruolivia,8/11/2021 12:05,http://creativecommons.org/licenses/by-nc/4.0/,Augustana College,,urn:uuid:299bdac3-a920-4c5b-af38-8917a165ffb7,https://scan-bugs.org:443/portal/collections/individual/index.php?occid=57343283
57343284,AUGIE,ENT,,120bf21c-d066-48ee-b4c0-880596ea22e4,PreservedSpecimen,f9df5692-5993-4e71-a878-7b0c05c9c650,AUGIEENTB0000163,,Animalia,Arthropoda,Insecta,Coleoptera,Coccinellidae,Harmonia axyridis,27230,"(Pallas, 1773)",Harmonia,axyridis,,,M. Gorsegner,8/11/2021,,,,,,V. Cervantes,,7/20/2021,2021,7,20,201,,,,,,,,,,,,,,,,,,,United States,IL,Rock Island,,,,41.469869,90.506684,,,,,,,,,,,,,,,,,ruolivia,8/11/2021 12:06,http://creativecommons.org/licenses/by-nc/4.0/,Augustana College,,urn:uuid:f9df5692-5993-4e71-a878-7b0c05c9c650,https://scan-bugs.org:443/portal/collections/individual/index.php?occid=57343284
57343286,AUGIE,ENT,,120bf21c-d066-48ee-b4c0-880596ea22e4,PreservedSpecimen,942fe41c-aef1-4179-8a51-74d38b589c84,AUGIEENTB0000164,,Animalia,Arthropoda,Insecta,Coleoptera,Coccinellidae,Harmonia axyridis,27230,"(Pallas, 1773)",Harmonia,axyridis,,,O. Ruffatto,7/20/2021,,,,,,O. Ruffatto,,7/20/2021,2021,7,20,201,,,,,,,,,,,,,,,,,,,United States,IL,Rock Island,,,,41.469869,90.506684,,,,,,,,,,,,,,,,,ruolivia,7/22/2021 6:40,http://creativecommons.org/licenses/by-nc/4.0/,Augustana College,,urn:uuid:942fe41c-aef1-4179-8a51-74d38b589c84,https://scan-bugs.org:443/portal/collections/individual/index.php?occid=57343286
57343290,AUGIE,ENT,,120bf21c-d066-48ee-b4c0-880596ea22e4,PreservedSpecimen,4e5571f2-f10a-42d4-b310-7ac12833db94,AUGIEENTB0000165,,Animalia,Arthropoda,Insecta,Coleoptera,Coccinellidae,Harmonia axyridis,27230,"(Pallas, 1773)",Harmonia,axyridis,,,O. Ruffatto,7/20/2021,,,,,,Olivia Ruffatto,,7/19/2021,2021,7,19,200,,,,,,,,,,,,,,,,,,,United States,Iowa,Scott,,,,41.54437,90.649164,,,,,,,,,,,,,,,,,ruolivia,7/22/2021 7:00,http://creativecommons.org/licenses/by-nc/4.0/,Augustana College,,urn:uuid:4e5571f2-f10a-42d4-b310-7ac12833db94,https://scan-bugs.org:443/portal/collections/individual/index.php?occid=57343290
57343291,AUGIE,ENT,,120bf21c-d066-48ee-b4c0-880596ea22e4,PreservedSpecimen,afd3eed5-f7e7-482d-8ca2-35926f63d2aa,AUGIEENTB0000166,,Animalia,Arthropoda,Insecta,Coleoptera,Coccinellidae,Harmonia axyridis,27230,"(Pallas, 1773)",Harmonia,axyridis,,,O. Ruffatto,7/20/2021,,,,,,Olivia Ruffatto,,7/19/2021,2021,7,19,200,,,,,,,,,,,,,,,,,,,United States,Iowa,Scott,,,,41.54437,90.649164,,,,,,,,,,,,,,,,,ruolivia,7/22/2021 7:01,http://creativecommons.org/licenses/by-nc/4.0/,Augustana College,,urn:uuid:afd3eed5-f7e7-482d-8ca2-35926f63d2aa,https://scan-bugs.org:443/portal/collections/individual/index.php?occid=57343291
57343292,AUGIE,ENT,,120bf21c-d066-48ee-b4c0-880596ea22e4,PreservedSpecimen,91530a8a-6f1b-443c-b012-ec5ddfa0dc32,AUGIEENTB0000167,,Animalia,Arthropoda,Insecta,Coleoptera,Coccinellidae,Harmonia axyridis,27230,"(Pallas, 1773)",Harmonia,axyridis,,,O. Ruffatto,7/20/2021,,,,,,J. Hughes,,7/19/2021,2021,7,19,200,,,,,,,,,,,,,,,,,,,United States,Iowa,Scott,,,,41.54437,90.649164,,,,,,,,,,,,,,,,,ruolivia,7/22/2021 7:02,http://creativecommons.org/licenses/by-nc/4.0/,Augustana College,,urn:uuid:91530a8a-6f1b-443c-b012-ec5ddfa0dc32,https://scan-bugs.org:443/portal/collections/individual/index.php?occid=57343292
57343293,AUGIE,ENT,,120bf21c-d066-48ee-b4c0-880596ea22e4,PreservedSpecimen,9d922eac-023c-478f-a43d-bf33e6104fcd,AUGIEENTB0000168,,Animalia,Arthropoda,Insecta,Coleoptera,Coccinellidae,Propylea quatuordecimpunctata,613667,(Linneus 1758),Propylea,quatuordecimpunctata,,,Veronica Cervantes,8/11/2021,,,,,,O. Ruffatto,,7/19/2021,2021,7,19,200,,,,,,,,,,,,,,,,,,,United States,Iowa,Scott,,,,41.54437,90.649164,,,,,,,,,,,,,,,,,ruolivia,8/11/2021 12:37,http://creativecommons.org/licenses/by-nc/4.0/,Augustana College,,urn:uuid:9d922eac-023c-478f-a43d-bf33e6104fcd,https://scan-bugs.org:443/portal/collections/individual/index.php?occid=57343293
57343294,AUGIE,ENT,,120bf21c-d066-48ee-b4c0-880596ea22e4,PreservedSpecimen,489a389a-28f9-4d20-9f7d-745a3ef1e5f3,AUGIEENTB0000169,,Animalia,Arthropoda,Insecta,Coleoptera,Coccinellidae,Coleomegilla maculata,25547,,Coleomegilla,maculata,,,O. Ruffatto,7/20/2021,,,,,,V. Cervantes,,7/19/2021,2021,7,19,200,,,,,,,,,,,,,,,,,,,United States,Iowa,Scott,,,,41.54437,90.649164,,,,,,,,,,,,,,,,,ruolivia,7/22/2021 7:03,http://creativecommons.org/licenses/by-nc/4.0/,Augustana College,,urn:uuid:489a389a-28f9-4d20-9f7d-745a3ef1e5f3,https://scan-bugs.org:443/portal/collections/individual/index.php?occid=57343294
57343295,AUGIE,ENT,,120bf21c-d066-48ee-b4c0-880596ea22e4,PreservedSpecimen,fce94f72-e695-4d38-a954-08bf21c285e4,AUGIEENTB0000170,,Animalia,Arthropoda,Insecta,Coleoptera,Coccinellidae,Harmonia axyridis,27230,"(Pallas, 1773)",Harmonia,axyridis,,,O. Ruffatto,7/20/2021,,,,,,M. Gorsegner,,7/19/2021,2021,7,19,200,,,,,,,,,,,,,,,,,,,United States,Iowa,Scott,,,,41.54437,90.649164,,,,,,,,,,,,,,,,,ruolivia,7/22/2021 7:04,http://creativecommons.org/licenses/by-nc/4.0/,Augustana College,,urn:uuid:fce94f72-e695-4d38-a954-08bf21c285e4,https://scan-bugs.org:443/portal/collections/individual/index.php?occid=57343295
57343296,AUGIE,ENT,,120bf21c-d066-48ee-b4c0-880596ea22e4,PreservedSpecimen,1fa6925a-5501-4c36-97a8-84cb2d8100de,AUGIEENTB0000171,,Animalia,Arthropoda,Insecta,Coleoptera,Coccinellidae,Harmonia axyridis,27230,"(Pallas, 1773)",Harmonia,axyridis,,,O. Ruffatto,7/20/2021,,,,,,V. Cervantes,,7/19/2021,2021,7,19,200,,,,,,,,,,,,,,,,,,,United States,Iowa,Scott,,,,41.54437,90.649164,,,,,,,,,,,,,,,,,ruolivia,7/22/2021 7:05,http://creativecommons.org/licenses/by-nc/4.0/,Augustana College,,urn:uuid:1fa6925a-5501-4c36-97a8-84cb2d8100de,https://scan-bugs.org:443/portal/collections/individual/index.php?occid=57343296
57343297,AUGIE,ENT,,120bf21c-d066-48ee-b4c0-880596ea22e4,PreservedSpecimen,01326955-12c4-4c92-a1fe-1f85e0141da0,AUGIEENTB0000172,,Animalia,Arthropoda,Insecta,Coleoptera,Coccinellidae,Harmonia axyridis,27230,"(Pallas, 1773)",Harmonia,axyridis,,,O. Ruffatto,7/20/2021,,,,,,M. Gorsegner,,7/19/2021,2021,7,19,200,,,,,,,,,,,,,,,,,,,United States,Iowa,Scott,,,,41.54437,90.649164,,,,,,,,,,,,,,,,,ruolivia,7/22/2021 7:05,http://creativecommons.org/licenses/by-nc/4.0/,Augustana College,,urn:uuid:01326955-12c4-4c92-a1fe-1f85e0141da0,https://scan-bugs.org:443/portal/collections/individual/index.php?occid=57343297
57343299,AUGIE,ENT,,120bf21c-d066-48ee-b4c0-880596ea22e4,PreservedSpecimen,5213f86d-6291-4829-be09-3514db598398,AUGIEENTB0000173,,Animalia,Arthropoda,Insecta,Coleoptera,Coccinellidae,Harmonia axyridis,27230,"(Pallas, 1773)",Harmonia,axyridis,,,O. Ruffatto,7/20/2021,,,,,,J. Hughes,,7/19/2021,2021,7,19,200,,,,,,,,,,,,,,,,,,,United States,Iowa,Scott,,,,41.54437,90.649164,,,,,,,,,,,,,,,,,ruolivia,7/22/2021 7:06,http://creativecommons.org/licenses/by-nc/4.0/,Augustana College,,urn:uuid:5213f86d-6291-4829-be09-3514db598398,https://scan-bugs.org:443/portal/collections/individual/index.php?occid=57343299
57343302,AUGIE,ENT,,120bf21c-d066-48ee-b4c0-880596ea22e4,PreservedSpecimen,1aa4b4a4-a8f6-4bc9-afb4-25d7789fc76a,AUGIEENTB0000174,,Animalia,Arthropoda,Insecta,Coleoptera,Coccinellidae,Cycloneda munda,25911,,Cycloneda,munda,,,O. Ruffatto,7/20/2021,,,,,,M. Gorsegner,,7/19/2021,2021,7,19,200,,,,,,,,,,,,,,,,,,,United States,Iowa,Scott,,,,41.50609,90.73943,,,,,,,,,,,,,,,,,ruolivia,7/22/2021 7:13,http://creativecommons.org/licenses/by-nc/4.0/,Augustana College,,urn:uuid:1aa4b4a4-a8f6-4bc9-afb4-25d7789fc76a,https://scan-bugs.org:443/portal/collections/individual/index.php?occid=57343302
57343303,AUGIE,ENT,,120bf21c-d066-48ee-b4c0-880596ea22e4,PreservedSpecimen,fe72da3e-bf28-492b-b47e-a40fcb404073,AUGIEENTB0000175,,,,,,,Hippodamia convergens,27393,"Guérin-Méneville, 1842",Hippodamia,convergens,,,Veronica Cervantes,8/19/2021,,,,,,O. Ruffatto,,7/19/2021,2021,7,19,200,,,,,,,,,,,,,,,,,,,United States,Iowa,Scott,,,,41.50609,90.73943,,,,,,,,,,,,,,,,,ruolivia,8/19/2021 12:33,http://creativecommons.org/licenses/by-nc/4.0/,Augustana College,,urn:uuid:fe72da3e-bf28-492b-b47e-a40fcb404073,https://scan-bugs.org:443/portal/collections/individual/index.php?occid=57343303
57343304,AUGIE,ENT,,120bf21c-d066-48ee-b4c0-880596ea22e4,PreservedSpecimen,c0cf608a-3c6d-4bfa-b87f-bef48102ad08,AUGIEENTB0000183,,Animalia,Arthropoda,Insecta,Coleoptera,Coccinellidae,Coccinella septempunctata,25520,"(Linnaeus, 1758)",Coccinella,septempunctata,,,O. Ruffatto,7/20/2021,,,,,,V. Cervantes,,7/19/2021,2021,7,19,200,,,,,,,,,,,,,,,,,,,United States,Iowa,Scott,,,,41.50609,90.73943,,,,,,,,,,,,,,,,,ruolivia,7/22/2021 7:14,http://creativecommons.org/licenses/by-nc/4.0/,Augustana College,,urn:uuid:c0cf608a-3c6d-4bfa-b87f-bef48102ad08,https://scan-bugs.org:443/portal/collections/individual/index.php?occid=57343304
57343306,AUGIE,ENT,,120bf21c-d066-48ee-b4c0-880596ea22e4,PreservedSpecimen,0fb9d503-926a-4fec-8aec-fbb11ba9f237,AUGIEENTB0000184,,Animalia,Arthropoda,Insecta,Coleoptera,Coccinellidae,Coleomegilla maculata,25547,,Coleomegilla,maculata,,,O. Ruffatto,7/20/2021,,,,,,M. Gorsegner,,7/19/2021,2021,7,19,200,,,,,,,,,,,,,,,,,,,United States,Iowa,Scott,,,,41.57847,90.61787,,,,,,,,,,,,,,,,,ruolivia,7/22/2021 7:20,http://creativecommons.org/licenses/by-nc/4.0/,Augustana College,,urn:uuid:0fb9d503-926a-4fec-8aec-fbb11ba9f237,https://scan-bugs.org:443/portal/collections/individual/index.php?occid=57343306
57343308,AUGIE,ENT,,120bf21c-d066-48ee-b4c0-880596ea22e4,PreservedSpecimen,83938e4a-37af-4e16-9eb7-3ae5b7faeb97,AUGIEENTB0000185,,Animalia,Arthropoda,Insecta,Coleoptera,Coccinellidae,Chilocorus stigma,25164,,Chilocorus,stigma,,,O. Ruffatto,7/20/2021,,,,,,O. Ruffatto,,7/19/2021,2021,7,19,200,,,,,,,,,,,,,,,,,,,United States,Iowa,Scott,,,,41.57847,90.61787,,,,,,,,,,,,,,,,,ruolivia,7/22/2021 7:21,http://creativecommons.org/licenses/by-nc/4.0/,Augustana College,,urn:uuid:83938e4a-37af-4e16-9eb7-3ae5b7faeb97,https://scan-bugs.org:443/portal/collections/individual/index.php?occid=57343308
57343309,AUGIE,ENT,,120bf21c-d066-48ee-b4c0-880596ea22e4,PreservedSpecimen,6dda1466-3303-4fd3-add4-93d042b79d92,AUGIEENTB0000186,,Animalia,Arthropoda,Insecta,Coleoptera,Coccinellidae,Coleomegilla maculata,25547,,Coleomegilla,maculata,,,O. Ruffatto,7/20/2021,,,,,,J. Hughes,,7/19/2021,2021,7,19,200,,,,,,,,,,,,,,,,,,,United States,Iowa,Scott,,,,41.57847,90.61787,,,,,,,,,,,,,,,,,ruolivia,7/22/2021 7:22,http://creativecommons.org/licenses/by-nc/4.0/,Augustana College,,urn:uuid:6dda1466-3303-4fd3-add4-93d042b79d92,https://scan-bugs.org:443/portal/collections/individual/index.php?occid=57343309
57343312,AUGIE,ENT,,120bf21c-d066-48ee-b4c0-880596ea22e4,PreservedSpecimen,d5c45036-06e4-43f4-8788-5fdf223bf35a,AUGIEENTB0000187,,Animalia,Arthropoda,Insecta,Coleoptera,Coccinellidae,Cycloneda munda,25911,,Cycloneda,munda,,,O. Ruffatto,7/20/2021,,,,,,O. Ruffatto,,7/20/2021,2021,7,20,201,,,,,,,,,,,,,,,,,,,United States,Illinois,Rock Island,,,,41.428138,90.508097,,,,,,,,,,,,,,,,,ruolivia,7/22/2021 7:27,http://creativecommons.org/licenses/by-nc/4.0/,Augustana College,,urn:uuid:d5c45036-06e4-43f4-8788-5fdf223bf35a,https://scan-bugs.org:443/portal/collections/individual/index.php?occid=57343312
57343313,AUGIE,ENT,,120bf21c-d066-48ee-b4c0-880596ea22e4,PreservedSpecimen,946abf44-7446-4ba9-8e7f-a52dde31b04a,AUGIEENTB0000188,,Animalia,Arthropoda,Insecta,Coleoptera,Coccinellidae,Cycloneda munda,25911,,Cycloneda,munda,,,O. Ruffatto,7/20/2021,,,,,,J. Hughes,,7/20/2021,2021,7,20,201,,,,,,,,,,,,,,,,,,,United States,Illinois,Rock Island,,,,41.428138,90.508097,,,,,,,,,,,,,,,,,ruolivia,7/22/2021 7:28,http://creativecommons.org/licenses/by-nc/4.0/,Augustana College,,urn:uuid:946abf44-7446-4ba9-8e7f-a52dde31b04a,https://scan-bugs.org:443/portal/collections/individual/index.php?occid=57343313
57343314,AUGIE,ENT,,120bf21c-d066-48ee-b4c0-880596ea22e4,PreservedSpecimen,37c7409e-8531-4c23-af98-49ca9e190537,AUGIEENTB0000189,,Animalia,Arthropoda,Insecta,Coleoptera,Coccinellidae,Propylea quatuordecimpunctata,613667,(Linneus 1758),Propylea,quatuordecimpunctata,,,Veronica Cervantes,8/11/2021,,,,,,J. Hughes,,7/20/2021,2021,7,20,201,,,,,,,,,,,,,,,,,,,United States,Illinois,Rock Island,,,,41.428138,90.508097,,,,,,,,,,,,,,,,,ruolivia,8/11/2021 12:39,http://creativecommons.org/licenses/by-nc/4.0/,Augustana College,,urn:uuid:37c7409e-8531-4c23-af98-49ca9e190537,https://scan-bugs.org:443/portal/collections/individual/index.php?occid=57343314
57343315,AUGIE,ENT,,120bf21c-d066-48ee-b4c0-880596ea22e4,PreservedSpecimen,3dfcdaf7-ea54-45d9-b897-5f71f72be8ba,AUGIEENTB0000190,,Animalia,Arthropoda,Insecta,Coleoptera,Coccinellidae,Brachiacantha ursina,24421,,Brachiacantha,ursina,,,Veronica Cervantes,8/11/2021,,,,,,Olivia Ruffatto,,7/19/2021,2021,7,19,200,,,,,,,,,,,,,,,,,,,United States,Iowa,Scott,,,,41.509708,90.640451,,,,,,,,,,,,,,,,,ruolivia,8/11/2021 12:43,http://creativecommons.org/licenses/by-nc/4.0/,Augustana College,,urn:uuid:3dfcdaf7-ea54-45d9-b897-5f71f72be8ba,https://scan-bugs.org:443/portal/collections/individual/index.php?occid=57343315
57343321,AUGIE,ENT,,120bf21c-d066-48ee-b4c0-880596ea22e4,PreservedSpecimen,82353358-4069-4c06-8dd7-2cb27a72bbc7,AUGIEENTB0000191,,Animalia,Arthropoda,Insecta,Coleoptera,Coccinellidae,Brachiacantha ursina,24421,,Brachiacantha,ursina,,,Veronica Cervantes,8/11/2021,,,,,,Jack Hughes,,7/20/2021,2021,7,20,201,,,,,,,,,,,,,,,,,,,United States,Iowa,Scott,,,,41.509708,90.640451,,,,,,,,,,,,,,,,,ruolivia,8/11/2021 12:45,http://creativecommons.org/licenses/by-nc/4.0/,Augustana College,,urn:uuid:82353358-4069-4c06-8dd7-2cb27a72bbc7,https://scan-bugs.org:443/portal/collections/individual/index.php?occid=57343321
57343363,AUGIE,ENT,,120bf21c-d066-48ee-b4c0-880596ea22e4,PreservedSpecimen,2f135918-2aa5-498b-b9a6-d8e168f35362,AUGIEENTB0000192,,Animalia,Arthropoda,Insecta,Coleoptera,Coccinellidae,Harmonia axyridis,27230,"(Pallas, 1773)",Harmonia,axyridis,,,O. Ruffatto,7/22/2021,,,,,,M. Gorsegner,,7/21/2021,2021,7,21,202,,,,,,,,,,,,,,,,,,,United States,Iowa,Scott,,,,41.489621,90.635952,,,,,,,,,,,,,,,,,ruolivia,7/22/2021 8:19,http://creativecommons.org/licenses/by-nc/4.0/,Augustana College,,urn:uuid:2f135918-2aa5-498b-b9a6-d8e168f35362,https://scan-bugs.org:443/portal/collections/individual/index.php?occid=57343363
57343366,AUGIE,ENT,,120bf21c-d066-48ee-b4c0-880596ea22e4,PreservedSpecimen,0b6fb3df-fdc6-4b82-bc22-1a8eba82581a,AUGIEENTB0000193,,Animalia,Arthropoda,Insecta,Coleoptera,Coccinellidae,Harmonia axyridis,27230,"(Pallas, 1773)",Harmonia,axyridis,,,O. Ruffatto,7/22/2021,,,,,,M. Gorsegner,,7/21/2021,2021,7,21,202,,,,,,,,,,,,,,,,,,,United States,Iowa,Scott,,,,41.489621,90.635952,,,,,,,,,,,,,,,,,ruolivia,7/22/2021 8:20,http://creativecommons.org/licenses/by-nc/4.0/,Augustana College,,urn:uuid:0b6fb3df-fdc6-4b82-bc22-1a8eba82581a,https://scan-bugs.org:443/portal/collections/individual/index.php?occid=57343366
57343367,AUGIE,ENT,,120bf21c-d066-48ee-b4c0-880596ea22e4,PreservedSpecimen,2b078c9f-8a22-4b71-b635-0e7b94b25cce,AUGIEENTB0000194,,Animalia,Arthropoda,Insecta,Coleoptera,Coccinellidae,Harmonia axyridis,27230,"(Pallas, 1773)",Harmonia,axyridis,,,O. Ruffatto,7/22/2021,,,,,,J. Hughes,,7/21/2021,2021,7,21,202,,,,,,,,,,,,,,,,,,,United States,Iowa,Scott,,,,41.489621,90.635952,,,,,,,,,,,,,,,,,ruolivia,7/22/2021 8:21,http://creativecommons.org/licenses/by-nc/4.0/,Augustana College,,urn:uuid:2b078c9f-8a22-4b71-b635-0e7b94b25cce,https://scan-bugs.org:443/portal/collections/individual/index.php?occid=57343367
57343368,AUGIE,ENT,,120bf21c-d066-48ee-b4c0-880596ea22e4,PreservedSpecimen,b32c7883-3023-4632-8b42-29e9a05a3e61,AUGIEENTB0000195,,Animalia,Arthropoda,Insecta,Coleoptera,Coccinellidae,Harmonia axyridis,27230,"(Pallas, 1773)",Harmonia,axyridis,,,O. Ruffatto,7/22/2021,,,,,,J. Hughes,,7/21/2021,2021,7,21,202,,,,,,,,,,,,,,,,,,,United States,Iowa,Scott,,,,41.489621,90.635952,,,,,,,,,,,,,,,,,ruolivia,7/22/2021 8:21,http://creativecommons.org/licenses/by-nc/4.0/,Augustana College,,urn:uuid:b32c7883-3023-4632-8b42-29e9a05a3e61,https://scan-bugs.org:443/portal/collections/individual/index.php?occid=57343368
57343369,AUGIE,ENT,,120bf21c-d066-48ee-b4c0-880596ea22e4,PreservedSpecimen,43d72f13-6b8f-4d99-bc27-5a99e68ff1f9,AUGIEENTB0000196,,Animalia,Arthropoda,Insecta,Coleoptera,Coccinellidae,Harmonia axyridis,27230,"(Pallas, 1773)",Harmonia,axyridis,,,O. Ruffatto,7/22/2021,,,,,,O. Ruffatto,,7/21/2021,2021,7,21,202,,,,,,,,,,,,,,,,,,,United States,Iowa,Scott,,,,41.489621,90.635952,,,,,,,,,,,,,,,,,ruolivia,7/22/2021 8:22,http://creativecommons.org/licenses/by-nc/4.0/,Augustana College,,urn:uuid:43d72f13-6b8f-4d99-bc27-5a99e68ff1f9,https://scan-bugs.org:443/portal/collections/individual/index.php?occid=57343369
57343372,AUGIE,ENT,,120bf21c-d066-48ee-b4c0-880596ea22e4,PreservedSpecimen,d95f2bd0-f9d9-4cca-bdad-b8ea59fecd6f,AUGIEENTB0000197,,Animalia,Arthropoda,Insecta,Coleoptera,Coccinellidae,Harmonia axyridis,27230,"(Pallas, 1773)",Harmonia,axyridis,,,O. Ruffatto,7/22/2021,,,,,,V. Cervantes,,7/21/2021,2021,7,21,202,,,,,,,,,,,,,,,,,,,United States,Iowa,Scott,,,,41.489621,90.635952,,,,,,,,,,,,,,,,,ruolivia,7/22/2021 8:23,http://creativecommons.org/licenses/by-nc/4.0/,Augustana College,,urn:uuid:d95f2bd0-f9d9-4cca-bdad-b8ea59fecd6f,https://scan-bugs.org:443/portal/collections/individual/index.php?occid=57343372
57343373,AUGIE,ENT,,120bf21c-d066-48ee-b4c0-880596ea22e4,PreservedSpecimen,fe6b30b5-9284-48b8-93b8-faf73a24be1e,AUGIEENTB0000198,,Animalia,Arthropoda,Insecta,Coleoptera,Coccinellidae,Harmonia axyridis,27230,"(Pallas, 1773)",Harmonia,axyridis,,,O. Ruffatto,7/22/2021,,,,,,M. Gorsegner,,7/21/2021,2021,7,21,202,,,,,,,,,,,,,,,,,,,United States,Iowa,Scott,,,,41.489621,90.635952,,,,,,,,,,,,,,,,,ruolivia,7/22/2021 8:26,http://creativecommons.org/licenses/by-nc/4.0/,Augustana College,,urn:uuid:fe6b30b5-9284-48b8-93b8-faf73a24be1e,https://scan-bugs.org:443/portal/collections/individual/index.php?occid=57343373
57343375,AUGIE,ENT,,120bf21c-d066-48ee-b4c0-880596ea22e4,PreservedSpecimen,caa08391-35c6-4203-a75d-b2816b98a281,AUGIEENTB0000199,,Animalia,Arthropoda,Insecta,Coleoptera,Coccinellidae,Harmonia axyridis,27230,"(Pallas, 1773)",Harmonia,axyridis,,,O. Ruffatto,7/22/2021,,,,,,V. Cervantes,,7/21/2021,2021,7,21,202,,,,,,,,,,,,,,,,,,,United States,Iowa,Scott,,,,41.489621,90.635952,,,,,,,,,,,,,,,,,ruolivia,7/22/2021 8:25,http://creativecommons.org/licenses/by-nc/4.0/,Augustana College,,urn:uuid:caa08391-35c6-4203-a75d-b2816b98a281,https://scan-bugs.org:443/portal/collections/individual/index.php?occid=57343375
57343380,AUGIE,ENT,,120bf21c-d066-48ee-b4c0-880596ea22e4,PreservedSpecimen,5da67df7-b95b-4570-8b1f-4e271f104949,AUGIEENTB0000200,,Animalia,Arthropoda,Insecta,Coleoptera,Coccinellidae,Harmonia axyridis,27230,"(Pallas, 1773)",Harmonia,axyridis,,,O. Ruffatto,7/22/2021,,,,,,M. Gorsegner,,7/21/2021,2021,7,21,202,,,,,,,,,,,,,,,,,,,United States,Iowa,Scott,,,,41.489621,90.635952,,,,,,,,,,,,,,,,,ruolivia,7/22/2021 8:27,http://creativecommons.org/licenses/by-nc/4.0/,Augustana College,,urn:uuid:5da67df7-b95b-4570-8b1f-4e271f104949,https://scan-bugs.org:443/portal/collections/individual/index.php?occid=57343380
57343381,AUGIE,ENT,,120bf21c-d066-48ee-b4c0-880596ea22e4,PreservedSpecimen,73bf5151-2275-4d84-ae40-ed34c04ae346,AUGIEENTB0000201,,Animalia,Arthropoda,Insecta,Coleoptera,Coccinellidae,Harmonia axyridis,27230,"(Pallas, 1773)",Harmonia,axyridis,,,O. Ruffatto,7/22/2021,,,,,,O. Ruffatto,,7/21/2021,2021,7,21,202,,,,,,,,,,,,,,,,,,,United States,Iowa,Scott,,,,41.489621,90.635952,,,,,,,,,,,,,,,,,ruolivia,7/22/2021 8:30,http://creativecommons.org/licenses/by-nc/4.0/,Augustana College,,urn:uuid:73bf5151-2275-4d84-ae40-ed34c04ae346,https://scan-bugs.org:443/portal/collections/individual/index.php?occid=57343381
57343382,AUGIE,ENT,,120bf21c-d066-48ee-b4c0-880596ea22e4,PreservedSpecimen,29832b37-967c-4691-a1fa-3d6633dc65e3,AUGIEENTB0000202,,Animalia,Arthropoda,Insecta,Coleoptera,Coccinellidae,Harmonia axyridis,27230,"(Pallas, 1773)",Harmonia,axyridis,,,O. Ruffatto,7/22/2021,,,,,,O. Ruffatto,,7/21/2021,2021,7,21,202,,,,,,,,,,,,,,,,,,,United States,Iowa,Scott,,,,41.489621,90.635952,,,,,,,,,,,,,,,,,ruolivia,7/22/2021 8:30,http://creativecommons.org/licenses/by-nc/4.0/,Augustana College,,urn:uuid:29832b37-967c-4691-a1fa-3d6633dc65e3,https://scan-bugs.org:443/portal/collections/individual/index.php?occid=57343382
57343385,AUGIE,ENT,,120bf21c-d066-48ee-b4c0-880596ea22e4,PreservedSpecimen,203ffc96-6dc5-4451-9861-d72dbaa64f56,AUGIEENTB0000203,,Animalia,Arthropoda,Insecta,Coleoptera,Coccinellidae,Harmonia axyridis,27230,"(Pallas, 1773)",Harmonia,axyridis,,,O. Ruffatto,7/22/2021,,,,,,V. Cervantes,,7/21/2021,2021,7,21,202,,,,,,,,,,,,,,,,,,,United States,Iowa,Scott,,,,41.489621,90.635952,,,,,,,,,,,,,,,,,ruolivia,7/22/2021 8:32,http://creativecommons.org/licenses/by-nc/4.0/,Augustana College,,urn:uuid:203ffc96-6dc5-4451-9861-d72dbaa64f56,https://scan-bugs.org:443/portal/collections/individual/index.php?occid=57343385
57343387,AUGIE,ENT,,120bf21c-d066-48ee-b4c0-880596ea22e4,PreservedSpecimen,5276e2aa-f4aa-441d-8622-27453a47d3c5,AUGIEENTB0000204,,Animalia,Arthropoda,Insecta,Coleoptera,Coccinellidae,harmonia axyridis,27230,"(Pallas, 1773)",Harmonia,axyridis,,,,,,,,,,J. Hughes,,7/21/2021,2021,7,21,202,,,,,,,,,,,,,,,,,,,United States,Iowa,Scott,,,,41.489621,90.635952,,,,,,,,,,,,,,,,,ruolivia,7/22/2021 8:32,http://creativecommons.org/licenses/by-nc/4.0/,Augustana College,,urn:uuid:5276e2aa-f4aa-441d-8622-27453a47d3c5,https://scan-bugs.org:443/portal/collections/individual/index.php?occid=57343387
57343388,AUGIE,ENT,,120bf21c-d066-48ee-b4c0-880596ea22e4,PreservedSpecimen,61857cc0-c833-4451-b8e7-8ff8afa4df36,AUGIEENTB0000205,,Animalia,Arthropoda,Insecta,Coleoptera,Coccinellidae,Harmonia axyridis,27230,"(Pallas, 1773)",Harmonia,axyridis,,,O. Ruffatto,7/22/2021,,,,,,V. Cervantes,,7/21/2021,2021,7,21,202,,,,,,,,,,,,,,,,,,,United States,Iowa,Scott,,,,41.489621,90.635952,,,,,,,,,,,,,,,,,ruolivia,7/22/2021 8:33,http://creativecommons.org/licenses/by-nc/4.0/,Augustana College,,urn:uuid:61857cc0-c833-4451-b8e7-8ff8afa4df36,https://scan-bugs.org:443/portal/collections/individual/index.php?occid=57343388
57343392,AUGIE,ENT,,120bf21c-d066-48ee-b4c0-880596ea22e4,PreservedSpecimen,fd1ba9b8-c130-4ef4-bf00-7a6c30b9df77,AUGIEENTB0000206,,Animalia,Arthropoda,Insecta,Coleoptera,Coccinellidae,Harmonia axyridis,27230,"(Pallas, 1773)",Harmonia,axyridis,,,O. Ruffatto,7/22/2021,,,,,,M. Gorsegner,,7/21/2021,2021,7,21,202,,,,,,,,,,,,,,,,,,,United States,Iowa,Scott,,,,41.489621,90.635952,,,,,,,,,,,,,,,,,ruolivia,7/22/2021 8:35,http://creativecommons.org/licenses/by-nc/4.0/,Augustana College,,urn:uuid:fd1ba9b8-c130-4ef4-bf00-7a6c30b9df77,https://scan-bugs.org:443/portal/collections/individual/index.php?occid=57343392
57343397,AUGIE,ENT,,120bf21c-d066-48ee-b4c0-880596ea22e4,PreservedSpecimen,44a0c345-d754-42f2-8ade-45006e71b3dd,AUGIEENTB0000207,,Animalia,Arthropoda,Insecta,Coleoptera,Coccinellidae,Harmonia axyridis,27230,"(Pallas, 1773)",Harmonia,axyridis,,,O. Ruffatto,7/22/2021,,,,,,M. Gorsegner,,7/21/2021,2021,7,21,202,,,,,,,,,,,,,,,,,,,United States,Iowa,Scott,,,,41.489621,90.635952,,,,,,,,,,,,,,,,,ruolivia,7/22/2021 8:36,http://creativecommons.org/licenses/by-nc/4.0/,Augustana College,,urn:uuid:44a0c345-d754-42f2-8ade-45006e71b3dd,https://scan-bugs.org:443/portal/collections/individual/index.php?occid=57343397
57343402,AUGIE,ENT,,120bf21c-d066-48ee-b4c0-880596ea22e4,PreservedSpecimen,e104392d-7413-4b79-94fe-415596052ace,AUGIEENTB0000208,,Animalia,Arthropoda,Insecta,Coleoptera,Coccinellidae,Harmonia axyridis,27230,"(Pallas, 1773)",Harmonia,axyridis,,,O. Ruffatto,7/22/2021,,,,,,O. Ruffatto,,7/21/2021,2021,7,21,202,,,,,,,,,,,,,,,,,,,United States,Iowa,Scott,,,,41.489621,90.635952,,,,,,,,,,,,,,,,,ruolivia,7/22/2021 8:37,http://creativecommons.org/licenses/by-nc/4.0/,Augustana College,,urn:uuid:e104392d-7413-4b79-94fe-415596052ace,https://scan-bugs.org:443/portal/collections/individual/index.php?occid=57343402
57343404,AUGIE,ENT,,120bf21c-d066-48ee-b4c0-880596ea22e4,PreservedSpecimen,e003f2f9-622c-4d84-8cab-8cac1f602365,AUGIEENTB0000209,,Animalia,Arthropoda,Insecta,Coleoptera,Coccinellidae,Coccinella septempunctata,25520,"(Linnaeus, 1758)",Coccinella,septempunctata,,,,,,,,,,J. Hughes,,7/21/2021,2021,7,21,202,,,,,,,,,,,,,,,,,,,United States,Iowa,Scott,,,,41.489621,90.635952,,,,,,,,,,,,,,,,,ruolivia,7/22/2021 8:39,http://creativecommons.org/licenses/by-nc/4.0/,Augustana College,,urn:uuid:e003f2f9-622c-4d84-8cab-8cac1f602365,https://scan-bugs.org:443/portal/collections/individual/index.php?occid=57343404
57343407,AUGIE,ENT,,120bf21c-d066-48ee-b4c0-880596ea22e4,PreservedSpecimen,c96d6dd8-3235-45e1-a551-a6b7bc80c5df,AUGIEENTB0000210,,Animalia,Arthropoda,Insecta,Coleoptera,Coccinellidae,Coccinella septempunctata,25520,"(Linnaeus, 1758)",Coccinella,septempunctata,,,O. Ruffatto,7/22/2021,,,,,,J. Hughes,,7/21/2021,2021,7,21,202,,,,,,,,,,,,,,,,,,,United States,Iowa,Scott,,,,41.489621,90.635952,,,,,,,,,,,,,,,,,ruolivia,7/22/2021 8:41,http://creativecommons.org/licenses/by-nc/4.0/,Augustana College,,urn:uuid:c96d6dd8-3235-45e1-a551-a6b7bc80c5df,https://scan-bugs.org:443/portal/collections/individual/index.php?occid=57343407
57343408,AUGIE,ENT,,120bf21c-d066-48ee-b4c0-880596ea22e4,PreservedSpecimen,e5975e2c-7b69-4b6d-b009-225e47c1407e,AUGIEENTB0000211,,Animalia,Arthropoda,Insecta,Coleoptera,Coccinellidae,Coccinella septempunctata,25520,"(Linnaeus, 1758)",Coccinella,septempunctata,,,,,,,,,,V. Cervantes,,7/21/2021,2021,7,21,202,,,,,,,,,,,,,,,,,,,United States,Iowa,Scott,,,,41.489621,90.635952,,,,,,,,,,,,,,,,,ruolivia,7/22/2021 8:41,http://creativecommons.org/licenses/by-nc/4.0/,Augustana College,,urn:uuid:e5975e2c-7b69-4b6d-b009-225e47c1407e,https://scan-bugs.org:443/portal/collections/individual/index.php?occid=57343408
57343413,AUGIE,ENT,,120bf21c-d066-48ee-b4c0-880596ea22e4,PreservedSpecimen,e693b5a6-08fb-4bed-ad4d-5a8d583e4deb,AUGIEENTB0000212,,Animalia,Arthropoda,Insecta,Coleoptera,Coccinellidae,Coccinella septempunctata,25520,"(Linnaeus, 1758)",Coccinella,septempunctata,,,O. Ruffatto,7/22/2021,,,,,,O. Ruffatto,,7/21/2021,2021,7,21,202,,,,,,,,,,,,,,,,,,,United States,Iowa,Scott,,,,41.489621,90.635952,,,,,,,,,,,,,,,,,ruolivia,7/22/2021 8:43,http://creativecommons.org/licenses/by-nc/4.0/,Augustana College,,urn:uuid:e693b5a6-08fb-4bed-ad4d-5a8d583e4deb,https://scan-bugs.org:443/portal/collections/individual/index.php?occid=57343413
57343420,AUGIE,ENT,,120bf21c-d066-48ee-b4c0-880596ea22e4,PreservedSpecimen,831f74da-b5d1-454b-a13c-3afdf9c773b1,AUGIEENTB0000213,,Animalia,Arthropoda,Insecta,Coleoptera,Coccinellidae,Cycloneda munda,25911,,Cycloneda,munda,,,O. Ruffatto,7/22/2021,,,,,,J. Hughes,,7/21/2021,2021,7,21,202,,,,,,,,,,,,,,,,,,,United States,Iowa,Scott,,,,41.489621,90.635952,,,,,,,,,,,,,,,,,ruolivia,7/22/2021 8:44,http://creativecommons.org/licenses/by-nc/4.0/,Augustana College,,urn:uuid:831f74da-b5d1-454b-a13c-3afdf9c773b1,https://scan-bugs.org:443/portal/collections/individual/index.php?occid=57343420
57343428,AUGIE,ENT,,120bf21c-d066-48ee-b4c0-880596ea22e4,PreservedSpecimen,80a8246e-9ff3-4731-8cf3-b32ba22feb78,AUGIEENTB0000214,,Animalia,Arthropoda,Insecta,Coleoptera,Coccinellidae,Hippodamia parenthesis,27400,,Hippodamia,parenthesis,,,O. Ruffatto,7/22/2021,,,,,,V. Cervantes,,7/21/2021,2021,7,21,202,,,,,,,,,,,,,,,,,,,United States,Illinois,Rock Island,,,,41.4355,90.510444,,,,,,,,,,,,,,,,,ruolivia,7/22/2021 8:48,http://creativecommons.org/licenses/by-nc/4.0/,Augustana College,,urn:uuid:80a8246e-9ff3-4731-8cf3-b32ba22feb78,https://scan-bugs.org:443/portal/collections/individual/index.php?occid=57343428
57343430,AUGIE,ENT,,120bf21c-d066-48ee-b4c0-880596ea22e4,PreservedSpecimen,1cbf82e5-275c-47ac-ad8c-c69dc9dac217,AUGIEENTB0000215,,Animalia,Arthropoda,Insecta,Coleoptera,Coccinellidae,Propylea quatuordecimpunctata,613667,(Linneus 1758),Propylea,quatuordecimpunctata,,,V. Cervantes,8/5/2021,,,,,,O. Ruffatto,,7/21/2021,2021,7,21,202,,,,,,,,,,,,,,,,,,,United States,Iowa,Scott,,,,41.567938,90.5591,,,,,,,,,,,,,,,,,ruolivia,8/5/2021 11:14,http://creativecommons.org/licenses/by-nc/4.0/,Augustana College,,urn:uuid:1cbf82e5-275c-47ac-ad8c-c69dc9dac217,https://scan-bugs.org:443/portal/collections/individual/index.php?occid=57343430
57343435,AUGIE,ENT,,120bf21c-d066-48ee-b4c0-880596ea22e4,PreservedSpecimen,66488b6e-e07f-48a4-a415-9345844e50c3,AUGIEENTB0000216,,Animalia,Arthropoda,Insecta,Coleoptera,Coccinellidae,Hippodamia parenthesis,27400,,Hippodamia,parenthesis,,,O. Ruffatto,7/22/2021,,,,,,J. Hughes,,7/21/2021,2021,7,21,202,,,,,,,,,,,,,,,,,,,United States,Iowa,Scott,,,,41.567938,90.5591,,,,,,,,,,,,,,,,,ruolivia,7/22/2021 8:52,http://creativecommons.org/licenses/by-nc/4.0/,Augustana College,,urn:uuid:66488b6e-e07f-48a4-a415-9345844e50c3,https://scan-bugs.org:443/portal/collections/individual/index.php?occid=57343435
57343442,AUGIE,ENT,,120bf21c-d066-48ee-b4c0-880596ea22e4,PreservedSpecimen,111de3f1-3f75-4480-b590-d2eb479bf42a,AUGIEENTB0000217,,Animalia,Arthropoda,Insecta,Coleoptera,Coccinellidae,Cycloneda munda,25911,,Cycloneda,munda,,,O. Ruffatto,7/22/2021,,,,,,M. Gorsegner,,7/21/2021,2021,7,21,202,,,,,,,,,,,,,,,,,,,United States,Iowa,Scott,,,,41.567938,90.5591,,,,,,,,,,,,,,,,,ruolivia,7/22/2021 8:53,http://creativecommons.org/licenses/by-nc/4.0/,Augustana College,,urn:uuid:111de3f1-3f75-4480-b590-d2eb479bf42a,https://scan-bugs.org:443/portal/collections/individual/index.php?occid=57343442
57343444,AUGIE,ENT,,120bf21c-d066-48ee-b4c0-880596ea22e4,PreservedSpecimen,a879da2c-af0e-4db7-8681-c8f30fb921c0,AUGIEENTB0000218,,Animalia,Arthropoda,Insecta,Coleoptera,Coccinellidae,Psyllobora vigintimaculata,31188,,Psyllobora,vigintimaculata,,,Veronica Cervantes,8/16/2021,,,,,,V. Cervantes,,7/21/2021,2021,7,21,202,,,,,,,,,,,,,,,,,,,United States,Illinois,Rock Island,,,,41.436864,90.552542,,,,,,,,,,,,,,,,,ruolivia,8/16/2021 6:54,http://creativecommons.org/licenses/by-nc/4.0/,Augustana College,,urn:uuid:a879da2c-af0e-4db7-8681-c8f30fb921c0,https://scan-bugs.org:443/portal/collections/individual/index.php?occid=57343444
57343446,AUGIE,ENT,,120bf21c-d066-48ee-b4c0-880596ea22e4,PreservedSpecimen,4e763cf3-47f6-4096-9d05-16fedfcebf73,AUGIEENTB0000219,,Animalia,Arthropoda,Insecta,Coleoptera,Coccinellidae,Cycloneda munda,25911,,Cycloneda,munda,,,Olivia Ruffatto,8/11/2021,,,,,,M. Gorsegner,,7/21/2021,2021,7,21,202,,,,,,,,,,,,,,,,,,,United States,Illinois,Rock Island,,,,41.436864,90.552542,,,,,,,,,,,,,,,,,ruolivia,8/16/2021 6:49,http://creativecommons.org/licenses/by-nc/4.0/,Augustana College,,urn:uuid:4e763cf3-47f6-4096-9d05-16fedfcebf73,https://scan-bugs.org:443/portal/collections/individual/index.php?occid=57343446
57343447,AUGIE,ENT,,120bf21c-d066-48ee-b4c0-880596ea22e4,PreservedSpecimen,58cb279a-af44-482b-a194-afc1fd11150e,AUGIEENTB0000220,,Animalia,Arthropoda,Insecta,Coleoptera,Coccinellidae,Harmonia axyridis,27230,"(Pallas, 1773)",Harmonia,axyridis,,,O. Ruffatto,,,,,3,,M. Gorsegner,,7/21/2021,2021,7,21,202,,,,,,,,,,,,,,,,,,,United States,Illinois,Rock Island,,,,40.506216,90.553531,,,,,,,,,,,,,,,,,ruolivia,7/22/2021 9:00,http://creativecommons.org/licenses/by-nc/4.0/,Augustana College,,urn:uuid:58cb279a-af44-482b-a194-afc1fd11150e,https://scan-bugs.org:443/portal/collections/individual/index.php?occid=57343447
57343461,AUGIE,ENT,,120bf21c-d066-48ee-b4c0-880596ea22e4,PreservedSpecimen,972f0cdf-4ae9-48db-ba80-8dfd5af9dad7,AUGIEENTB0000221,,Animalia,Arthropoda,Insecta,Coleoptera,Coccinellidae,Coleomegilla maculata,25547,,Coleomegilla,maculata,,,O. Ruffatto,,,,,,,J. Hughes,,7/21/2021,2021,7,21,202,,,,,,,,,,,,,,,,,,,United States,Iowa,Scott,,,,41.54693,90.552795,,,,,,,,,,,,,,,,,ruolivia,7/22/2021 9:04,http://creativecommons.org/licenses/by-nc/4.0/,Augustana College,,urn:uuid:972f0cdf-4ae9-48db-ba80-8dfd5af9dad7,https://scan-bugs.org:443/portal/collections/individual/index.php?occid=57343461
57343467,AUGIE,ENT,,120bf21c-d066-48ee-b4c0-880596ea22e4,PreservedSpecimen,0a82e021-676b-4a0e-a2da-f919d17fdff6,AUGIEENTB0000222,,Animalia,Arthropoda,Insecta,Coleoptera,Coccinellidae,Coleomegilla maculata,25547,,Coleomegilla,maculata,,,O. Ruffatto,7/22/2021,,,,,,O. Ruffatto,,7/21/2021,2021,7,21,202,,,,,,,,,,,,,,,,,,,United States,Iowa,Scott,,,,41.54693,90.552795,,,,,,,,,,,,,,,,,ruolivia,7/22/2021 9:06,http://creativecommons.org/licenses/by-nc/4.0/,Augustana College,,urn:uuid:0a82e021-676b-4a0e-a2da-f919d17fdff6,https://scan-bugs.org:443/portal/collections/individual/index.php?occid=57343467
57343468,AUGIE,ENT,,120bf21c-d066-48ee-b4c0-880596ea22e4,PreservedSpecimen,a931d17d-42aa-4dcf-bf4e-7cec986ddee7,AUGIEENTB0000223,,Animalia,Arthropoda,Insecta,Coleoptera,Coccinellidae,Coleomegilla maculata,25547,,Coleomegilla,maculata,,,O. Ruffatto,7/22/2021,,,,,,V. Cervantes,,7/21/2021,2021,7,21,202,,,,,,,,,,,,,,,,,,,United States,Iowa,Scott,,,,41.54693,90.552795,,,,,,,,,,,,,,,,,ruolivia,7/22/2021 9:06,http://creativecommons.org/licenses/by-nc/4.0/,Augustana College,,urn:uuid:a931d17d-42aa-4dcf-bf4e-7cec986ddee7,https://scan-bugs.org:443/portal/collections/individual/index.php?occid=57343468
57343469,AUGIE,ENT,,120bf21c-d066-48ee-b4c0-880596ea22e4,PreservedSpecimen,5cd032f6-b3aa-42d7-8cdd-6b9aa7776dce,AUGIEENTB0000224,,Animalia,Arthropoda,Insecta,Coleoptera,Coccinellidae,Coleomegilla maculata,25547,,Coleomegilla,maculata,,,O. Ruffatto,7/22/2021,,,,,,M. Gorsegner,,7/21/2021,2021,7,21,202,,,,,,,,,,,,,,,,,,,United States,Iowa,Scott,,,,41.54693,90.552795,,,,,,,,,,,,,,,,,ruolivia,7/22/2021 9:07,http://creativecommons.org/licenses/by-nc/4.0/,Augustana College,,urn:uuid:5cd032f6-b3aa-42d7-8cdd-6b9aa7776dce,https://scan-bugs.org:443/portal/collections/individual/index.php?occid=57343469
57343471,AUGIE,ENT,,120bf21c-d066-48ee-b4c0-880596ea22e4,PreservedSpecimen,145639d2-a38b-43ff-9262-b4e544a115cc,AUGIEENTB0000225,,Animalia,Arthropoda,Insecta,Coleoptera,Coccinellidae,Coleomegilla maculata,25547,,Coleomegilla,maculata,,,O. Ruffatto,7/22/2021,,,,,,J. Hughes,,7/21/2021,2021,7,21,202,,,,,,,,,,,,,,,,,,,United States,Iowa,Scott,,,,41.54693,90.552795,,,,,,,,,,,,,,,,,ruolivia,7/22/2021 9:08,http://creativecommons.org/licenses/by-nc/4.0/,Augustana College,,urn:uuid:145639d2-a38b-43ff-9262-b4e544a115cc,https://scan-bugs.org:443/portal/collections/individual/index.php?occid=57343471
57343474,AUGIE,ENT,,120bf21c-d066-48ee-b4c0-880596ea22e4,PreservedSpecimen,e8ae3fa9-7f6f-471f-8eac-ae32811223c4,AUGIEENTB0000226,,Animalia,Arthropoda,Insecta,Coleoptera,Coccinellidae,Coleomegilla maculata,25547,,Coleomegilla,maculata,,,O. Ruffatto,7/22/2021,,,,,,O. Ruffatto,,7/21/2021,2021,7,21,202,,,,,,,,,,,,,,,,,,,United States,Iowa,Scott,,,,41.54693,90.552795,,,,,,,,,,,,,,,,,ruolivia,7/22/2021 9:09,http://creativecommons.org/licenses/by-nc/4.0/,Augustana College,,urn:uuid:e8ae3fa9-7f6f-471f-8eac-ae32811223c4,https://scan-bugs.org:443/portal/collections/individual/index.php?occid=57343474
57343476,AUGIE,ENT,,120bf21c-d066-48ee-b4c0-880596ea22e4,PreservedSpecimen,9a4fa2f4-773a-4e8e-a7be-b11690538c8e,AUGIEENTB0000227,,Animalia,Arthropoda,Insecta,Coleoptera,Coccinellidae,Coleomegilla maculata,25547,,Coleomegilla,maculata,,,O. Ruffatto,7/22/2021,,,,,,M. Gorsegner,,7/21/2021,2021,7,21,202,,,,,,,,,,,,,,,,,,,United States,Iowa,Scott,,,,41.54693,90.552795,,,,,,,,,,,,,,,,,ruolivia,7/22/2021 9:09,http://creativecommons.org/licenses/by-nc/4.0/,Augustana College,,urn:uuid:9a4fa2f4-773a-4e8e-a7be-b11690538c8e,https://scan-bugs.org:443/portal/collections/individual/index.php?occid=57343476
57343477,AUGIE,ENT,,120bf21c-d066-48ee-b4c0-880596ea22e4,PreservedSpecimen,4aae2203-e216-4a31-bc96-6d00c32fa489,AUGIEENTB0000228,,Animalia,Arthropoda,Insecta,Coleoptera,Coccinellidae,Coleomegilla maculata,25547,,Coleomegilla,maculata,,,O. Ruffatto,,,,,,,O. Ruffatto,,7/21/2021,2021,7,21,202,,,,,,,,,,,,,,,,,,,United States,Iowa,Scott,,,,41.54693,90.552795,,,,,,,,,,,,,,,,,ruolivia,7/22/2021 9:10,http://creativecommons.org/licenses/by-nc/4.0/,Augustana College,,urn:uuid:4aae2203-e216-4a31-bc96-6d00c32fa489,https://scan-bugs.org:443/portal/collections/individual/index.php?occid=57343477
57343478,AUGIE,ENT,,120bf21c-d066-48ee-b4c0-880596ea22e4,PreservedSpecimen,6c96fd8f-e63c-4c75-a798-aca4ec00a018,AUGIEENTB0000229,,Animalia,Arthropoda,Insecta,Coleoptera,Coccinellidae,Coleomegilla maculata,25547,,Coleomegilla,maculata,,,O. Ruffatto,7/22/2021,,,,,,V. Cervantes,,7/21/2021,2021,7,21,202,,,,,,,,,,,,,,,,,,,United States,Iowa,Scott,,,,41.54693,90.552795,,,,,,,,,,,,,,,,,ruolivia,7/22/2021 9:11,http://creativecommons.org/licenses/by-nc/4.0/,Augustana College,,urn:uuid:6c96fd8f-e63c-4c75-a798-aca4ec00a018,https://scan-bugs.org:443/portal/collections/individual/index.php?occid=57343478
57343491,AUGIE,ENT,,120bf21c-d066-48ee-b4c0-880596ea22e4,PreservedSpecimen,40ad5c80-af74-4700-8ffa-0f50d4df71db,AUGIEENTB0000232,,Animalia,Arthropoda,Insecta,Coleoptera,Coccinellidae,Coleomegilla maculata,25547,,Coleomegilla,maculata,,,O. Ruffatto,7/22/2021,,,,,,V. Cervantes,,7/21/2021,2021,7,21,202,,,,,,,,,,,,,,,,,,,United States,Illinois,Rock Island,,,,41.509388,90.491046,,,,,,,,,,,,,,,,,ruolivia,7/22/2021 9:16,http://creativecommons.org/licenses/by-nc/4.0/,Augustana College,,urn:uuid:40ad5c80-af74-4700-8ffa-0f50d4df71db,https://scan-bugs.org:443/portal/collections/individual/index.php?occid=57343491
57343492,AUGIE,ENT,,120bf21c-d066-48ee-b4c0-880596ea22e4,PreservedSpecimen,43ac3d2c-f8b1-4022-9159-a02c87cd375a,AUGIEENTB0000231,,Animalia,Arthropoda,Insecta,Coleoptera,Coccinellidae,Harmonia axyridis,27230,"(Pallas, 1773)",Harmonia,axyridis,,,O. Ruffatto,7/22/2021,,,,,,O. Ruffatto,,7/21/2021,2021,7,21,202,,,,,,,,,,,,,,,,,,,United States,Illinois,Rock Island,,,,41.509388,90.491046,,,,,,,,,,,,,,,,,ruolivia,7/22/2021 9:17,http://creativecommons.org/licenses/by-nc/4.0/,Augustana College,,urn:uuid:43ac3d2c-f8b1-4022-9159-a02c87cd375a,https://scan-bugs.org:443/portal/collections/individual/index.php?occid=57343492
57343493,AUGIE,ENT,,120bf21c-d066-48ee-b4c0-880596ea22e4,PreservedSpecimen,115c1033-78e1-4cb0-8911-ab0669ea6848,AUGIEENTB0000233,,Animalia,Arthropoda,Insecta,Coleoptera,Coccinellidae,Brachiacantha ursina,24421,,Brachiacantha,ursina,,,M. Gorsegner,8/11/2021,,,,,,Jack Hughes,,7/19/2021,2021,7,19,200,,,,,,,,,,,,,,,,,,,United States,Iowa,Scott,,,,41.435905,90.501559,,,,,,,,,,,,,,,,,ruolivia,8/11/2021 12:44,http://creativecommons.org/licenses/by-nc/4.0/,Augustana College,,urn:uuid:115c1033-78e1-4cb0-8911-ab0669ea6848,https://scan-bugs.org:443/portal/collections/individual/index.php?occid=57343493
57350313,AUGIE,ENT,,120bf21c-d066-48ee-b4c0-880596ea22e4,PreservedSpecimen,a507a242-77d6-4579-8503-41304cdfc517,AUGIEENTB0000249,,Animalia,Arthropoda,Insecta,Coleoptera,Coccinellidae,Harmonia axyridis,27230,"(Pallas, 1773)",Harmonia,axyridis,,,Veronica Cervantes,8/16/2021,,,,,,Veronica Cervantes,,8/3/2021,2021,8,3,215,,,,,,,,,,,,,,,,,,,United States,IA,Scott,Davenport,,,41.544137,90.649164,,,,,,,,,,,,,,,,,jackhughes20,8/16/2021 7:06,http://creativecommons.org/licenses/by-nc/4.0/,Augustana College,,urn:uuid:a507a242-77d6-4579-8503-41304cdfc517,https://scan-bugs.org:443/portal/collections/individual/index.php?occid=57350313
57350314,AUGIE,ENT,,120bf21c-d066-48ee-b4c0-880596ea22e4,PreservedSpecimen,103e7f3f-e627-477c-b251-280f73965002,AUGIEENTB0000250,,Animalia,Arthropoda,Insecta,Coleoptera,Coccinellidae,Coleomegilla maculata,25547,,Coleomegilla,maculata,,,Marissa Gorsegner,8/4/2021,,,,,,Marissa Gorsegner,,8/3/2021,2021,8,3,215,,,,,,,,,,,,,,,,,,,United States,IA,Scott,Davenport,,,41.544137,90.649164,,,,,,,,,,,,,,,,,jackhughes20,8/19/2021 12:34,http://creativecommons.org/licenses/by-nc/4.0/,Augustana College,,urn:uuid:103e7f3f-e627-477c-b251-280f73965002,https://scan-bugs.org:443/portal/collections/individual/index.php?occid=57350314
57350316,AUGIE,ENT,,120bf21c-d066-48ee-b4c0-880596ea22e4,PreservedSpecimen,b62374c2-fcbc-45a1-b85c-5688e0a6ed44,AUGIEENTB0000251,,Animalia,Arthropoda,Insecta,Coleoptera,Coccinellidae,Cycloneda munda,25911,,Cycloneda,munda,,,Jack Hughes,8/4/2021,,,,,,Jack Hughes,,8/3/2021,2021,8,3,215,,,,,,,,,,,,,,,,,,,United States,Iowa,Scott,Davenport,,,41.50609,90.73943,,,,,,,,,,,,,,,,,jackhughes20,8/12/2021 8:06,http://creativecommons.org/licenses/by-nc/4.0/,Augustana College,,urn:uuid:b62374c2-fcbc-45a1-b85c-5688e0a6ed44,https://scan-bugs.org:443/portal/collections/individual/index.php?occid=57350316
57350317,AUGIE,ENT,,120bf21c-d066-48ee-b4c0-880596ea22e4,PreservedSpecimen,6dca0051-c7b0-4486-b58d-90d6ee48865d,AUGIEENTB0000252,,Animalia,Arthropoda,Insecta,Coleoptera,Coccinellidae,Cycloneda munda,25911,,Cycloneda,munda,,,Jack Hughes,8/4/2021,,,,,,Olivia Ruffatto,,8/3/2021,2021,8,3,215,,,,,,,,,,,,,,,,,,,United States,IA,Scott,,,,41.50609,90.73943,,,,,,,,,,,,,,,,,jackhughes20,8/4/2021 10:23,http://creativecommons.org/licenses/by-nc/4.0/,Augustana College,,urn:uuid:6dca0051-c7b0-4486-b58d-90d6ee48865d,https://scan-bugs.org:443/portal/collections/individual/index.php?occid=57350317
57350319,AUGIE,ENT,,120bf21c-d066-48ee-b4c0-880596ea22e4,PreservedSpecimen,201498cb-7353-4aec-9a98-89f97ac8fb2a,AUGIEENTB0000253,,Animalia,Arthropoda,Insecta,Coleoptera,Coccinellidae,Harmonia axyridis,27230,"(Pallas, 1773)",Harmonia,axyridis,,,Marissa Gorsegner,8/4/2021,,,,,,Jack Hughes,,8/3/2021,2021,8,3,215,,,,,,,,,,,,,,,,,,,United States,IA,Scott,,,,41.57974,90.48991,,,,,,,,,,,,,,,,,jackhughes20,8/4/2021 10:26,http://creativecommons.org/licenses/by-nc/4.0/,Augustana College,,urn:uuid:201498cb-7353-4aec-9a98-89f97ac8fb2a,https://scan-bugs.org:443/portal/collections/individual/index.php?occid=57350319
57350321,AUGIE,ENT,,120bf21c-d066-48ee-b4c0-880596ea22e4,PreservedSpecimen,cee82210-fbe2-4168-9e3d-0eb19052c213,AUGIEENTB0000254,,Animalia,Arthropoda,Insecta,Coleoptera,Coccinellidae,Chilocorus stigma,25164,,Chilocorus,stigma,,,Marissa Gorsegner,8/4/2021,,,,,,Veronica Cervantes,,8/3/2021,2021,8,3,215,,,,,,,,,,,,,,,,,,,United States,IA,Scott,,,,41.57847,90.61787,,,,,,,,,,,,,,,,,jackhughes20,8/4/2021 10:31,http://creativecommons.org/licenses/by-nc/4.0/,Augustana College,,urn:uuid:cee82210-fbe2-4168-9e3d-0eb19052c213,https://scan-bugs.org:443/portal/collections/individual/index.php?occid=57350321
57350322,AUGIE,ENT,,120bf21c-d066-48ee-b4c0-880596ea22e4,PreservedSpecimen,b542ce3c-9a0f-444b-90cf-c460d3aecbaa,AUGIEENTB0000246,,Animalia,Arthropoda,Insecta,Coleoptera,Coccinellidae,Coccinella septempunctata,25520,"(Linnaeus, 1758)",Coccinella,septempunctata,,,Veronica Cervantes,8/4/2021,,,,,,M. Gorsegner,,8/3/2021,2021,8,3,215,,,,,,,,,,,,,,,,,,,United States,Iowa,Scott,,,,41.489621,90.635952,,,,,,,,,,,,,,,,,ruolivia,8/19/2021 12:34,http://creativecommons.org/licenses/by-nc/4.0/,Augustana College,,urn:uuid:b542ce3c-9a0f-444b-90cf-c460d3aecbaa,https://scan-bugs.org:443/portal/collections/individual/index.php?occid=57350322
57350323,AUGIE,ENT,,120bf21c-d066-48ee-b4c0-880596ea22e4,PreservedSpecimen,c6b8894a-7c7c-419e-9513-df5ed1c8ac92,AUGIEENTB0000255,,Animalia,Arthropoda,Insecta,Coleoptera,Coccinellidae,Cycloneda munda,25911,,Cycloneda,munda,,,Jack Hughes,8/4/2021,,,,,,Marissa Gorsegner,,8/3/2021,2021,8,3,215,,,,,,,,,,,,,,,,,,,United States,IA,Scott,,,,41.57874,90.61787,,,,,,,,,,,,,,,,,jackhughes20,8/4/2021 10:34,http://creativecommons.org/licenses/by-nc/4.0/,Augustana College,,urn:uuid:c6b8894a-7c7c-419e-9513-df5ed1c8ac92,https://scan-bugs.org:443/portal/collections/individual/index.php?occid=57350323
57350324,AUGIE,ENT,,120bf21c-d066-48ee-b4c0-880596ea22e4,PreservedSpecimen,ee4d69c3-fc47-4f04-9ed7-f173cde43a5b,AUGIEENTB0000247,,Animalia,Arthropoda,Insecta,Coleoptera,Coccinellidae,Coccinella septempunctata,25520,"(Linnaeus, 1758)",Coccinella,septempunctata,,,Veronica Cervantes,8/4/2021,,,,,,Olivia Ruffatto,,8/3/2021,2021,8,3,215,,,,,,,,,,,,,,,,,,,United States,Iowa,Scott,,,,41.489621,90.635952,,,,,,,,,,,,,,,,,ruolivia,8/19/2021 12:34,http://creativecommons.org/licenses/by-nc/4.0/,Augustana College,,urn:uuid:ee4d69c3-fc47-4f04-9ed7-f173cde43a5b,https://scan-bugs.org:443/portal/collections/individual/index.php?occid=57350324
57350325,AUGIE,ENT,,120bf21c-d066-48ee-b4c0-880596ea22e4,PreservedSpecimen,30befe19-e38e-48df-9509-4e2fd16b7bd1,AUGIEENTB0000248,,Animalia,Arthropoda,Insecta,Coleoptera,Coccinellidae,Harmonia axyridis,27230,"(Pallas, 1773)",Harmonia,axyridis,,,Veronica Cervantes,8/4/2021,,,,,,V. Cervantes,,8/3/2021,2021,8,3,215,,,,,,,,,,,,,,,,,,,United States,Iowa,Scott,,,,41.489621,90.635952,,,,,,,,,,,,,,,,,ruolivia,8/19/2021 12:35,http://creativecommons.org/licenses/by-nc/4.0/,Augustana College,,urn:uuid:30befe19-e38e-48df-9509-4e2fd16b7bd1,https://scan-bugs.org:443/portal/collections/individual/index.php?occid=57350325
57350326,AUGIE,ENT,,120bf21c-d066-48ee-b4c0-880596ea22e4,PreservedSpecimen,2d2a855e-6322-4f87-91a1-3ae319e51d7f,AUGIEENTB0000236,,Animalia,Arthropoda,Insecta,Coleoptera,Coccinellidae,Harmonia axyridis,27230,"(Pallas, 1773)",Harmonia,axyridis,,,Veronica Cervantes,8/16/2021,,,,,,J. Hughes,,8/3/2021,2021,8,3,215,,,,,,,,,,,,,,,,,,,United States,Iowa,Scott,,,,41.489621,90.635952,,,,,,,,,,,,,,,,,ruolivia,8/19/2021 12:35,http://creativecommons.org/licenses/by-nc/4.0/,Augustana College,,urn:uuid:2d2a855e-6322-4f87-91a1-3ae319e51d7f,https://scan-bugs.org:443/portal/collections/individual/index.php?occid=57350326
57350327,AUGIE,ENT,,120bf21c-d066-48ee-b4c0-880596ea22e4,PreservedSpecimen,c366404a-d95a-47c2-9196-9f1b02518f4b,AUGIEENTB0000237,,Animalia,Arthropoda,Insecta,Coleoptera,Coccinellidae,Harmonia axyridis,27230,"(Pallas, 1773)",Harmonia,axyridis,,,Veronica Cervantes,8/16/2021,,,,,,O. Ruffatto,,8/3/2021,2021,8,3,215,,,,,,,,,,,,,,,,,,,United States,Iowa,Scott,,,,41.489621,90.635952,,,,,,,,,,,,,,,,,ruolivia,8/19/2021 12:36,http://creativecommons.org/licenses/by-nc/4.0/,Augustana College,,urn:uuid:c366404a-d95a-47c2-9196-9f1b02518f4b,https://scan-bugs.org:443/portal/collections/individual/index.php?occid=57350327
57350328,AUGIE,ENT,,120bf21c-d066-48ee-b4c0-880596ea22e4,PreservedSpecimen,1c92fb07-f67c-4fef-9845-292d7f0830b0,AUGIEENTB0000238,,Animalia,Arthropoda,Insecta,Coleoptera,Coccinellidae,Harmonia axyridis,27230,"(Pallas, 1773)",Harmonia,axyridis,,,Veronica Cervantes,8/16/2021,,,,,,J. Hughes,,8/3/2021,2021,8,3,215,,,,,,,,,,,,,,,,,,,United States,Iowa,Scott,,,,41.489621,90.635952,,,,,,,,,,,,,,,,,ruolivia,8/19/2021 12:36,http://creativecommons.org/licenses/by-nc/4.0/,Augustana College,,urn:uuid:1c92fb07-f67c-4fef-9845-292d7f0830b0,https://scan-bugs.org:443/portal/collections/individual/index.php?occid=57350328
57350329,AUGIE,ENT,,120bf21c-d066-48ee-b4c0-880596ea22e4,PreservedSpecimen,fa6c2257-13ec-45e9-ace1-3f95b033024f,AUGIEENTB0000239,,Animalia,Arthropoda,Insecta,Coleoptera,Coccinellidae,Harmonia axyridis,27230,"(Pallas, 1773)",Harmonia,axyridis,,,Veronica Cervantes,8/4/2021,,,,,,V. Cervantes,,8/3/2021,2021,8,3,215,,,,,,,,,,,,,,,,,,,United States,Iowa,Scott,,,,41.489621,90.635952,,,,,,,,,,,,,,,,,ruolivia,8/19/2021 12:37,http://creativecommons.org/licenses/by-nc/4.0/,Augustana College,,urn:uuid:fa6c2257-13ec-45e9-ace1-3f95b033024f,https://scan-bugs.org:443/portal/collections/individual/index.php?occid=57350329
57350330,AUGIE,ENT,,120bf21c-d066-48ee-b4c0-880596ea22e4,PreservedSpecimen,80448b60-ce39-4730-8697-f1af8c44191a,AUGIEENTB0000256,,Animalia,Arthropoda,Insecta,Coleoptera,Coccinellidae,Coleomegilla maculata,25547,,Coleomegilla,maculata,,,Marissa Gorsegner,8/4/2021,,,,,,Veronica Cervantes,,8/3/2021,2021,8,3,215,,,,,,,,,,,,,,,,,,,United States,IA,Scott,,,,,90.57834,,,,,,,,,,,,,,,,,jackhughes20,8/4/2021 10:43,http://creativecommons.org/licenses/by-nc/4.0/,Augustana College,,urn:uuid:80448b60-ce39-4730-8697-f1af8c44191a,https://scan-bugs.org:443/portal/collections/individual/index.php?occid=57350330
57350331,AUGIE,ENT,,120bf21c-d066-48ee-b4c0-880596ea22e4,PreservedSpecimen,35c0c0b6-28b2-408d-aa4b-ad1c838046ff,AUGIEENTB0000240,,Animalia,Arthropoda,Insecta,Coleoptera,Coccinellidae,Cycloneda munda,25911,,Cycloneda,munda,,,Veronica Cervantes,8/4/2021,,,,,,M. Gorsegner,,8/3/2021,2021,8,3,215,,,,,,,,,,,,,,,,,,,United States,Iowa,Scott,,,,41.56812,41.56812,,,,,,,,,,,,,,,,,ruolivia,8/4/2021 10:43,http://creativecommons.org/licenses/by-nc/4.0/,Augustana College,,urn:uuid:35c0c0b6-28b2-408d-aa4b-ad1c838046ff,https://scan-bugs.org:443/portal/collections/individual/index.php?occid=57350331
57350332,AUGIE,ENT,,120bf21c-d066-48ee-b4c0-880596ea22e4,PreservedSpecimen,a133bea1-3e31-42cc-aa4d-0c8a6397ff56,AUGIEENTB000257,,Animalia,Arthropoda,Insecta,Coleoptera,Coccinellidae,Hippodamia convergens,27393,"Guérin-Méneville, 1842",Hippodamia,convergens,,,Veronica Cervantes,8/19/2021,,,,,,Jack Hughes,,8/3/2021,2021,8,3,215,,,,,,,,,,,,,,,,,,,United States,IA,Scott,,,,41.550606,90.57834,,,,,,,,,,,,,,,,,jackhughes20,8/19/2021 9:33,http://creativecommons.org/licenses/by-nc/4.0/,Augustana College,,urn:uuid:a133bea1-3e31-42cc-aa4d-0c8a6397ff56,https://scan-bugs.org:443/portal/collections/individual/index.php?occid=57350332
57350333,AUGIE,ENT,,120bf21c-d066-48ee-b4c0-880596ea22e4,PreservedSpecimen,05ac5d59-1bf4-49f4-bda1-1f86ba4076af,AUGIEENTB0000241,,Animalia,Arthropoda,Insecta,Coleoptera,Coccinellidae,Coccinella septempunctata,25520,"(Linnaeus, 1758)",Coccinella,septempunctata,,,Veronica Cervantes,8/4/2021,,,,,,M. Gorsegner,,8/3/2021,2021,8,3,215,,,,,,,,,,,,,,,,,,,United States,Iowa,Scott,,,,41.5677,90.52301,,,,,,,,,,,,,,,,,ruolivia,8/4/2021 10:46,http://creativecommons.org/licenses/by-nc/4.0/,Augustana College,,urn:uuid:05ac5d59-1bf4-49f4-bda1-1f86ba4076af,https://scan-bugs.org:443/portal/collections/individual/index.php?occid=57350333
57350334,AUGIE,ENT,,120bf21c-d066-48ee-b4c0-880596ea22e4,PreservedSpecimen,bf1fa3d2-b365-433d-b502-bbdec92cc4eb,AUGIEENTB0000242,,Animalia,Arthropoda,Insecta,Coleoptera,Coccinellidae,Harmonia axyridis,27230,"(Pallas, 1773)",Harmonia,axyridis,,,Veronica Cervantes,8/4/2021,,,,,,V. Cervantes,,8/3/2021,2021,8,3,215,,,,,,,,,,,,,,,,,,,United States,Iowa,Scott,,,,41.5677,90.52301,,,,,,,,,,,,,,,,,ruolivia,8/4/2021 10:47,http://creativecommons.org/licenses/by-nc/4.0/,Augustana College,,urn:uuid:bf1fa3d2-b365-433d-b502-bbdec92cc4eb,https://scan-bugs.org:443/portal/collections/individual/index.php?occid=57350334
57350335,AUGIE,ENT,,120bf21c-d066-48ee-b4c0-880596ea22e4,PreservedSpecimen,d522535d-918e-4365-8571-b112bcab9ca1,AUGIEENTB0000243,,Animalia,Arthropoda,Insecta,Coleoptera,Coccinellidae,Harmonia axyridis,27230,"(Pallas, 1773)",Harmonia,axyridis,,,Veronica Cervantes,8/4/2021,,,,,,O. Ruffatto,,8/3/2021,2021,8,3,215,,,,,,,,,,,,,,,,,,,United States,Iowa,Scott,,,,41.5677,90.52301,,,,,,,,,,,,,,,,,ruolivia,8/4/2021 10:48,http://creativecommons.org/licenses/by-nc/4.0/,Augustana College,,urn:uuid:d522535d-918e-4365-8571-b112bcab9ca1,https://scan-bugs.org:443/portal/collections/individual/index.php?occid=57350335
57350336,AUGIE,ENT,,120bf21c-d066-48ee-b4c0-880596ea22e4,PreservedSpecimen,e7624796-8ef6-4161-8dd8-e7cd43877a63,AUGIEENTB0000244,,Animalia,Arthropoda,Insecta,Coleoptera,Coccinellidae,Hippodamia parenthesis,27400,,Hippodamia,parenthesis,,,Olivia Ruffatto,8/4/2021,,,,,,O. Ruffatto,,8/3/2021,2021,8,3,215,,,,,,,,,,,,,,,,,,,United States,Iowa,Scott,,,,41.5677,90.52301,,,,,,,,,,,,,,,,,ruolivia,8/4/2021 10:49,http://creativecommons.org/licenses/by-nc/4.0/,Augustana College,,urn:uuid:e7624796-8ef6-4161-8dd8-e7cd43877a63,https://scan-bugs.org:443/portal/collections/individual/index.php?occid=57350336
57350337,AUGIE,ENT,,120bf21c-d066-48ee-b4c0-880596ea22e4,PreservedSpecimen,b7907695-df1b-4eb0-8791-ae3c7a84bd5f,AUGIEENTB0000258,,Animalia,Arthropoda,Insecta,Coleoptera,Coccinellidae,Harmonia axyridis,27230,"(Pallas, 1773)",Harmonia,axyridis,,,Marissa Gorsegner,8/4/2021,,,,,,Olivia Ruffatto,,8/3/2021,2021,8,3,215,,8/3/2021,,,,,,,,,,,,,,,,,United States,Iowa,Scott,,,,41.509708,90.640451,,,,,,,,,,,,,,,,,jackhughes20,8/4/2021 13:01,http://creativecommons.org/licenses/by-nc/4.0/,Augustana College,,urn:uuid:b7907695-df1b-4eb0-8791-ae3c7a84bd5f,https://scan-bugs.org:443/portal/collections/individual/index.php?occid=57350337
57350338,AUGIE,ENT,,120bf21c-d066-48ee-b4c0-880596ea22e4,PreservedSpecimen,2cd5b518-a34d-475d-be6d-e5bec8d22b3f,AUGIEENTB0000245,,Animalia,Arthropoda,Insecta,Coleoptera,Coccinellidae,Propylea quatuordecimpunctata,613667,(Linneus 1758),Propylea,quatuordecimpunctata,,,V. Cervantes,8/5/2021,,,,,,J. Hughes,,8/3/2021,2021,8,3,215,,,,,,,,,,,,,,,,,,,United States,Iowa,Scott,,,,41.5677,90.52301,,,,,,,,,,,,,,,,,ruolivia,8/5/2021 13:07,http://creativecommons.org/licenses/by-nc/4.0/,Augustana College,,urn:uuid:2cd5b518-a34d-475d-be6d-e5bec8d22b3f,https://scan-bugs.org:443/portal/collections/individual/index.php?occid=57350338
57350340,AUGIE,ENT,,120bf21c-d066-48ee-b4c0-880596ea22e4,PreservedSpecimen,1791038c-0ffa-423b-9913-b45fef3778fc,AUGIEENTB0000259,,Animalia,Arthropoda,Insecta,Coleoptera,Coccinellidae,Coleomegilla maculata,25547,,Coleomegilla,maculata,,,Veronica Cervantes,8/4/2021,,,,,,V. Cervantes,,8/3/2021,2021,8,3,215,,,,,,,,,,,,,,,,,,,United States,Iowa,Scott,,,,41.5677,90.52301,,,,,,,,,,,,,,,,,ruolivia,8/4/2021 10:51,http://creativecommons.org/licenses/by-nc/4.0/,Augustana College,,urn:uuid:1791038c-0ffa-423b-9913-b45fef3778fc,https://scan-bugs.org:443/portal/collections/individual/index.php?occid=57350340
57350341,AUGIE,ENT,,120bf21c-d066-48ee-b4c0-880596ea22e4,PreservedSpecimen,2137bd4f-61fe-4864-8b5e-d9be288a7281,AUGIEENTB0000269,,Animalia,Arthropoda,Insecta,Coleoptera,Coccinellidae,Harmonia axyridis,27230,"(Pallas, 1773)",Harmonia,axyridis,,,Marissa Gorsegner,,,,,,,Marissa Gorsegner,,8/3/2021,2021,8,3,215,,8/3/2021,,,,,,,,,,,,,,,,,United States,Iowa,Scott,,,,41.509708,90.640451,,,,,,,,,,,,,,,,,jackhughes20,8/4/2021 13:01,http://creativecommons.org/licenses/by-nc/4.0/,Augustana College,,urn:uuid:2137bd4f-61fe-4864-8b5e-d9be288a7281,https://scan-bugs.org:443/portal/collections/individual/index.php?occid=57350341
57350342,AUGIE,ENT,,120bf21c-d066-48ee-b4c0-880596ea22e4,PreservedSpecimen,d7177888-598a-4e29-a70a-fe26baf4db09,AUGIEENTB0000260,,Animalia,Arthropoda,Insecta,Coleoptera,Coccinellidae,Propylea quatuordecimpunctata,613667,(Linneus 1758),Propylea,quatuordecimpunctata,,,V. Cervantes,8/5/2021,,,,,,M. Gorsegner,,8/3/2021,2021,8,3,215,,,,,,,,,,,,,,,,,,,United States,Iowa,Scott,,,,41.5677,90.52301,,,,,,,,,,,,,,,,,ruolivia,8/5/2021 13:07,http://creativecommons.org/licenses/by-nc/4.0/,Augustana College,,urn:uuid:d7177888-598a-4e29-a70a-fe26baf4db09,https://scan-bugs.org:443/portal/collections/individual/index.php?occid=57350342
57350344,AUGIE,ENT,,120bf21c-d066-48ee-b4c0-880596ea22e4,PreservedSpecimen,698cb4b5-863a-4c23-b119-5cdd3dd69ba1,AUGIEENTB0000270,,Animalia,Arthropoda,Insecta,Coleoptera,Coccinellidae,Brachiacantha ursina,24421,,Brachiacantha,ursina,,,Veronica Cervantes,8/16/2021,,,,,,Jack Hughes,,8/3/2021,2021,8,3,215,,8/3/2021,,,,,,,,,,,,,,,,,United States,Iowa,Scott,,,,41.509708,90.640451,,,,,,,,,,,,,,,,,jackhughes20,8/16/2021 7:17,http://creativecommons.org/licenses/by-nc/4.0/,Augustana College,,urn:uuid:698cb4b5-863a-4c23-b119-5cdd3dd69ba1,https://scan-bugs.org:443/portal/collections/individual/index.php?occid=57350344
57350345,AUGIE,ENT,,120bf21c-d066-48ee-b4c0-880596ea22e4,PreservedSpecimen,eb039315-162e-4c0c-9ff7-2cfeb879bc0c,AUGIEENTB0000271,,Animalia,Arthropoda,Insecta,Coleoptera,Coccinellidae,Brachiacantha ursina,24421,,Brachiacantha,ursina,,,Veronica Cervantes,8/16/2021,,,,,,Veronica Cervantes,,8/3/2021,2021,8,3,215,,8/3/2021,,,,,,,,,,,,,,,,,United States,Iowa,Scott,,,,41.509708,90.640451,,,,,,,,,,,,,,,,,jackhughes20,8/16/2021 7:17,http://creativecommons.org/licenses/by-nc/4.0/,Augustana College,,urn:uuid:eb039315-162e-4c0c-9ff7-2cfeb879bc0c,https://scan-bugs.org:443/portal/collections/individual/index.php?occid=57350345
57350346,AUGIE,ENT,,120bf21c-d066-48ee-b4c0-880596ea22e4,PreservedSpecimen,ac3373e1-4322-4a51-956c-036d4f430785,AUGIEENTB0000235,,Animalia,Arthropoda,Insecta,Coleoptera,Coccinellidae,Brachiacantha ursina,24421,,Brachiacantha,ursina,,,Veronica Cervantes,8/16/2021,,,,,,M. Gorsegner,,8/3/2021,2021,8,3,215,,,,,,,,,,,,,,,,,,,United States,Iowa,Scott,,,,41.435905,90.501557,,,,,,,,,,,,,,,,,ruolivia,8/16/2021 7:26,http://creativecommons.org/licenses/by-nc/4.0/,Augustana College,,urn:uuid:ac3373e1-4322-4a51-956c-036d4f430785,https://scan-bugs.org:443/portal/collections/individual/index.php?occid=57350346
57350347,AUGIE,ENT,,120bf21c-d066-48ee-b4c0-880596ea22e4,PreservedSpecimen,3f258a15-7e69-49f7-b092-0294b7a5b663,AUGIEENTB0000261,,Animalia,Arthropoda,Insecta,Coleoptera,Coccinellidae,Brachiacantha ursina,24421,,Brachiacantha,ursina,,,Veronica Cervantes,8/16/2021,,,,,,O. Ruffatto,,8/3/2021,2021,8,3,215,,,,,,,,,,,,,,,,,,,United States,Iowa,Scott,,,,41.435905,90.501557,,,,,,,,,,,,,,,,,ruolivia,8/16/2021 7:18,http://creativecommons.org/licenses/by-nc/4.0/,Augustana College,,urn:uuid:3f258a15-7e69-49f7-b092-0294b7a5b663,https://scan-bugs.org:443/portal/collections/individual/index.php?occid=57350347
57350348,AUGIE,ENT,,120bf21c-d066-48ee-b4c0-880596ea22e4,PreservedSpecimen,85031e3b-3163-4aed-a43d-488fcf89a19d,AUGIEENTB0000262,,Animalia,Arthropoda,Insecta,Coleoptera,Coccinellidae,Brachiacantha ursina,24421,,Brachiacantha,ursina,,,Veronica Cervantes,8/16/2021,,,,,,J. Hughes,,8/3/2021,2021,8,3,215,,,,,,,,,,,,,,,,,,,United States,Iowa,Scott,Davenport,,,41.435905,90.501557,,,,,,,,,,,,,,,,,ruolivia,8/16/2021 7:20,http://creativecommons.org/licenses/by-nc/4.0/,Augustana College,,urn:uuid:85031e3b-3163-4aed-a43d-488fcf89a19d,https://scan-bugs.org:443/portal/collections/individual/index.php?occid=57350348
57350349,AUGIE,ENT,,120bf21c-d066-48ee-b4c0-880596ea22e4,PreservedSpecimen,364b5f25-7a76-4fa7-8971-28abd7e87c60,AUGIEENTB0000262,,,,,,,,,,,,,,,,,,,,,J. Hughes,,8/3/2021,2021,8,3,215,,,,,,,,,,,,,,,,,,,United States,Iowa,Scott,,,,41.435905,90.501557,,,,,,,,,,,,,,,,,ruolivia,8/4/2021 10:58,http://creativecommons.org/licenses/by-nc/4.0/,Augustana College,,urn:uuid:364b5f25-7a76-4fa7-8971-28abd7e87c60,https://scan-bugs.org:443/portal/collections/individual/index.php?occid=57350349
57350350,AUGIE,ENT,,120bf21c-d066-48ee-b4c0-880596ea22e4,PreservedSpecimen,20fde4e0-68fa-46a2-bf23-d8a3d40995bd,AUGIEENTB0000263,,Animalia,Arthropoda,Insecta,Coleoptera,Coccinellidae,Brachiacantha ursina,24421,,Brachiacantha,ursina,,,Veronica Cervantes,8/16/2021,,,,,,J. Hughes,,8/3/2021,2021,8,3,215,,,,,,,,,,,,,,,,,,,United States,Iowa,Scott,,,,41.435905,90.501557,,,,,,,,,,,,,,,,,ruolivia,8/16/2021 7:21,http://creativecommons.org/licenses/by-nc/4.0/,Augustana College,,urn:uuid:20fde4e0-68fa-46a2-bf23-d8a3d40995bd,https://scan-bugs.org:443/portal/collections/individual/index.php?occid=57350350
57350352,AUGIE,ENT,,120bf21c-d066-48ee-b4c0-880596ea22e4,PreservedSpecimen,c2275a4a-dd91-4fa9-ad01-424ffe22706d,AUGIEENTB0000264,,Animalia,Arthropoda,Insecta,Coleoptera,Coccinellidae,Brachiacantha ursina,24421,,Brachiacantha,ursina,,,Veronica Cervantes,8/16/2021,,,,,,Olivia Ruffatto,,8/3/2021,2021,8,3,215,,,,,,,,,,,,,,,,,,,United States,Iowa,Scott,,,,41.435905,90.501557,,,,,,,,,,,,,,,,,ruolivia,8/16/2021 7:21,http://creativecommons.org/licenses/by-nc/4.0/,Augustana College,,urn:uuid:c2275a4a-dd91-4fa9-ad01-424ffe22706d,https://scan-bugs.org:443/portal/collections/individual/index.php?occid=57350352
57350353,AUGIE,ENT,,120bf21c-d066-48ee-b4c0-880596ea22e4,PreservedSpecimen,a9564ab8-01fb-4af3-b619-a23bad9e93cd,AUGIEENTB0000265,,Animalia,Arthropoda,Insecta,Coleoptera,Coccinellidae,Brachiacantha ursina,24421,,Brachiacantha,ursina,,,Veronica Cervantes,8/16/2021,,,,,,V. Cervantes,,8/3/2021,2021,8,3,215,,,,,,,,,,,,,,,,,,,United States,Iowa,Scott,,,,41.435905,90.501557,,,,,,,,,,,,,,,,,ruolivia,8/16/2021 7:22,http://creativecommons.org/licenses/by-nc/4.0/,Augustana College,,urn:uuid:a9564ab8-01fb-4af3-b619-a23bad9e93cd,https://scan-bugs.org:443/portal/collections/individual/index.php?occid=57350353
57350354,AUGIE,ENT,,120bf21c-d066-48ee-b4c0-880596ea22e4,PreservedSpecimen,18122181-1a58-4726-a85d-672799d47af6,AUGIEENTB0000266,,Animalia,Arthropoda,Insecta,Coleoptera,Coccinellidae,Brachiacantha ursina,24421,,Brachiacantha,ursina,,,Veronica Cervantes,8/16/2021,,,,,,V. Cervantes,,8/3/2021,2021,8,3,215,,,,,,,,,,,,,,,,,,,United States,Iowa,Scott,,,,41.435905,90.501557,,,,,,,,,,,,,,,,,ruolivia,8/16/2021 7:22,http://creativecommons.org/licenses/by-nc/4.0/,Augustana College,,urn:uuid:18122181-1a58-4726-a85d-672799d47af6,https://scan-bugs.org:443/portal/collections/individual/index.php?occid=57350354
57350355,AUGIE,ENT,,120bf21c-d066-48ee-b4c0-880596ea22e4,PreservedSpecimen,f614ab80-86e2-453c-97e4-3ea117984073,AUGIEENTB0000267,,Animalia,Arthropoda,Insecta,Coleoptera,Coccinellidae,Brachiacantha ursina,24421,,Brachiacantha,ursina,,,Veronica Cervantes,8/16/2021,,,,,,M. Gorsegner,,8/3/2021,2021,8,3,215,,,,,,,,,,,,,,,,,,,United States,Iowa,Scott,,,,41.435905,90.501557,,,,,,,,,,,,,,,,,ruolivia,8/16/2021 7:23,http://creativecommons.org/licenses/by-nc/4.0/,Augustana College,,urn:uuid:f614ab80-86e2-453c-97e4-3ea117984073,https://scan-bugs.org:443/portal/collections/individual/index.php?occid=57350355
57350356,AUGIE,ENT,,120bf21c-d066-48ee-b4c0-880596ea22e4,PreservedSpecimen,ae3a9b60-1a05-4be8-8e48-ee763ac104aa,AUGIEENTB0000268,,Animalia,Arthropoda,Insecta,Coleoptera,Coccinellidae,Brachiacantha ursina,24421,,Brachiacantha,ursina,,,Veronica Cervantes,8/16/2021,,,,,,J. Hughes,,8/3/2021,2021,8,3,215,,,,,,,,,,,,,,,,,,,United States,Iowa,Scott,,,,41.435905,90.501557,,,,,,,,,,,,,,,,,ruolivia,8/16/2021 7:23,http://creativecommons.org/licenses/by-nc/4.0/,Augustana College,,urn:uuid:ae3a9b60-1a05-4be8-8e48-ee763ac104aa,https://scan-bugs.org:443/portal/collections/individual/index.php?occid=57350356
57350358,AUGIE,ENT,,120bf21c-d066-48ee-b4c0-880596ea22e4,PreservedSpecimen,95cc2b22-2239-4966-a686-4cd3b907f48f,AUGIEENTB0000281,,Animalia,Arthropoda,Insecta,Coleoptera,Coccinellidae,Brachiacantha ursina,24421,,Brachiacantha,ursina,,,Veronica Cervantes,8/16/2021,,,,,,O. Ruffatto,,8/3/2021,2021,8,3,215,,,,,,,,,,,,,,,,,,,United States,Iowa,Scott,,,,41.435905,90.501557,,,,,,,,,,,,,,,,,ruolivia,8/16/2021 7:24,http://creativecommons.org/licenses/by-nc/4.0/,Augustana College,,urn:uuid:95cc2b22-2239-4966-a686-4cd3b907f48f,https://scan-bugs.org:443/portal/collections/individual/index.php?occid=57350358
57350359,AUGIE,ENT,,120bf21c-d066-48ee-b4c0-880596ea22e4,PreservedSpecimen,6aeb5ef4-3078-4bc7-b59b-fc17a7e6bbd8,AUGIEENTB0000282,,Animalia,Arthropoda,Insecta,Coleoptera,Coccinellidae,Brachiacantha ursina,24421,,Brachiacantha,ursina,,,Veronica Cervantes,8/16/2021,,,,,,V. Cervantes,,8/3/2021,2021,8,3,215,,,,,,,,,,,,,,,,,,,United States,Iowa,Scott,,,,41.435905,90.501557,,,,,,,,,,,,,,,,,ruolivia,8/16/2021 7:24,http://creativecommons.org/licenses/by-nc/4.0/,Augustana College,,urn:uuid:6aeb5ef4-3078-4bc7-b59b-fc17a7e6bbd8,https://scan-bugs.org:443/portal/collections/individual/index.php?occid=57350359
57350360,AUGIE,ENT,,120bf21c-d066-48ee-b4c0-880596ea22e4,PreservedSpecimen,c305db88-eb54-4bc8-9bb7-8536b4dafbb9,AUGIEENTB0000283,,Animalia,Arthropoda,Insecta,Coleoptera,Coccinellidae,Brachiacantha ursina,24421,,Brachiacantha,ursina,,,Veronica Cervantes,8/16/2021,,,,,,O. Ruffatto,,8/3/2021,2021,8,3,215,,,,,,,,,,,,,,,,,,,United States,Iowa,Scott,,,,41.435905,90.501557,,,,,,,,,,,,,,,,,ruolivia,8/16/2021 7:25,http://creativecommons.org/licenses/by-nc/4.0/,Augustana College,,urn:uuid:c305db88-eb54-4bc8-9bb7-8536b4dafbb9,https://scan-bugs.org:443/portal/collections/individual/index.php?occid=57350360
57350361,AUGIE,ENT,,120bf21c-d066-48ee-b4c0-880596ea22e4,PreservedSpecimen,261c1e0e-25ba-4172-8ef8-2c4659786f41,AUGIEENTB0000284,,Animalia,Arthropoda,Insecta,Coleoptera,Coccinellidae,Brachiacantha ursina,24421,,Brachiacantha,ursina,,,Veronica Cervantes,8/16/2021,,,,,,M. Gorsegner,,8/3/2021,2021,8,3,215,,,,,,,,,,,,,,,,,,,United States,Iowa,Scott,,,,41.435905,90.501557,,,,,,,,,,,,,,,,,ruolivia,8/16/2021 7:25,http://creativecommons.org/licenses/by-nc/4.0/,Augustana College,,urn:uuid:261c1e0e-25ba-4172-8ef8-2c4659786f41,https://scan-bugs.org:443/portal/collections/individual/index.php?occid=57350361
57350363,AUGIE,ENT,,120bf21c-d066-48ee-b4c0-880596ea22e4,PreservedSpecimen,44c21183-44a7-447c-8a31-f836d2a65cba,AUGIEENTB0000272,,Animalia,Arthropoda,Insecta,Coleoptera,Coccinellidae,Coleomegilla maculata,25547,,Coleomegilla,maculata,,,Marissa Gorsegner,,,,,,,Jack Hughes,,8/3/2021,2021,8,3,215,,,,,,,,,,,,,,,,,,,United States,IA,Scott,,,,41.567938,90.5591,,,,,,,,,,,,,,,,,jackhughes20,8/4/2021 11:08,http://creativecommons.org/licenses/by-nc/4.0/,Augustana College,,urn:uuid:44c21183-44a7-447c-8a31-f836d2a65cba,https://scan-bugs.org:443/portal/collections/individual/index.php?occid=57350363
57350364,AUGIE,ENT,,120bf21c-d066-48ee-b4c0-880596ea22e4,PreservedSpecimen,c2fc3510-7326-4149-80d7-eac6d2dc7206,AUGIEENTB0000273,,Animalia,Arthropoda,Insecta,Coleoptera,Coccinellidae,Coleomegilla maculata,25547,,Coleomegilla,maculata,,,Marissa Gorsegner,8/4/2021,,,,,,Jack Hughes,,8/3/2021,2021,8,3,215,,,,,,,,,,,,,,,,,,,United States,IA,Scott,,,,41.567938,90.5591,,,,,,,,,,,,,,,,,jackhughes20,8/4/2021 11:09,http://creativecommons.org/licenses/by-nc/4.0/,Augustana College,,urn:uuid:c2fc3510-7326-4149-80d7-eac6d2dc7206,https://scan-bugs.org:443/portal/collections/individual/index.php?occid=57350364
57350365,AUGIE,ENT,,120bf21c-d066-48ee-b4c0-880596ea22e4,PreservedSpecimen,05a15f5d-1119-4826-9057-326859196d0b,AUGIEENTB0000274,,Animalia,Arthropoda,Insecta,Coleoptera,Coccinellidae,Coleomegilla maculata,25547,,Coleomegilla,maculata,,,Marissa Gorsegner,8/4/2021,,,,,,Veronica Cervantes,,8/3/2021,2021,8,3,215,,,,,,,,,,,,,,,,,,,United States,IA,Scott,,,,41.567938,90.5591,,,,,,,,,,,,,,,,,jackhughes20,8/4/2021 11:09,http://creativecommons.org/licenses/by-nc/4.0/,Augustana College,,urn:uuid:05a15f5d-1119-4826-9057-326859196d0b,https://scan-bugs.org:443/portal/collections/individual/index.php?occid=57350365
57350366,AUGIE,ENT,,120bf21c-d066-48ee-b4c0-880596ea22e4,PreservedSpecimen,68c7db17-398f-4dc6-975a-89364ed4c0b6,AUGIEENTB0000285,,Animalia,Arthropoda,Insecta,Coleoptera,Coccinellidae,Coleomegilla maculata,25547,,Coleomegilla,maculata,,,Veronica Cervantes,8/4/2021,,,,,,J. Hughes,,8/3/2021,2021,8,3,215,,,,,,,,,,,,,,,,,,,United States,Iowa,Scott,,,,41.54693,90.552795,,,,,,,,,,,,,,,,,ruolivia,8/4/2021 11:10,http://creativecommons.org/licenses/by-nc/4.0/,Augustana College,,urn:uuid:68c7db17-398f-4dc6-975a-89364ed4c0b6,https://scan-bugs.org:443/portal/collections/individual/index.php?occid=57350366
57350367,AUGIE,ENT,,120bf21c-d066-48ee-b4c0-880596ea22e4,PreservedSpecimen,9ca0fb84-0275-461d-8e97-a8c22602815a,AUGIEENTB0000275,,Animalia,Arthropoda,Insecta,Coleoptera,Coccinellidae,Hippodamia variegata,27405,"(Goeze, 1777)",Hippodamia,variegata,,,Veronica Cervantes,8/16/2021,,,,,,Jack Hughes,,8/3/2021,2021,8,3,215,,,,,,,,,,,,,,,,,,,United States,IA,Scott,,,,41.567938,90.5591,,,,,,,,,,,,,,,,,jackhughes20,8/16/2021 7:31,http://creativecommons.org/licenses/by-nc/4.0/,Augustana College,,urn:uuid:9ca0fb84-0275-461d-8e97-a8c22602815a,https://scan-bugs.org:443/portal/collections/individual/index.php?occid=57350367
57350368,AUGIE,ENT,,120bf21c-d066-48ee-b4c0-880596ea22e4,PreservedSpecimen,5f74fc37-4f09-4d38-a7b8-b467394b519c,AUGIEENTB0000286,,Animalia,Arthropoda,Insecta,Coleoptera,Coccinellidae,Coleomegilla maculata,25547,,Coleomegilla,maculata,,,Veronica Cervantes,8/4/2021,,,,,,O. Ruffatto,,8/3/2021,2021,8,3,215,,,,,,,,,,,,,,,,,,,United States,Iowa,Scott,,,,41.54693,90.552795,,,,,,,,,,,,,,,,,ruolivia,8/4/2021 11:10,http://creativecommons.org/licenses/by-nc/4.0/,Augustana College,,urn:uuid:5f74fc37-4f09-4d38-a7b8-b467394b519c,https://scan-bugs.org:443/portal/collections/individual/index.php?occid=57350368
57350369,AUGIE,ENT,,120bf21c-d066-48ee-b4c0-880596ea22e4,PreservedSpecimen,9791977b-e1f1-43e4-b9a8-2952f129d7a3,AUGIEENTB0000276,,Animalia,Arthropoda,Insecta,Coleoptera,Coccinellidae,Hippodamia convergens,27393,"Guérin-Méneville, 1842",Hippodamia,convergens,,,Jack Hughes,8/4/2021,,,,,,Jack Hughes,,8/3/2021,2021,8,3,215,,,,,,,,,,,,,,,,,,,United States,IA,Scott,,,,41.567938,90.5591,,,,,,,,,,,,,,,,,jackhughes20,8/4/2021 11:11,http://creativecommons.org/licenses/by-nc/4.0/,Augustana College,,urn:uuid:9791977b-e1f1-43e4-b9a8-2952f129d7a3,https://scan-bugs.org:443/portal/collections/individual/index.php?occid=57350369
57350370,AUGIE,ENT,,120bf21c-d066-48ee-b4c0-880596ea22e4,PreservedSpecimen,963115b2-de34-4266-9d5d-b230a4abcf42,AUGIEENTB0000287,,Animalia,Arthropoda,Insecta,Coleoptera,Coccinellidae,Coleomegilla maculata,25547,,Coleomegilla,maculata,,,Veronica Cervantes,8/4/2021,,,,,,M. Gorsegner,,8/3/2021,2021,8,3,215,,,,,,,,,,,,,,,,,,,United States,Iowa,Scott,,,,41.54693,90.552795,,,,,,,,,,,,,,,,,ruolivia,8/4/2021 11:11,http://creativecommons.org/licenses/by-nc/4.0/,Augustana College,,urn:uuid:963115b2-de34-4266-9d5d-b230a4abcf42,https://scan-bugs.org:443/portal/collections/individual/index.php?occid=57350370
57350372,AUGIE,ENT,,120bf21c-d066-48ee-b4c0-880596ea22e4,PreservedSpecimen,f4569c03-bf37-4627-ba2c-c51cfe05d2f3,AUGIEENTB0000288,,Animalia,Arthropoda,Insecta,Coleoptera,Coccinellidae,Coleomegilla maculata,25547,,Coleomegilla,maculata,,,Veronica Cervantes,8/4/2021,,,,,,V. Cervantes,,8/3/2021,2021,8,3,215,,,,,,,,,,,,,,,,,,,United States,Iowa,Scott,,,,41.54693,90.552795,,,,,,,,,,,,,,,,,ruolivia,8/4/2021 11:12,http://creativecommons.org/licenses/by-nc/4.0/,Augustana College,,urn:uuid:f4569c03-bf37-4627-ba2c-c51cfe05d2f3,https://scan-bugs.org:443/portal/collections/individual/index.php?occid=57350372
57350373,AUGIE,ENT,,120bf21c-d066-48ee-b4c0-880596ea22e4,PreservedSpecimen,d7201cc4-0027-4067-8daa-41c55d0f0c9f,AUGIEENTB0000289,,Animalia,Arthropoda,Insecta,Coleoptera,Coccinellidae,Coleomegilla maculata,25547,,Coleomegilla,maculata,,,Veronica Cervantes,8/4/2021,,,,,,O. Ruffatto,,8/3/2021,2021,8,3,215,,,,,,,,,,,,,,,,,,,United States,Iowa,Scott,,,,41.54693,90.552795,,,,,,,,,,,,,,,,,ruolivia,8/4/2021 11:12,http://creativecommons.org/licenses/by-nc/4.0/,Augustana College,,urn:uuid:d7201cc4-0027-4067-8daa-41c55d0f0c9f,https://scan-bugs.org:443/portal/collections/individual/index.php?occid=57350373
57350375,AUGIE,ENT,,120bf21c-d066-48ee-b4c0-880596ea22e4,PreservedSpecimen,e8e7a7aa-6fd6-4cf8-9916-bb87676aec13,AUGIEENTB0000290,,Animalia,Arthropoda,Insecta,Coleoptera,Coccinellidae,Harmonia axyridis,27230,"(Pallas, 1773)",Harmonia,axyridis,,,Veronica Cervantes,8/4/2021,,,,,,O. Ruffatto,,8/3/2021,2021,8,3,215,,,,,,,,,,,,,,,,,,,United States,Iowa,Scott,,,,41.50368,90.62248,,,,,,,,,,,,,,,,,ruolivia,8/4/2021 11:17,http://creativecommons.org/licenses/by-nc/4.0/,Augustana College,,urn:uuid:e8e7a7aa-6fd6-4cf8-9916-bb87676aec13,https://scan-bugs.org:443/portal/collections/individual/index.php?occid=57350375
57350376,AUGIE,ENT,,120bf21c-d066-48ee-b4c0-880596ea22e4,PreservedSpecimen,9d56e166-a3e3-493a-82fe-12f111494ee5,AUGIEENTB0000291,,Animalia,Arthropoda,Insecta,Coleoptera,Coccinellidae,Harmonia axyridis,27230,"(Pallas, 1773)",Harmonia,axyridis,,,Veronica Cervantes,8/16/2021,,,,,,J. Hughes,,8/3/2021,2021,8,3,215,,,,,,,,,,,,,,,,,,,United States,Iowa,Scott,,,,41.50368,90.62248,,,,,,,,,,,,,,,,,ruolivia,8/16/2021 8:07,http://creativecommons.org/licenses/by-nc/4.0/,Augustana College,,urn:uuid:9d56e166-a3e3-493a-82fe-12f111494ee5,https://scan-bugs.org:443/portal/collections/individual/index.php?occid=57350376
57350378,AUGIE,ENT,,120bf21c-d066-48ee-b4c0-880596ea22e4,PreservedSpecimen,4e8e5fcf-9cf6-40be-b4b4-239ee3e2994b,AUGIEENTB0000292,,Animalia,Arthropoda,Insecta,Coleoptera,Coccinellidae,Coleomegilla maculata,25547,,Coleomegilla,maculata,,,Veronica Cervantes,8/4/2021,,,,,,J. Hughes,,8/3/2021,2021,8,3,215,,,,,,,,,,,,,,,,,,,United States,Iowa,Scott,,,,41.537828,90.645823,,,,,,,,,,,,,,,,,ruolivia,8/19/2021 12:50,http://creativecommons.org/licenses/by-nc/4.0/,Augustana College,,urn:uuid:4e8e5fcf-9cf6-40be-b4b4-239ee3e2994b,https://scan-bugs.org:443/portal/collections/individual/index.php?occid=57350378
57350379,AUGIE,ENT,,120bf21c-d066-48ee-b4c0-880596ea22e4,PreservedSpecimen,855f1792-1496-4244-be5b-848b067697b2,AUGIEENTB0000296,,Animalia,Arthropoda,Insecta,Coleoptera,Coccinellidae,Harmonia axyridis,27230,"(Pallas, 1773)",Harmonia,axyridis,,,Veronica Cervantes,8/4/2021,,,,,,M. Gorsegner,,8/3/2021,2021,8,3,215,,,,,,,,,,,,,,,,,,,United States,Iowa,Scott,,,,41.537828,90.645823,,,,,,,,,,,,,,,,,ruolivia,8/19/2021 12:50,http://creativecommons.org/licenses/by-nc/4.0/,Augustana College,,urn:uuid:855f1792-1496-4244-be5b-848b067697b2,https://scan-bugs.org:443/portal/collections/individual/index.php?occid=57350379
57350380,AUGIE,ENT,,120bf21c-d066-48ee-b4c0-880596ea22e4,PreservedSpecimen,a9679783-c90b-4648-855d-057a96c268eb,AUGIEENTB0000297,,Animalia,Arthropoda,Insecta,Coleoptera,Coccinellidae,Harmonia axyridis,27230,"(Pallas, 1773)",Harmonia,axyridis,,,Veronica Cervantes,8/4/2021,,,,,,v. cervantes,,8/3/2021,2021,8,3,215,,,,,,,,,,,,,,,,,,,United States,Iowa,Scott,,,,41.537828,90.645823,,,,,,,,,,,,,,,,,ruolivia,8/4/2021 11:24,http://creativecommons.org/licenses/by-nc/4.0/,Augustana College,,urn:uuid:a9679783-c90b-4648-855d-057a96c268eb,https://scan-bugs.org:443/portal/collections/individual/index.php?occid=57350380
57350381,AUGIE,ENT,,120bf21c-d066-48ee-b4c0-880596ea22e4,PreservedSpecimen,a6d98bf1-53f5-434a-96bb-dab3e506f995,AUGIEENTB0000277,,Animalia,Arthropoda,Insecta,Coleoptera,Coccinellidae,Hippodamia parenthesis,27400,,Hippodamia,parenthesis,,,Jack Hughes,8/4/2021,,,,,,Marissa Gorsegner,,8/3/2021,2021,8,3,215,,,,,,,,,,,,,,,,,,,United States,IA,Scott,,,,41.56304,90.46707,,,,,,,,,,,,,,,,,jackhughes20,8/4/2021 11:24,http://creativecommons.org/licenses/by-nc/4.0/,Augustana College,,urn:uuid:a6d98bf1-53f5-434a-96bb-dab3e506f995,https://scan-bugs.org:443/portal/collections/individual/index.php?occid=57350381
57350382,AUGIE,ENT,,120bf21c-d066-48ee-b4c0-880596ea22e4,PreservedSpecimen,6f55a789-3d99-4ff9-95a4-4237d17bf68b,AUGIEENTB0000298,,Animalia,Arthropoda,Insecta,Coleoptera,Coccinellidae,Coleomegilla maculata,25547,,Coleomegilla,maculata,,,Veronica Cervantes,8/4/2021,,,,,,O. Ruffatto,,8/3/2021,2021,8,3,215,,,,,,,,,,,,,,,,,,,United States,Iowa,Scott,,,,41.537828,90.645823,,,,,,,,,,,,,,,,,ruolivia,8/4/2021 11:25,http://creativecommons.org/licenses/by-nc/4.0/,Augustana College,,urn:uuid:6f55a789-3d99-4ff9-95a4-4237d17bf68b,https://scan-bugs.org:443/portal/collections/individual/index.php?occid=57350382
57350383,AUGIE,ENT,,120bf21c-d066-48ee-b4c0-880596ea22e4,PreservedSpecimen,c539fc40-c26a-49b6-bf78-fb332ddffd23,AUGIEENTB0000278,,Animalia,Arthropoda,Insecta,Coleoptera,Coccinellidae,Hippodamia variegata,27405,"(Goeze, 1777)",Hippodamia,variegata,,,Veronica Cervantes,8/16/2021,,,,,,Veronica Cervantes,,8/3/2021,2021,8,3,215,,,,,,,,,,,,,,,,,,,United States,IA,Scott,,,,41.56304,90.46707,,,,,,,,,,,,,,,,,jackhughes20,8/16/2021 7:37,http://creativecommons.org/licenses/by-nc/4.0/,Augustana College,,urn:uuid:c539fc40-c26a-49b6-bf78-fb332ddffd23,https://scan-bugs.org:443/portal/collections/individual/index.php?occid=57350383
57350384,AUGIE,ENT,,120bf21c-d066-48ee-b4c0-880596ea22e4,PreservedSpecimen,98b3645d-9543-47d6-a943-791f1e56f176,AUGIEENTB0000299,,Animalia,Arthropoda,Insecta,Coleoptera,Coccinellidae,Harmonia axyridis,27230,"(Pallas, 1773)",Harmonia,axyridis,,,Veronica Cervantes,8/4/2021,,,,,,O. Ruffatto,,8/3/2021,2021,8,3,215,,,,,,,,,,,,,,,,,,,United States,Iowa,Scott,,,,41.537828,90.645823,,,,,,,,,,,,,,,,,ruolivia,8/4/2021 11:25,http://creativecommons.org/licenses/by-nc/4.0/,Augustana College,,urn:uuid:98b3645d-9543-47d6-a943-791f1e56f176,https://scan-bugs.org:443/portal/collections/individual/index.php?occid=57350384
57350385,AUGIE,ENT,,120bf21c-d066-48ee-b4c0-880596ea22e4,PreservedSpecimen,524b44f1-3fd1-4588-a923-c281f0ef4c02,AUGIEENTB0000279,,Animalia,Arthropoda,Insecta,Coleoptera,Coccinellidae,Hippodamia parenthesis,27400,,Hippodamia,parenthesis,,,Jack Hughes,,,,,,,Jack Hughes,,8/3/2021,2021,8,3,215,,,,,,,,,,,,,,,,,,,United States,IA,Scott,,,,41.56304,90.46707,,,,,,,,,,,,,,,,,jackhughes20,8/4/2021 11:26,http://creativecommons.org/licenses/by-nc/4.0/,Augustana College,,urn:uuid:524b44f1-3fd1-4588-a923-c281f0ef4c02,https://scan-bugs.org:443/portal/collections/individual/index.php?occid=57350385
57350386,AUGIE,ENT,,120bf21c-d066-48ee-b4c0-880596ea22e4,PreservedSpecimen,1808797e-a94b-4fa9-873d-e93aa5201e6b,AUGIEENTB0000300,,Animalia,Arthropoda,Insecta,Coleoptera,Coccinellidae,Harmonia axyridis,27230,"(Pallas, 1773)",Harmonia,axyridis,,,Veronica Cervantes,8/4/2021,,,,,,M. Gorsegner,,8/3/2021,2021,8,3,215,,,,,,,,,,,,,,,,,,,United States,Iowa,Scott,,,,41.537828,90.645823,,,,,,,,,,,,,,,,,ruolivia,8/4/2021 11:26,http://creativecommons.org/licenses/by-nc/4.0/,Augustana College,,urn:uuid:1808797e-a94b-4fa9-873d-e93aa5201e6b,https://scan-bugs.org:443/portal/collections/individual/index.php?occid=57350386
57350387,AUGIE,ENT,,120bf21c-d066-48ee-b4c0-880596ea22e4,PreservedSpecimen,545ac248-0c1a-4a5d-932d-53509081dd40,AUGIEENTB0000280,,Animalia,Arthropoda,Insecta,Coleoptera,Coccinellidae,Hippodamia variegata,27405,"(Goeze, 1777)",Hippodamia,variegata,,,Veronica Cervantes,8/16/2021,,,,,,Jack Hughes,,8/3/2021,2021,8,3,215,,,,,,,,,,,,,,,,,,,United States,IA,Scott,,,,41.56304,90.46707,,,,,,,,,,,,,,,,,jackhughes20,8/16/2021 7:46,http://creativecommons.org/licenses/by-nc/4.0/,Augustana College,,urn:uuid:545ac248-0c1a-4a5d-932d-53509081dd40,https://scan-bugs.org:443/portal/collections/individual/index.php?occid=57350387
57350388,AUGIE,ENT,,120bf21c-d066-48ee-b4c0-880596ea22e4,PreservedSpecimen,10b5123e-f32a-4a73-95e4-29603974c672,AUGIEENTB0000301,,Animalia,Arthropoda,Insecta,Coleoptera,Coccinellidae,Harmonia axyridis,27230,"(Pallas, 1773)",Harmonia,axyridis,,,Veronica Cervantes,8/4/2021,,,,,,V. Cervantes,,8/3/2021,2021,8,3,215,,,,,,,,,,,,,,,,,,,United States,Iowa,Scott,,,,41.537828,90.645823,,,,,,,,,,,,,,,,,ruolivia,8/4/2021 11:26,http://creativecommons.org/licenses/by-nc/4.0/,Augustana College,,urn:uuid:10b5123e-f32a-4a73-95e4-29603974c672,https://scan-bugs.org:443/portal/collections/individual/index.php?occid=57350388
57350389,AUGIE,ENT,,120bf21c-d066-48ee-b4c0-880596ea22e4,PreservedSpecimen,c17f3d66-2463-43ab-8eb6-8c516f9576b3,AUGIEENTB0000293,,Animalia,Arthropoda,Insecta,Coleoptera,Coccinellidae,Hippodamia variegata,27405,"(Goeze, 1777)",Hippodamia,variegata,,,Veronica Cervantes,8/16/2021,,,,,,Olivia Ruffatto,,8/3/2021,2021,8,3,215,,,,,,,,,,,,,,,,,,,United States,IA,Scott,,,,41.56304,90.46707,,,,,,,,,,,,,,,,,jackhughes20,8/16/2021 7:51,http://creativecommons.org/licenses/by-nc/4.0/,Augustana College,,urn:uuid:c17f3d66-2463-43ab-8eb6-8c516f9576b3,https://scan-bugs.org:443/portal/collections/individual/index.php?occid=57350389
57350390,AUGIE,ENT,,120bf21c-d066-48ee-b4c0-880596ea22e4,PreservedSpecimen,38651f08-a31c-4a69-ba50-dd1f237fddc4,AUGIEENTB0000302,,Animalia,Arthropoda,Insecta,Coleoptera,Coccinellidae,Harmonia axyridis,27230,"(Pallas, 1773)",Harmonia,axyridis,,,Veronica Cervantes,8/4/2021,,,,,,O. Ruffatto,,8/3/2021,2021,8,3,215,,,,,,,,,,,,,,,,,,,United States,Iowa,Scott,,,,41.537828,90.645823,,,,,,,,,,,,,,,,,ruolivia,8/4/2021 11:27,http://creativecommons.org/licenses/by-nc/4.0/,Augustana College,,urn:uuid:38651f08-a31c-4a69-ba50-dd1f237fddc4,https://scan-bugs.org:443/portal/collections/individual/index.php?occid=57350390
57350391,AUGIE,ENT,,120bf21c-d066-48ee-b4c0-880596ea22e4,PreservedSpecimen,7da01bc2-bfd7-4c5a-8c1e-7868b285c0d2,AUGIEENTB0000294,,Animalia,Arthropoda,Insecta,Coleoptera,Coccinellidae,Propylea quatuordecimpunctata,613667,(Linneus 1758),Propylea,quatuordecimpunctata,,,V. Cervantes,8/5/2021,,,,,,Marissa Gorsegner,,8/3/2021,2021,8,3,215,,,,,,,,,,,,,,,,,,,United States,IA,Scott,,,,41.56304,90.46707,,,,,,,,,,,,,,,,,jackhughes20,8/5/2021 13:07,http://creativecommons.org/licenses/by-nc/4.0/,Augustana College,,urn:uuid:7da01bc2-bfd7-4c5a-8c1e-7868b285c0d2,https://scan-bugs.org:443/portal/collections/individual/index.php?occid=57350391
57350392,AUGIE,ENT,,120bf21c-d066-48ee-b4c0-880596ea22e4,PreservedSpecimen,3734a2d0-a975-4f3c-b446-5c2804112580,AUGIEENTB0000303,,Animalia,Arthropoda,Insecta,Coleoptera,Coccinellidae,Propylea quatuordecimpunctata,613667,(Linneus 1758),Propylea,quatuordecimpunctata,,,V. Cervantes,8/5/2021,,,,,,V. Cervantes,,8/3/2021,2021,8,3,215,,,,,,,,,,,,,,,,,,,United States,Iowa,Scott,,,,41.537828,90.645823,,,,,,,,,,,,,,,,,ruolivia,8/5/2021 13:07,http://creativecommons.org/licenses/by-nc/4.0/,Augustana College,,urn:uuid:3734a2d0-a975-4f3c-b446-5c2804112580,https://scan-bugs.org:443/portal/collections/individual/index.php?occid=57350392
57350393,AUGIE,ENT,,120bf21c-d066-48ee-b4c0-880596ea22e4,PreservedSpecimen,338a86c7-2824-4c6e-afc4-84b4aeddc326,AUGIEENTB0000295,,Animalia,Arthropoda,Insecta,Coleoptera,Coccinellidae,Propylea quatuordecimpunctata,613667,(Linneus 1758),Propylea,quatuordecimpunctata,,,V. Cervantes,8/5/2021,,,,,,Olivia Ruffatto,,8/3/2021,2021,8,3,215,,,,,,,,,,,,,,,,,,,United States,IA,Scott,,,,41.56304,90.46707,,,,,,,,,,,,,,,,,jackhughes20,8/5/2021 13:07,http://creativecommons.org/licenses/by-nc/4.0/,Augustana College,,urn:uuid:338a86c7-2824-4c6e-afc4-84b4aeddc326,https://scan-bugs.org:443/portal/collections/individual/index.php?occid=57350393
57350394,AUGIE,ENT,,120bf21c-d066-48ee-b4c0-880596ea22e4,PreservedSpecimen,1c7ba319-e588-4ef7-a0aa-fc32085b550b,AUGIEENTB0000304,,Animalia,Arthropoda,Insecta,Coleoptera,Coccinellidae,Coleomegilla maculata,25547,,Coleomegilla,maculata,,,Veronica Cervantes,8/4/2021,,,,,,M. Gorsegner,,8/3/2021,2021,8,3,215,,,,,,,,,,,,,,,,,,,United States,Iowa,Scott,,,,41.537828,90.645823,,,,,,,,,,,,,,,,,ruolivia,8/4/2021 11:29,http://creativecommons.org/licenses/by-nc/4.0/,Augustana College,,urn:uuid:1c7ba319-e588-4ef7-a0aa-fc32085b550b,https://scan-bugs.org:443/portal/collections/individual/index.php?occid=57350394
57350396,AUGIE,ENT,,120bf21c-d066-48ee-b4c0-880596ea22e4,PreservedSpecimen,43178751-096d-44bc-a3d3-3cc1de193a1f,AUGIEENTB0000305,,Animalia,Arthropoda,Insecta,Coleoptera,Coccinellidae,Cycloneda munda,25911,,Cycloneda,munda,,,Veronica Cervantes,8/4/2021,,,,,,J. Hughes,,8/3/2021,2021,8,3,215,,,,,,,,,,,,,,,,,,,United States,Iowa,Scott,,,,41.537828,90.645823,,,,,,,,,,,,,,,,,ruolivia,8/4/2021 11:29,http://creativecommons.org/licenses/by-nc/4.0/,Augustana College,,urn:uuid:43178751-096d-44bc-a3d3-3cc1de193a1f,https://scan-bugs.org:443/portal/collections/individual/index.php?occid=57350396
57354751,AUGIE,ENT,,120bf21c-d066-48ee-b4c0-880596ea22e4,PreservedSpecimen,3d782ffa-f0f4-468d-b280-6e9c8f2880c8,AUGIEENTB0000306,,Animalia,Arthropoda,Insecta,Coleoptera,Coccinellidae,Harmonia axyridis,27230,"(Pallas, 1773)",Harmonia,axyridis,,,o. ruffatto,8/5/2021,,,,,,o. ruffatto,,8/4/2021,2021,8,4,216,,,,,,,,,,,,,,,,,,,United States,Illinois,Rock Island,,,,41.4355,90.510444,,,,,,,,,,,,,,,,,ruolivia,8/5/2021 9:56,http://creativecommons.org/licenses/by-nc/4.0/,Augustana College,,urn:uuid:3d782ffa-f0f4-468d-b280-6e9c8f2880c8,https://scan-bugs.org:443/portal/collections/individual/index.php?occid=57354751
57354756,AUGIE,ENT,,120bf21c-d066-48ee-b4c0-880596ea22e4,PreservedSpecimen,6e3a611f-ebe3-417a-9cc0-89288ede6d05,AUGIEENTB0000307,,Animalia,Arthropoda,Insecta,Coleoptera,Coccinellidae,Harmonia axyridis,27230,"(Pallas, 1773)",Harmonia,axyridis,,,o. ruffatto,8/5/2021,,,,,,V. cervantes,,8/4/2021,2021,8,4,216,,,,,,,,,,,,,,,,,,,United States,Illinois,Rock Island,,,,41.510229,90.490812,,,,,,,,,,,,,,,,,ruolivia,8/5/2021 9:58,http://creativecommons.org/licenses/by-nc/4.0/,Augustana College,,urn:uuid:6e3a611f-ebe3-417a-9cc0-89288ede6d05,https://scan-bugs.org:443/portal/collections/individual/index.php?occid=57354756
57354759,AUGIE,ENT,,120bf21c-d066-48ee-b4c0-880596ea22e4,PreservedSpecimen,a6137652-cd2e-40b2-a315-56fa7320e7ef,AUGIEENTB0000308,,Animalia,Arthropoda,Insecta,Coleoptera,Coccinellidae,Harmonia axyridis,27230,"(Pallas, 1773)",Harmonia,axyridis,,,o. ruffatto,8/5/2021,,,,,,m. gorsegner,,8/4/2021,2021,8,4,216,,,,,,,,,,,,,,,,,,,United States,Illinois,Rock Island,,,,41.510229,90.490812,,,,,,,,,,,,,,,,,ruolivia,8/5/2021 10:00,http://creativecommons.org/licenses/by-nc/4.0/,Augustana College,,urn:uuid:a6137652-cd2e-40b2-a315-56fa7320e7ef,https://scan-bugs.org:443/portal/collections/individual/index.php?occid=57354759
57354766,AUGIE,ENT,,120bf21c-d066-48ee-b4c0-880596ea22e4,PreservedSpecimen,7b77512a-8d89-4ec4-90a5-8877bd45e5d2,AUGIEENTB0000309,,Animalia,Arthropoda,Insecta,Coleoptera,Coccinellidae,Harmonia axyridis,27230,"(Pallas, 1773)",Harmonia,axyridis,,,o. ruffatto,8/5/2021,,,,,,o. ruffatto,,8/4/2021,2021,8,4,216,,,,,,,,,,,,,,,,,,,United States,Illinois,Rock Island,,,,41.506216,90.553531,,,,,,,,,,,,,,,,,ruolivia,8/5/2021 10:03,http://creativecommons.org/licenses/by-nc/4.0/,Augustana College,,urn:uuid:7b77512a-8d89-4ec4-90a5-8877bd45e5d2,https://scan-bugs.org:443/portal/collections/individual/index.php?occid=57354766
57354769,AUGIE,ENT,,120bf21c-d066-48ee-b4c0-880596ea22e4,PreservedSpecimen,fb42fcf3-b6b1-4f59-a864-e44086527998,AUGIEENTB0000310,,Animalia,Arthropoda,Insecta,Coleoptera,Coccinellidae,Psyllobora vigintimaculata,31188,,Psyllobora,vigintimaculata,,,Veronica Cervantes,8/16/2021,,,,,,j. hughes,,8/4/2021,2021,8,4,216,,,,,,,,,,,,,,,,,,,United States,Illinois,Rock Island,,,,41.506216,90.553531,,,,,,,,,,,,,,,,,ruolivia,8/16/2021 8:14,http://creativecommons.org/licenses/by-nc/4.0/,Augustana College,,urn:uuid:fb42fcf3-b6b1-4f59-a864-e44086527998,https://scan-bugs.org:443/portal/collections/individual/index.php?occid=57354769
57354770,AUGIE,ENT,,120bf21c-d066-48ee-b4c0-880596ea22e4,PreservedSpecimen,5ff5757a-26fc-4118-bb1d-60fcef5d9eae,AUGIEENTB0000311,,Animalia,Arthropoda,Insecta,Coleoptera,Coccinellidae,Psyllobora vigintimaculata,31188,,Psyllobora,vigintimaculata,,,Veronica Cervantes,8/16/2021,,,,,,m. gorsegner,,8/4/2021,2021,8,4,216,,,,,,,,,,,,,,,,,,,United States,Illinois,Rock Island,,,,41.506216,90.553531,,,,,,,,,,,,,,,,,ruolivia,8/16/2021 8:14,http://creativecommons.org/licenses/by-nc/4.0/,Augustana College,,urn:uuid:5ff5757a-26fc-4118-bb1d-60fcef5d9eae,https://scan-bugs.org:443/portal/collections/individual/index.php?occid=57354770
57354771,AUGIE,ENT,,120bf21c-d066-48ee-b4c0-880596ea22e4,PreservedSpecimen,44723e2a-d0d9-437c-a720-7e0630b139d6,AUGIEENTB0000312,,Animalia,Arthropoda,Insecta,Coleoptera,Coccinellidae,Psyllobora vigintimaculata,31188,,Psyllobora,vigintimaculata,,,Veronica Cervantes,8/16/2021,,,,,,V. cervantes,,8/4/2021,2021,8,4,216,,,,,,,,,,,,,,,,,,,United States,Illinois,Rock Island,,,,41.506216,90.553531,,,,,,,,,,,,,,,,,ruolivia,8/16/2021 8:15,http://creativecommons.org/licenses/by-nc/4.0/,Augustana College,,urn:uuid:44723e2a-d0d9-437c-a720-7e0630b139d6,https://scan-bugs.org:443/portal/collections/individual/index.php?occid=57354771
57354776,AUGIE,ENT,,120bf21c-d066-48ee-b4c0-880596ea22e4,PreservedSpecimen,90a7dd8c-bf31-44da-8ce8-53efbcf56419,AUGIEENTB0000313,,Animalia,Arthropoda,Insecta,Coleoptera,Coccinellidae,Propylea quatuordecimpunctata,613667,(Linneus 1758),Propylea,quatuordecimpunctata,,,V. Cervantes,8/5/2021,,,,,,o. ruffatto,,8/4/2021,2021,8,4,216,,,,,,,,,,,,,,,,,,,United States,Illinois,Rock Island,,,,41.509388,90.491046,,,,,,,,,,,,,,,,,ruolivia,8/5/2021 13:07,http://creativecommons.org/licenses/by-nc/4.0/,Augustana College,,urn:uuid:90a7dd8c-bf31-44da-8ce8-53efbcf56419,https://scan-bugs.org:443/portal/collections/individual/index.php?occid=57354776
57354777,AUGIE,ENT,,120bf21c-d066-48ee-b4c0-880596ea22e4,PreservedSpecimen,9ac337f7-d08f-4e7d-a290-ce58c0129228,AUGIEENTB0000314,,Animalia,Arthropoda,Insecta,Coleoptera,Coccinellidae,Psyllobora vigintimaculata,31188,,Psyllobora,vigintimaculata,,,Veronica Cervantes,8/16/2021,,,,,,o. ruffatto,,8/4/2021,2021,8,4,216,,,,,,,,,,,,,,,,,,,United States,Illinois,Rock Island,,,,41.509388,90.491046,,,,,,,,,,,,,,,,,ruolivia,8/16/2021 8:18,http://creativecommons.org/licenses/by-nc/4.0/,Augustana College,,urn:uuid:9ac337f7-d08f-4e7d-a290-ce58c0129228,https://scan-bugs.org:443/portal/collections/individual/index.php?occid=57354777
57354800,AUGIE,ENT,,120bf21c-d066-48ee-b4c0-880596ea22e4,PreservedSpecimen,d2d95da9-e7e4-4cfd-a986-e5d2d72d364c,AUGIEENTB0000315,,Animalia,Arthropoda,Insecta,Coleoptera,Coccinellidae,Cycloneda munda,25911,,Cycloneda,munda,,,o. ruffatto,8/5/2021,,,,,,V. cervantes,,8/4/2021,2021,8,4,216,,,,,,,,,,,,,,,,,,,United States,Illinois,Rock Island,,,,41.47252,90.473754,,,,,,,,,,,,,,,,,ruolivia,8/5/2021 10:37,http://creativecommons.org/licenses/by-nc/4.0/,Augustana College,,urn:uuid:d2d95da9-e7e4-4cfd-a986-e5d2d72d364c,https://scan-bugs.org:443/portal/collections/individual/index.php?occid=57354800
57354802,AUGIE,ENT,,120bf21c-d066-48ee-b4c0-880596ea22e4,PreservedSpecimen,0d1d6454-6e36-4cb6-b863-98a140a69fce,AUGIEENTB0000316,,Animalia,Arthropoda,Insecta,Coleoptera,Coccinellidae,Cycloneda munda,25911,,Cycloneda,munda,,,o. ruffatto,8/5/2021,,,,,,o. ruffatto,,8/4/2021,2021,8,4,216,,,,,,,,,,,,,,,,,,,United States,Illinois,Rock Island,,,,41.47252,90.473754,,,,,,,,,,,,,,,,,ruolivia,8/5/2021 10:38,http://creativecommons.org/licenses/by-nc/4.0/,Augustana College,,urn:uuid:0d1d6454-6e36-4cb6-b863-98a140a69fce,https://scan-bugs.org:443/portal/collections/individual/index.php?occid=57354802
57354811,AUGIE,ENT,,120bf21c-d066-48ee-b4c0-880596ea22e4,PreservedSpecimen,185fde3b-7557-4562-9ccf-516e5a8dff92,AUGIEENTB0000318,,Animalia,Arthropoda,Insecta,Coleoptera,Coccinellidae,Harmonia axyridis,27230,"(Pallas, 1773)",Harmonia,axyridis,,,j. hughes,8/5/2021,,,,,,V. cervantes,,8/5/2021,2021,8,5,217,,,,,,,,,,,,,,,,,,,United States,Illinois,Rock Island,,,,41.436864,90.552542,,,,,,,,,,,,,,,,,ruolivia,8/5/2021 10:43,http://creativecommons.org/licenses/by-nc/4.0/,Augustana College,,urn:uuid:185fde3b-7557-4562-9ccf-516e5a8dff92,https://scan-bugs.org:443/portal/collections/individual/index.php?occid=57354811
57354812,AUGIE,ENT,,120bf21c-d066-48ee-b4c0-880596ea22e4,PreservedSpecimen,0edfad6c-272f-4fcb-880f-24c895dbb795,AUGIEENTB0000319,,Animalia,Arthropoda,Insecta,Coleoptera,Coccinellidae,Harmonia axyridis,27230,"(Pallas, 1773)",Harmonia,axyridis,,,j. hughes,8/5/2021,,,,,,j. hughes,,8/5/2021,2021,8,5,217,,,,,,,,,,,,,,,,,,,United States,Illinois,Rock Island,,,,41.436864,90.552542,,,,,,,,,,,,,,,,,ruolivia,8/5/2021 10:43,http://creativecommons.org/licenses/by-nc/4.0/,Augustana College,,urn:uuid:0edfad6c-272f-4fcb-880f-24c895dbb795,https://scan-bugs.org:443/portal/collections/individual/index.php?occid=57354812
57354813,AUGIE,ENT,,120bf21c-d066-48ee-b4c0-880596ea22e4,PreservedSpecimen,a8dd80bf-5106-4b6f-9870-6728ab1bfedc,AUGIEENTB0000320,,Animalia,Arthropoda,Insecta,Coleoptera,Coccinellidae,Cycloneda munda,25911,,Cycloneda,munda,,,j. hughes,8/5/2021,,,,,,o. ruffatto,,8/5/2021,2021,8,5,217,,,,,,,,,,,,,,,,,,,United States,Illinois,Rock Island,,,,41.436864,90.552542,,,,,,,,,,,,,,,,,ruolivia,8/5/2021 10:44,http://creativecommons.org/licenses/by-nc/4.0/,Augustana College,,urn:uuid:a8dd80bf-5106-4b6f-9870-6728ab1bfedc,https://scan-bugs.org:443/portal/collections/individual/index.php?occid=57354813
57354815,AUGIE,ENT,,120bf21c-d066-48ee-b4c0-880596ea22e4,PreservedSpecimen,b461cf2e-1046-4c26-9508-5fe0ac5d9797,AUGIEENTB0000321,,Animalia,Arthropoda,Insecta,Coleoptera,Coccinellidae,Cycloneda munda,25911,,Cycloneda,munda,,,j. hughes,8/5/2021,,,,,,m. gorsegner,,8/5/2021,2021,8,5,217,,,,,,,,,,,,,,,,,,,United States,Illinois,Rock Island,,,,41.436864,90.552542,,,,,,,,,,,,,,,,,ruolivia,8/5/2021 10:45,http://creativecommons.org/licenses/by-nc/4.0/,Augustana College,,urn:uuid:b461cf2e-1046-4c26-9508-5fe0ac5d9797,https://scan-bugs.org:443/portal/collections/individual/index.php?occid=57354815
57354816,AUGIE,ENT,,120bf21c-d066-48ee-b4c0-880596ea22e4,PreservedSpecimen,f8e8d2af-095a-41f2-aea2-1eb8e58a8b02,AUGIEENTB0000322,,Animalia,Arthropoda,Insecta,Coleoptera,Coccinellidae,Cycloneda munda,25911,,Cycloneda,munda,,,j. hughes,8/5/2021,,,,,,j. hughes,,8/5/2021,2021,8,5,217,,,,,,,,,,,,,,,,,,,United States,Illinois,Rock Island,,,,41.436864,90.552542,,,,,,,,,,,,,,,,,ruolivia,8/5/2021 10:45,http://creativecommons.org/licenses/by-nc/4.0/,Augustana College,,urn:uuid:f8e8d2af-095a-41f2-aea2-1eb8e58a8b02,https://scan-bugs.org:443/portal/collections/individual/index.php?occid=57354816
57354818,AUGIE,ENT,,120bf21c-d066-48ee-b4c0-880596ea22e4,PreservedSpecimen,2d752303-2a66-482a-be7c-104a77b3e8ec,AUGIEENTB0000323,,Animalia,Arthropoda,Insecta,Coleoptera,Coccinellidae,Cycloneda munda,25911,,Cycloneda,munda,,,j. hughes,8/5/2021,,,,,,o. ruffatto,,8/5/2021,2021,8,5,217,,,,,,,,,,,,,,,,,,,United States,Illinois,Rock Island,,,,41.436864,90.552542,,,,,,,,,,,,,,,,,ruolivia,8/5/2021 10:46,http://creativecommons.org/licenses/by-nc/4.0/,Augustana College,,urn:uuid:2d752303-2a66-482a-be7c-104a77b3e8ec,https://scan-bugs.org:443/portal/collections/individual/index.php?occid=57354818
57354820,AUGIE,ENT,,120bf21c-d066-48ee-b4c0-880596ea22e4,PreservedSpecimen,e13f9302-13f6-4abd-9b2d-48adee9548e3,AUGIEENTB0000324,,Animalia,Arthropoda,Insecta,Coleoptera,Coccinellidae,Cycloneda munda,25911,,Cycloneda,munda,,,j. hughes,8/5/2021,,,,,,m. gorsegner,,8/5/2021,2021,8,5,217,,,,,,,,,,,,,,,,,,,United States,Illinois,Rock Island,,,,41.436864,90.552542,,,,,,,,,,,,,,,,,ruolivia,8/5/2021 10:46,http://creativecommons.org/licenses/by-nc/4.0/,Augustana College,,urn:uuid:e13f9302-13f6-4abd-9b2d-48adee9548e3,https://scan-bugs.org:443/portal/collections/individual/index.php?occid=57354820
57354824,AUGIE,ENT,,120bf21c-d066-48ee-b4c0-880596ea22e4,PreservedSpecimen,e0d98965-71f5-4926-bf2a-559441b8ef3b,AUGIEENTB0000325,,Animalia,Arthropoda,Insecta,Coleoptera,Coccinellidae,Harmonia axyridis,27230,"(Pallas, 1773)",Harmonia,axyridis,,,j. hughes,8/5/2021,,,,,,m. gorsegner,,8/5/2021,2021,8,5,217,,,,,,,,,,,,,,,,,,,United States,Illinois,Rock Island,,,,41.520413,90.439069,,,,,,,,,,,,,,,,,ruolivia,8/5/2021 10:51,http://creativecommons.org/licenses/by-nc/4.0/,Augustana College,,urn:uuid:e0d98965-71f5-4926-bf2a-559441b8ef3b,https://scan-bugs.org:443/portal/collections/individual/index.php?occid=57354824
57354826,AUGIE,ENT,,120bf21c-d066-48ee-b4c0-880596ea22e4,PreservedSpecimen,aa2e5f79-12c7-4adb-a194-0ccf405c6e68,AUGIEENTB0000326,,,,,,,Harmonia axyridis,,,,,,,,,,,,,,m. gorsegner,,8/5/2021,2021,8,5,217,,,,,,,,,,,,,,,,,,,United States,Illinois,Rock Island,,,,41.520413,90.439069,,,,,,,,,,,,,,,,,ruolivia,8/5/2021 10:51,http://creativecommons.org/licenses/by-nc/4.0/,Augustana College,,urn:uuid:aa2e5f79-12c7-4adb-a194-0ccf405c6e68,https://scan-bugs.org:443/portal/collections/individual/index.php?occid=57354826
57354827,AUGIE,ENT,,120bf21c-d066-48ee-b4c0-880596ea22e4,PreservedSpecimen,0a5d21bf-67e3-423c-9d6b-dc2291584dc2,AUGIEENTB0000327,,Animalia,Arthropoda,Insecta,Coleoptera,Coccinellidae,Harmonia axyridis,27230,"(Pallas, 1773)",Harmonia,axyridis,,,j. hughes,8/5/2021,,,,,,V. cervantes,,8/5/2021,2021,8,5,217,,,,,,,,,,,,,,,,,,,United States,Illinois,Rock Island,,,,41.520413,90.439069,,,,,,,,,,,,,,,,,ruolivia,8/5/2021 10:52,http://creativecommons.org/licenses/by-nc/4.0/,Augustana College,,urn:uuid:0a5d21bf-67e3-423c-9d6b-dc2291584dc2,https://scan-bugs.org:443/portal/collections/individual/index.php?occid=57354827
57354830,AUGIE,ENT,,120bf21c-d066-48ee-b4c0-880596ea22e4,PreservedSpecimen,ba6d9b44-6f1c-4a10-9119-7e2dd7fabbf9,AUGIEENTB0000328,,Animalia,Arthropoda,Insecta,Coleoptera,Coccinellidae,Harmonia axyridis,27230,"(Pallas, 1773)",Harmonia,axyridis,,,j. hughes,8/5/2021,,,,,,o. ruffatto,,8/5/2021,2021,8,5,217,,,,,,,,,,,,,,,,,,,United States,Illinois,Rock Island,,,,41.520413,90.439069,,,,,,,,,,,,,,,,,ruolivia,8/5/2021 10:52,http://creativecommons.org/licenses/by-nc/4.0/,Augustana College,,urn:uuid:ba6d9b44-6f1c-4a10-9119-7e2dd7fabbf9,https://scan-bugs.org:443/portal/collections/individual/index.php?occid=57354830
57354832,AUGIE,ENT,,120bf21c-d066-48ee-b4c0-880596ea22e4,PreservedSpecimen,ccceb9ce-4b59-4c1d-a660-0a8208637c4c,AUGIEENTB0000329,,Animalia,Arthropoda,Insecta,Coleoptera,Coccinellidae,Harmonia axyridis,27230,"(Pallas, 1773)",Harmonia,axyridis,,,j. hughes,8/5/2021,,,,,,o. ruffatto,,8/5/2021,2021,8,5,217,,,,,,,,,,,,,,,,,,,United States,Illinois,Rock Island,,,,41.520413,90.439069,,,,,,,,,,,,,,,,,ruolivia,8/5/2021 10:53,http://creativecommons.org/licenses/by-nc/4.0/,Augustana College,,urn:uuid:ccceb9ce-4b59-4c1d-a660-0a8208637c4c,https://scan-bugs.org:443/portal/collections/individual/index.php?occid=57354832
57354834,AUGIE,ENT,,120bf21c-d066-48ee-b4c0-880596ea22e4,PreservedSpecimen,8f9efe45-9616-44eb-a163-adbc0e4bcbe8,AUGIEENTB0000330,,Animalia,Arthropoda,Insecta,Coleoptera,Coccinellidae,Harmonia axyridis,27230,"(Pallas, 1773)",Harmonia,axyridis,,,j. hughes,8/5/2021,,,,,,j. hughes,,8/5/2021,2021,8,5,217,,,,,,,,,,,,,,,,,,,United States,Illinois,Rock Island,,,,41.520413,90.439069,,,,,,,,,,,,,,,,,ruolivia,8/5/2021 10:53,http://creativecommons.org/licenses/by-nc/4.0/,Augustana College,,urn:uuid:8f9efe45-9616-44eb-a163-adbc0e4bcbe8,https://scan-bugs.org:443/portal/collections/individual/index.php?occid=57354834
57354836,AUGIE,ENT,,120bf21c-d066-48ee-b4c0-880596ea22e4,PreservedSpecimen,caa9862d-8801-4990-936f-6ea8207570a2,AUGIEENTB0000331,,Animalia,Arthropoda,Insecta,Coleoptera,Coccinellidae,Harmonia axyridis,27230,"(Pallas, 1773)",Harmonia,axyridis,,,j. hughes,8/5/2021,,,,,,m. gorsegner,,8/5/2021,2021,8,5,217,,,,,,,,,,,,,,,,,,,United States,Illinois,Rock Island,,,,41.520413,90.439069,,,,,,,,,,,,,,,,,ruolivia,8/5/2021 10:54,http://creativecommons.org/licenses/by-nc/4.0/,Augustana College,,urn:uuid:caa9862d-8801-4990-936f-6ea8207570a2,https://scan-bugs.org:443/portal/collections/individual/index.php?occid=57354836
57354838,AUGIE,ENT,,120bf21c-d066-48ee-b4c0-880596ea22e4,PreservedSpecimen,aa41505c-7b08-4ba2-ab78-4431ea93c69f,AUGIEENTB0000332,,Animalia,Arthropoda,Insecta,Coleoptera,Coccinellidae,Harmonia axyridis,27230,"(Pallas, 1773)",Harmonia,axyridis,,,j. hughes,8/5/2021,,,,,,V. cervantes,,8/5/2021,2021,8,5,217,,,,,,,,,,,,,,,,,,,United States,Illinois,Rock Island,,,,41.520413,90.439069,,,,,,,,,,,,,,,,,ruolivia,8/5/2021 10:56,http://creativecommons.org/licenses/by-nc/4.0/,Augustana College,,urn:uuid:aa41505c-7b08-4ba2-ab78-4431ea93c69f,https://scan-bugs.org:443/portal/collections/individual/index.php?occid=57354838
57354839,AUGIE,ENT,,120bf21c-d066-48ee-b4c0-880596ea22e4,PreservedSpecimen,5a704957-2e2d-410b-8f22-856e80fae229,AUGIEENTB0000333,,Animalia,Arthropoda,Insecta,Coleoptera,Coccinellidae,Harmonia axyridis,27230,"(Pallas, 1773)",Harmonia,axyridis,,,j. hughes,8/5/2021,,,,,,m. gorsegner,,8/5/2021,2021,8,5,217,,,,,,,,,,,,,,,,,,,United States,Illinois,Rock Island,,,,41.520413,90.439069,,,,,,,,,,,,,,,,,ruolivia,8/5/2021 10:56,http://creativecommons.org/licenses/by-nc/4.0/,Augustana College,,urn:uuid:5a704957-2e2d-410b-8f22-856e80fae229,https://scan-bugs.org:443/portal/collections/individual/index.php?occid=57354839
57354840,AUGIE,ENT,,120bf21c-d066-48ee-b4c0-880596ea22e4,PreservedSpecimen,a3fcbba3-a6eb-45f8-a609-9cc7de473dfe,AUGIEENTB0000344,,Animalia,Arthropoda,Insecta,Coleoptera,Coccinellidae,Coleomegilla maculata,25547,,Coleomegilla,maculata,,,V. Cervantes,8/4/2021,,,,,,M. Gorsegner,,8/4/2021,2021,8,4,216,,8/4/2021,,,,,,,,,,,,,,,,,United States,Illinois,Rock Island,,,,41.531584,90.414653,,,,,,,,,,,,,,,,,marissagorsegner,8/5/2021 10:57,http://creativecommons.org/licenses/by-nc/4.0/,Augustana College,,urn:uuid:a3fcbba3-a6eb-45f8-a609-9cc7de473dfe,https://scan-bugs.org:443/portal/collections/individual/index.php?occid=57354840
57354841,AUGIE,ENT,,120bf21c-d066-48ee-b4c0-880596ea22e4,PreservedSpecimen,e44d3e89-e212-4f10-97aa-a0d5adb132f9,AUGIEENTB0000334,,Animalia,Arthropoda,Insecta,Coleoptera,Coccinellidae,Harmonia axyridis,27230,"(Pallas, 1773)",Harmonia,axyridis,,,j. hughes,8/5/2021,,,,,,o. ruffatto,,8/5/2021,2021,8,5,217,,,,,,,,,,,,,,,,,,,United States,Illinois,Rock Island,,,,41.520413,90.439069,,,,,,,,,,,,,,,,,ruolivia,8/5/2021 10:57,http://creativecommons.org/licenses/by-nc/4.0/,Augustana College,,urn:uuid:e44d3e89-e212-4f10-97aa-a0d5adb132f9,https://scan-bugs.org:443/portal/collections/individual/index.php?occid=57354841
57354842,AUGIE,ENT,,120bf21c-d066-48ee-b4c0-880596ea22e4,PreservedSpecimen,daade12b-696e-4d38-ac7b-2c206119c42e,AUGIEENTB0000345,,Animalia,Arthropoda,Insecta,Coleoptera,Coccinellidae,Harmonia axyridis,27230,"(Pallas, 1773)",Harmonia,axyridis,,,V. Cervantes,8/4/2021,,,,,,M. Gorsegner,,8/4/2021,2021,8,4,216,,8/4/2021,,,,,,,,,,,,,,,,,United States,Illinois,Rock Island,,,,41.531584,90.414653,,,,,,,,,,,,,,,,,marissagorsegner,8/5/2021 13:07,http://creativecommons.org/licenses/by-nc/4.0/,Augustana College,,urn:uuid:daade12b-696e-4d38-ac7b-2c206119c42e,https://scan-bugs.org:443/portal/collections/individual/index.php?occid=57354842
57354843,AUGIE,ENT,,120bf21c-d066-48ee-b4c0-880596ea22e4,PreservedSpecimen,536ec835-9f94-4ff5-8c2d-855903c1de53,AUGIEENTB0000335,,Animalia,Arthropoda,Insecta,Coleoptera,Coccinellidae,Harmonia axyridis,27230,"(Pallas, 1773)",Harmonia,axyridis,,,j. hughes,8/5/2021,,,,,,j. hughes,,8/5/2021,2021,8,5,217,,,,,,,,,,,,,,,,,,,United States,Illinois,Rock Island,,,,41.520413,90.439069,,,,,,,,,,,,,,,,,ruolivia,8/5/2021 10:58,http://creativecommons.org/licenses/by-nc/4.0/,Augustana College,,urn:uuid:536ec835-9f94-4ff5-8c2d-855903c1de53,https://scan-bugs.org:443/portal/collections/individual/index.php?occid=57354843
57354844,AUGIE,ENT,,120bf21c-d066-48ee-b4c0-880596ea22e4,PreservedSpecimen,706385dd-c7d2-4b08-9929-939949ec4fc9,AUGIEENTB0000346,,Animalia,Arthropoda,Insecta,Coleoptera,Coccinellidae,Harmonia axyridis,27230,"(Pallas, 1773)",Harmonia,axyridis,,,V. Cervantes,8/5/2021,,,,,,Jack Hughes,,8/4/2021,2021,8,4,216,,8/4/2021,,,,,,,,,,,,,,,,,United States,Illinois,Rock Island,,,,41.531584,90.414653,,,,,,,,,,,,,,,,,marissagorsegner,8/5/2021 13:07,http://creativecommons.org/licenses/by-nc/4.0/,Augustana College,,urn:uuid:706385dd-c7d2-4b08-9929-939949ec4fc9,https://scan-bugs.org:443/portal/collections/individual/index.php?occid=57354844
57354845,AUGIE,ENT,,120bf21c-d066-48ee-b4c0-880596ea22e4,PreservedSpecimen,2453e78a-b015-4159-8905-64a489cd1809,AUGIEENTB0000336,,Animalia,Arthropoda,Insecta,Coleoptera,Coccinellidae,Harmonia axyridis,27230,"(Pallas, 1773)",Harmonia,axyridis,,,j. hughes,8/5/2021,,,,,,o. ruffatto,,8/5/2021,2021,8,5,217,,,,,,,,,,,,,,,,,,,United States,Illinois,Rock Island,,,,41.520413,90.439069,,,,,,,,,,,,,,,,,ruolivia,8/5/2021 10:58,http://creativecommons.org/licenses/by-nc/4.0/,Augustana College,,urn:uuid:2453e78a-b015-4159-8905-64a489cd1809,https://scan-bugs.org:443/portal/collections/individual/index.php?occid=57354845
57354847,AUGIE,ENT,,120bf21c-d066-48ee-b4c0-880596ea22e4,PreservedSpecimen,ef6b0b6f-06f5-4575-a6ae-40889d2b399f,AUGIEENTB0000347,,Animalia,Arthropoda,Insecta,Coleoptera,Coccinellidae,Harmonia axyridis,27230,"(Pallas, 1773)",Harmonia,axyridis,,,V. Cervantes,8/5/2021,,,,,,V. Cervantes,,8/4/2021,2021,8,4,216,,8/4/2021,,,,,,,,,,,,,,,,,United States,Illinois,Rock Island,,,,41.531584,90.414653,,,,,,,,,,,,,,,,,marissagorsegner,8/5/2021 13:07,http://creativecommons.org/licenses/by-nc/4.0/,Augustana College,,urn:uuid:ef6b0b6f-06f5-4575-a6ae-40889d2b399f,https://scan-bugs.org:443/portal/collections/individual/index.php?occid=57354847
57354848,AUGIE,ENT,,120bf21c-d066-48ee-b4c0-880596ea22e4,PreservedSpecimen,59e76373-e416-4e23-be0c-590fcac356cc,AUGIEENTB0000337,,Animalia,Arthropoda,Insecta,Coleoptera,Coccinellidae,Cycloneda munda,25911,,Cycloneda,munda,,,j. hughes,8/5/2021,,,,,,o. ruffatto,,8/5/2021,2021,8,5,217,,,,,,,,,,,,,,,,,,,United States,Illinois,Rock Island,,,,41.520413,90.439069,,,,,,,,,,,,,,,,,ruolivia,8/5/2021 10:59,http://creativecommons.org/licenses/by-nc/4.0/,Augustana College,,urn:uuid:59e76373-e416-4e23-be0c-590fcac356cc,https://scan-bugs.org:443/portal/collections/individual/index.php?occid=57354848
57354850,AUGIE,ENT,,120bf21c-d066-48ee-b4c0-880596ea22e4,PreservedSpecimen,3bfc1124-7c46-4e51-a8cd-744607b34986,AUGIEENTB0000348,,Animalia,Arthropoda,Insecta,Coleoptera,Coccinellidae,Harmonia axyridis,27230,"(Pallas, 1773)",Harmonia,axyridis,,,V. Cervantes,8/5/2021,,,,,,Olivia Ruffatto,,8/4/2021,2021,8,4,216,,8/4/2021,,,,,,,,,,,,,,,,,United States,Illinois,Rock Island,,,,41.531584,90.414653,,,,,,,,,,,,,,,,,marissagorsegner,8/5/2021 13:07,http://creativecommons.org/licenses/by-nc/4.0/,Augustana College,,urn:uuid:3bfc1124-7c46-4e51-a8cd-744607b34986,https://scan-bugs.org:443/portal/collections/individual/index.php?occid=57354850
57354851,AUGIE,ENT,,120bf21c-d066-48ee-b4c0-880596ea22e4,PreservedSpecimen,47590054-f38e-436e-9596-834c91bd8b9a,AUGIEENTB0000338,,Animalia,Arthropoda,Insecta,Coleoptera,Coccinellidae,Harmonia axyridis,27230,"(Pallas, 1773)",Harmonia,axyridis,,,j. hughes,8/5/2021,,,,,,m. gorsegner,,8/5/2021,2021,8,5,217,,,,,,,,,,,,,,,,,,,United States,Illinois,Rock Island,,,,41.520413,90.439069,,,,,,,,,,,,,,,,,ruolivia,8/5/2021 11:00,http://creativecommons.org/licenses/by-nc/4.0/,Augustana College,,urn:uuid:47590054-f38e-436e-9596-834c91bd8b9a,https://scan-bugs.org:443/portal/collections/individual/index.php?occid=57354851
57354853,AUGIE,ENT,,120bf21c-d066-48ee-b4c0-880596ea22e4,PreservedSpecimen,076732b8-fbbc-450e-a0aa-3d24897320fa,AUGIEENTB0000339,,Animalia,Arthropoda,Insecta,Coleoptera,Coccinellidae,Harmonia axyridis,27230,"(Pallas, 1773)",Harmonia,axyridis,,,j. hughes,8/5/2021,,,,,,j. hughes,,8/5/2021,2021,8,5,217,,,,,,,,,,,,,,,,,,,United States,Illinois,Rock Island,,,,41.520413,90.439069,,,,,,,,,,,,,,,,,ruolivia,8/5/2021 11:00,http://creativecommons.org/licenses/by-nc/4.0/,Augustana College,,urn:uuid:076732b8-fbbc-450e-a0aa-3d24897320fa,https://scan-bugs.org:443/portal/collections/individual/index.php?occid=57354853
57354854,AUGIE,ENT,,120bf21c-d066-48ee-b4c0-880596ea22e4,PreservedSpecimen,00d8d131-be44-44b3-99cb-de0ee4e7f181,AUGIEENTB0000349,,Animalia,Arthropoda,Insecta,Coleoptera,Coccinellidae,Propylea quatuordecimpunctata,613667,(Linneus 1758),Propylea,quatuordecimpunctata,,,V. Cervantes,8/5/2021,,,,,,Jack Hughes,,8/4/2021,2021,8,4,216,,8/4/2021,,,,,,,,,,,,,,,,,United States,Illinois,Rock Island,,,,41.531584,90.414653,,,,,,,,,,,,,,,,,marissagorsegner,8/5/2021 13:07,http://creativecommons.org/licenses/by-nc/4.0/,Augustana College,,urn:uuid:00d8d131-be44-44b3-99cb-de0ee4e7f181,https://scan-bugs.org:443/portal/collections/individual/index.php?occid=57354854
57354855,AUGIE,ENT,,120bf21c-d066-48ee-b4c0-880596ea22e4,PreservedSpecimen,647742de-be55-4f4b-8730-3fe0d48177e4,AUGIEENTB0000340,,Animalia,Arthropoda,Insecta,Coleoptera,Coccinellidae,Harmonia axyridis,27230,"(Pallas, 1773)",Harmonia,axyridis,,,j. hughes,8/5/2021,,,,,,V. cervantes,,8/5/2021,2021,8,5,217,,,,,,,,,,,,,,,,,,,United States,Illinois,Rock Island,,,,41.520413,90.439069,,,,,,,,,,,,,,,,,ruolivia,8/5/2021 11:01,http://creativecommons.org/licenses/by-nc/4.0/,Augustana College,,urn:uuid:647742de-be55-4f4b-8730-3fe0d48177e4,https://scan-bugs.org:443/portal/collections/individual/index.php?occid=57354855
57354856,AUGIE,ENT,,120bf21c-d066-48ee-b4c0-880596ea22e4,PreservedSpecimen,47b3d755-88af-4cf7-8ad5-c71e5a6daf71,AUGIEENTB0000350,,Animalia,Arthropoda,Insecta,Coleoptera,Coccinellidae,Propylea quatuordecimpunctata,613667,(Linneus 1758),Propylea,quatuordecimpunctata,,,V. Cervantes,8/5/2021,,,,,,Olivia Ruffatto,,8/4/2021,2021,8,4,216,,8/4/2021,,,,,,,,,,,,,,,,,United States,Illinois,Rock Island,,,,41.531584,90.414653,,,,,,,,,,,,,,,,,marissagorsegner,8/5/2021 13:07,http://creativecommons.org/licenses/by-nc/4.0/,Augustana College,,urn:uuid:47b3d755-88af-4cf7-8ad5-c71e5a6daf71,https://scan-bugs.org:443/portal/collections/individual/index.php?occid=57354856
57354858,AUGIE,ENT,,120bf21c-d066-48ee-b4c0-880596ea22e4,PreservedSpecimen,27da07b0-8a97-416c-b49e-5bacf752fe92,AUGIEENTB0000341,,Animalia,Arthropoda,Insecta,Coleoptera,Coccinellidae,Hippodamia convergens,27393,"Guérin-Méneville, 1842",Hippodamia,convergens,,,j. hughes,8/5/2021,,,,,,o. ruffatto,,8/5/2021,2021,8,5,217,,,,,,,,,,,,,,,,,,,United States,Illinois,Rock Island,,,,41.520413,90.439069,,,,,,,,,,,,,,,,,ruolivia,8/5/2021 11:02,http://creativecommons.org/licenses/by-nc/4.0/,Augustana College,,urn:uuid:27da07b0-8a97-416c-b49e-5bacf752fe92,https://scan-bugs.org:443/portal/collections/individual/index.php?occid=57354858
57354860,AUGIE,ENT,,120bf21c-d066-48ee-b4c0-880596ea22e4,PreservedSpecimen,ad3176a3-021c-4bf8-8936-9c2a65cdfa3b,AUGIEENTB0000342,,Animalia,Arthropoda,Insecta,Coleoptera,Coccinellidae,Harmonia axyridis,27230,"(Pallas, 1773)",Harmonia,axyridis,,,j. hughes,8/5/2021,,,,,,m. gorsegner,,8/5/2021,2021,8,5,217,,,,,,,,,,,,,,,,,,,United States,Illinois,Rock Island,,,,41.520413,90.439069,,,,,,,,,,,,,,,,,ruolivia,8/5/2021 11:03,http://creativecommons.org/licenses/by-nc/4.0/,Augustana College,,urn:uuid:ad3176a3-021c-4bf8-8936-9c2a65cdfa3b,https://scan-bugs.org:443/portal/collections/individual/index.php?occid=57354860
57354862,AUGIE,ENT,,120bf21c-d066-48ee-b4c0-880596ea22e4,PreservedSpecimen,d245f716-6dc2-41f6-b488-7a0aa9a03c72,AUGIEENTB0000343,,Animalia,Arthropoda,Insecta,Coleoptera,Coccinellidae,Harmonia axyridis,27230,"(Pallas, 1773)",Harmonia,axyridis,,,j. hughes,8/5/2021,,,,,,V. cervantes,,8/5/2021,2021,8,5,217,,,,,,,,,,,,,,,,,,,United States,Illinois,Rock Island,,,,41.520413,90.439069,,,,,,,,,,,,,,,,,ruolivia,8/5/2021 11:03,http://creativecommons.org/licenses/by-nc/4.0/,Augustana College,,urn:uuid:d245f716-6dc2-41f6-b488-7a0aa9a03c72,https://scan-bugs.org:443/portal/collections/individual/index.php?occid=57354862
57354863,AUGIE,ENT,,120bf21c-d066-48ee-b4c0-880596ea22e4,PreservedSpecimen,1fc959db-b4f2-4fa8-a9ad-b02976cab49c,AUGIEENTB0000351,,Animalia,Arthropoda,Insecta,Coleoptera,Coccinellidae,Harmonia axyridis,27230,"(Pallas, 1773)",Harmonia,axyridis,,,j. hughes,8/5/2021,,,,,,j. hughes,,8/5/2021,2021,8,5,217,,,,,,,,,,,,,,,,,,,United States,Illinois,Rock Island,,,,41.520413,90.439069,,,,,,,,,,,,,,,,,ruolivia,8/5/2021 11:04,http://creativecommons.org/licenses/by-nc/4.0/,Augustana College,,urn:uuid:1fc959db-b4f2-4fa8-a9ad-b02976cab49c,https://scan-bugs.org:443/portal/collections/individual/index.php?occid=57354863
57354864,AUGIE,ENT,,120bf21c-d066-48ee-b4c0-880596ea22e4,PreservedSpecimen,5f122db7-f112-4285-9409-68d0593a17ae,AUGIEENTB0000352,,Animalia,Arthropoda,Insecta,Coleoptera,Coccinellidae,Hippodamia convergens,27393,"Guérin-Méneville, 1842",Hippodamia,convergens,,,j. hughes,8/5/2021,,,,,,V. cervantes,,8/5/2021,2021,8,5,217,,,,,,,,,,,,,,,,,,,United States,Illinois,Rock Island,,,,41.520413,90.439069,,,,,,,,,,,,,,,,,ruolivia,8/5/2021 11:04,http://creativecommons.org/licenses/by-nc/4.0/,Augustana College,,urn:uuid:5f122db7-f112-4285-9409-68d0593a17ae,https://scan-bugs.org:443/portal/collections/individual/index.php?occid=57354864
57354868,AUGIE,ENT,,120bf21c-d066-48ee-b4c0-880596ea22e4,PreservedSpecimen,6f39dc45-95e0-4f2a-a0bf-0dc3b9d3034b,AUGIEENTB0000353,,Animalia,Arthropoda,Insecta,Coleoptera,Coccinellidae,Harmonia axyridis,27230,"(Pallas, 1773)",Harmonia,axyridis,,,j. hughes,8/5/2021,,,,,,o. ruffatto,,8/5/2021,2021,8,5,217,,,,,,,,,,,,,,,,,,,United States,Illinois,Rock Island,,,,41.469869,90.506684,,,,,,,,,,,,,,,,,ruolivia,8/5/2021 11:08,http://creativecommons.org/licenses/by-nc/4.0/,Augustana College,,urn:uuid:6f39dc45-95e0-4f2a-a0bf-0dc3b9d3034b,https://scan-bugs.org:443/portal/collections/individual/index.php?occid=57354868
57354869,AUGIE,ENT,,120bf21c-d066-48ee-b4c0-880596ea22e4,PreservedSpecimen,82d21280-3d9d-46c4-be87-e58cc9c38e43,AUGIEENTB0000354,,Animalia,Arthropoda,Insecta,Coleoptera,Coccinellidae,Harmonia axyridis,27230,"(Pallas, 1773)",Harmonia,axyridis,,,j. hughes,8/5/2021,,,,,,j. hughes,,8/5/2021,2021,8,5,217,,,,,,,,,,,,,,,,,,,United States,Illinois,Rock Island,,,,41.469869,90.506684,,,,,,,,,,,,,,,,,ruolivia,8/5/2021 11:08,http://creativecommons.org/licenses/by-nc/4.0/,Augustana College,,urn:uuid:82d21280-3d9d-46c4-be87-e58cc9c38e43,https://scan-bugs.org:443/portal/collections/individual/index.php?occid=57354869
57354870,AUGIE,ENT,,120bf21c-d066-48ee-b4c0-880596ea22e4,PreservedSpecimen,f5dba7aa-490d-439e-b27b-ddc389c589b2,AUGIEENTB0000355,,Animalia,Arthropoda,Insecta,Coleoptera,Coccinellidae,Harmonia axyridis,27230,"(Pallas, 1773)",Harmonia,axyridis,,,j. hughes,8/5/2021,,,,,,V. cervantes,,8/5/2021,2021,8,5,217,,,,,,,,,,,,,,,,,,,United States,Illinois,Rock Island,,,,41.469869,90.506684,,,,,,,,,,,,,,,,,ruolivia,8/5/2021 11:09,http://creativecommons.org/licenses/by-nc/4.0/,Augustana College,,urn:uuid:f5dba7aa-490d-439e-b27b-ddc389c589b2,https://scan-bugs.org:443/portal/collections/individual/index.php?occid=57354870
57354871,AUGIE,ENT,,120bf21c-d066-48ee-b4c0-880596ea22e4,PreservedSpecimen,b8e7729b-6be9-4725-bc84-e621d5b4aa8a,AUGIEENTB0000356,,Animalia,Arthropoda,Insecta,Coleoptera,Coccinellidae,Harmonia axyridis,27230,"(Pallas, 1773)",Harmonia,axyridis,,,j. hughes,8/5/2021,,,,,,j. hughes,,8/5/2021,2021,8,5,217,,,,,,,,,,,,,,,,,,,United States,Illinois,Rock Island,,,,41.469869,90.506684,,,,,,,,,,,,,,,,,ruolivia,8/5/2021 11:09,http://creativecommons.org/licenses/by-nc/4.0/,Augustana College,,urn:uuid:b8e7729b-6be9-4725-bc84-e621d5b4aa8a,https://scan-bugs.org:443/portal/collections/individual/index.php?occid=57354871
57354872,AUGIE,ENT,,120bf21c-d066-48ee-b4c0-880596ea22e4,PreservedSpecimen,bbec29b0-2f82-4b46-aea3-e7a11ea8246c,AUGIEENTB0000357,,Animalia,Arthropoda,Insecta,Coleoptera,Coccinellidae,Harmonia axyridis,27230,"(Pallas, 1773)",Harmonia,axyridis,,,j. hughes,8/5/2021,,,,,,m. gorsegner,,8/5/2021,2021,8,5,217,,,,,,,,,,,,,,,,,,,United States,Illinois,Rock Island,,,,41.469869,90.506684,,,,,,,,,,,,,,,,,ruolivia,8/5/2021 11:10,http://creativecommons.org/licenses/by-nc/4.0/,Augustana College,,urn:uuid:bbec29b0-2f82-4b46-aea3-e7a11ea8246c,https://scan-bugs.org:443/portal/collections/individual/index.php?occid=57354872
57354873,AUGIE,ENT,,120bf21c-d066-48ee-b4c0-880596ea22e4,PreservedSpecimen,fcb8faaa-baca-4703-9094-ae60006c47c2,AUGIEENTB0000358,,Animalia,Arthropoda,Insecta,Coleoptera,Coccinellidae,Harmonia axyridis,27230,"(Pallas, 1773)",Harmonia,axyridis,,,j. hughes,8/5/2021,,,,,,o. ruffatto,,8/5/2021,2021,8,5,217,,,,,,,,,,,,,,,,,,,United States,Illinois,Rock Island,,,,41.469869,90.506684,,,,,,,,,,,,,,,,,ruolivia,8/5/2021 11:10,http://creativecommons.org/licenses/by-nc/4.0/,Augustana College,,urn:uuid:fcb8faaa-baca-4703-9094-ae60006c47c2,https://scan-bugs.org:443/portal/collections/individual/index.php?occid=57354873
57354874,AUGIE,ENT,,120bf21c-d066-48ee-b4c0-880596ea22e4,PreservedSpecimen,608e2e0d-2ba7-4a91-a56f-3a1760ad6f06,AUGIEENTB0000359,,Animalia,Arthropoda,Insecta,Coleoptera,Coccinellidae,Harmonia axyridis,27230,"(Pallas, 1773)",Harmonia,axyridis,,,j. hughes,8/5/2021,,,,,,m. gorsegner,,8/5/2021,2021,8,5,217,,,,,,,,,,,,,,,,,,,United States,Illinois,Rock Island,,,,41.469869,90.506684,,,,,,,,,,,,,,,,,ruolivia,8/5/2021 11:11,http://creativecommons.org/licenses/by-nc/4.0/,Augustana College,,urn:uuid:608e2e0d-2ba7-4a91-a56f-3a1760ad6f06,https://scan-bugs.org:443/portal/collections/individual/index.php?occid=57354874
57354875,AUGIE,ENT,,120bf21c-d066-48ee-b4c0-880596ea22e4,PreservedSpecimen,c58b5e26-846b-4c34-9042-9d6c7ab1d8eb,AUGIEENTB0000360,,Animalia,Arthropoda,Insecta,Coleoptera,Coccinellidae,Coccinella septempunctata,25520,"(Linnaeus, 1758)",Coccinella,septempunctata,,,j. hughes,8/5/2021,,,,,,j. hughes,,8/5/2021,2021,8,5,217,,,,,,,,,,,,,,,,,,,United States,Illinois,Rock Island,,,,41.469869,90.506684,,,,,,,,,,,,,,,,,ruolivia,8/5/2021 11:11,http://creativecommons.org/licenses/by-nc/4.0/,Augustana College,,urn:uuid:c58b5e26-846b-4c34-9042-9d6c7ab1d8eb,https://scan-bugs.org:443/portal/collections/individual/index.php?occid=57354875
57354876,AUGIE,ENT,,120bf21c-d066-48ee-b4c0-880596ea22e4,PreservedSpecimen,306642c4-626e-494a-8052-412293abfa20,AUGIEENTB0000361,,Animalia,Arthropoda,Insecta,Coleoptera,Coccinellidae,Coccinella septempunctata,25520,"(Linnaeus, 1758)",Coccinella,septempunctata,,,j. hughes,8/5/2021,,,,,,V. cervantes,,8/5/2021,2021,8,5,217,,,,,,,,,,,,,,,,,,,United States,Illinois,Rock Island,,,,41.469869,90.506684,,,,,,,,,,,,,,,,,ruolivia,8/5/2021 11:12,http://creativecommons.org/licenses/by-nc/4.0/,Augustana College,,urn:uuid:306642c4-626e-494a-8052-412293abfa20,https://scan-bugs.org:443/portal/collections/individual/index.php?occid=57354876
57354877,AUGIE,ENT,,120bf21c-d066-48ee-b4c0-880596ea22e4,PreservedSpecimen,526e8a39-da91-4660-9189-f4f9ea94da89,AUGIEENTB0000362,,Animalia,Arthropoda,Insecta,Coleoptera,Coccinellidae,Hippodamia convergens,27393,"Guérin-Méneville, 1842",Hippodamia,convergens,,,j. hughes,8/5/2021,,,,,,o. ruffatto,,8/5/2021,2021,8,5,217,,,,,,,,,,,,,,,,,,,United States,Illinois,Rock Island,,,,41.469869,90.506684,,,,,,,,,,,,,,,,,ruolivia,8/5/2021 11:13,http://creativecommons.org/licenses/by-nc/4.0/,Augustana College,,urn:uuid:526e8a39-da91-4660-9189-f4f9ea94da89,https://scan-bugs.org:443/portal/collections/individual/index.php?occid=57354877
57354878,AUGIE,ENT,,120bf21c-d066-48ee-b4c0-880596ea22e4,PreservedSpecimen,1214a0f2-a1dc-4684-a9c6-c9f934368e83,AUGIEENTB0000363,,Animalia,Arthropoda,Insecta,Coleoptera,Coccinellidae,Hippodamia parenthesis,27400,,Hippodamia,parenthesis,,,j. hughes,8/5/2021,,,,,,j. hughes,,8/5/2021,2021,8,5,217,,,,,,,,,,,,,,,,,,,United States,Illinois,Rock Island,,,,41.469869,90.506684,,,,,,,,,,,,,,,,,ruolivia,8/5/2021 11:14,http://creativecommons.org/licenses/by-nc/4.0/,Augustana College,,urn:uuid:1214a0f2-a1dc-4684-a9c6-c9f934368e83,https://scan-bugs.org:443/portal/collections/individual/index.php?occid=57354878
57356967,AUGIE,ENT,,120bf21c-d066-48ee-b4c0-880596ea22e4,PreservedSpecimen,14bd1cc6-e1c1-4396-b46f-fd0430e1f700,AUGIEENTB0000234,,Animalia,Arthropoda,Insecta,Coleoptera,Coccinellidae,Coleomegilla maculata,25547,,Coleomegilla,maculata,,,M. Gorsegner,8/11/2021,,,,,,M. Gorsegner,,7/20/2021,2021,7,20,201,,,,,,,,,,,,,,,,,,,United States,Illinois,Rock Island,,,,41.428138,90.508097,,,,,,,,,,,,,,,,,marissagorsegner,8/11/2021 12:47,http://creativecommons.org/licenses/by-nc/4.0/,Augustana College,,urn:uuid:14bd1cc6-e1c1-4396-b46f-fd0430e1f700,https://scan-bugs.org:443/portal/collections/individual/index.php?occid=57356967
57357160,AUGIE,ENT,,120bf21c-d066-48ee-b4c0-880596ea22e4,PreservedSpecimen,807f22aa-3f5d-4f42-bc2f-4d22eeda9036,AUGIEENTB0000002,,Animalia,Arthropoda,Insecta,Coleoptera,Coccinellidae,Coleomegilla maculata,25547,,Coleomegilla,maculata,,,Marissa Gorsegner,8/12/2021,,,,,,Jack Hughes,,6/23/2021,2021,6,23,174,,6/23/2021,,,,,,,,,,,,,,,,,United States,Iowa,Scott,,,,41.5677,90.52301,,,,,,,,,,,,,,,,,marissagorsegner,8/12/2021 7:02,http://creativecommons.org/licenses/by-nc/4.0/,Augustana College,,urn:uuid:807f22aa-3f5d-4f42-bc2f-4d22eeda9036,https://scan-bugs.org:443/portal/collections/individual/index.php?occid=57357160
57363193,AUGIE,ENT,,120bf21c-d066-48ee-b4c0-880596ea22e4,PreservedSpecimen,76cb1d67-20ad-43c5-89b8-7879998a5362,AUGIEENTB0000230,,Animalia,Arthropoda,Insecta,Coleoptera,Coccinellidae,Hippodamia variegata,27405,"(Goeze, 1777)",Hippodamia,variegata,,,Veronica Cervantes,8/16/2021,,,,,,Jack Hughes,,7/21/2021,2021,7,21,202,,,,,,,,,,,,,,,,,,,United States,Illinois,Rock Island,,,,41.54693,90.552795,,,,,,,,,,,,,,,,,marissagorsegner,8/16/2021 7:02,http://creativecommons.org/licenses/by-nc/4.0/,Augustana College,,urn:uuid:76cb1d67-20ad-43c5-89b8-7879998a5362,https://scan-bugs.org:443/portal/collections/individual/index.php?occid=57363193
57363274,AUGIE,ENT,,120bf21c-d066-48ee-b4c0-880596ea22e4,PreservedSpecimen,76ae1e25-b114-4623-9fd7-1fb933527778,AUGIEENTB0000365,,Animalia,Arthropoda,Insecta,Coleoptera,Coccinellidae,Cycloneda munda,25911,,Cycloneda,munda,,,Veronica Cervantes,8/16/2021,,,,,,Jack Hughes,,8/5/2021,2021,8,5,217,,,,,,,,,,,,,,,,,,,United States,Illinois,Rock Island,,,,41.492597,90.550592,,,,,,,,,,,,,,,,,jackhughes20,8/16/2021 10:54,http://creativecommons.org/licenses/by-nc/4.0/,Augustana College,,urn:uuid:76ae1e25-b114-4623-9fd7-1fb933527778,https://scan-bugs.org:443/portal/collections/individual/index.php?occid=57363274
57363277,AUGIE,ENT,,120bf21c-d066-48ee-b4c0-880596ea22e4,PreservedSpecimen,a197b3da-78de-4ba8-b30a-6ebec7d6e202,AUGIEENTB0000364,,Animalia,Arthropoda,Insecta,Coleoptera,Coccinellidae,Coleomegilla maculata,25547,,Coleomegilla,maculata,,,Veronica Cervantes,8/16/2021,,,,,,Olivia Ruffatto,,8/5/2021,2021,8,5,217,,,,,,,,,,,,,,,,,,,United States,Illinois,Rock Island,,,,41.492597,90.550592,,,,,,,,,,,,,,,,,jackhughes20,8/19/2021 12:41,http://creativecommons.org/licenses/by-nc/4.0/,Augustana College,,urn:uuid:a197b3da-78de-4ba8-b30a-6ebec7d6e202,https://scan-bugs.org:443/portal/collections/individual/index.php?occid=57363277
57363281,AUGIE,ENT,,120bf21c-d066-48ee-b4c0-880596ea22e4,PreservedSpecimen,f7d1b18e-fbf8-422d-b7b0-60bd5e1ce43e,AUGIEENTB0000367,,,,,,,,,,,,,,,,,,,,,V. Cervantes,,8/5/2021,2021,8,5,217,,,,,,,,,,,,,,,,,,,United States,Illinois,Rock Island,,,,41.47603,90.557711,,,,,,,,,,,,,,,,,jackhughes20,8/16/2021 10:59,http://creativecommons.org/licenses/by-nc/4.0/,Augustana College,,urn:uuid:f7d1b18e-fbf8-422d-b7b0-60bd5e1ce43e,https://scan-bugs.org:443/portal/collections/individual/index.php?occid=57363281
57363282,AUGIE,ENT,,120bf21c-d066-48ee-b4c0-880596ea22e4,PreservedSpecimen,f8dc89bf-bcb5-4567-abb2-d6a8e5b8e8e9,AUGIEENTB0000368,,,,,,,,,,,,,,,,,,,,,V. Cervantes,,8/5/2021,2021,8,5,217,,,,,,,,,,,,,,,,,,,United States,Illinois,Rock Island,,,,41.47603,90.557711,,,,,,,,,,,,,,,,,jackhughes20,8/16/2021 11:00,http://creativecommons.org/licenses/by-nc/4.0/,Augustana College,,urn:uuid:f8dc89bf-bcb5-4567-abb2-d6a8e5b8e8e9,https://scan-bugs.org:443/portal/collections/individual/index.php?occid=57363282
57363283,AUGIE,ENT,,120bf21c-d066-48ee-b4c0-880596ea22e4,PreservedSpecimen,a3e2ccbc-a243-4105-a0c6-16ac0cc29ca9,AUGIEENTB0000369,,,,,,,,,,,,,,,,,,,,,Jack Hughes,,8/5/2021,2021,8,5,217,,,,,,,,,,,,,,,,,,,United States,Illinois,Rock Island,,,,41.47603,90.557711,,,,,,,,,,,,,,,,,jackhughes20,8/16/2021 11:01,http://creativecommons.org/licenses/by-nc/4.0/,Augustana College,,urn:uuid:a3e2ccbc-a243-4105-a0c6-16ac0cc29ca9,https://scan-bugs.org:443/portal/collections/individual/index.php?occid=57363283
57363285,AUGIE,ENT,,120bf21c-d066-48ee-b4c0-880596ea22e4,PreservedSpecimen,901838f4-59fd-4f5b-87db-e6246a2adb60,AUGIEENTB0000370,,,,,,,,,,,,,,,,,,,,,Olivia Ruffatto,,8/5/2021,2021,8,5,217,,,,,,,,,,,,,,,,,,,United States,Illinois,Rock Island,,,,41.47603,90.557711,,,,,,,,,,,,,,,,,jackhughes20,8/16/2021 11:02,http://creativecommons.org/licenses/by-nc/4.0/,Augustana College,,urn:uuid:901838f4-59fd-4f5b-87db-e6246a2adb60,https://scan-bugs.org:443/portal/collections/individual/index.php?occid=57363285
57363287,AUGIE,ENT,,120bf21c-d066-48ee-b4c0-880596ea22e4,PreservedSpecimen,ff7006d6-44bd-40d4-8638-10c55e4e1bf9,AUGIEENTB0000366,,,,,,,,,,,,,,,,,,,,,M. Gorsegner,,8/5/2021,2021,8,5,217,,,,,,,,,,,,,,,,,,,United States,Illinois,Rock Island,,,,41.47603,90.557711,,,,,,,,,,,,,,,,,jackhughes20,8/16/2021 11:02,http://creativecommons.org/licenses/by-nc/4.0/,Augustana College,,urn:uuid:ff7006d6-44bd-40d4-8638-10c55e4e1bf9,https://scan-bugs.org:443/portal/collections/individual/index.php?occid=57363287
57363289,AUGIE,ENT,,120bf21c-d066-48ee-b4c0-880596ea22e4,PreservedSpecimen,7051da1c-9859-46f6-9f2c-42c9d3dc18e2,AUGIEENTB0000374,,,,,,,,,,,,,,,,,,,,,Jack Hughes,,8/5/2021,2021,8,5,217,,,,,,,,,,,,,,,,,,,United States,Illinois,Rock Island,,,,41.47603,90.557711,,,,,,,,,,,,,,,,,jackhughes20,8/16/2021 11:05,http://creativecommons.org/licenses/by-nc/4.0/,Augustana College,,urn:uuid:7051da1c-9859-46f6-9f2c-42c9d3dc18e2,https://scan-bugs.org:443/portal/collections/individual/index.php?occid=57363289
57363290,AUGIE,ENT,,120bf21c-d066-48ee-b4c0-880596ea22e4,PreservedSpecimen,8c6c402e-42fd-46a6-8523-5384472886df,AUGIEENTB0000372,,Animalia,Arthropoda,Insecta,Coleoptera,Coccinellidae,Coleomegilla maculata,25547,,Coleomegilla,maculata,,,Veronica Cervantes,8/16/2021,,,,,,M. Gorsegner,,8/5/2021,2021,8,5,217,,,,,,,,,,,,,,,,,,,United States,Illinois,Rock Island,,,,41.47603,90.557711,,,,,,,,,,,,,,,,,jackhughes20,8/16/2021 11:06,http://creativecommons.org/licenses/by-nc/4.0/,Augustana College,,urn:uuid:8c6c402e-42fd-46a6-8523-5384472886df,https://scan-bugs.org:443/portal/collections/individual/index.php?occid=57363290
57363292,AUGIE,ENT,,120bf21c-d066-48ee-b4c0-880596ea22e4,PreservedSpecimen,6141baf6-5914-4d94-8561-ae06ce227f52,AUGIEENTB0000373,,,,,,,,,,,,,,,,,,,,,V. Cervantes,,8/5/2021,2021,8,5,217,,,,,,,,,,,,,,,,,,,United States,Illinois,Rock Island,,,,41.47603,90.557711,,,,,,,,,,,,,,,,,jackhughes20,8/16/2021 11:07,http://creativecommons.org/licenses/by-nc/4.0/,Augustana College,,urn:uuid:6141baf6-5914-4d94-8561-ae06ce227f52,https://scan-bugs.org:443/portal/collections/individual/index.php?occid=57363292
57363294,AUGIE,ENT,,120bf21c-d066-48ee-b4c0-880596ea22e4,PreservedSpecimen,b0bd19a2-0aed-4cb7-b5f4-68cc187664e5,AUGIEENTB0000371,,,,,,,,,,,,,,,,,,,,,Olivia Ruffatto,,8/5/2021,2021,8,5,217,,,,,,,,,,,,,,,,,,,United States,Illinois,Rock Island,,,,41.47603,90.557711,,,,,,,,,,,,,,,,,jackhughes20,8/16/2021 11:12,http://creativecommons.org/licenses/by-nc/4.0/,Augustana College,,urn:uuid:b0bd19a2-0aed-4cb7-b5f4-68cc187664e5,https://scan-bugs.org:443/portal/collections/individual/index.php?occid=57363294
57363295,AUGIE,ENT,,120bf21c-d066-48ee-b4c0-880596ea22e4,PreservedSpecimen,7af8c5c9-8303-4b5b-b310-f42615900575,AUGIEENTB0000375,,,,,,,,,,,,,,,,,,,,,M. Gorsegner,,8/5/2021,2021,8,5,217,,,,,,,,,,,,,,,,,,,United States,Illinois,Rock Island,,,,41.47603,90.557711,,,,,,,,,,,,,,,,,jackhughes20,8/16/2021 11:13,http://creativecommons.org/licenses/by-nc/4.0/,Augustana College,,urn:uuid:7af8c5c9-8303-4b5b-b310-f42615900575,https://scan-bugs.org:443/portal/collections/individual/index.php?occid=57363295
57363583,AUGIE,ENT,,120bf21c-d066-48ee-b4c0-880596ea22e4,PreservedSpecimen,b0fce552-ba14-47bb-9f48-f296b885eef6,AUGIEENTB0000376,,Animalia,Arthropoda,Insecta,Coleoptera,Coccinellidae,Coccinella septempunctata,25520,"(Linnaeus, 1758)",Coccinella,septempunctata,,,Jack Hughes,8/17/2021,,,,,,O. Ruffatto,,8/17/2021,2021,8,17,229,,,,,,,,,,,,,,,,,,,United States,Iowa,Scott,,,,41.56812,90.57119,,,,,,,,,,,,,,,,,jackhughes20,8/17/2021 12:39,http://creativecommons.org/licenses/by-nc/4.0/,Augustana College,,urn:uuid:b0fce552-ba14-47bb-9f48-f296b885eef6,https://scan-bugs.org:443/portal/collections/individual/index.php?occid=57363583
57363584,AUGIE,ENT,,120bf21c-d066-48ee-b4c0-880596ea22e4,PreservedSpecimen,561184d3-4b8c-4416-bb06-495d70f4f6fd,AUGIEENTB0000377,,Animalia,Arthropoda,Insecta,Coleoptera,Coccinellidae,Coccinella septempunctata,25520,"(Linnaeus, 1758)",Coccinella,septempunctata,,,Jack Hughes,,,,,,,J. Hughes,,8/17/2021,2021,8,17,229,,,,,,,,,,,,,,,,,,,United States,Iowa,Scott,,,,41.56812,90.57119,,,,,,,,,,,,,,,,,jackhughes20,8/17/2021 12:40,http://creativecommons.org/licenses/by-nc/4.0/,Augustana College,,urn:uuid:561184d3-4b8c-4416-bb06-495d70f4f6fd,https://scan-bugs.org:443/portal/collections/individual/index.php?occid=57363584
57363585,AUGIE,ENT,,120bf21c-d066-48ee-b4c0-880596ea22e4,PreservedSpecimen,068dfe40-caa2-4085-8924-0e42a8324c1e,AUGIEENTB0000378,,Animalia,Arthropoda,Insecta,Coleoptera,Coccinellidae,Harmonia axyridis,27230,"(Pallas, 1773)",Harmonia,axyridis,,,Jack Hughes,8/17/2021,,,,,,V. Cervantes,,8/17/2021,2021,8,17,229,,,,,,,,,,,,,,,,,,,United States,Iowa,Scott,,,,41.56812,90.57119,,,,,,,,,,,,,,,,,jackhughes20,8/17/2021 12:41,http://creativecommons.org/licenses/by-nc/4.0/,Augustana College,,urn:uuid:068dfe40-caa2-4085-8924-0e42a8324c1e,https://scan-bugs.org:443/portal/collections/individual/index.php?occid=57363585
57363587,AUGIE,ENT,,120bf21c-d066-48ee-b4c0-880596ea22e4,PreservedSpecimen,7a0d50dd-0cf4-4037-8070-5f03ae05b020,AUGIEENTB0000379,,Animalia,Arthropoda,Insecta,Coleoptera,Coccinellidae,Hippodamia parenthesis,27400,,Hippodamia,parenthesis,,,Jack Hughes,8/17/2021,,,,,,M. Gorsegner,,8/17/2021,2021,8,17,229,,,,,,,,,,,,,,,,,,,United States,Iowa,Scott,,,,41.56812,90.57119,,,,,,,,,,,,,,,,,jackhughes20,8/17/2021 12:42,http://creativecommons.org/licenses/by-nc/4.0/,Augustana College,,urn:uuid:7a0d50dd-0cf4-4037-8070-5f03ae05b020,https://scan-bugs.org:443/portal/collections/individual/index.php?occid=57363587
57363588,AUGIE,ENT,,120bf21c-d066-48ee-b4c0-880596ea22e4,PreservedSpecimen,1377b8b9-05f8-4f93-b5d6-ef8b828e66f3,AUGIEENTB0000380,,Animalia,Arthropoda,Insecta,Coleoptera,Coccinellidae,Propylea quatuordecimpunctata,613667,(Linneus 1758),Propylea,quatuordecimpunctata,,,Veronica Cervantes,8/17/2021,,,,,,V. Cervantes,,8/17/2021,2021,8,17,229,,,,,,,,,,,,,,,,,,,United States,Iowa,Scott,,,,41.5677,90.52301,,,,,,,,,,,,,,,,,jackhughes20,8/17/2021 12:48,http://creativecommons.org/licenses/by-nc/4.0/,Augustana College,,urn:uuid:1377b8b9-05f8-4f93-b5d6-ef8b828e66f3,https://scan-bugs.org:443/portal/collections/individual/index.php?occid=57363588
57363589,AUGIE,ENT,,120bf21c-d066-48ee-b4c0-880596ea22e4,PreservedSpecimen,6d689ecd-c1d4-45e4-a683-c7009cdf7bc0,AUGIEENTB0000381,,Animalia,Arthropoda,Insecta,Coleoptera,Coccinellidae,Propylea quatuordecimpunctata,613667,(Linneus 1758),Propylea,quatuordecimpunctata,,,Veronica Cervantes,8/17/2021,,,,,,V. Cervantes,,8/17/2021,2021,8,17,229,,,,,,,,,,,,,,,,,,,United States,Iowa,Scott,,,,41.5677,90.52301,,,,,,,,,,,,,,,,,jackhughes20,8/17/2021 12:49,http://creativecommons.org/licenses/by-nc/4.0/,Augustana College,,urn:uuid:6d689ecd-c1d4-45e4-a683-c7009cdf7bc0,https://scan-bugs.org:443/portal/collections/individual/index.php?occid=57363589
57363590,AUGIE,ENT,,120bf21c-d066-48ee-b4c0-880596ea22e4,PreservedSpecimen,eba7ffa4-a131-4d6b-957c-871abc17be3a,AUGIEENTB0000382,,Animalia,Arthropoda,Insecta,Coleoptera,Coccinellidae,Cycloneda munda,25911,,Cycloneda,munda,,,Veronica Cervantes,8/17/2021,,,,,,J. Hughes,,8/17/2021,2021,8,17,229,,,,,,,,,,,,,,,,,,,United States,Iowa,Scott,,,,41.5677,90.52301,,,,,,,,,,,,,,,,,jackhughes20,8/17/2021 12:50,http://creativecommons.org/licenses/by-nc/4.0/,Augustana College,,urn:uuid:eba7ffa4-a131-4d6b-957c-871abc17be3a,https://scan-bugs.org:443/portal/collections/individual/index.php?occid=57363590
57363591,AUGIE,ENT,,120bf21c-d066-48ee-b4c0-880596ea22e4,PreservedSpecimen,b0651d42-aa57-4b96-95eb-70775bfc7293,AUGIEENTB0000383,,Animalia,Arthropoda,Insecta,Coleoptera,Coccinellidae,Cycloneda munda,25911,,Cycloneda,munda,,,Veronica Cervantes,,,,,,,M. Gorsegner,,8/17/2021,2021,8,17,229,,,,,,,,,,,,,,,,,,,United States,Iowa,Scott,,,,41.5677,90.52301,,,,,,,,,,,,,,,,,jackhughes20,8/17/2021 12:51,http://creativecommons.org/licenses/by-nc/4.0/,Augustana College,,urn:uuid:b0651d42-aa57-4b96-95eb-70775bfc7293,https://scan-bugs.org:443/portal/collections/individual/index.php?occid=57363591
57363592,AUGIE,ENT,,120bf21c-d066-48ee-b4c0-880596ea22e4,PreservedSpecimen,4ca96d34-b73a-4e3f-a90f-4284a46a6622,AUGIEENTB0000384,,Animalia,Arthropoda,Insecta,Coleoptera,Coccinellidae,Cycloneda munda,25911,,Cycloneda,munda,,,Veronica Cervantes,8/17/2021,,,,,,O. Ruffatto,,8/17/2021,2021,8,17,229,,,,,,,,,,,,,,,,,,,United States,Iowa,Scott,,,,41.5677,90.52301,,,,,,,,,,,,,,,,,jackhughes20,8/17/2021 12:52,http://creativecommons.org/licenses/by-nc/4.0/,Augustana College,,urn:uuid:4ca96d34-b73a-4e3f-a90f-4284a46a6622,https://scan-bugs.org:443/portal/collections/individual/index.php?occid=57363592
57363593,AUGIE,ENT,,120bf21c-d066-48ee-b4c0-880596ea22e4,PreservedSpecimen,2d6661d2-d18a-4fd5-ba97-964741482491,,,,,,,,,,,,,,,,,,,,,,O. Ruffatto,,8/17/2021,2021,8,17,229,,,,,,,,,,,,,,,,,,,United States,Iowa,Scott,,,,41.5677,90.52301,,,,,,,,,,,,,,,,,jackhughes20,8/17/2021 12:53,http://creativecommons.org/licenses/by-nc/4.0/,Augustana College,,urn:uuid:2d6661d2-d18a-4fd5-ba97-964741482491,https://scan-bugs.org:443/portal/collections/individual/index.php?occid=57363593
57363594,AUGIE,ENT,,120bf21c-d066-48ee-b4c0-880596ea22e4,PreservedSpecimen,d0897894-480b-44b6-bb79-e42993da2f52,AUGIEENTB0000385,,Animalia,Arthropoda,Insecta,Coleoptera,Coccinellidae,Coleomegilla maculata,25547,,Coleomegilla,maculata,,,Veronica Cervantes,,,,,,,J. Hughes,,8/17/2021,2021,8,17,229,,,,,,,,,,,,,,,,,,,United States,Iowa,Scott,,,,41.5677,90.52301,,,,,,,,,,,,,,,,,jackhughes20,8/17/2021 12:54,http://creativecommons.org/licenses/by-nc/4.0/,Augustana College,,urn:uuid:d0897894-480b-44b6-bb79-e42993da2f52,https://scan-bugs.org:443/portal/collections/individual/index.php?occid=57363594
57363595,AUGIE,ENT,,120bf21c-d066-48ee-b4c0-880596ea22e4,PreservedSpecimen,715832fa-804e-4477-a4fb-946733e4f4b7,AUGIEENTB0000386,,Animalia,Arthropoda,Insecta,Coleoptera,Coccinellidae,Propylea quatuordecimpunctata,613667,(Linneus 1758),Propylea,quatuordecimpunctata,,,Veronica Cervantes,8/17/2021,,,,,,J. Hughes,,8/17/2021,2021,8,17,229,,,,,,,,,,,,,,,,,,,United States,Iowa,Scott,,,,41.5677,90.52301,,,,,,,,,,,,,,,,,jackhughes20,8/17/2021 12:55,http://creativecommons.org/licenses/by-nc/4.0/,Augustana College,,urn:uuid:715832fa-804e-4477-a4fb-946733e4f4b7,https://scan-bugs.org:443/portal/collections/individual/index.php?occid=57363595
57363596,AUGIE,ENT,,120bf21c-d066-48ee-b4c0-880596ea22e4,PreservedSpecimen,a2e7c05d-3519-4b36-adb9-018b06f9d6ed,AUGIEENTB0000387,,Animalia,Arthropoda,Insecta,Coleoptera,Coccinellidae,Cycloneda munda,25911,,Cycloneda,munda,,,Veronica Cervantes,8/17/2021,,,,,,M. Gorsegner,,8/17/2021,2021,8,17,229,,,,,,,,,,,,,,,,,,,United States,Iowa,Scott,,,,41.50609,90.73943,,,,,,,,,,,,,,,,,jackhughes20,8/17/2021 13:00,http://creativecommons.org/licenses/by-nc/4.0/,Augustana College,,urn:uuid:a2e7c05d-3519-4b36-adb9-018b06f9d6ed,https://scan-bugs.org:443/portal/collections/individual/index.php?occid=57363596
57363597,AUGIE,ENT,,120bf21c-d066-48ee-b4c0-880596ea22e4,PreservedSpecimen,1ce848b4-ee2f-48df-af8a-c16acb8a6fb2,AUGIEENTB0000388,,Animalia,Arthropoda,Insecta,Coleoptera,Coccinellidae,Psyllobora vigintimaculata,31188,,Psyllobora,vigintimaculata,,,,,,,,,,M. Gorsegner,,8/17/2021,2021,8,17,229,,,,,,,,,,,,,,,,,,,United States,Iowa,Scott,,,,41.550606,90.62248,,,,,,,,,,,,,,,,,jackhughes20,8/17/2021 13:03,http://creativecommons.org/licenses/by-nc/4.0/,Augustana College,,urn:uuid:1ce848b4-ee2f-48df-af8a-c16acb8a6fb2,https://scan-bugs.org:443/portal/collections/individual/index.php?occid=57363597
57363598,AUGIE,ENT,,120bf21c-d066-48ee-b4c0-880596ea22e4,PreservedSpecimen,de6054b7-802c-42f9-975b-04ea6a3031d0,AUGIEENTB0000389,,Animalia,Arthropoda,Insecta,Coleoptera,Coccinellidae,Psyllobora vigintimaculata,31188,,Psyllobora,vigintimaculata,,,Veronica Cervantes,8/17/2021,,,,,,J. Hughes,,8/17/2021,2021,8,17,229,,,,,,,,,,,,,,,,,,,United States,Iowa,Scott,,,,41.550606,90.62248,,,,,,,,,,,,,,,,,jackhughes20,8/17/2021 13:04,http://creativecommons.org/licenses/by-nc/4.0/,Augustana College,,urn:uuid:de6054b7-802c-42f9-975b-04ea6a3031d0,https://scan-bugs.org:443/portal/collections/individual/index.php?occid=57363598
57363600,AUGIE,ENT,,120bf21c-d066-48ee-b4c0-880596ea22e4,PreservedSpecimen,10d2a0e9-8fb5-4c58-8d3d-8917132c7d8c,AUGIEENTB0000390,,Animalia,Arthropoda,Insecta,Coleoptera,Coccinellidae,Hippodamia convergens,27393,"Guérin-Méneville, 1842",Hippodamia,convergens,,,Veronica Cervantes,8/17/2021,,,,,,V. Cervantes,,8/17/2021,2021,8,17,229,,,,,,,,,,,,,,,,,,,United States,Iowa,Scott,,,,41.556505,90.57834,,,,,,,,,,,,,,,,,jackhughes20,8/17/2021 13:10,http://creativecommons.org/licenses/by-nc/4.0/,Augustana College,,urn:uuid:10d2a0e9-8fb5-4c58-8d3d-8917132c7d8c,https://scan-bugs.org:443/portal/collections/individual/index.php?occid=57363600
57363601,AUGIE,ENT,,120bf21c-d066-48ee-b4c0-880596ea22e4,PreservedSpecimen,59c9459f-0b89-4a12-a9b9-d81c80f2e0b8,AUGIEENTB0000391,,Animalia,Arthropoda,Insecta,Coleoptera,Coccinellidae,Coleomegilla maculata,25547,,Coleomegilla,maculata,,,Veronica Cervantes,8/17/2021,,,,,,M. Gorsegner,,8/17/2021,2021,8,17,229,,,,,,,,,,,,,,,,,,,United States,Iowa,Scott,,,,41.556505,90.57834,,,,,,,,,,,,,,,,,jackhughes20,8/17/2021 13:11,http://creativecommons.org/licenses/by-nc/4.0/,Augustana College,,urn:uuid:59c9459f-0b89-4a12-a9b9-d81c80f2e0b8,https://scan-bugs.org:443/portal/collections/individual/index.php?occid=57363601
57363602,AUGIE,ENT,,120bf21c-d066-48ee-b4c0-880596ea22e4,PreservedSpecimen,ffa36496-d370-4913-a58f-992855fb7a39,AUGIEENTB0000392,,Animalia,Arthropoda,Insecta,Coleoptera,Coccinellidae,Brachiacantha ursina,24421,,Brachiacantha,ursina,,,Veronica Cervantes,8/17/2021,,,,,,O. Ruffatto,,8/17/2021,2021,8,17,229,,,,,,,,,,,,,,,,,,,United States,Iowa,Scott,,,,41.509708,90.640451,,,,,,,,,,,,,,,,,jackhughes20,8/17/2021 13:12,http://creativecommons.org/licenses/by-nc/4.0/,Augustana College,,urn:uuid:ffa36496-d370-4913-a58f-992855fb7a39,https://scan-bugs.org:443/portal/collections/individual/index.php?occid=57363602
57363604,AUGIE,ENT,,120bf21c-d066-48ee-b4c0-880596ea22e4,PreservedSpecimen,0711f4be-825c-435a-a363-94ebe517745b,AUGIEENTB0000393,,Animalia,Arthropoda,Insecta,Coleoptera,Coccinellidae,Brachiacantha ursina,24421,,Brachiacantha,ursina,,,Veronica Cervantes,8/17/2021,,,,,,Jack Hughes,,8/17/2021,2021,8,17,229,,,,,,,,,,,,,,,,,,,United States,Iowa,Scott,,,,41.509708,90.640451,,,,,,,,,,,,,,,,,jackhughes20,8/17/2021 13:12,http://creativecommons.org/licenses/by-nc/4.0/,Augustana College,,urn:uuid:0711f4be-825c-435a-a363-94ebe517745b,https://scan-bugs.org:443/portal/collections/individual/index.php?occid=57363604
57363605,AUGIE,ENT,,120bf21c-d066-48ee-b4c0-880596ea22e4,PreservedSpecimen,70c9861d-7f72-4acd-900a-dae91e133848,AUGIEENTB0000394,,Animalia,Arthropoda,Insecta,Coleoptera,Coccinellidae,Brachiacantha ursina,24421,,Brachiacantha,ursina,,,Veronica Cervantes,8/17/2021,,,,,,V. Cervantes,,8/17/2021,2021,8,17,229,,,,,,,,,,,,,,,,,,,United States,Iowa,Scott,,,,41.509708,90.640451,,,,,,,,,,,,,,,,,jackhughes20,8/17/2021 13:13,http://creativecommons.org/licenses/by-nc/4.0/,Augustana College,,urn:uuid:70c9861d-7f72-4acd-900a-dae91e133848,https://scan-bugs.org:443/portal/collections/individual/index.php?occid=57363605
57363606,AUGIE,ENT,,120bf21c-d066-48ee-b4c0-880596ea22e4,PreservedSpecimen,9bd59158-3605-4840-bb0b-380c29315e09,AUGIEENTB0000395,,Animalia,Arthropoda,Insecta,Coleoptera,Coccinellidae,Brachiacantha ursina,24421,,Brachiacantha,ursina,,,Marissa Gorsegner,8/17/2021,,,,,,M. Gorsegner,,8/17/2021,2021,8,17,229,,,,,,,,,,,,,,,,,,,United States,Iowa,Scott,,,,41.435905,90.501557,,,,,,,,,,,,,,,,,jackhughes20,8/17/2021 13:16,http://creativecommons.org/licenses/by-nc/4.0/,Augustana College,,urn:uuid:9bd59158-3605-4840-bb0b-380c29315e09,https://scan-bugs.org:443/portal/collections/individual/index.php?occid=57363606
57363608,AUGIE,ENT,,120bf21c-d066-48ee-b4c0-880596ea22e4,PreservedSpecimen,5ac63187-09e4-42a9-b76e-db30dbf02da5,AUGIEENTB0000396,,Animalia,Arthropoda,Insecta,Coleoptera,Coccinellidae,Harmonia axyridis,27230,"(Pallas, 1773)",Harmonia,axyridis,,,Jack Hughes,8/17/2021,,,,,,Olivia Ruffatto,,8/17/2021,2021,8,17,229,,,,,,,,,,,,,,,,,,,United States,Iowa,Scott,,,,41.537828,90.645823,,,,,,,,,,,,,,,,,jackhughes20,8/17/2021 13:20,http://creativecommons.org/licenses/by-nc/4.0/,Augustana College,,urn:uuid:5ac63187-09e4-42a9-b76e-db30dbf02da5,https://scan-bugs.org:443/portal/collections/individual/index.php?occid=57363608
57363609,AUGIE,ENT,,120bf21c-d066-48ee-b4c0-880596ea22e4,PreservedSpecimen,97bd2ae3-48cb-4356-b889-185818cdf0dc,AUGIEENTB0000397,,Animalia,Arthropoda,Insecta,Coleoptera,Coccinellidae,Harmonia axyridis,27230,"(Pallas, 1773)",Harmonia,axyridis,,,Jack Hughes,8/17/2021,,,,,,Jack Hughes,,8/17/2021,2021,8,17,229,,,,,,,,,,,,,,,,,,,United States,Iowa,Scott,,,,41.537828,90.645823,,,,,,,,,,,,,,,,,jackhughes20,8/17/2021 13:21,http://creativecommons.org/licenses/by-nc/4.0/,Augustana College,,urn:uuid:97bd2ae3-48cb-4356-b889-185818cdf0dc,https://scan-bugs.org:443/portal/collections/individual/index.php?occid=57363609
57363610,AUGIE,ENT,,120bf21c-d066-48ee-b4c0-880596ea22e4,PreservedSpecimen,d8e94a69-9c9e-4e4b-9fdd-04d3bd469315,AUGIEENTB0000398,,Animalia,Arthropoda,Insecta,Coleoptera,Coccinellidae,Harmonia axyridis,27230,"(Pallas, 1773)",Harmonia,axyridis,,,Jack Hughes,8/17/2021,,,,,,Olivia Ruffatto,,8/17/2021,2021,8,17,229,,,,,,,,,,,,,,,,,,,United States,Iowa,Scott,,,,41.537828,90.645823,,,,,,,,,,,,,,,,,jackhughes20,8/17/2021 13:22,http://creativecommons.org/licenses/by-nc/4.0/,Augustana College,,urn:uuid:d8e94a69-9c9e-4e4b-9fdd-04d3bd469315,https://scan-bugs.org:443/portal/collections/individual/index.php?occid=57363610
57363611,AUGIE,ENT,,120bf21c-d066-48ee-b4c0-880596ea22e4,PreservedSpecimen,22f124d2-1937-4059-aaa8-6d7c7944cb0a,AUGIEENTB0000399,,Animalia,Arthropoda,Insecta,Coleoptera,Coccinellidae,Harmonia axyridis,27230,"(Pallas, 1773)",Harmonia,axyridis,,,Jack Hughes,8/17/2021,,,,,,V. Cervantes,,8/17/2021,2021,8,17,229,,,,,,,,,,,,,,,,,,,United States,Iowa,Scott,,,,41.537828,90.645823,,,,,,,,,,,,,,,,,jackhughes20,8/17/2021 13:22,http://creativecommons.org/licenses/by-nc/4.0/,Augustana College,,urn:uuid:22f124d2-1937-4059-aaa8-6d7c7944cb0a,https://scan-bugs.org:443/portal/collections/individual/index.php?occid=57363611
57363612,AUGIE,ENT,,120bf21c-d066-48ee-b4c0-880596ea22e4,PreservedSpecimen,3e4d1791-2190-4300-bf94-77d52cb19302,AUGIEENTB0000400,,Animalia,Arthropoda,Insecta,Coleoptera,Coccinellidae,Harmonia axyridis,27230,"(Pallas, 1773)",Harmonia,axyridis,,,Jack Hughes,8/17/2021,,,,,,M. Gorsegner,,8/17/2021,2021,8,17,229,,,,,,,,,,,,,,,,,,,United States,Iowa,Scott,,,,41.537828,90.645823,,,,,,,,,,,,,,,,,jackhughes20,8/17/2021 13:23,http://creativecommons.org/licenses/by-nc/4.0/,Augustana College,,urn:uuid:3e4d1791-2190-4300-bf94-77d52cb19302,https://scan-bugs.org:443/portal/collections/individual/index.php?occid=57363612
57363613,AUGIE,ENT,,120bf21c-d066-48ee-b4c0-880596ea22e4,PreservedSpecimen,1411d185-aca8-4f8e-bcc5-4b5fde49703c,AUGIEENTB0000401,,Animalia,Arthropoda,Insecta,Coleoptera,Coccinellidae,Harmonia axyridis,27230,"(Pallas, 1773)",Harmonia,axyridis,,,Jack Hughes,8/17/2021,,,,,,Olivia Ruffatto,,8/17/2021,2021,8,17,229,,,,,,,,,,,,,,,,,,,United States,Iowa,Scott,,,,41.537828,90.645823,,,,,,,,,,,,,,,,,jackhughes20,8/17/2021 13:24,http://creativecommons.org/licenses/by-nc/4.0/,Augustana College,,urn:uuid:1411d185-aca8-4f8e-bcc5-4b5fde49703c,https://scan-bugs.org:443/portal/collections/individual/index.php?occid=57363613
57363614,AUGIE,ENT,,120bf21c-d066-48ee-b4c0-880596ea22e4,PreservedSpecimen,6641b108-2c69-4125-ac6d-b609379d0a05,AUGIEENTB0000402,,Animalia,Arthropoda,Insecta,Coleoptera,Coccinellidae,Harmonia axyridis,27230,"(Pallas, 1773)",Harmonia,axyridis,,,Jack Hughes,8/17/2021,,,,,,Jack Hughes,,8/17/2021,2021,8,17,229,,,,,,,,,,,,,,,,,,,United States,Iowa,Scott,,,,41.537828,90.645823,,,,,,,,,,,,,,,,,jackhughes20,8/17/2021 13:25,http://creativecommons.org/licenses/by-nc/4.0/,Augustana College,,urn:uuid:6641b108-2c69-4125-ac6d-b609379d0a05,https://scan-bugs.org:443/portal/collections/individual/index.php?occid=57363614
57363615,AUGIE,ENT,,120bf21c-d066-48ee-b4c0-880596ea22e4,PreservedSpecimen,59945d6d-2dac-4e1a-90f7-0d2dfddf37ad,AUGIEENTB0000403,,Animalia,Arthropoda,Insecta,Coleoptera,Coccinellidae,Harmonia axyridis,27230,"(Pallas, 1773)",Harmonia,axyridis,,,Jack Hughes,8/17/2021,,,,,,V. Cervantes,,8/17/2021,2021,8,17,229,,,,,,,,,,,,,,,,,,,United States,Iowa,Scott,,,,41.537828,90.645823,,,,,,,,,,,,,,,,,jackhughes20,8/17/2021 13:25,http://creativecommons.org/licenses/by-nc/4.0/,Augustana College,,urn:uuid:59945d6d-2dac-4e1a-90f7-0d2dfddf37ad,https://scan-bugs.org:443/portal/collections/individual/index.php?occid=57363615
57363616,AUGIE,ENT,,120bf21c-d066-48ee-b4c0-880596ea22e4,PreservedSpecimen,917b39b1-489d-4cdb-9c4f-3a902741b056,AUGIEENTB0000404,,,,,,,,,,,,,,,,,,,,,V. Cervantes,,8/17/2021,2021,8,17,229,,,,,,,,,,,,,,,,,,,United States,Iowa,Scott,,,,41.537828,90.645823,,,,,,,,,,,,,,,,,jackhughes20,8/17/2021 13:27,http://creativecommons.org/licenses/by-nc/4.0/,Augustana College,,urn:uuid:917b39b1-489d-4cdb-9c4f-3a902741b056,https://scan-bugs.org:443/portal/collections/individual/index.php?occid=57363616
57363618,AUGIE,ENT,,120bf21c-d066-48ee-b4c0-880596ea22e4,PreservedSpecimen,63e7721a-2a25-4154-96c9-651ebb847872,AUGIEENTB0000405,,Animalia,Arthropoda,Insecta,Coleoptera,Coccinellidae,Harmonia axyridis,27230,"(Pallas, 1773)",Harmonia,axyridis,,,Jack Hughes,8/17/2021,,,,,,Olivia Ruffatto,,8/17/2021,2021,8,17,229,,,,,,,,,,,,,,,,,,,United States,Iowa,Scott,,,,41.537828,90.645823,,,,,,,,,,,,,,,,,jackhughes20,8/17/2021 13:28,http://creativecommons.org/licenses/by-nc/4.0/,Augustana College,,urn:uuid:63e7721a-2a25-4154-96c9-651ebb847872,https://scan-bugs.org:443/portal/collections/individual/index.php?occid=57363618
57363619,AUGIE,ENT,,120bf21c-d066-48ee-b4c0-880596ea22e4,PreservedSpecimen,864a2cc8-0c54-4176-a6e4-c60b014234cd,AUGIEENTB0000406,,Animalia,Arthropoda,Insecta,Coleoptera,Coccinellidae,Harmonia axyridis,27230,"(Pallas, 1773)",Harmonia,axyridis,,,Jack Hughes,8/17/2021,,,,,,V. Cervantes,,8/17/2021,2021,8,17,229,,,,,,,,,,,,,,,,,,,United States,Iowa,Scott,,,,41.537828,90.645823,,,,,,,,,,,,,,,,,jackhughes20,8/17/2021 13:28,http://creativecommons.org/licenses/by-nc/4.0/,Augustana College,,urn:uuid:864a2cc8-0c54-4176-a6e4-c60b014234cd,https://scan-bugs.org:443/portal/collections/individual/index.php?occid=57363619
57363620,AUGIE,ENT,,120bf21c-d066-48ee-b4c0-880596ea22e4,PreservedSpecimen,3f5441d9-472b-47e4-a28c-a5a12019d9bb,AUGIEENTB0000407,,Animalia,Arthropoda,Insecta,Coleoptera,Coccinellidae,Harmonia axyridis,27230,"(Pallas, 1773)",Harmonia,axyridis,,,Jack Hughes,8/17/2021,,,,,,Olivia Ruffatto,,8/17/2021,2021,8,17,229,,,,,,,,,,,,,,,,,,,United States,Iowa,Scott,,,,41.537828,90.645823,,,,,,,,,,,,,,,,,jackhughes20,8/17/2021 13:28,http://creativecommons.org/licenses/by-nc/4.0/,Augustana College,,urn:uuid:3f5441d9-472b-47e4-a28c-a5a12019d9bb,https://scan-bugs.org:443/portal/collections/individual/index.php?occid=57363620
57363621,AUGIE,ENT,,120bf21c-d066-48ee-b4c0-880596ea22e4,PreservedSpecimen,87650f5f-c34e-43e6-84c9-885a2230eb41,AUGIEENTB0000408,,Animalia,Arthropoda,Insecta,Coleoptera,Coccinellidae,Harmonia axyridis,27230,"(Pallas, 1773)",Harmonia,axyridis,,,Jack Hughes,8/17/2021,,,,,,M. Gorsegner,,8/17/2021,2021,8,17,229,,,,,,,,,,,,,,,,,,,United States,Iowa,Scott,,,,41.537828,90.645823,,,,,,,,,,,,,,,,,jackhughes20,8/17/2021 13:29,http://creativecommons.org/licenses/by-nc/4.0/,Augustana College,,urn:uuid:87650f5f-c34e-43e6-84c9-885a2230eb41,https://scan-bugs.org:443/portal/collections/individual/index.php?occid=57363621
57363622,AUGIE,ENT,,120bf21c-d066-48ee-b4c0-880596ea22e4,PreservedSpecimen,8ab35d1d-a3c4-4d8a-b681-231c420a83a4,AUGIEENTB0000409,,Animalia,Arthropoda,Insecta,Coleoptera,Coccinellidae,Harmonia axyridis,27230,"(Pallas, 1773)",Harmonia,axyridis,,,Jack Hughes,8/17/2021,,,,,,Jack Hughes,,8/17/2021,2021,8,17,229,,,,,,,,,,,,,,,,,,,United States,Iowa,Scott,,,,41.57974,90.48991,,,,,,,,,,,,,,,,,jackhughes20,8/17/2021 13:31,http://creativecommons.org/licenses/by-nc/4.0/,Augustana College,,urn:uuid:8ab35d1d-a3c4-4d8a-b681-231c420a83a4,https://scan-bugs.org:443/portal/collections/individual/index.php?occid=57363622
57363624,AUGIE,ENT,,120bf21c-d066-48ee-b4c0-880596ea22e4,PreservedSpecimen,7189fbe3-b0a8-4921-85b3-ec6337df7a39,AUGIEENTB0000410,,Animalia,Arthropoda,Insecta,Coleoptera,Coccinellidae,Harmonia axyridis,27230,"(Pallas, 1773)",Harmonia,axyridis,,,Jack Hughes,8/17/2021,,,,,,V. Cervantes,,8/17/2021,2021,8,17,229,,,,,,,,,,,,,,,,,,,United States,Iowa,Scott,,,,41.57974,90.48991,,,,,,,,,,,,,,,,,jackhughes20,8/17/2021 13:32,http://creativecommons.org/licenses/by-nc/4.0/,Augustana College,,urn:uuid:7189fbe3-b0a8-4921-85b3-ec6337df7a39,https://scan-bugs.org:443/portal/collections/individual/index.php?occid=57363624
57363625,AUGIE,ENT,,120bf21c-d066-48ee-b4c0-880596ea22e4,PreservedSpecimen,25625f51-a7b9-4f13-a4fc-9b4a5cb2e833,AUGIEENTB0000411,,Animalia,Arthropoda,Insecta,Coleoptera,Coccinellidae,Harmonia axyridis,27230,"(Pallas, 1773)",Harmonia,axyridis,,,Jack Hughes,8/17/2021,,,,,,M. Gorsegner,,8/17/2021,2021,8,17,229,,,,,,,,,,,,,,,,,,,United States,Iowa,Scott,,,,41.57974,90.48991,,,,,,,,,,,,,,,,,jackhughes20,8/17/2021 13:32,http://creativecommons.org/licenses/by-nc/4.0/,Augustana College,,urn:uuid:25625f51-a7b9-4f13-a4fc-9b4a5cb2e833,https://scan-bugs.org:443/portal/collections/individual/index.php?occid=57363625
57363626,AUGIE,ENT,,120bf21c-d066-48ee-b4c0-880596ea22e4,PreservedSpecimen,1b8c5bef-23ae-47ee-9062-716e5cc61fb1,AUGIEENTB0000412,,Animalia,Arthropoda,Insecta,Coleoptera,Coccinellidae,Harmonia axyridis,27230,"(Pallas, 1773)",Harmonia,axyridis,,,Jack Hughes,8/17/2021,,,,,,Olivia Ruffatto,,8/17/2021,2021,8,17,229,,,,,,,,,,,,,,,,,,,United States,Iowa,Scott,,,,41.57974,90.48991,,,,,,,,,,,,,,,,,jackhughes20,8/17/2021 13:33,http://creativecommons.org/licenses/by-nc/4.0/,Augustana College,,urn:uuid:1b8c5bef-23ae-47ee-9062-716e5cc61fb1,https://scan-bugs.org:443/portal/collections/individual/index.php?occid=57363626
57363627,AUGIE,ENT,,120bf21c-d066-48ee-b4c0-880596ea22e4,PreservedSpecimen,010858d8-d6aa-419e-856e-dfe01638ce1a,AUGIEENTB0000413,,Animalia,Arthropoda,Insecta,Coleoptera,Coccinellidae,Harmonia axyridis,27230,"(Pallas, 1773)",Harmonia,axyridis,,,Jack Hughes,8/17/2021,,,,,,V. Cervantes,,8/17/2021,2021,8,17,229,,,,,,,,,,,,,,,,,,,United States,Iowa,Scott,,,,41.57974,90.48991,,,,,,,,,,,,,,,,,jackhughes20,8/17/2021 13:33,http://creativecommons.org/licenses/by-nc/4.0/,Augustana College,,urn:uuid:010858d8-d6aa-419e-856e-dfe01638ce1a,https://scan-bugs.org:443/portal/collections/individual/index.php?occid=57363627
57363628,AUGIE,ENT,,120bf21c-d066-48ee-b4c0-880596ea22e4,PreservedSpecimen,c48b3b0d-c5d1-41b2-a150-8c0c5a578cb6,AUGIEENTB0000414,,Animalia,Arthropoda,Insecta,Coleoptera,Coccinellidae,Harmonia axyridis,27230,"(Pallas, 1773)",Harmonia,axyridis,,,Jack Hughes,8/17/2021,,,,,,Jack Hughes,,8/17/2021,2021,8,17,229,,,,,,,,,,,,,,,,,,,United States,Iowa,Scott,,,,41.57974,90.48991,,,,,,,,,,,,,,,,,jackhughes20,8/17/2021 13:34,http://creativecommons.org/licenses/by-nc/4.0/,Augustana College,,urn:uuid:c48b3b0d-c5d1-41b2-a150-8c0c5a578cb6,https://scan-bugs.org:443/portal/collections/individual/index.php?occid=57363628
57363629,AUGIE,ENT,,120bf21c-d066-48ee-b4c0-880596ea22e4,PreservedSpecimen,7abbda61-e7f4-44d0-9703-5257f7bdfbdf,AUGIEENTB0000415,,Animalia,Arthropoda,Insecta,Coleoptera,Coccinellidae,Psyllobora vigintimaculata,31188,,Psyllobora,vigintimaculata,,,Jack Hughes,8/17/2021,,,,,,M. Gorsegner,,8/17/2021,2021,8,17,229,,,,,,,,,,,,,,,,,,,United States,Iowa,Scott,,,,41.55032,90.45992,,,,,,,,,,,,,,,,,jackhughes20,8/17/2021 13:36,http://creativecommons.org/licenses/by-nc/4.0/,Augustana College,,urn:uuid:7abbda61-e7f4-44d0-9703-5257f7bdfbdf,https://scan-bugs.org:443/portal/collections/individual/index.php?occid=57363629
57363630,AUGIE,ENT,,120bf21c-d066-48ee-b4c0-880596ea22e4,PreservedSpecimen,cd877251-0f80-45ec-9aea-2978f4e7bb00,AUGIEENTB0000416,,Animalia,Arthropoda,Insecta,Coleoptera,Coccinellidae,Harmonia axyridis,27230,"(Pallas, 1773)",Harmonia,axyridis,,,Jack Hughes,8/17/2021,,,,,,Olivia Ruffatto,,8/17/2021,2021,8,17,229,,,,,,,,,,,,,,,,,,,United States,Iowa,Scott,,,,41.54693,90.552795,,,,,,,,,,,,,,,,,jackhughes20,8/17/2021 13:38,http://creativecommons.org/licenses/by-nc/4.0/,Augustana College,,urn:uuid:cd877251-0f80-45ec-9aea-2978f4e7bb00,https://scan-bugs.org:443/portal/collections/individual/index.php?occid=57363630
57363631,AUGIE,ENT,,120bf21c-d066-48ee-b4c0-880596ea22e4,PreservedSpecimen,3e8d7520-f0f7-44e7-90f4-d6ddf715d1cc,AUGIEENTB0000417,,Animalia,Arthropoda,Insecta,Coleoptera,Coccinellidae,Harmonia axyridis,27230,"(Pallas, 1773)",Harmonia,axyridis,,,Jack Hughes,8/17/2021,,,,,,Jack Hughes,,8/17/2021,2021,8,17,229,,,,,,,,,,,,,,,,,,,United States,Iowa,Scott,,,,41.54693,90.552795,,,,,,,,,,,,,,,,,jackhughes20,8/17/2021 13:39,http://creativecommons.org/licenses/by-nc/4.0/,Augustana College,,urn:uuid:3e8d7520-f0f7-44e7-90f4-d6ddf715d1cc,https://scan-bugs.org:443/portal/collections/individual/index.php?occid=57363631
57363632,AUGIE,ENT,,120bf21c-d066-48ee-b4c0-880596ea22e4,PreservedSpecimen,3931daa1-8825-462e-bc4b-182840d7719b,AUGIEENTB0000418,,Animalia,Arthropoda,Insecta,Coleoptera,Coccinellidae,Harmonia axyridis,27230,"(Pallas, 1773)",Harmonia,axyridis,,,Jack Hughes,8/17/2021,,,,,,V. Cervantes,,8/17/2021,2021,8,17,229,,,,,,,,,,,,,,,,,,,United States,Iowa,Scott,,,,41.54693,90.552795,,,,,,,,,,,,,,,,,jackhughes20,8/17/2021 13:39,http://creativecommons.org/licenses/by-nc/4.0/,Augustana College,,urn:uuid:3931daa1-8825-462e-bc4b-182840d7719b,https://scan-bugs.org:443/portal/collections/individual/index.php?occid=57363632
57363633,AUGIE,ENT,,120bf21c-d066-48ee-b4c0-880596ea22e4,PreservedSpecimen,ef98e025-619d-4f68-8e50-34e6632761e3,AUGIEENTB0000419,,Animalia,Arthropoda,Insecta,Coleoptera,Coccinellidae,Harmonia axyridis,27230,"(Pallas, 1773)",Harmonia,axyridis,,,Jack Hughes,8/17/2021,,,,,,Jack Hughes,,8/17/2021,2021,8,17,229,,,,,,,,,,,,,,,,,,,United States,Iowa,Scott,,,,41.54693,90.552795,,,,,,,,,,,,,,,,,jackhughes20,8/17/2021 13:40,http://creativecommons.org/licenses/by-nc/4.0/,Augustana College,,urn:uuid:ef98e025-619d-4f68-8e50-34e6632761e3,https://scan-bugs.org:443/portal/collections/individual/index.php?occid=57363633
57363634,AUGIE,ENT,,120bf21c-d066-48ee-b4c0-880596ea22e4,PreservedSpecimen,bf32696e-f4e7-4e05-b287-4c7e300debf3,AUGIEENTB0000420,,Animalia,Arthropoda,Insecta,Coleoptera,Coccinellidae,Harmonia axyridis,27230,"(Pallas, 1773)",Harmonia,axyridis,,,Jack Hughes,8/17/2021,,,,,,M. Gorsegner,,8/17/2021,2021,8,17,229,,,,,,,,,,,,,,,,,,,United States,Iowa,Scott,,,,41.54693,90.552795,,,,,,,,,,,,,,,,,jackhughes20,8/17/2021 13:40,http://creativecommons.org/licenses/by-nc/4.0/,Augustana College,,urn:uuid:bf32696e-f4e7-4e05-b287-4c7e300debf3,https://scan-bugs.org:443/portal/collections/individual/index.php?occid=57363634
57363635,AUGIE,ENT,,120bf21c-d066-48ee-b4c0-880596ea22e4,PreservedSpecimen,75964d9f-25b5-4e6f-966e-7e063efae3f2,AUGIEENTB0000421,,Animalia,Arthropoda,Insecta,Coleoptera,Coccinellidae,Harmonia axyridis,27230,"(Pallas, 1773)",Harmonia,axyridis,,,Jack Hughes,8/17/2021,,,,,,Olivia Ruffatto,,8/17/2021,2021,8,17,229,,,,,,,,,,,,,,,,,,,United States,Iowa,Scott,,,,41.54693,90.552795,,,,,,,,,,,,,,,,,jackhughes20,8/17/2021 13:41,http://creativecommons.org/licenses/by-nc/4.0/,Augustana College,,urn:uuid:75964d9f-25b5-4e6f-966e-7e063efae3f2,https://scan-bugs.org:443/portal/collections/individual/index.php?occid=57363635
57363636,AUGIE,ENT,,120bf21c-d066-48ee-b4c0-880596ea22e4,PreservedSpecimen,71ccb35a-69ae-4e96-b68b-4248a5dfb125,AUGIEENTB0000422,,Animalia,Arthropoda,Insecta,Coleoptera,Coccinellidae,Harmonia axyridis,27230,"(Pallas, 1773)",Harmonia,axyridis,,,Jack Hughes,8/17/2021,,,,,,Jack Hughes,,8/17/2021,2021,8,17,229,,,,,,,,,,,,,,,,,,,United States,Iowa,Scott,,,,41.56304,90.46707,,,,,,,,,,,,,,,,,jackhughes20,8/17/2021 13:44,http://creativecommons.org/licenses/by-nc/4.0/,Augustana College,,urn:uuid:71ccb35a-69ae-4e96-b68b-4248a5dfb125,https://scan-bugs.org:443/portal/collections/individual/index.php?occid=57363636
57363637,AUGIE,ENT,,120bf21c-d066-48ee-b4c0-880596ea22e4,PreservedSpecimen,d3a186da-1ef0-4057-a9a5-4813e5f4cde3,AUGIEENTB0000423,,Animalia,Arthropoda,Insecta,Coleoptera,Coccinellidae,Cycloneda munda,25911,,Cycloneda,munda,,,Jack Hughes,8/17/2021,,,,,,V. Cervantes,,8/17/2021,2021,8,17,229,,,,,,,,,,,,,,,,,,,United States,Iowa,Scott,,,,41.56304,90.46707,,,,,,,,,,,,,,,,,jackhughes20,8/17/2021 13:44,http://creativecommons.org/licenses/by-nc/4.0/,Augustana College,,urn:uuid:d3a186da-1ef0-4057-a9a5-4813e5f4cde3,https://scan-bugs.org:443/portal/collections/individual/index.php?occid=57363637
57363638,AUGIE,ENT,,120bf21c-d066-48ee-b4c0-880596ea22e4,PreservedSpecimen,acbe4b76-be6c-45f8-9ceb-8bd6db4a178e,AUGIEENTB0000424,,Animalia,Arthropoda,Insecta,Coleoptera,Coccinellidae,Coleomegilla maculata,25547,,Coleomegilla,maculata,,,Jack Hughes,8/17/2021,,,,,,M. Gorsegner,,8/17/2021,2021,8,17,229,,,,,,,,,,,,,,,,,,,United States,Iowa,Scott,,,,41.56304,90.46707,,,,,,,,,,,,,,,,,jackhughes20,8/17/2021 13:45,http://creativecommons.org/licenses/by-nc/4.0/,Augustana College,,urn:uuid:acbe4b76-be6c-45f8-9ceb-8bd6db4a178e,https://scan-bugs.org:443/portal/collections/individual/index.php?occid=57363638
57363639,AUGIE,ENT,,120bf21c-d066-48ee-b4c0-880596ea22e4,PreservedSpecimen,2a6a7c7a-473f-43a8-a70f-31e1859b29e8,AUGIEENTB0000425,,Animalia,Arthropoda,Insecta,Coleoptera,Coccinellidae,Coccinella septempunctata,25520,"(Linnaeus, 1758)",Coccinella,septempunctata,,,Jack Hughes,8/17/2021,,,,,,Olivia Ruffatto,,8/17/2021,2021,8,17,229,,,,,,,,,,,,,,,,,,,United States,Iowa,Scott,,,,41.489621,90.635952,,,,,,,,,,,,,,,,,jackhughes20,8/17/2021 13:49,http://creativecommons.org/licenses/by-nc/4.0/,Augustana College,,urn:uuid:2a6a7c7a-473f-43a8-a70f-31e1859b29e8,https://scan-bugs.org:443/portal/collections/individual/index.php?occid=57363639
57363640,AUGIE,ENT,,120bf21c-d066-48ee-b4c0-880596ea22e4,PreservedSpecimen,3645b543-62c9-4488-85f6-0c72d3fa546f,AUGIEENTB0000426,,Animalia,Arthropoda,Insecta,Coleoptera,Coccinellidae,Harmonia axyridis,27230,"(Pallas, 1773)",Harmonia,axyridis,,,Jack Hughes,8/17/2021,,,,,,Jack Hughes,,8/17/2021,2021,8,17,229,,,,,,,,,,,,,,,,,,,United States,Iowa,Scott,,,,41.489621,90.635952,,,,,,,,,,,,,,,,,jackhughes20,8/17/2021 13:51,http://creativecommons.org/licenses/by-nc/4.0/,Augustana College,,urn:uuid:3645b543-62c9-4488-85f6-0c72d3fa546f,https://scan-bugs.org:443/portal/collections/individual/index.php?occid=57363640
57363641,AUGIE,ENT,,120bf21c-d066-48ee-b4c0-880596ea22e4,PreservedSpecimen,5d24b110-8d0f-4a4b-bfc9-f81b1068f37b,AUGIEENTB0000427,,Animalia,Arthropoda,Insecta,Coleoptera,Coccinellidae,Harmonia axyridis,27230,"(Pallas, 1773)",Harmonia,axyridis,,,Jack Hughes,8/17/2021,,,,,,V. Cervantes,,8/17/2021,2021,8,17,229,,,,,,,,,,,,,,,,,,,United States,Iowa,Scott,,,,41.489621,90.635952,,,,,,,,,,,,,,,,,jackhughes20,8/17/2021 13:51,http://creativecommons.org/licenses/by-nc/4.0/,Augustana College,,urn:uuid:5d24b110-8d0f-4a4b-bfc9-f81b1068f37b,https://scan-bugs.org:443/portal/collections/individual/index.php?occid=57363641
57363642,AUGIE,ENT,,120bf21c-d066-48ee-b4c0-880596ea22e4,PreservedSpecimen,86c7ce18-836f-4755-b5cb-f3897d2c31b1,AUGIEENTB0000428,,Animalia,Arthropoda,Insecta,Coleoptera,Coccinellidae,Coccinella septempunctata,25520,"(Linnaeus, 1758)",Coccinella,septempunctata,,,Jack Hughes,8/17/2021,,,,,,V. Cervantes,,8/17/2021,2021,8,17,229,,,,,,,,,,,,,,,,,,,United States,Iowa,Scott,,,,41.489621,90.635952,,,,,,,,,,,,,,,,,jackhughes20,8/17/2021 13:52,http://creativecommons.org/licenses/by-nc/4.0/,Augustana College,,urn:uuid:86c7ce18-836f-4755-b5cb-f3897d2c31b1,https://scan-bugs.org:443/portal/collections/individual/index.php?occid=57363642
57363643,AUGIE,ENT,,120bf21c-d066-48ee-b4c0-880596ea22e4,PreservedSpecimen,6709b4de-1ba4-4db4-836c-d425350439b3,AUGIEENTB0000429,,Animalia,Arthropoda,Insecta,Coleoptera,Coccinellidae,Cycloneda munda,25911,,Cycloneda,munda,,,Jack Hughes,8/17/2021,,,,,,M. Gorsegner,,8/17/2021,2021,8,17,229,,,,,,,,,,,,,,,,,,,United States,Iowa,Scott,,,,41.489621,90.635952,,,,,,,,,,,,,,,,,jackhughes20,8/17/2021 13:52,http://creativecommons.org/licenses/by-nc/4.0/,Augustana College,,urn:uuid:6709b4de-1ba4-4db4-836c-d425350439b3,https://scan-bugs.org:443/portal/collections/individual/index.php?occid=57363643
57363644,AUGIE,ENT,,120bf21c-d066-48ee-b4c0-880596ea22e4,PreservedSpecimen,76796bfe-cee1-4fec-8cd3-e3dd7cd4924c,AUGIEENTB0000430,,Animalia,Arthropoda,Insecta,Coleoptera,Coccinellidae,Harmonia axyridis,27230,"(Pallas, 1773)",Harmonia,axyridis,,,Jack Hughes,8/17/2021,,,,,,Jack Hughes,,8/17/2021,2021,8,17,229,,,,,,,,,,,,,,,,,,,United States,Iowa,Scott,,,,41.489621,90.635952,,,,,,,,,,,,,,,,,jackhughes20,8/17/2021 13:53,http://creativecommons.org/licenses/by-nc/4.0/,Augustana College,,urn:uuid:76796bfe-cee1-4fec-8cd3-e3dd7cd4924c,https://scan-bugs.org:443/portal/collections/individual/index.php?occid=57363644
57363645,AUGIE,ENT,,120bf21c-d066-48ee-b4c0-880596ea22e4,PreservedSpecimen,1e89c49c-e3ad-4466-8d0d-517d93daeb70,AUGIEENTB0000431,,Animalia,Arthropoda,Insecta,Coleoptera,Coccinellidae,Cycloneda munda,25911,,Cycloneda,munda,,,Jack Hughes,8/17/2021,,,,,,Olivia Ruffatto,,8/17/2021,2021,8,17,229,,,,,,,,,,,,,,,,,,,United States,Iowa,Scott,,,,41.489621,90.635952,,,,,,,,,,,,,,,,,jackhughes20,8/17/2021 13:53,http://creativecommons.org/licenses/by-nc/4.0/,Augustana College,,urn:uuid:1e89c49c-e3ad-4466-8d0d-517d93daeb70,https://scan-bugs.org:443/portal/collections/individual/index.php?occid=57363645
57363646,AUGIE,ENT,,120bf21c-d066-48ee-b4c0-880596ea22e4,PreservedSpecimen,a8467d8e-607d-456c-b00d-e5204f81e5fd,AUGIEENTB0000432,,Animalia,Arthropoda,Insecta,Coleoptera,Coccinellidae,Cycloneda munda,25911,,Cycloneda,munda,,,Jack Hughes,8/17/2021,,,,,,M. Gorsegner,,8/17/2021,2021,8,17,229,,,,,,,,,,,,,,,,,,,United States,Iowa,Scott,,,,41.489621,90.635952,,,,,,,,,,,,,,,,,jackhughes20,8/17/2021 13:54,http://creativecommons.org/licenses/by-nc/4.0/,Augustana College,,urn:uuid:a8467d8e-607d-456c-b00d-e5204f81e5fd,https://scan-bugs.org:443/portal/collections/individual/index.php?occid=57363646
57363720,AUGIE,ENT,,120bf21c-d066-48ee-b4c0-880596ea22e4,PreservedSpecimen,07b6c4c3-824a-46d4-9e6e-8277b21dca31,AUGIEENTB0000433,,Animalia,Arthropoda,Insecta,Coleoptera,Coccinellidae,Harmonia axyridis,27230,"(Pallas, 1773)",Harmonia,axyridis,,,M. Gorsegner,8/18/2021,,,,,,Olivia Ruffatto,,8/18/2021,2021,8,18,230,,8/18/2021,,,,,,,,,,,,,,,,,United States,Illinois,Rock Island,,,,41.56812,90.57119,,,,,,,,,,,,,,,,,marissagorsegner,8/19/2021 13:21,http://creativecommons.org/licenses/by-nc/4.0/,Augustana College,,urn:uuid:07b6c4c3-824a-46d4-9e6e-8277b21dca31,https://scan-bugs.org:443/portal/collections/individual/index.php?occid=57363720
57363722,AUGIE,ENT,,120bf21c-d066-48ee-b4c0-880596ea22e4,PreservedSpecimen,378b7b6b-30dd-4d08-97cc-9a864615b2f3,AUGIEENTB0000434,,Animalia,Arthropoda,Insecta,Coleoptera,Coccinellidae,Hippodamia parenthesis,27400,,Hippodamia,parenthesis,,,M. Gorsegner,8/18/2021,,,,,,Olivia Ruffatto,,8/18/2021,2021,8,18,230,,8/18/2021,,,,,,,,,,,,,,,,,United States,Illinois,Rock Island,,,,41.56812,90.57119,,,,,,,,,,,,,,,,,marissagorsegner,8/19/2021 12:48,http://creativecommons.org/licenses/by-nc/4.0/,Augustana College,,urn:uuid:378b7b6b-30dd-4d08-97cc-9a864615b2f3,https://scan-bugs.org:443/portal/collections/individual/index.php?occid=57363722
57363729,AUGIE,ENT,,120bf21c-d066-48ee-b4c0-880596ea22e4,PreservedSpecimen,dee78b79-d39b-49a0-a751-0f3c0490fd50,AUGIEENTB0000435,,Animalia,Arthropoda,Insecta,Coleoptera,Coccinellidae,Harmonia axyridis,27230,"(Pallas, 1773)",Harmonia,axyridis,,,Jack Hughes,8/18/2021,,,,,,Olivia Ruffatto,,8/18/2021,2021,8,18,230,,8/18/2021,,,,,,,,,,,,,,,,,United States,Illinois,Rock Island,,,,41.469869,90.506684,,,,,,,,,,,,,,,,,marissagorsegner,8/19/2021 13:21,http://creativecommons.org/licenses/by-nc/4.0/,Augustana College,,urn:uuid:dee78b79-d39b-49a0-a751-0f3c0490fd50,https://scan-bugs.org:443/portal/collections/individual/index.php?occid=57363729
57363735,AUGIE,ENT,,120bf21c-d066-48ee-b4c0-880596ea22e4,PreservedSpecimen,d701dc0c-5385-4505-b69f-db77fd7e7ce0,AUGIEENTB0000441,,Animalia,Arthropoda,Insecta,Coleoptera,Coccinellidae,Coleomegilla maculata,25547,,Coleomegilla,maculata,,,Jack Hughes,8/18/2021,,,,,,Olivia Ruffatto,,8/18/2021,2021,8,18,230,,8/18/2021,,,,,,,,,,,,,,,,,United States,Illinois,Rock Island,,,,41.510229,90.490812,,,,,,,,,,,,,,,,,marissagorsegner,8/18/2021 12:13,http://creativecommons.org/licenses/by-nc/4.0/,Augustana College,,urn:uuid:d701dc0c-5385-4505-b69f-db77fd7e7ce0,https://scan-bugs.org:443/portal/collections/individual/index.php?occid=57363735
57363737,AUGIE,ENT,,120bf21c-d066-48ee-b4c0-880596ea22e4,PreservedSpecimen,521f2085-03a0-4a4f-837a-050718f1cdca,AUGIEENTB0000442,,Animalia,Arthropoda,Insecta,Coleoptera,Coccinellidae,Psyllobora vigintimaculata,31188,,Psyllobora,vigintimaculata,,,Jack Hughes,8/18/2021,,,,,,Jack Hughes,,8/18/2021,2021,8,18,230,,8/18/2021,,,,,,,,,,,,,,,,,United States,Illinois,Rock Island,,,,41.510229,90.490812,,,,,,,,,,,,,,,,,marissagorsegner,8/18/2021 12:14,http://creativecommons.org/licenses/by-nc/4.0/,Augustana College,,urn:uuid:521f2085-03a0-4a4f-837a-050718f1cdca,https://scan-bugs.org:443/portal/collections/individual/index.php?occid=57363737
57363746,AUGIE,ENT,,120bf21c-d066-48ee-b4c0-880596ea22e4,PreservedSpecimen,8a620155-6526-4e6e-bfca-020979783c4c,AUGIEENTB0000436,,Animalia,Arthropoda,Insecta,Coleoptera,Coccinellidae,Harmonia axyridis,27230,"(Pallas, 1773)",Harmonia,axyridis,,,Jack Hughes,8/18/2021,,,,,,Jack Hughes,,8/18/2021,2021,8,18,230,,8/18/2021,,,,,,,,,,,,,,,,,United States,Illinois,Rock Island,,,,41.428138,90.508097,,,,,,,,,,,,,,,,,marissagorsegner,8/19/2021 13:21,http://creativecommons.org/licenses/by-nc/4.0/,Augustana College,,urn:uuid:8a620155-6526-4e6e-bfca-020979783c4c,https://scan-bugs.org:443/portal/collections/individual/index.php?occid=57363746
57363748,AUGIE,ENT,,120bf21c-d066-48ee-b4c0-880596ea22e4,PreservedSpecimen,bba0cd47-dab4-48dd-8e6c-8958627c77b7,AUGIEENTB0000437,,Animalia,Arthropoda,Insecta,Coleoptera,Coccinellidae,Coleomegilla maculata,25547,,Coleomegilla,maculata,,,Jack Hughes,8/18/2021,,,,,,V. Cervantes,,8/18/2021,2021,8,18,230,,8/18/2021,,,,,,,,,,,,,,,,,United States,Illinois,Rock Island,,,,41.428138,90.508097,,,,,,,,,,,,,,,,,marissagorsegner,8/18/2021 12:21,http://creativecommons.org/licenses/by-nc/4.0/,Augustana College,,urn:uuid:bba0cd47-dab4-48dd-8e6c-8958627c77b7,https://scan-bugs.org:443/portal/collections/individual/index.php?occid=57363748
57363749,AUGIE,ENT,,120bf21c-d066-48ee-b4c0-880596ea22e4,PreservedSpecimen,a30025d7-c695-466d-8d53-7328f25fbf59,AUGIEENTB0000438,,Animalia,Arthropoda,Insecta,Coleoptera,Coccinellidae,Harmonia axyridis,27230,"(Pallas, 1773)",Harmonia,axyridis,,,Jack Hughes,8/18/2021,,,,,,Jack Hughes,,8/18/2021,2021,8,18,230,,8/18/2021,,,,,,,,,,,,,,,,,United States,Illinois,Rock Island,,,,41.428138,90.508097,,,,,,,,,,,,,,,,,marissagorsegner,8/18/2021 12:22,http://creativecommons.org/licenses/by-nc/4.0/,Augustana College,,urn:uuid:a30025d7-c695-466d-8d53-7328f25fbf59,https://scan-bugs.org:443/portal/collections/individual/index.php?occid=57363749
57363750,AUGIE,ENT,,120bf21c-d066-48ee-b4c0-880596ea22e4,PreservedSpecimen,ba63c26c-d467-49f6-871e-7c7fa9532f24,AUGIEENTB0000439,,Animalia,Arthropoda,Insecta,Coleoptera,Coccinellidae,Harmonia axyridis,27230,"(Pallas, 1773)",Harmonia,axyridis,,,Jack Hughes,,,,,,,M. Gorsegner,,8/18/2021,2021,8,18,230,,8/18/2021,,,,,,,,,,,,,,,,,United States,Illinois,Rock Island,,,,41.428138,90.508097,,,,,,,,,,,,,,,,,marissagorsegner,8/18/2021 12:22,http://creativecommons.org/licenses/by-nc/4.0/,Augustana College,,urn:uuid:ba63c26c-d467-49f6-871e-7c7fa9532f24,https://scan-bugs.org:443/portal/collections/individual/index.php?occid=57363750
57363751,AUGIE,ENT,,120bf21c-d066-48ee-b4c0-880596ea22e4,PreservedSpecimen,53e119a9-8ac6-4da0-bfc5-ca395dd51d63,AUGIEENTB0000440,,Animalia,Arthropoda,Insecta,Coleoptera,Coccinellidae,Coleomegilla maculata,25547,,Coleomegilla,maculata,,,Jack Hughes,,,,,,,Olivia Ruffatto,,8/18/2021,2021,8,18,230,,8/18/2021,,,,,,,,,,,,,,,,,United States,Illinois,Rock Island,,,,41.428138,90.508097,,,,,,,,,,,,,,,,,marissagorsegner,8/18/2021 12:22,http://creativecommons.org/licenses/by-nc/4.0/,Augustana College,,urn:uuid:53e119a9-8ac6-4da0-bfc5-ca395dd51d63,https://scan-bugs.org:443/portal/collections/individual/index.php?occid=57363751
57363755,AUGIE,ENT,,120bf21c-d066-48ee-b4c0-880596ea22e4,PreservedSpecimen,8eb420c2-5c64-4cda-b47d-7be9fc90eca4,AUGIEENTB0000443,,Animalia,Arthropoda,Insecta,Coleoptera,Coccinellidae,Cycloneda munda,25911,,Cycloneda,munda,,,Jack Hughes,,,,,,,Olivia Ruffatto,,8/18/2021,2021,8,18,230,,8/18/2021,,,,,,,,,,,,,,,,,United States,Illinois,Rock Island,,,,41.509388,90.491046,,,,,,,,,,,,,,,,,marissagorsegner,8/18/2021 12:26,http://creativecommons.org/licenses/by-nc/4.0/,Augustana College,,urn:uuid:8eb420c2-5c64-4cda-b47d-7be9fc90eca4,https://scan-bugs.org:443/portal/collections/individual/index.php?occid=57363755
57363756,AUGIE,ENT,,120bf21c-d066-48ee-b4c0-880596ea22e4,PreservedSpecimen,9c5d875c-c698-4bfc-b0da-32dbefc41959,AUGIEENTB0000444,,Animalia,Arthropoda,Insecta,Coleoptera,Coccinellidae,Harmonia axyridis,27230,"(Pallas, 1773)",Harmonia,axyridis,,,Jack Hughes,,,,,,,V. Cervantes,,8/18/2021,2021,8,18,230,,8/18/2021,,,,,,,,,,,,,,,,,United States,Illinois,Rock Island,,,,41.509388,90.491046,,,,,,,,,,,,,,,,,marissagorsegner,8/18/2021 12:27,http://creativecommons.org/licenses/by-nc/4.0/,Augustana College,,urn:uuid:9c5d875c-c698-4bfc-b0da-32dbefc41959,https://scan-bugs.org:443/portal/collections/individual/index.php?occid=57363756
57363759,AUGIE,ENT,,120bf21c-d066-48ee-b4c0-880596ea22e4,PreservedSpecimen,bcdd9595-8fcd-462d-a973-f679608aac34,AUGIEENTB0000445,,Animalia,Arthropoda,Insecta,Coleoptera,Coccinellidae,Coleomegilla maculata,25547,,Coleomegilla,maculata,,,Jack Hughes,8/18/2021,,,,,,Olivia Ruffatto,,8/18/2021,2021,8,18,230,,8/18/2021,,,,,,,,,,,,,,,,,United States,Illinois,Rock Island,,,,41.509388,90.491046,,,,,,,,,,,,,,,,,marissagorsegner,8/18/2021 12:28,http://creativecommons.org/licenses/by-nc/4.0/,Augustana College,,urn:uuid:bcdd9595-8fcd-462d-a973-f679608aac34,https://scan-bugs.org:443/portal/collections/individual/index.php?occid=57363759
57363763,AUGIE,ENT,,120bf21c-d066-48ee-b4c0-880596ea22e4,PreservedSpecimen,4630af35-b215-4f7f-8f2b-046479a5c7a4,AUGIEENTB0000447,,Animalia,Arthropoda,Insecta,Coleoptera,Coccinellidae,Psyllobora vigintimaculata,31188,,Psyllobora,vigintimaculata,,,Jack Hughes,8/18/2021,,,,,,Jack Hughes,,8/18/2021,2021,8,18,230,,8/18/2021,,,,,,,,,,,,,,,,,United States,Illinois,Rock Island,,,,41.509388,90.491046,,,,,,,,,,,,,,,,,marissagorsegner,8/18/2021 12:30,http://creativecommons.org/licenses/by-nc/4.0/,Augustana College,,urn:uuid:4630af35-b215-4f7f-8f2b-046479a5c7a4,https://scan-bugs.org:443/portal/collections/individual/index.php?occid=57363763
57363769,AUGIE,ENT,,120bf21c-d066-48ee-b4c0-880596ea22e4,PreservedSpecimen,75c9709d-27cf-4b39-8ade-2d61fc774a30,AUGIEENTB0000448,,Animalia,Arthropoda,Insecta,Coleoptera,Coccinellidae,Cycloneda munda,25911,,Cycloneda,munda,,,Jack Hughes,8/18/2021,,,,,,Jack Hughes,,8/18/2021,2021,8,18,230,,8/18/2021,,,,,,,,,,,,,,,,,United States,Illinois,Rock Island,,,,40.506216,90.553531,,,,,,,,,,,,,,,,,marissagorsegner,8/18/2021 12:34,http://creativecommons.org/licenses/by-nc/4.0/,Augustana College,,urn:uuid:75c9709d-27cf-4b39-8ade-2d61fc774a30,https://scan-bugs.org:443/portal/collections/individual/index.php?occid=57363769
57363771,AUGIE,ENT,,120bf21c-d066-48ee-b4c0-880596ea22e4,PreservedSpecimen,d6c918cc-e1f2-4106-9962-3d9c58690118,AUGIEENTB0000449,,Animalia,Arthropoda,Insecta,Coleoptera,Coccinellidae,Psyllobora vigintimaculata,31188,,Psyllobora,vigintimaculata,,,Jack Hughes,8/18/2021,,,,,,M. Gorsegner,,8/18/2021,2021,8,18,230,,8/18/2021,,,,,,,,,,,,,,,,,United States,Illinois,Rock Island,,,,40.506216,90.553531,,,,,,,,,,,,,,,,,marissagorsegner,8/18/2021 12:35,http://creativecommons.org/licenses/by-nc/4.0/,Augustana College,,urn:uuid:d6c918cc-e1f2-4106-9962-3d9c58690118,https://scan-bugs.org:443/portal/collections/individual/index.php?occid=57363771
57363776,AUGIE,ENT,,120bf21c-d066-48ee-b4c0-880596ea22e4,PreservedSpecimen,bf892514-8f27-42ee-8385-d608ff71f83a,AUGIEENTB0000450,,Animalia,Arthropoda,Insecta,Coleoptera,Coccinellidae,Harmonia axyridis,27230,"(Pallas, 1773)",Harmonia,axyridis,,,Jack Hughes,8/18/2021,,,,,,M. Gorsegner,,8/18/2021,2021,8,18,230,,8/18/2021,,,,,,,,,,,,,,,,,United States,Illinois,Rock Island,,,,41.531584,90.414653,,,,,,,,,,,,,,,,,marissagorsegner,8/18/2021 12:40,http://creativecommons.org/licenses/by-nc/4.0/,Augustana College,,urn:uuid:bf892514-8f27-42ee-8385-d608ff71f83a,https://scan-bugs.org:443/portal/collections/individual/index.php?occid=57363776
57363777,AUGIE,ENT,,120bf21c-d066-48ee-b4c0-880596ea22e4,PreservedSpecimen,47f90bfc-8060-4e41-8b4f-56c787746152,AUGIEENTB0000451,,Animalia,Arthropoda,Insecta,Coleoptera,Coccinellidae,Harmonia axyridis,27230,"(Pallas, 1773)",Harmonia,axyridis,,,Jack Hughes,8/18/2021,,,,,,Jack Hughes,,8/18/2021,2021,8,18,230,,8/18/2021,,,,,,,,,,,,,,,,,United Arab Emirates,Illinois,Rock Island,,,,41.463906,90.537662,,,,,,,,,,,,,,,,,marissagorsegner,8/18/2021 12:42,http://creativecommons.org/licenses/by-nc/4.0/,Augustana College,,urn:uuid:47f90bfc-8060-4e41-8b4f-56c787746152,https://scan-bugs.org:443/portal/collections/individual/index.php?occid=57363777
57363783,AUGIE,ENT,,120bf21c-d066-48ee-b4c0-880596ea22e4,PreservedSpecimen,e67550a2-9a36-4763-aab1-0003faa7a4cf,AUGIEENTB0000455,,Animalia,Arthropoda,Insecta,Coleoptera,Coccinellidae,Hyperaspis undulata,27847,,Hyperaspis,undulata,,,Veronica Cervantes,8/18/2021,,,,,,V. Cervantes,,8/18/2021,2021,8,18,230,,8/18/2021,,,,,,,,,,,,,,,,,United States,Illinois,Rock Island,,,,41.50206,90.45157,,,,,,,,,,,,,,,,,marissagorsegner,8/18/2021 12:45,http://creativecommons.org/licenses/by-nc/4.0/,Augustana College,,urn:uuid:e67550a2-9a36-4763-aab1-0003faa7a4cf,https://scan-bugs.org:443/portal/collections/individual/index.php?occid=57363783
57363790,AUGIE,ENT,,120bf21c-d066-48ee-b4c0-880596ea22e4,PreservedSpecimen,2d5a1e4f-e722-469c-91d5-8601e39d7db8,AUGIEENTB0000452,,Animalia,Arthropoda,Insecta,Coleoptera,Coccinellidae,Harmonia axyridis,27230,"(Pallas, 1773)",Harmonia,axyridis,,,Jack Hughes,8/18/2021,,,,3,,Olivia Ruffatto,,8/18/2021,2021,8,18,230,,8/18/2021,,,,,,,,,,,,,,,,,United States,Illinois,Rock Island,,,,41.436864,90.552542,,,,,,,,,,,,,,,,,marissagorsegner,8/19/2021 12:41,http://creativecommons.org/licenses/by-nc/4.0/,Augustana College,,urn:uuid:2d5a1e4f-e722-469c-91d5-8601e39d7db8,https://scan-bugs.org:443/portal/collections/individual/index.php?occid=57363790
57363793,AUGIE,ENT,,120bf21c-d066-48ee-b4c0-880596ea22e4,PreservedSpecimen,c4fa8203-dbfd-4283-9ec9-f34d672a4b63,AUGIEENTB0000453,,Animalia,Arthropoda,Insecta,Coleoptera,Coccinellidae,Cycloneda munda,25911,,Cycloneda,munda,,,Jack Hughes,8/18/2021,,,,,,V. Cervantes,,8/18/2021,2021,8,18,230,,8/18/2021,,,,,,,,,,,,,,,,,United States,Illinois,Rock Island,,,,41.436864,90.552542,,,,,,,,,,,,,,,,,marissagorsegner,8/18/2021 12:53,http://creativecommons.org/licenses/by-nc/4.0/,Augustana College,,urn:uuid:c4fa8203-dbfd-4283-9ec9-f34d672a4b63,https://scan-bugs.org:443/portal/collections/individual/index.php?occid=57363793
57363795,AUGIE,ENT,,120bf21c-d066-48ee-b4c0-880596ea22e4,PreservedSpecimen,7c1104b2-fcb5-4375-9916-715ac71ec8cf,AUGIEENTB0000454,,Animalia,Arthropoda,Insecta,Coleoptera,Coccinellidae,Propylea quatuordecimpunctata,613667,(Linneus 1758),Propylea,quatuordecimpunctata,,,Veronica Cervantes,8/18/2021,,,,,,Jack Hughes,,8/18/2021,2021,8,18,230,,8/18/2021,,,,,,,,,,,,,,,,,United States,Illinois,Rock Island,,,,41.436864,90.552542,,,,,,,,,,,,,,,,,marissagorsegner,8/18/2021 12:54,http://creativecommons.org/licenses/by-nc/4.0/,Augustana College,,urn:uuid:7c1104b2-fcb5-4375-9916-715ac71ec8cf,https://scan-bugs.org:443/portal/collections/individual/index.php?occid=57363795
57364179,AUGIE,ENT,,120bf21c-d066-48ee-b4c0-880596ea22e4,PreservedSpecimen,5c279b84-0ac9-4b9b-af85-b5aa0c8c5b84,AUGIEENTB0000501,,Animalia,Arthropoda,Insecta,Coleoptera,Coccinellidae,Cycloneda munda,25911,,Cycloneda,munda,,,Jack Hughes,8/18/2021,,,,,,V. Cervantes,,8/18/2021,2021,8,18,230,,,,,,,,,,,,,,,,,,,United States,Illinois,Rock Island,,,,40.506216,90.553531,,,,,,,,,,,,,,,,,jackhughes20,8/19/2021 12:05,http://creativecommons.org/licenses/by-nc/4.0/,Augustana College,,urn:uuid:5c279b84-0ac9-4b9b-af85-b5aa0c8c5b84,https://scan-bugs.org:443/portal/collections/individual/index.php?occid=57364179
57364182,AUGIE,ENT,,120bf21c-d066-48ee-b4c0-880596ea22e4,PreservedSpecimen,47c18303-82c3-4f36-9147-360190424566,AUGIEENTB0000502,,Animalia,Arthropoda,Insecta,Coleoptera,Coccinellidae,Psyllobora vigintimaculata,31188,,Psyllobora,vigintimaculata,,,Jack Hughes,8/18/2021,,,,,,V. Cervantes,,8/18/2021,2021,8,18,230,,,,,,,,,,,,,,,,,,,United States,Illinois,Rock Island,,,,40.506216,90.553531,,,,,,,,,,,,,,,,,jackhughes20,8/19/2021 12:08,http://creativecommons.org/licenses/by-nc/4.0/,Augustana College,,urn:uuid:47c18303-82c3-4f36-9147-360190424566,https://scan-bugs.org:443/portal/collections/individual/index.php?occid=57364182
57364186,AUGIE,ENT,,120bf21c-d066-48ee-b4c0-880596ea22e4,PreservedSpecimen,cdc8894b-17a4-465d-9f83-7e4d2ac195e4,AUGIEENTB0000503,,Animalia,Arthropoda,Insecta,Coleoptera,Coccinellidae,Psyllobora vigintimaculata,31188,,Psyllobora,vigintimaculata,,,Jack Hughes,8/18/2021,,,,,,Olivia Ruffatto,,8/18/2021,2021,8,18,230,,,,,,,,,,,,,,,,,,,United States,Illinois,Rock Island,,,,40.506216,90.553531,,,,,,,,,,,,,,,,,jackhughes20,8/19/2021 12:10,http://creativecommons.org/licenses/by-nc/4.0/,Augustana College,,urn:uuid:cdc8894b-17a4-465d-9f83-7e4d2ac195e4,https://scan-bugs.org:443/portal/collections/individual/index.php?occid=57364186
57364187,AUGIE,ENT,,120bf21c-d066-48ee-b4c0-880596ea22e4,PreservedSpecimen,cc8456dd-3770-4821-a294-ab27665b4b66,AUGIEENTB0000504,,Animalia,Arthropoda,Insecta,Coleoptera,Coccinellidae,Psyllobora vigintimaculata,31188,,Psyllobora,vigintimaculata,,,Jack Hughes,8/18/2021,,,,,,Jack Hughes,,8/18/2021,2021,8,18,230,,,,,,,,,,,,,,,,,,,United States,Illinois,Rock Island,,,,40.506216,90.553531,,,,,,,,,,,,,,,,,jackhughes20,8/19/2021 12:12,http://creativecommons.org/licenses/by-nc/4.0/,Augustana College,,urn:uuid:cc8456dd-3770-4821-a294-ab27665b4b66,https://scan-bugs.org:443/portal/collections/individual/index.php?occid=57364187
57364196,AUGIE,ENT,,120bf21c-d066-48ee-b4c0-880596ea22e4,PreservedSpecimen,244efbac-f6ff-4025-9465-5e7c1780ca68,AUGIEENTB0000505,,Animalia,Arthropoda,Insecta,Coleoptera,Coccinellidae,Coleomegilla maculata,25547,,Coleomegilla,maculata,,,M. Gorsegner,8/18/2021,,,,,,M. Gorsegner,,8/18/2021,2021,8,18,230,,,,,,,,,,,,,,,,,,,United States,Illinois,Rock Island,,,,41.510229,90.490812,,,,,,,,,,,,,,,,,jackhughes20,8/19/2021 12:22,http://creativecommons.org/licenses/by-nc/4.0/,Augustana College,,urn:uuid:244efbac-f6ff-4025-9465-5e7c1780ca68,https://scan-bugs.org:443/portal/collections/individual/index.php?occid=57364196
57364204,AUGIE,ENT,,120bf21c-d066-48ee-b4c0-880596ea22e4,PreservedSpecimen,204da9f8-bd40-47fa-a226-efb2de10ec20,AUGIEENTB0000506,,Animalia,Arthropoda,Insecta,Coleoptera,Coccinellidae,Psyllobora vigintimaculata,31188,,Psyllobora,vigintimaculata,,,M. Gorsegner,8/18/2021,,,,,,V. Cervantes,,8/18/2021,2021,8,18,230,,,,,,,,,,,,,,,,,,,United States,Illinois,Rock Island,,,,41.510229,90.490812,,,,,,,,,,,,,,,,,jackhughes20,8/19/2021 12:25,http://creativecommons.org/licenses/by-nc/4.0/,Augustana College,,urn:uuid:204da9f8-bd40-47fa-a226-efb2de10ec20,https://scan-bugs.org:443/portal/collections/individual/index.php?occid=57364204
57364208,AUGIE,ENT,,120bf21c-d066-48ee-b4c0-880596ea22e4,PreservedSpecimen,70bdbea8-3779-4c29-b70d-5e05468bbd38,AUGIEENTB0000507,,Animalia,Arthropoda,Insecta,Coleoptera,Coccinellidae,Cycloneda munda,25911,,Cycloneda,munda,,,Jack Hughes,8/18/2021,,,,,,M. Gorsegner,,8/18/2021,2021,8,18,230,,,,,,,,,,,,,,,,,,,United States,Illinois,Rock Island,,,,41.436864,90.552542,,,,,,,,,,,,,,,,,jackhughes20,8/19/2021 12:30,http://creativecommons.org/licenses/by-nc/4.0/,Augustana College,,urn:uuid:70bdbea8-3779-4c29-b70d-5e05468bbd38,https://scan-bugs.org:443/portal/collections/individual/index.php?occid=57364208
57364210,AUGIE,ENT,,120bf21c-d066-48ee-b4c0-880596ea22e4,PreservedSpecimen,45f7327f-5f12-4a16-977d-c86aaf7df875,AUGIEENTB0000508,,Animalia,Arthropoda,Insecta,Coleoptera,Coccinellidae,Cycloneda munda,25911,,Cycloneda,munda,,,Jack Hughes,8/18/2021,,,,,,V. Cervantes,,8/18/2021,2021,8,18,230,,,,,,,,,,,,,,,,,,,United States,Illinois,Rock Island,,,,41.436864,90.552542,,,,,,,,,,,,,,,,,jackhughes20,8/19/2021 12:33,http://creativecommons.org/licenses/by-nc/4.0/,Augustana College,,urn:uuid:45f7327f-5f12-4a16-977d-c86aaf7df875,https://scan-bugs.org:443/portal/collections/individual/index.php?occid=57364210
57364211,AUGIE,ENT,,120bf21c-d066-48ee-b4c0-880596ea22e4,PreservedSpecimen,d93baafc-4d9a-4929-91f5-8270bed426f4,AUGIEENTB0000509,,Animalia,Arthropoda,Insecta,Coleoptera,Coccinellidae,Cycloneda munda,25911,,Cycloneda,munda,,,Jack Hughes,8/18/2021,,,,,,M. Gorsegner,,8/18/2021,2021,8,18,230,,,,,,,,,,,,,,,,,,,United States,Illinois,Rock Island,,,,41.436864,90.552542,,,,,,,,,,,,,,,,,jackhughes20,8/19/2021 12:35,http://creativecommons.org/licenses/by-nc/4.0/,Augustana College,,urn:uuid:d93baafc-4d9a-4929-91f5-8270bed426f4,https://scan-bugs.org:443/portal/collections/individual/index.php?occid=57364211
57364212,AUGIE,ENT,,120bf21c-d066-48ee-b4c0-880596ea22e4,PreservedSpecimen,cd6ea74f-d5ac-4599-99b6-a425be11a169,AUGIEENTB0000510,,Animalia,Arthropoda,Insecta,Coleoptera,Coccinellidae,Cycloneda munda,25911,,Cycloneda,munda,,,Jack Hughes,8/18/2021,,,,,,Olivia Ruffatto,,8/18/2021,2021,8,18,230,,,,,,,,,,,,,,,,,,,United States,Illinois,Rock Island,,,,41.436864,90.552542,,,,,,,,,,,,,,,,,jackhughes20,8/19/2021 12:37,http://creativecommons.org/licenses/by-nc/4.0/,Augustana College,,urn:uuid:cd6ea74f-d5ac-4599-99b6-a425be11a169,https://scan-bugs.org:443/portal/collections/individual/index.php?occid=57364212
57364216,AUGIE,ENT,,120bf21c-d066-48ee-b4c0-880596ea22e4,PreservedSpecimen,f1b55c1d-545d-4b8e-a44d-35bdd00cd9c6,AUGIEENTB0000511,,Animalia,Arthropoda,Insecta,Coleoptera,Coccinellidae,Cycloneda munda,25911,,Cycloneda,munda,,,Jack Hughes,8/18/2021,,,,,,Olivia Ruffatto,,8/18/2021,2021,8,18,230,,,,,,,,,,,,,,,,,,,United States,Illinois,Rock Island,,,,41.436864,90.552542,,,,,,,,,,,,,,,,,jackhughes20,8/19/2021 12:39,http://creativecommons.org/licenses/by-nc/4.0/,Augustana College,,urn:uuid:f1b55c1d-545d-4b8e-a44d-35bdd00cd9c6,https://scan-bugs.org:443/portal/collections/individual/index.php?occid=57364216
57364246,AUGIE,ENT,,120bf21c-d066-48ee-b4c0-880596ea22e4,PreservedSpecimen,21932103-84a2-4cd7-be68-5b38bd380715,AUGIEENTB0000512,,Animalia,Arthropoda,Insecta,Coleoptera,Coccinellidae,Psyllobora vigintimaculata,31188,,Psyllobora,vigintimaculata,,,Jack Hughes,8/18/2021,,,,,,V. Cervantes,,8/18/2021,2021,8,18,230,,,,,,,,,,,,,,,,,,,United States,Illinois,Rock Island,,,,41.509388,90.491046,,,,,,,,,,,,,,,,,jackhughes20,8/19/2021 12:47,http://creativecommons.org/licenses/by-nc/4.0/,Augustana College,,urn:uuid:21932103-84a2-4cd7-be68-5b38bd380715,https://scan-bugs.org:443/portal/collections/individual/index.php?occid=57364246
57364249,AUGIE,ENT,,120bf21c-d066-48ee-b4c0-880596ea22e4,PreservedSpecimen,2012bbd2-75a5-4200-b1e7-6d1bd73bc68c,AUGIEENTB0000513,,Animalia,Arthropoda,Insecta,Coleoptera,Coccinellidae,Psyllobora vigintimaculata,31188,,Psyllobora,vigintimaculata,,,Jack Hughes,8/18/2021,,,,,,M. Gorsegner,,8/18/2021,2021,8,18,230,,,,,,,,,,,,,,,,,,,United States,Illinois,Rock Island,,,,41.509388,90.491046,,,,,,,,,,,,,,,,,jackhughes20,8/19/2021 12:51,http://creativecommons.org/licenses/by-nc/4.0/,Augustana College,,urn:uuid:2012bbd2-75a5-4200-b1e7-6d1bd73bc68c,https://scan-bugs.org:443/portal/collections/individual/index.php?occid=57364249
57364251,AUGIE,ENT,,120bf21c-d066-48ee-b4c0-880596ea22e4,PreservedSpecimen,4682a29f-6bd8-489d-9c69-47ae3703f0a5,AUGIEENTB0000514,,Animalia,Arthropoda,Insecta,Coleoptera,Coccinellidae,Cycloneda munda,25911,,Cycloneda,munda,,,Jack Hughes,,,,,,,Jack Hughes,,8/18/2021,2021,8,18,230,,,,,,,,,,,,,,,,,,,United States,Illinois,Rock Island,,,,41.509388,90.491046,,,,,,,,,,,,,,,,,jackhughes20,8/19/2021 12:53,http://creativecommons.org/licenses/by-nc/4.0/,Augustana College,,urn:uuid:4682a29f-6bd8-489d-9c69-47ae3703f0a5,https://scan-bugs.org:443/portal/collections/individual/index.php?occid=57364251
57364253,AUGIE,ENT,,120bf21c-d066-48ee-b4c0-880596ea22e4,PreservedSpecimen,444cf994-f94d-4274-9013-cd81184e1e98,AUGIEENTB0000515,,Animalia,Arthropoda,Insecta,Coleoptera,Coccinellidae,Cycloneda munda,25911,,Cycloneda,munda,,,Jack Hughes,8/18/2021,,,,,,Jack Hughes,,8/18/2021,2021,8,18,230,,,,,,,,,,,,,,,,,,,United States,Illinois,Rock Island,,,,41.509388,90.491046,,,,,,,,,,,,,,,,,jackhughes20,8/19/2021 13:00,http://creativecommons.org/licenses/by-nc/4.0/,Augustana College,,urn:uuid:444cf994-f94d-4274-9013-cd81184e1e98,https://scan-bugs.org:443/portal/collections/individual/index.php?occid=57364253
57364409,AUGIE,ENT,,120bf21c-d066-48ee-b4c0-880596ea22e4,PreservedSpecimen,388b3748-bf6f-44af-ad1f-df5919572bcd,AUGIEENTB0000517,,Animalia,Arthropoda,Insecta,Coleoptera,Coccinellidae,Harmonia axyridis,27230,"(Pallas, 1773)",Harmonia,axyridis,,,j. hughes,8/19/2021,,,,,,o. ruffatto,,8/19/2021,2021,8,19,231,,,,,,,,,,,,,,,,,,,United States,Illinois,Rock Island,,,,41.492597,90.550592,,,,,,,,,,,,,,,,,jackhughes20,8/20/2021 7:15,http://creativecommons.org/licenses/by-nc/4.0/,Augustana College,,urn:uuid:388b3748-bf6f-44af-ad1f-df5919572bcd,https://scan-bugs.org:443/portal/collections/individual/index.php?occid=57364409
57382907,AUGIE,ENT,,120bf21c-d066-48ee-b4c0-880596ea22e4,PreservedSpecimen,820e9dd7-0ca9-43b5-934d-8b579b54055e,AUGIEENTA0000500,,Animalia,Arthropoda,Insecta,Lepidoptera,Hesperiidae,Epargyreus clarus,144841,"(Cramer, [1775])",Epargyreus,clarus,,,Larson I. W.,,,,,,,C. A. Carlson,,6/29/1966,1966,6,29,180,,June 29 1966,,,,,,,,,,,,,,,,,United States,Il,Rock Island,,,,,,,,,,,,,,,,,,,,,,tierneybrosius,9/16/2021 8:56,http://creativecommons.org/licenses/by-nc/4.0/,Augustana College,,urn:uuid:820e9dd7-0ca9-43b5-934d-8b579b54055e,https://scan-